idx,text
3962,My wife is currently making $89k a year with her online degree.
3963,Do professors hate her?
3964,pretty sure they liked her.
3965,Where did she get her degree and what is her degree in?
3966,"This thread is depressing. I busted my ass for four years and graduated with a 4.0 to earn my B.S. I wrote papers, diagrammed fingerprints, diagrammed crime scenes, dusted for prints, studied chemicals, took tests, did homework, bought and read all of the books, took part in real-time class seminars where I interacted with my professors, took notes, and still retain a large portion of the degree-related information. It's frustrating to know that people in positions to hire me will trash my resume just because I earned my degree online."
3967,"Just out of curiosity, how did you do things like diagramming crime scenes, dusting for print, study chemicals, etc online?"
3968,"I had to draw and then scan the diagrams and email them into the professors. Dusting for prints we did with what we had on hand. I used crushed pencil graphite and was able to pull some excellent prints with that. The chemicals were studied via books, watching videos, etc."
3969,Well what university is the degree from?
3970,Kaplan University
3971,"A friend of mine is a police officer and she's getting her B.S. in something criminology related from Kaplan.  As far as I know she's set to get promoted after getting her degree or something.

Good luck to you!  My suggestion would be to network with classmates/professors at Kaplan, see what they can do for you in your area in terms of getting real work experience or job placement.  Seriously, I wish you the best of luck, it's tough when you get shot down without even being given a chance."
64615,Thank you so much!
3973,"You're welcome :) Us online learners need to support each other.  I don't know how much help I can be, but if you need help with anything send me a PM.  I'm somewhat resourceful."
3974,I'll be sure to keep that in mind. Thank you!
3975,"I don't think they trash it if it's from a traditional, accredited university with an online program. The ones most people are talking about here are for-profit online schools, like the University of Phoenix."
3976,It's from Kaplan University.
3977,"Kaplan at least has regional accreditation, unlike U of Phoenix, which is nationally accredited. National accreditation is generally reserved for for-profit schools, and don't hold much weight. Regional accreditation holds significantly more value."
3978,"Capella is also a for-profit school but has regional accreditation (and many of their programs are accredited by the institutions that offer licensure like CACREP for counselors, etc.)."
3979,Ah! Thanks for the information.
3980,"My coworker is a teller and he has a MBA from University of Phoenix. Usually with a MBA, one instantly becomes a branch manager or regional manager."
3981,"Uhhh, not true at all. In banking, it's experience and proven track record in numbers that gets you a job. 

I've been in banking for years."
3982,Ex-banker here. Can confirm.
3983,MBA is worthless unless it's from a brand name school and/or backed by years of experience.
3984,I got my law degree from some shady online college. I got fired and now I go to a community college with some loveable misfits.
3985,'Community' reference!?
3986,"Online certification (e.g. project management or SPSS) or online coursework from a reputable institution is much different from an online degree from a diploma mill. If I see Walden, Phoenix, Capella, or any of their ilk, the resume goes in the trash. In my field, the degrees from these places aren't even properly accredited, and I've witnessed coworkers who can't string together a paragraph getting master's degrees and PhDs."
3987,"Have you tried taking a course at one of these institutions? I would suggest you do so before casting its students aside-- you could be passing up the opportunity to hire some very innovative and well-put-together people.  It takes a tremendous amount of self-discipline to go through a 2 or 3 year program online with little to no social support, work a full-time job on top of that, and for a lot of students they are also parenting at the same time.

Don't knock it til you've tried it."
3988,Point taken. I've had multiple bad experiences with coworkers and other folks who received degrees through these programs. I don't doubt there are intelligent and capable people in programs like this.
3990,"I have to agree.  I'm in Capella's Mental Health Counseling program, which is CACREP accredited as well and it takes quite a bit more time and effort than most of my psychology classes did when I was an undergraduate at a reputable private school.

As an undergrad I probably ended up with good grades just because I showed up to class, was respectful, and at least tried to do my work.  And office hours.  As an online student I can't kiss ass quite like that.  So it's all hard work."
3991,"I stand corrected re: the accreditation. It's hard to get over multiple bad personal experiences with any institution, though, and the fact that folks like my coworker were able to graduate doesn't speak well for the program, I'm afraid. Some of the cover letters I've received from graduates of Capella and Walden have been riddled with typos, run-on sentences, and so on. 

Sorry if I sound like an elitist asshole, but I'm just relaying my experience as a hiring manager. Clearly, there are some talented and intelligent folks attending these programs, so I'll do my best to be more open-minded next time there's an open position on my team."
3992,"I highly appreciate the fact that you will do your best to be open-minded in the future (and so will future applicants, I believe). 

You stated it is hard to get over multiple bad experiences with any institution; are you letting your personal feelings affect your professional work?

You also said ""some of the cover letters....from graduates of Capella and Walden..""; did cover letters from other (brick and mortar) schools have perfect cover letters? (I am speaking about every. single. cover. letter. ever. received. from. said. schools.)


I'm not trying to start a war with you (concerning this, or any other thing); I am just curious how integrating personal experiences, with any institution, is beneficial as a hiring manager ? 


Note: I am on mobile right now. I apologize for bad formatting."
3993,They're still online.
3994,"I'm studying nursing via distance ed, and its really good. In all honesty I am really slack with the studying as I have a toddler and am two months pregnant, so seem to leave assignments to the last minute, but I have still been achieving high marks so apparently I am understanding the course work. 

Because my university offers it both on campus and off campus I doubt it will affect my job prospects at all when I'm finished, as its exactly the same degree. 

And for those wondering it is a Bachelor of nursing to become an RN, not an EN course"
3995,"My wife got both her BSN and MSN online.  She had no problems getting a job as a Nurse, or a Nurse educator.   Go get 'em."
3996,"I have friends who work in staffing and HR and they have told me the completely online colleges you see commercials on tv for might separate you from someone with just a high school diploma or GED, but won't come close to putting you on an equal playing field as someone with a degree from a non for profit accredited college.  

Im not saying legit colleges and universities don't offer certain classes online.  They certainly do, but the majority is still in the classroom I'm pretty sure.  Pretty much if you can't take the credits and use them to transfer to say a local state school (if ur in usa), it's not worth your time or money"
3997,"This is a hard one to answer as I had the career first. As far as that's concerned the degree, and the certs, are assisting immensely. Online school, nonprofit, nationally and regionally accredited, is great. I have tried the for profits and agree with the top poster, they do nothing to ready you for the real world. This school does a fantastic job of trying to prepare you for real life. It focuses a great deal on the assessment end of things but, the tests are applicable, in the IT majors many finals are industry cert exams, bonus. Only about half of the courses have an exam at the end, the others you're expected to turn in a document of some kind. I did a science paper and turned in video and pictures with the project, very contemporary. 


If you're interested in online school and think you have the self discipline, do your research, find a quality online degree program, with reputable  accreditation and the experience is great. Self discipline is not optional, no one is there holding your hand.

I have purposefully not mentioned the school by name, I don't want to be accused of being a plant of some kind. If you can't find them with the details I've given (basically it's the only school that meets this criteria), PM me."
3998,"I'm in a program at a state brick and mortar school that offers all of my program's classes online. It's great for people who need to be flexible and have their shit together. The diploma is the same, the material is the same and they stream the in class lectures. I however took one of the classes online instead of learning in the classroom and discovered that online learning isn't my thing. It requires a greater deal of motivation, and alas I am a weak individual in that department. If you know you can do it, go for it; it really boils down to knowing yourself and your learning style. I'm content to rue the stupid B+ I got in that online class."
3999,"I know a gal at my grad program that has an online degree, so, it can be alright if you've got a lot of determination."
4000,"My best friend has an online Bachelor's in Graphic Arts. He now works as a technical writer. He seems happy with his current gig, but I attribute it more to his strong work ethic and not necessarily his degree."
4001,"I started out at a brick and mortar university but was unable to afford it. Tried going to a community college and they screwed up my financial aid three times in a row. The next thing on the list was online school; I'm working on an Associates in Counter-Terrorism Studies with American Public University. So far so good; I like my classes, professors, etc.

To note other for-profit schools, my dad has a degree from University of Phoenix and (I think) Kaplan University. He's an HR ""professional"" as he likes to say, and he's done just fine."
4002,Any tips for defusal strategies on de_inferno??
4003,Don't for-profits usually cost a whole lot more though?
4004,"From what I've heard, sometimes. So far it's cheaper than what I was doing and financial aid is helping out."
4005,"I see no mention of Western Governors University here. Has anyone gone that route? I've had several friends go into programs (all IT) and have great success with it, but I haven't heard reddit's experiences with it."
4007,From which school?
4008,"At a place I worked, if a resume came in from phoenix univ or strayer, we would just cross it out. Not really a strike against you, but we sure as hell weren't going to look at it the same as a duke or FSU degree."
4009,"I'm currently getting my master's degree through the distance learning program at a state university. As many have already said, getting a degree through a program like this at an actual university is almost the exact same as getting the degree on-campus. The main difference is what attracts most people to online education: you get to do everything when it's convenient for you (while still observing due dates for assignments, obviously).

I actually completed the majority of my bachelor's degree requirements online (for my major, not just core classes), and no one's questioned the legitimacy of my degree. The application process for my current program was actually more rigorous than for the on-campus programs (at other schools) that I applied to - you can tell they take it just as seriously.

tl;dr pretty well so far"
4014,"I'm a HR Manager now, but when I was an assistant, I can tell you that when reviewing resumes and we saw ""Education: University of Phoenix"", it went straight into the trash/shred box. Now that I'm a manager I have more say so. If you just have a degree from UofP, I'm probably not bringing you in, but if you also have a steady work history along with it, I'll consider bringing you in."
4015,"Phoenix. I work in software, there are plenty of self-educated people in software who point to cool things they have built when someone doubts their education. I would say 80% of what I know I learned independently. The school work was very easy - if you ever got tutored in a subject to get ahead (as opposed to catch up) you know what I mean - when you're far enough ahead every thing you write/type is as easy and natural as name and date.

I really enjoyed this arrangement, I read a lot of great books on the topics of my classes and played around with every language and tool we were using, and more. I also worked, a lot, to support myself and to pay for school. I didn't end up building anything cool enough to be proud of on my resume while in school, but my internship (not school-related) turned into my first real job at a very cool company after I finished school. In effect all I got from school was a shove into some aspects of my field that I thought were lame and boring (some things take a few years to grow on you, like your parents and writing documentation) and a piece of paper that doubled my hours, my pay, and gave me benefits.

I DO NOT SPEAK FOR ANY FIELD BESIDES SOFTWARE

I DO NOT SPEAK FOR ANYONE BESIDES THE SELF-MOTIVATED

If you're not all of the above, forget my happy outcome and read some other responses.

*EDIT:* I really have to re-state, in CompSci you can learn and practice everything with a computer and an internet connection. I can't think of another field where this applies. I wanted to finish college because:

1. Sitting down and learning a subject without a guide is hard.

2. I didn't really believe I could get hired as a self-taught person.

If you are in the same situation as me, I would advise:

1. Take free CS courses from MIT, Harvard, and all the other amazing universities that offer them. One of them actually offers a degree (with lots of asterisks) now.

2. Find people who want to collaborate on cool things. Small cool things. Things you think you could finish in a 20-hour day. (You will learn a hard truth that you've always thought didn't apply to you.)"
4016,"Got a masters degree from Walden.edu

Graduated 15k in debt. 

Found a job that doubled my salarie. 

Edit - salary. 
Typed that on my tablet that sometimes autocorrects me in Spanish for some reason."
4017,"> .

bahhahaha ""salarie"""
4018,....*salarY
4019,"My dad got his masters from University of Phoenix, and currently teaches fourth grade."
4020,">Are there any fully online accredited colleges, hopefully affordable, where I could possibly transfer my existing credits and come out with a degree that is respectable?

You could see if any local universities offer online programs. Most 'colleges' that are marketed as fully online, inexpensive, and a fast track into IT are not what I'd call respectable. You could also try to go for some certs instead; you'd likely end up more knowledgeable than with an online program. 

maybe try /r/itcareerquestions"
4021,I've debated with myself going with certs or the degree but I want to finally get my degree since almost every job I see requires it.  I can always swing back and get certs for a specif job requirement.
4022,"This. Most every local university has an online option now. Go with a traditional school and you'll get a degree worth something. Some of the online only schools are ok, but many are a waste."
4023,"Like others have said, go with a brick and mortar institution that offers online degrees.  So many schools do this now.

I'm enrolled at Champlain College for MS in Infosec. 
  
I originally started at Capella and switched after the first class to the traditional school.  I literally Google'd something like  ""top online masters programs"" and weeded out any school that wasn't brick and mortar, then researched the pros and cons from there."
4024,That was my plan with my local community college but at least half of the required classes aren't offered online for some reason.  I'll check some of the other colleges and see what they look like.
4025,"1. is the school regionally accredited?
2. is the school non-profit?
3. does the school also have brick and mortar locations?

if the answer to all of those are yes, then it's probably not considered a joke"
4026,"WGU. 

Western Governor's University.  About 5000 a year - you can take as many classes as you want, just have to complete 12 units each 6 month. AWESOME one on one support by a dedicated mentor. All the materials are provided, including things like CBTnuggets, Boson test preps, lab simulators, etc. The books are electronic so I did buy a handful of books - especially for the Cisco.

I have gotten two promotions and tripled my salary since I started. Best thing I ever did.

I have a B.S. in IT with security emphasis. The finals for ALL of the IT classes are passing the certifications which are including in the tuition. I got credit for my existing A+, Security + and my AA in Networking from the local Tech College, so started as a Junior. (at age 52)
Walked away with a CCNA, CCNA Security, CompTIA Project +

and LPIC-1 / Linux + 2015


NSA CNSS 4011

The CIW certs aren't worth a lot but I learned a lot with them:


CIW Web Design Specialist
CIW Javascript Specialist
CIW Database Specialist"
4027,Just to clarify.  The bachelors does not meet NSA CNSS 4011 only the masters program in information security & assurance.  Don't know if that's a big deal to some when choosing an online bachelors program but thought I'd throw it out there.
4028,"> NSA CNSS 4011

pffft.  They can't find talent as it is.  They'll soon enough realize their own self defeating policies are the only thing in their way of finding the candidate that they need.  Not the lack of candidates."
4029,"If I was going back to school, this is what I'd do. I did a lot of research of the online options and a not for profit, at your own pace school really seemed like the best way to go."
4030,"This sounds really good to me, thanks so much for the tip!  I'm going to check into it this afternoon and see what it will take to get me started."
4031,"+1 for WGU.. got my BS in IT from them few years back. Good mix of traditional education and industry certs. I've been mulling over going back for masters, but kids are in college or starting soon. Good alumni connections too!"
4032,That sounds really interesting.
4033,"**Good Online College Options**  

[US News & World Report Ranking of Best Online Undergraduate Schools](http://www.usnews.com/education/online-education/bachelors/rankings)  

[Western Kentucky University - B.S. in Computer InfoTech](http://www.wku.edu/online/bach-programs/cit/index.php)  
[Daytona State College - B.S. in InfoTech](https://daytonastate.edu/online/)  
[Arizona State University - B.S. in InfoTech or Software Engineering](http://asuonline.asu.edu/online-degree-programs/undergraduate)  
[University of Florida - B.S. in Computer Science](http://ufonline.ufl.edu/degrees/undergraduate/computer-science/)  
[Florida State University - B.S. in Computer Science](https://distance.fsu.edu/students/computer-science-bs)  
[University of Massachusetts @Lowell - A.S. or B.S. in InfoTech](https://continuinged.uml.edu/undergraduate-programs.cfm)  
[PennState World Campus - A.S. or B.S. in Information Sciences & Technology, B.S. in Security & Risk Analysis - Information and Cyber Security Option](http://www.worldcampus.psu.edu/degrees-and-certificates)"
4034,"You can find a ton of these if you spend like 5 minutes on google. I'm not sure why you haven't done this.

I googled these. These are all state schools.

http://mis.uis.edu
http://www.umuc.edu/academic-programs/bachelors-degrees/information-systems-management-major.cfm"
4035,Oh I have but the list is very long and its hard for me to say which schools will allow me to do the degree entirely online.
4036,I simply googled online bs management information systems
4037,"Here's what I did. I've had a pretty successful career but not having a degree really bugged me. After a lot of trial and error. I went back to school at 26 (now 31 and finally close to graduation) and I highly recommend the following path:

- Enroll at you local Community College first. Most community colleges offer almost completely online programs today. The advantage of a community college is that you have an actual brick and mortar school to drive to to meet with tutors and professors, while still doing almost all your classes online. This also give you the option of taking more difficult/interesting classes in person. If you worried about your age you'll learn CC varies from 18-65. Also this will save you a ton of money. Not to mention in some cases an AA degree from a CC might be worth more than a for profit online degree. 

- After enrolling at the local community college look at your states online college program. For instance in my area we have UMUC (University of Maryland) and Penn State Online. Most state college systems offer an online program linked to your actual school system. This makes transferring credits seamless. I would dual enroll in CC and your states online almost right away. Most will have a transition program so not a single credit is wasted and you'll earn a AA after your second year. Even though UMUC for example blitzs our market with ads at least I know its not for profit like UoP.

- It sounds like your career is setup well, but most IT programs have classes based on certifications. I would recommend taking the cert after the class. For example a typical ""network security"" class will link directly to Security+ cert.

- Suck it up and realize it will take 4-6 years even online, but we live in a golden age online education and you'll find a vast amount offered from free sources to help out. 

Good Luck!"
4038,I'm an instructor at a CC and I agree with this. CC's now have many online programs and its an accredited degree that will allow you to enroll in a state university.  You really do have to watch out for the ITT tech's Phoenix and other non-accredited diploma mills.
4039,"Excellent advise. Thank you.

>It sounds like your career is setup well, but most IT programs have classes based on certifications. I would recommend taking the cert after the class. For example a typical ""network security"" class will link directly to Security+ cert.

Very well. Funny, I have Sec+, Net+, MCSA and CISSP already :)"
4040,Some schools will give you transfer credit for your certifications as well.
4041,"Makes those classes cake. I had certs before I went to college, and those classes we super easy."
4042,"There may be cheaper options (if you're not a PA resident).  Western Governor's is an accredited online-only college, so the pacing, flexibility, and tuition can all be better for someone with a job and a family.

http://www.wgu.edu/online_it_degrees/programs

I haven't enrolled at WGU (I applied and got auto-rejected for not having a HS diploma even though I have a Master's), but I studied out various options fairly thoroughly a few years ago, and it is definitely worth looking at.  I did my Master's online through GATech, which was fine but really nothing more than video-taped classroom lectures, so I couldn't fully recommend it.  Programs that focus on online education are going to have better resources and support for you."
4043,"WGU is amazing if you're looking at IT, you get a ton of certifications as you go through the program- I admit I am biased because I work there, but OP's situation sounds exactly like most of the students I get- if you want more information you can PM me."
4044,"Consider Excelsior College, regionally accredited and nonprofit: http://www.excelsior.edu/programs/technology"
4045,"I went to a community college then a university to end up getting a bachelors and masters in Spanish, which you pretty much can't do online.

I had two friends do online college.

1 went to some unknown online university, spent $$$$$ and graduated and its not taken seriously because nobody recognizes it and its only online so I think some people don't trust them or something.  She has had a terrible time and she's in debt-a lot. 

My other friend went to an actual college that has a good online program.  She takes one in person class and the rest she does online.  It's called the PACE program for working adults but its an actual, accredited university here (she could in any semester actually take in person classes if she wants to or if something isn't offered online) and she is almost done and already has a job lined up. 

I think the difference is just respect for their effort (because who knows who did the work in the completely online classes) and recognition of the school.  Also, my friend at the actual university ended up spending less! 

Good for you for going back-just be smart about it! And definitely look into pell grants! And don't go to any school that isn't accredited.  

My ex boyfriends mother went to one of those 12 month nursing school things and it wasn't accredited so the only places that will hire her are the companies that work with that school...and she can't use the year if she decided to actually become a nurse, which she won't but it wouldn't even be an option to transfer.  

Good luck!!"
