idx,text
66649,That was my pacman vs black guy fight.
66650,[Liverpool](http://youtu.be/XlP9KGjqXf4) or [Borrusia Dortmund](http://youtu.be/JQsmnulp1Do).
66651,"Real Madrid. Sport it's about enjoy, not crying out every sunday coz your team been defeated onve again.."
66652,be a fan of the Italian national team or Liverpool (Balotelli's club)
66653,"If you like Balotelli, then Liverpool"
66654,I like 1 EPL goal this season
66655,That's nice
66657,a joke of a club
66658,What's this soccer thing?
66659,"Since your in Chicago, Manchester United. You can relate to most of the fans of United as well, since most of them aren't from Manchester."
66660,"well since they are the most widely supported club on the planet its pretty obvious MOST of the supporters aren't from Manchester, doesn't take away from the fact that probably 3/4 of Manchester is red.  And yes i am from Manchester and yes im a United supporter."
66661,I don't really wanna be a front runner tho. I'm not a bandwagon fan.
66662,"Stade Rennais. Just kidding, french first league is only exciting to french people.

Well if you don't want to be original, Real Madrid or Barcelona. If you want to do big teams but ""less original"", Bayern, ManCity, Manchester United, Chelsea, PSG, maybe like Juventus, Atletico Madrid."
66663,"I was thinking ManU, bcuz they're owned by Americans. But I guess they're like the Yankees of soccer. I hate the Yankees. Chelsea jus won Premier League and I don't wanna be a front runner."
66664,PSG is a French team.
66665,I know I'm french. They were not that bad.
66666,"I agree, they just lacked a little something this year in CL. It seemed weird to me that you mention them because you said French first league is only exciting to French  people, a fact i'm not that sure about.... but you might be right..."
66667,I don't really consider them the same as other french teams. They win because they have a lot of money.
66668,"Obviously Hansa Rostock.

They had Turboneger as their stadium hymn."
66669,"For their population, that's very impressive for Croatia and Serbia"
66670,"Yeah, Portugal and Belgium deserve a shout out as well."
66671,Belgium a little.. literally this is their only promising generation in their history and still might not win anything.
66672,We're at the tail end of it. Sad they never won
66673,"Super fucking hard to win titles om the international level even with great players though. There'll always be 3-4 other teams ranked around your level plus a further 4-5 that can beat you on a good day, not to mention the additional handful of sides that might very well take points off you if your team aren't going at 100% on matchday.

That's without taking into account that even the biggest superstar of a team is unlikely to play more than 6 or 7 tournaments over his career. You don't get many opportunities."
66674,Add that you only get a few chances with a generation at their prime. A 6 year window of players in their prime gives you 3 chances. And it’s not like the competition is a bunch of scrubs.
66675,Unless you're Italy of course.
66676,Same can be said for the Dutch twice (although at least they won the Euros)
66677,"Not really because Netherlands consistently has had good squads since the early 70s. 3 World Cup finals, one of the best Euro records in the game and won it once. Belgium has/had a golden generation but before that they were straight poopoo for a long time. Cannot compare the two nations"
66678,"The Dutch have definitely been more consistent, but they’re widely regarded as being ‘the best team to never win a world cup’ and it feels like they had two generations with a great shot and just couldn’t get it either time"
66679,"I’d say four generations with a good shot:

1. Mid 70s (Cruyff)
2. Late 80s/ early 90s (Dutch trio)
3. Late 90s/early 2000s (95 Ajax)
4. Late 2000s/ early 2010s (Robben, Sneijder, van Persie)"
66680,"That late 90's might honestly be the best one, but is probably the most forgotten one due to missing penalties, people think about Ronaldo's Brazil and Zidane's France, but I genuinly think the Dutch team was the best those years, the strikers we have at the moment would struggle to make the top 10 list of Dutch strikers those years"
66681,"To be fair it is super hard to win an international title, even with a ""golden generation"" you only have a few chances, it definitely requires luck as well"
66682,There's always 5 other top tier teams at any give tournament so you're looking at best 1 expected trophy during your golden generation
66683,"They medaled at the World Cup and look pretty happy about it:

https://www.irishtimes.com/polopoly_fs/1.3565545.1531586204!/image/image.jpg_gen/derivatives/ratio_1x1_w1200/image.jpg

Funny that we think of a bronze medal as being pretty good in Olympic events, but somehow you are shit if you don't win the World Cup.

I think Belgium did about as well as they could've. I suppose on paper they had the weapons to win a big one with KdB, Lukaku, Hazard, etc, but on the international scene you are just going to run into those huge nations like Spain, Brazil, Germany, and France who have the same infrastructure for development and a much bigger population. It's not impossible (see: Greece, Portugal), but the margin for error is razor thin.

I think Belgium can be proud of what they achieved."
66684,I still remember Spain in 2010. Their games were all very tight 1-0 wins but they got there in the end.
66685,">literally this is their in promising generation in their history and still might not win anything.

Hungary: *First time?*"
66686,They won an Olympic gold atleast.
66687,"People said the same about our NT between 2000-2008, but the unfancied, boring 2016 was the one to win. Labelling them a golden generation just adds extra pressure."
66688,what makes it all funnier is your current squad is probably stronger than the 2016 one too. So you guys won a major title with probably your weakest team in the 21st century.
66689,"Their golden generation is pretty much over, none of the defenders are up to it anymore and by the next world cup most of the rest of the team will be done too."
66690,You don’t think they’ll be solid for the next World Cup in like 14 months?
66691,"We'll make the quarters then lose a close game to some team who have a better defense.

And that'll be that, we'll look back fondly at the best footballers the country ever had but will never get rid of the lingering ""what if"" , especially the wc semi final.. if we had reached the final I'm sure we would have won the whole thing, Lukaku and Hazard/KDB would've dominated in those circumstances."
66692,"You'll come to terms with it eventually. We were really close to beating Brazil the semis in 94. A lot of people thought ""what if"" for a few years but since then its been considered a peak achievement for us."
66693,"There were always better teams, so it's not surprising."
66694,But Serbia are eternally shit in tournaments.
66695,username checks out
66696,What tournaments
66697,All tournoments
66698,need to qualify for tournaments to be shite in tournaments :/
66699,We sure don’t perform like the 11th most valuable team
66700,"It's worth keeping in mind with Croatia and Serbia that they often draw their players from their diaspora population as well as their local population. Some examples which spring to mind are Ivan Rakitic and Milos Veljkovic who were born and raised entirely in Switzerland, but due to their parentage, and presumably a strong sense of identity with their parents' homeland, opted to play for Croatia and Serbia respectively. It can be a bit misleading to look simply at the population of the country to determine their potential pool of players, for that reason. Still very impressive for them, either way."
66701,"good point. just this week you'll have sucic and stanisic making their u21s debuts, kids born and developed in Austria and Germany."
66702,"This is a rather new trend, Croatia made semis at the world cup in 98, Serbia & Montenegro had a strong team in 2006 & 2010, with players like Vidic, Kezman, Ivnovic, Kolarov, Stankovic & Krasic (who fell off a cliff after a great year at Juve)."
66703,Croatia made the semis in 98 not 94
66704,"Kezman was kinda struggling by 2006. Still led the line for Serbia & Montenegro and I think top scored for them in qualifying, but he wasn't great at club level. He had a minor revival at Fener and then just faded away. Massive shame. One of my favourite players at PSV."
66705,">It can be a bit misleading to look simply at the population of the country to determine their potential pool of players, for that reason.

Croatian diaspora is 1 million at best. So instead of 4.5 million there's 5.5 million to look at. Still less than 10% of the populations of Germany, England or France. Hardly misleading."
66706,"Yeah, I don't know why people like to so strongly exaggerate the size of emigration from Yugoslavia. Of course it exists, but in terms of national football teams it doesn't play some game-changing role. It's not some main reason why these countries have so many talented athletes.

The guy said ""often"", and then he gave two examples. One is Rakitić, true. The second one is Vejlković, who played like a few games for Serbia in 2018 (and adds 4,5 million in this table). There is a lot of ex-Yugo people raised in German countries, but it's not something completely changing their football team."
66707,"Yes, Especially when you take all other sports into account. Tennis (Djokovic and others), Basketball (5x World champs, a dozen Euro champs), Watepolo (world and Olympic champs for decades), Volleyball same thing. And more."
66708,imagine the possibilities of a combined (former)Yugoslavia
66709,Yugoslavia would be worth 1bn if you get the gang back together.
66710,Luka Chad Jović.
66711,Jesus Haaland is worth half of Norway
66712,"Imagine how much His Father, God Haaland, is worth."
66713,"To us, he’s priceless"
66714,Even The Haaland Ghost is worth a few kroners.
66715,A Roy Keane tackle?
66716,">Jesus Haaland

I read that in my head as Hesus Haaland. Was wondering whether there's a Spanish or Mexican version."
66717,"Serbia being there is a surprise, looks like they really underperform based on the value of players"
66718,Serbia would be much better if their national team management wasn't a complete fucking joke.
66719,"It doesn't help that barely anything has changed structure-wise in our football since like, the 90s. Add the ever-persistent criminal presence in our football into the equation and it gets even worse. We literally only rely on raw talent to get by, and I think that our inadequacies in terms of development and coaching will keep biting us in the ass more ferociously with each following qualification cycle."
66720,"SMS, Vlahovic Kostic, Milenkovic is probably like £150M themselves"
66721,Jović
66722,Not according to Lazio
66723,They've always been high in these value estimates. They're always about there with Croatia. They're just underperforming massively last 10 years.
66724,Last 20 years*
66725,Last 30 years*
66726,"> looks like they really underperform based on the value of players

I mean, England is in first place lol"
66727,It is the market value. The market for English players is just different. Ferran Torres with an English passport would have been a huge transfer but since he is Spanish the price was only 30M or so.
66728,Also because he came from Valencia
66730,How does it look now? Any better than a year ago?
66731,Can say the same thing about Brazil
66732,This England team has got to the semis and finals of the two most recent major tournaments. Don't think it's fair to say they've underperformed
66733,If you want to see underperform in the two most recent major tournaments you have to watch us...
66734,"Even if England win the next WC, the joke of us being shit in sports that we invented is so ingrained in internet culture, that people will still be saying it.

Besides football, and I suppose rugby, we're having an absolute golden era across loads of sports, but still people take the piss"
66735,"Part of that is just down to how young the England squad is. They had the second youngest squad at the Euros, 2.5 years younger than France"
66736,Yeah and we narrowly lost the Euro final on penalties after a World Cup semi final exit. Not sure this current crop of players (which the value here represents) can be criticised for underperforming. Give them another 2 or 3 tournaments and judge them then.
66737,"Suddenly England reaching a final is underperforming, even though you’d have been laughed at for predicting they’d get that far before the tournament. Keep moving the goalposts."
66738,If Yugoslavia was still a country it would dominate Europe
66739,Roman Empire is laughing
66740,That would be an interesting squad.
66741,"I think the best European player not to be able to make the squad would be Lewandowski, but he wouldn't be missed. That's just how good that squad would be"
66742,"Hard to complain about Lewy when your striker options are Kane, Benzema, and Immobile.  But if we want to be strict about place of birth, we lose Ronaldo too.  The Romans were certainly aware of Madeira but don't seem to have ever established a presence on it.

We can have a front three of Salah-Kane-Mbappe, as well as a midfield with Kante, De Bruyne, Verratti, and basically whoever we want from France/Italy/Spain.  It's definitely far and away the best national team that would ever exist."
66743,They would be more competitive for sure but they wouldn’t dominate.
66744,If benelux was a country it would dominate europe
66745,If the EU was a country if would dominate the world
66746,Pangea FC when?
66747,"I'd probably have fancied South America with Messi most years but Cristiano so good in big games and one weak spot on the South American teams would have made it like 3-1 for the EU in World Cups he was around for.

Africa intriguing on the break, maybe squeaks a semi-final one year at home and loses in the final."
66748,Frenkie de Jong - De Bruyne - Wijnaldum midfield.... bruh
66749,"Hazard - Lukaku - Depay

        De Jong - De Bruyne - Wijnaldum

    Wijndal - Van Dijk - De Ligt - Dumfries

                    Courtois"
66750,Shit full backs still
66751,Serbs-Croats-Bosniaks-Montenegrins speak the exact same language and are genetically basically the exact same ethnic group. Constantinople and Rome and Istanbul successfully played with their identity to the point of no return.
66752,Doubt that.
66753,Doubt
66754,"We do, past 9000 years.

We always have better team on paper than results actually show. It's like there is no culture to play for your country, but to come back from clubs to visit some night life with colleagues :)"
66755,English tax coming in clutch
66756,"England does have a lot of valuable players now who. Gomez, Maguire, Trent, Walker, AWB, James, Shaw, Rice, Phillips, Mount, Hendo, Bellingham, Foden, Saka, Sancho, Graelish, Rashford, Sterling, Tammy and Kane. There are still plenty more who are worth a bit."
66757,">England does have a lot of valuable players now who. Gomez, Maguire, Trent, Walker, AWB, James, Shaw, Rice, Phillips, Mount, Hendo, Bellingham, Foden, Saka, Sancho, Graelish, Rashford, Sterling, Tammy and Kane. There are still plenty more who are worth a bit.

Gomez, Phillips, Tammy, AWB and the like would hardly be as valuable if they weren't English.

Some of those players are undoubtedly brilliant but others are considered better than they are because they play in a league which is generally watched more"
66758,">Gomez, Phillips, Tammy, AWB and the like would hardly be as valuable if they weren't English.

I know you're just commenting on these players because they mentioned them, but it's worth noting that all of these (except Phillips) didn't get called up, so their value is irrelevant for the graphic regardless"
66759,I get your point but Gomez would have 1000% been called up had it not been for injury.
66760,"I fully agree, although if it wasn't for his injury then his value would also be higher"
66761,Idk if that’s true considering we ( a non PL team) just paid 40 mil for Tammy and he’s been great so far
66762,"you bought him for that price ALSO because he's english

even if he flop in italy there'll be a low table team wanting him back in PL"
