idx,text
3882,"I know what you mean. I'm only on week three here, but I keep having mini flashes where I freak out that I made a wrong decision."
3883,Agreed! But not if it's from some random one
3884,"UCLA has their ""Empowered"" program where you can receive certificates and they are a credible university. 

EDIT:Certificates, not Degrees"
3885,"No, you don't receive degrees.  Your receive ""Certificates""."
3886,"If you receive, say, a masters degree online from Duke, would it be the same as taking traditional on-campus courses? You could still just put M.A. in Underwater Basket Weaving on your resume, right?"
3887,yes. But good luck getting a masters online from Duke.
3888,"My dad's 3rd Masters is from IU's online program. Degree doesn't make any mention of that fact. Of course, it's not like it's been put to the Job Application test since he's been in the same field for 40+ years."
3889,What's IU?  What are the three masters in?  I'm just curious.  I wish I had three masters
3890,"Indiana University, mentioned upthread."
3891,"Indiana University. Masters from them was in Public Affairs in the early 2000s, others were in engineering in the late 70s from, obviously, more traditional programs. I wish I had three Masters as well, or at least that mine was in something useful."
3892,"Yep, a lot of universities in Canada are now offering programs where some or all classes can be completed online. They are fully accredited and not differentiated from the non-online ones because they are still from reputable, accredited post-secondary institutions."
3893,yup. what i was wondering as well
3894,"I considered going back to school but my only real choice would have been online due to work schedule.  My bosses (including director and SVP, SVP over ~900 people) said not to bother."
3895,"My friend is a hiring manager for a fortune 500 company- they dont hold only online degrees (Phoenix) up to same standard as an actual university, he wont hire anyone from online degree. Im not sure if everyone else is the same- but thought it was worth sharing."
3896,"Thanks, it confirmed what I thought from the beginning. No online courses for me."
3897,I work in project management and most of the reputable programs are delivered through online course work.  I've never had an issue and I am making a VERY comfortable living.
3898,"Hiring manager here. If I see U of Pheonix or any of that type, I treat it like no degree. Doesn't mean I think less of you, but I don't think much of your degree."
3899,Really? I feel like that's kind of harsh. Some people don't have the option to physically go to school. Do you at least give them a chance based on other qualifications?
3900,Are people just missing the part where I was talking about for profits?
3901,"> I feel like that's kind of harsh

Wahhhh too bad. It's a business. I'll take the state school kid over online scam colleges 99 times out of 100"
3902,"And you are qualified to make that determination how?  No offense, but some folks have no other choice but to go online.  Dismissing their resume out of hand because of where they got their degree seems a bit uppity. 

For instance, I worked two jobs supporting a family while going to school online.  What I learned there was as academically challenging as any B&M school would offer, if not more.  I got a degree in business, Project Management, and was able to pass the PMI CAPM and PMP tests on the first try within the following few months.  I also kick ass at my job.  

Biggest difference between B&M and Online?  My son is going to school now.  He touts the ""Social experience"" and ""Collaborative environment"".
What?  Binge Drinking at Frat Parties?  I'm 50 years old, own five houses and served 22 years in the Army.  Earned 5.2 Million dollars for my company as a contractor, and the fucking HR filters wouldn't get me to an interview until I had a BS degree.  

Just about pisses me off when someone says that going to a Brick and Mortar school while being a twenty something single kid with parents and financial aid paying the bills is harder or somehow more  challenging than keeping a roof over a family, working 60 hours or more a week to replace the 100K job you lost, being a father and a husband, and having to properly research and cite every thing you write, meet weekly objectives, papers, projects, postings, all properly researched and cited."
3903,"Ok, but why didn't you go to an online program from a good school?

There are plenty of options."
3904,Exactly...U Phoenix is a bullshit school.... doing an online program and any reputable uni would be fine.. but Phoenix man.. come on
3905,"Who says I didn't?  I never specified my School.  (Columbia Southern University, FWIW) 

My point is, I'm good at what I do- but your company would never have the opportunity to know that because you'd have tossed my resume in the trash, because you ""Don't trust the degree"".  

Like I pointed out to the smart ass HR kid that I had to interview with along the process of getting the job I have now- he graduated from UCLA.  Mom and Dad paid for it.  He didn't have a job through college except for internships.  He didn't have a mortgage, a kid going through school that HE had to pay for, two other kids in middle and high school, bills to pay, and two soul crushing jobs, a family to hold together, four rental houses to maintain, He didn't have to do anything but make it to class, turn in roughly the same amount of work I did, if not less.  And I am not complaining...I just had all the responsibilities that grown folks do, and people who counted on me.  

Now who's better at managing time, allocating resources, prioritizing tasks, not to mention leading others?  At least, who's *demonstrated* that?"
3906,"It is harder. That's the thing people who didnt go to a 4 year college don't get. It takes 4 years out of your life where you can do nothing but school. That's why 4 year colleges are held in higher regard because the people that attended them sacrificed working for four years to get the degree. 

College was never meant to be something to do in conjunction with work. College was meant to be something where you went to learn skills to work. It was never a given. It required legitimate sacrifice of your life to obtain a degree and that's why the people who hold regular 4 year degrees observe online ones that way. 

Imagine being flat broke and only able to work 15 hours a week for four years and doing nothing but school."
3907,"Meanwhile, imagine having a family, a mortgage, and a job while attempting to go back to school. I'm not sure you can consider that easy in comparison to going to university. I worked full-time while taking 4-5 classes per semester when I was getting my BA and I still don't envy people who have to sacrifice any semblance of freetime in order to go back to school as an adult. People in both situations face their own unique set of difficulties and it's impossible to make any kind of blanket statement about who has it worse."
3908,Dude who are you arguing with? Obviously college is easier if you're not married and raising kids..
3909,"Ah.  Yeah, I can see that.  Those poor kids I see moseying about at CNU look so poor and downtrodden.  Legitimate Sacrifice?  Most of those kids have no clue what a legitimate sacrifice is.  What, exactly are you ""sacrificing""?  

I'd have loved to go to college right out of high school.  Spent that dreamy time taking care of my mother until she died of cancer.  Pity I couldn't have made that college sacrifice.  After that, I enlisted into the Army.  Now THAT was a cake walk.  All those leadership skills just handed to me on a platter, rather than having to earn them like those poor hardworking college kids.  All those technical skills just dropped into my lap while those poor college kids had to slave over their classes.  

22 years of that, much of it running organizations larger than most companies, and as I grow older, marriage, kids, always moving, wars, etc...but that holds no ""prestige"" within your circles.  

But you betray your ignorance with the statement ""College was never meant to be something to do in conjunction with work""  No, it wasn't.  Once upon a time, the social elite sent their kids to colleges and universities because they could, while common folk went in for a trade, if they were lucky, or just did whatever they could to survive.  The commoner going to college was seen as an anomaly, and he was despised for it, generally.  

You asked me to imagine being flat broke for four years and only able to work 15 hours a week...  Now you imagine having two kids at home and one in college, a mortgage on a 3500 square foot house in a decent neighborhood because you don't want your kids to have to do what you did to get started in life.  Imagine stroking check after check for your wife's tuition, because at the time you have a job making more money than most college grads could dream of making- but not taking your turn just yet.  Then the bottom falls out of the economy, and that job goes away.  Imagine working 12 hours, getting home, and firing up a computer for another three or four hours.  Do that for a couple of years.  Imagine selling off things you worked hard for so you can buy a car for your son to take to college...that you just sold a motorcycle to pay tuition to so he wouldn't have to take out a loan...and selling another motorcycle for the next semester...losing shit you earned the money to pay for...and still working at a shit job many levels below where you should be because there's people out there with Bachelors degrees like yours that just don't get it...college is a breeze compared to real life.  Sacrifice?  Until you've driven yourself to utter exhaustion to provide others a better life than you did, you have no clue what sacrifice is.  You really don't.  

I was a project manager running a portfolio of projects long before I hung up the uniform.  I was an operations manager, and more than that, I was a leader, in charge of real people, real deadlines, real budgets-something no college kid ever has the opportunity, much less the ability to do...but people like you cling to that paradigm without the slightest clue as to what life really is.  Yet in corporate America, you become the gatekeepers.  HR Punks with ""regular"" degrees, without a clue as to how to evaluate the quality of a potential job applicant.  You discard anyone who has had to take a route different from yours, hit the delete key when sifting through resumes, and then sending corporate recruiters to job fairs to find someone that looks and talks like you. 

Yeah, I went to college online.  Difference between me and you, I had *context* to apply to my studies.  The best you could hope for is to be able to remember a fraction of whatever you learned in school when the situation arises where you can apply it.  

You scan a resume for ten seconds, then toss it, or like you, thinking less of a person because they got their degree online- regardless of the school.  You honestly think you did the right thing by your company?  You honestly think you fairly and accurately evaluated that person to determine if they were the best fir for the job?  No.  You didn't.  Same applies for thinking you are somehow superior to someone because of how they got their degree.  All you did was look down on someone because they don't look like you."
3910,"At first, as I was reading through this thread, I was feeling bad for deciding to do a trade instead of school and go for the online degree. Almost like everyone was superior to me. I've been struggling with this for a while, questioning my choices and everything. And even though my reasons and experiences are much different than yours, you have helped me out a lot. Definitely gave me a boost of confidence. Just wanted to say thanks :D"
3911,"FWIW 

I enlisted in the navy as a corpsman out of high school. I made it up to E6 and went to the university while in the reserves. I spent over a year in Iraq when I was in my early twenties.

 Please spare me the i didnt drive myself to the point of utter exhaustion to give someone a better life cause i lived it ever waking moment as a hospital corpsman. 

I gave up my active duty salary and orders to Europe in order to get a quality education because I knew how important education was to me.  Now I'm an officer on my 9th year of service. 

I had plenty of context to apply my studies. Shit I did my masters thesis on Iraq after I spent so much time there. 

I don't think less of the person, I just don't hold their degree in the same regard because they aren't the same.  There is no comparison between the degrees."
3913,"my thoughts exactly, plus HR doesn't assume that an online degree equals you have more hardships and work harder..."
3914,A good portion of my job is HR related. Everything matters when presenting yourself to a company. Seeing that online degree on your resume is not a positive...
3916,"Actually that depends. Some colleges, such as embry riddle, offer degrees online but their diploma and transcripts say worldwide campus distance Ed"
3917,It's the institution that matters.
3918,They will if it's an accredited school.
3919,"I have a bachelor's from University of Phoenix.  I think it all depends on the field you are going in to.  For me, the degree made my resume look good enough to get an interview so I could prove that I was a good fit for the company.  I was hired as a systems administrator by a company I love.  The only problem with my education is that I am now under a mountain of debt."
3920,I got a BS in IT from U of P also. Currently working as a programmer. It helped me get my foot in the door for sure.
3921,"If you're going to an online school, shouldn't the expenses be less?"
44152,HA!
3923,"Well, it's easier to pretend you bought the book when you actually didn't. Seriously, I bought only one book throughout getting my graduate degree. I did use the heck out of it, though."
3924,"I think, at UOP, the understanding is that you are essentially purchasing an easy degree.  It really was very little work, unfortunately.  You can learn more in two weeks on www.codeacademy.com then I learned in my classes."
3925,"agreed. The debt is killer, but i had no other choice in the matter. I was out on my own and had to work full time to pay my bills while going to school."
3926,how much does a degree from U of P cost?
3927,"[Here you go.](https://bigfuture.collegeboard.org/college-university-search/university-of-phoenix-phoenix-hohokam)

4 year degrees usually fall into the 120 credit region, which makes a UoP degree cost around $50,000."
3928,"Holy hell. I was wrong about what this program is for. I thought you paid 1,000 a year and got the paper that says you're educated now."
3929,"Really, for 4 years, that's not too bad, considering."
3930,I took a course online through a local college while working full time. I didn't end up completing the course for other reasons but I had a great experience. I was able to contact instructors at any time and could study and complete my work when I saw fit. All of the course material was provided and we had regular chat room sessions with instructors and other students in the same program to make sure we were all on the same page. If you're someone who can keep yourself on task and get yourself to complete assignments on your own then an online course might work for you. However if you need a classroom environment and an instructor lecturing to you and keeping you on task then I don't recommend it.
3931,"thanks for the reply! I am thinking about starting exactly for the learning side of it, i also believe you have to have good discipline, but I was also wondering about the job side of things. Do you think there are advantages/disadvantages of having your degree from an online school in terms of getting work in that area?"
3932,Well my school wasn't an online school so I'm not sure. It was a regular provincial college that offers the opportunity to take classes online as a part-time student. You may want to see of any colleges/universities in your area offer the same thing.
3933,Take online classes at an accredited college.  Don't do only online college.
3934,The big problem I see in online school is slacking off.  My brother slacked off and did very little of his work as it was all due by a certain due date that was like a year ahead.  By last week he had a month's worth of work done and ten or eleven months to do in three weeks.  He's stayed awake with a combination of medicine and catnaps and I'm kind of worried about him.
3935,catnip: not even once.
3936,That's why it isn't for everyone. You have to be really self motivated and manage your school work schedule all on your own.
3938,"I took online classes from an online college- I went 3 years (work was reimbursing me at 100% for that college) and transferred so my degree was from an accredited university, of which I took the classes online. Loop hole!"
3939,"Former recruiter here. While selecting resumes, the employment agency I worked for ALWAYS preferred someone who got a degree from a ""physical"" college over someone who got an online degree (like Phoenix University). I've heard it been referred to as a ""Mickey Mouse College"". But, an online degree is better than no degree, so you're still winning."
3940,"Yeah it is called Mickey mouse college and it's soley because you don't have to do any ""real"" research.  When I was working for my under grad I put in at least 300 hrs into research and the student's who didn't give a shit put in at least 100 hrs into research...  The whole idea of research is to train you how to think rather than to follow in the foot steps of others and hopefully that's what corporations want."
3941,"Absolutely perfectly. I have my master's degree in nursing education and work as a nurse educator for a large magnet status organization. 

I would never sit in an actual classroom ever again."
3943,Western Governors University
3944,My firm hired a woman who had a masters degree in accounting from the university of phoenix. she was bad. really bad. She didn't even know the most basic accounting procedures and was fired after a month.
3945,made me lol
3947,What in the fuck? An online law degree? Can you even take the bar with that?
3948,Some states allow you to take the bar exam without a law degree.
3950,I didn't even know online law schools existed. That's why I asked.
3951,"Went for almost two years without a decent job interview.  I had a lot of experience as a retired soldier and contractor, but no degree.  When my contract went away due to budget cuts, I couldn't buy a job interview.  Within one month of finishing my degree, I had three solid job offers, all within my field.  

Edit:  I did learn quite a bit, and felt that the classes were academically challenging as well as current.  Looking forward now to starting and completing my Master's degree."
3952,"I got my master's degree in Library and Information Science from the University of Illinois. I took mostly online courses because I registered for classes late and they were my only option.  This turned out to be advantageous because the classes were 2 hours instead of 3 like the on-campus classes. The online classes met on campus one day each semester to account for shorter class time. 

A lot if schools are offering online classes that are just as valid as if you attended on-campus. Makes it easy when you have a job in addition to school. 

In terms of finding a job with my degree: one month after I finished my degree, I found a high level job as Associate Director and Head of Reference at a library in the area I wanted to live. 

I'm so glad I got my degrees, even if I don't use them directly in my current career. I gained a lot of skills that I wouldn't have had the opportunities or encountered the scenarios to learn otherwise. 

Tldr: I got a masters and I'm quite glad that I did."
3953,"Quick question for you, unrelated to this thread, how is the job market for librarians these days? I'm considering changing fields in a few years and would love it if I could have this as an option."
3954,"It really depends on where you're at. You should do some research for your state's library association and see if they have any job listing pages or resources. 

If you're not limited to one location in particular or you're not married to the idea of working in a typical library setting, it's a lot easier to find a position. The degree prepares you for a lot more than just the library field. It's basically a degree in research and ethical information management / dissemination. 

You can specialize if you know you want to go into a field that has more to do with archiving or serving a particular community or data management.  It's a great degree to have. 

If you're set on working in a specific library setting, it gets harder. I wanted to work with teens at a public library near Boston and lucked into my job where I built a teen services department. 

Don't expect to be a wealthy person if this is the path you choose. Library funding is scarce in the first place and jobs frequently get cut or reduced. 

I moved to LA and opted to switch careers because the market was very tough here at the time. 

It was a very rewarding time in my life but I don't think I'll be returning to that career any time soon."
3955,"I have an elementary education degree from Phoenix. I got a long term subbing job before I even graduated and am now teaching full time (got this job five months after I graduated, once hiring for this school year began). 

That being said, I did three years of my schooling at a private Christian university in my home state. I went to UoP because I was freshly married to a man in the military and we had to move and I had no idea "" real schools"" had online programs. I hated UoP and I worried I wouldn't get a job. Luckily people can tell I'm not a dipshit. Networking is also important."
3956,"I received a degree from The University of Maryland University College online a couple years back, I do not attribute my high pay to the degree, but it is a decent accomplishment. In the eyes of employers, it is that you finished what you started. The degree is in Cybersecurity, coupled with many industry certifications, I make close to 100k in the states, and over 200k overseas contracting. Mind you I am only 26. It is what you make of it. Depends on how far you want to go within your career, and why you are picking an online program. My advice, if you can, go traditional PT. If you are unable, kids, jobs, remote location, then online is a fine runner up.  With all that being said, most of the comments are correct about online for-profit vs. non-profit. Schools like UMUC, are part of the State of Maryland University system, most people won't bat an eye if you but University of Maryland-UC on your resume, there is also College Park, Baltimore and a couple other schools in that system. But places like Phoenix and Virginia College, which or private-for-profit institutions, I would stay away from."
3957,"UMUC is thankfully part of the UM system, so I've never heard any employer/person doubt its rigor. Many of its graduate programs seem to be tailor made for people connected to the DoD/IC community.

Still think UMUC is a hilarious name."
3958,"The Open University in the UK is known for long-distance/online learning. I know some nice people who teach there, and people with degrees from there can make it on to do good things. However, I don't think it's 'for profit' like some online courses. If anyone is interested in online learning you should check it out."
3959,I have an interview with Best Western as a desk guy
3960,"I have an online degree from a non-online school. No schools in my state offered a Masters in the program I wanted to attend, so I applied to a bunch of random schools. I was accepted into one of the big programs, basically if you have an interest in historic preservation, this is where you go. Unfortunately, tuition was way outside my grasp, but the online program was a lot more affordable.

I ended up finishing my program while working for a historic preservation group. When I started applying for jobs, I got a lot of wtf comments from employers because I had to explain that I worked full-time and finished my program at the same time. Hell, I took a full course load, worked 40 hours a week, and worked on my thesis all at the same time.

Did it work out for me? Not really. I ended up falling into freelance work. I write for some companies online, published a book completely unrelated to my field, and haven't worked in historic preservation in around four years or so. I still love the field, but I got screwed my a former ""supervisor"" who I tried and later threw me under the bus. The school itself talked up the program and kept mentioning how its grad professors were almost all former grads of the program. Turns out that they almost never have any open positions, so I couldn't apply for work there. Most grad schools have a small number of teachers and jobs as professors almost never turn up. I loved the program and still love historic preservation, but my life definitely didn't turn out the way I intended."
3961,"I got a degree in Film; against the advice of most friends and family. After a year and a half of food service jobs I've been working in the film/TV industry for over 2 years now. Both casting for several notable TV series and movies (Warner Bros, HBO, NBC, CW) and working hands on on-set for several feature films and TV shows (Dark Knight Rises, Walter Mitty, Law and Order SVU, Girls, Amazing Spider-Man 2, etc) 

My only main issue is that I'm already jaded by the way the industry works as a whole. And it may be too late to find another industry to work in (would love to work in Video Games)."
