idx,text
4133,"I work in higher ed and I am not aware of a bricks and mortar university who offers a degree that would be only online. There is a difference between online courses and online degrees. The schools that I aware of that offer distance degrees usually require at least a weekend or two in a classroom setting.

Of course, I don't know the curriculum of every university, but I am unaware of any. Does anyone know of a traditional, non-profit university that offers a one hundred percent online degree?"
4134,Southern New Hampshire University is a not for profit school that offers quite a few undergrad and masters programs completely online.
4135,"I've supervised uniformed personnel for a long time and seen the rise of online programs. Be really careful about online degrees and degree programs. Your best bet is to find a real school, with real grass, and a college football program (bear with me), and then check out their online programs. 

About the college football program: a school that has one has an established grass-brick physical presence. And that's worth $ compared to one run out of a strip mall in Miami. Imagine if you're competing with someone and you have exactly the same skills, but your degree comes from a physically-established program as compared to a pure online school. You'll win the interview. Look at Park U if you need to go online (I'm not affiliated with them in any way) as an example."
4136,"Grand Canyon University is a for-profit school in the same vein as DeVry, Ashford, AMU, or University of Phoenix.  As others here pointed out, they just arent held to the same esteem as most regionally accredited schools. ~~In fact, I think the DoD even banned AMU from being eligible for TA for a while, because they were seen as predatory and offering an inferior education. (I think Betsy DeVos is trying to undo this, but I may be wrong.)~~ (proved wrong by /u/colabear19)

I was doing some research for military friendly schools myself a bit back - heres a few I found to be reputable, most of which are tied to state brick-and-mortar universities.

~~- University of Maryland University College (I know, stupid name)~~ I should do more research. University of Maryland College Park has a stellar reputation, not necessarily University College, apparently

- Arizona State University (great for technical degrees! I worked with a lot of engineers in Silicon Valley who got their Computer Science undergraduate and master degrees from here)
- Colorado State University (ty, /u/russki !)
- Penn State University
- Ohio State University
- Oregon State University
- Utah State University
- Excelsior College (I believe theyre a private school, but theyre very accommodating to military folks. I believe a lot of Master Chiefs of the Navy graduated from here.)

Military friendliness is one important aspect, for sure. But a school's reputation is another important aspect. You can try looking through US News' online programs rankings to scrutinize for yourself. (Of course, they're just one of many resources).
https://www.usnews.com/education/online-education"
4137,Currently using TA for AMU here.
4138,"If you want your degree to be taken seriously, stay away from online for-profit colleges and even some non-profit.

Im talking about: UMUC, AMU, SNHU, Grand Canyon University, Trident U, University of Phoenix, and others."
4140,"Yeah, hes an idiot. I have a college degree from prior to the Army from a state school. Im applying to green to gold to earn my masters and commission because Im sick of Intel. 

The board of Officers that select Soldiers for this program put in their AAR last year, brick and mortar schools held more weight than those who went to online schools. So it isnt just a check the box like some people say. You will be judged, ESPECIALLY in the civilian world."
4141,"Post University is a good one to look into,as well as Southern New Hampshire university. They both have good programs for service members"
4146,I changed to GIS last semester from electrical engineering. The program is really good!
4147,What's wrong with SNHU? It's a brick and mortar school that has been open for 80 years. Its fully accredited
4148,"University of Louisville online will do Degrees for $250/credit hour as an active duty discounted rate.  That is whether or not you use tuition assistance.  You won't find a better deal.  

http://louisville.edu/online/tuition"
4149,University of Wisconsin is highly regarded
4150,Both my husband and I are at Southern New Hampshire University. They have quite a few degree programs and a very flexible schedule. They've got many start dates in the year. I do the 4 semesters a year. Classes are 8 weeks long. but they also have standard class times. They've got discounts for military and I believe all of the military academic advisors have served. It is an awesome school. I am using FAFSA and my husband is using TA. They were very accommodating for the TA! Only took my husband about 3 weeks to get everything set up from company to school.
4151,"Degree plan?

Got to rep my school WGU though. 3k for 6 months, flat rate. Minimum of 12 credits in those six months, but you can bang out more if you want."
4152,"I finished up my degree at WGU this last week. Bachelors of Science, IT-Security. I have degrees from WGU AND a brick and mortar school. I can tell you several things, I learned more at WGU and felt significantly more accomplished at WGU because I didn't have my hand held. I have 10 different IT certifications and now work as a Security Officer. Not only has my degree never been questioned in interviews, it has actually been praised. Many of the smartest IT folks that I've worked with have WGU degrees. In fact that is where I got the idea to even look at WGU originally.   


Brick and mortar schools serve a purpose but they simply cannot stack up to the flexibility of WGU (did I mention I've been military for the lat 15 years as well?). You will pay more at a brick and mortar school, the certifications will not be part of your curriculum, and you will have less flexibility. WGU has the same accreditation as the University of Oregon and tons of others. I see users in here mentioning competition between you and another person, but you have a degree from an online school and they have one from a brick and mortar school, then say it is favorable for the non-online school. This is a made up scenario that doesn't happen, which is laughable. Why? Because WGU you do not get your hand held at all, you do all the work yourself. If any interviewer is worth their salt, they will know what goes into the more well-known school programs.    


TLDR: There isn't a wrong answer, just that the answer is going to different depending on what is right for you! Many people in here spewing what-if scenarios that don't happen in reality."
4153,"Attending AMU personally.  They have helped me do things such as work on a resume, got me into an apprenticeship program relating to my degree and took a bunch of elective credits based on being a submariner E5.  If you do any research, then yes some places do not personally like for-profit colleges while others do.  Difference in for-profit is the lack of focus on general education and more on specialized.  I do agree that a non-profit, state college-type-thing that also has an online program generally looks better.  However, AMU and Excelsior are both regionally accredited schools and are further accredited in specific programs by boards that mean something.  The most important part is to do research on that school prior to committing.  For instance, AMU got sued by the state of either Massachusetts or Pennsylvania (I cannot find it currently) for their failure to disclose post-completion employment data.  They did not lose their certification.  While I also agree that  for-profit colleges are a business, either way you are paying for a product.  WGU is another example.  They are regionally accredited  and their online teaching program is also one of the only online accredited ones.  I also know people at the company that I am apprenticing with that got their degrees through AMU as well as connections through sites like LinkedIn.  Online for-profits are generally more flexible with schedules as well.

TL:DR 

Do research and haters gonna hate on online college because they paid more or took on loans for their brick-and-mortar degree. A degree is mostly a check in the box and you need networking and experience.

Edit: There are pros and cons to for-profit and non-profit.  Research.

Edit 2: Graduation rates seem to be lower for online for-profit schools as there is less interaction.  If you are good at teaching yourself it may be for you. Results may vary."
4154,Thinks html is a programming language. Number 1 choice is sublime. Mentions brackets and TextMate which are kinda dead communities if not actually dead projects and an editor for ios but not Emacs.
4155,"Here's a nice text editor benchmark on [github](https://github.com/jhallen/joes-sandbox/tree/master/editor-perf).

I started with notepad++ on WinXP and when sublime text came out in 2008 I've used that every day.

My favorites are:

1. Sublime text
1. Vim
1. VS Code
1. Jetbrains IDE

I use them all equally as they're tools to get a task done.

Sublime for scratch.txt, a fast launch and browsing tons of files.

Vim for editing text and running macros or opening 1 GB text files quickly. Vim > sublime for performance.

I'm writing this in VS Code w/ markdown preview. And for a live preview of LaTeX.

Regular expressions are 100% the same in sublime and VS code (and I think Jetbrains too).

I've made all my 4 editors follow hotkeys from Jetbrains (Intellij, GoLand). 

| key      | action           |
| -------- | ---------------- |
| ctrl + y | delete line      |
| ctrl + d | duplicate line   |
| ctrl + w | expand selection |
| ctrl + 4 | close tab        |
| alt + 1  | toggle side bar  |"
4156,"I honestly find that most IDE's are bloated with simple options often difficult to dig out of their gui hierarchy

If you're comfortable with Makefiles (and you can make them much simpler than some do!) then look for a text editor with just a little more....

I quite like geany, it gives intelliguess functionality (""predictive text"") and also will list functions and variables in the side bar which can be very useful for rapid navigation of code.

while it does have an integrated terminal I prefer to alt-tab to a separate terminal to maximize the size of the code window.

available for Linux, Mac, and other more difficult to use OS's [https://www.geany.org/](https://www.geany.org/)"
4157,"I suggest CLion.  It's commercial software, but I think you can get it for free if you're a student.  It's cross-platform, flexible, has a growing plugin ecosystem, and its code analysis and refactoring features are second-to-none. Using it as an IDE will require some familiarity with the CMake build system, since its project awareness is built on top of it, but that's good to know anyway, and for simple projects it's trivial to set up.   My only real knock on it is that the built-in debugging is just adequate.

IMHO coding in ""dumb"" text editors is for preening hipsters and old dudes whose preferences calcified decades ago, not programmers looking for the best ways to get work done quickly and well in 2019.   Powerful tools make coding much more pleasant."
4158,"I use emacs for everything. I assume there are probably code completion plugins available, but I hate the idea so I've never looked into it.

But after 20 years of using it and trying the hot new editor of the day on a regular basis... Nothing comes close to feeling as right as emacs does out of the box or working as well as it does"
4159,"Ditto.  Emacs is potentially infinitely powerful, running its own domain specific extension language.  Not for the faint hearted, but the nuclear option for those who care to wield such a thing."
4160,"If you want a debugger, use eclipse. If not then I just use sublime or atom"
4161,I use [Sublime Text](https://www.sublimetext.com) it should have everything you want.
4162,debugger ?
4163,Sublime text is a text editor not an IDE therefore it does not have a debugger.
4164,I use gedit
4165,"I don't like IDE's because of the bloat that comes with them, but I can see the allure.  The built in debug suite that comes with Visual Studio (last used it like 3 years ago I think) is really really nice.

I work in vim combined with ctags, and I normally mix this with tmux. You can compile and do all that fun stuff in vim on it's own, but I like having tmux at the aid.  I started tmux a while back so that I wouldn't lose ongoing work on machines I had to ssh into, but I've got used to building using in with multipane set ups."
4166,I use visual studio at work and vim at home. I don't think there's a reason to use an IDE for C if you don't work on a bigger project with more than one developer.
4167,"/S P A C E M A C S/

- It's got style
- It's got everything you will ever need and some more
- Still very light on resources
- Very portable / runs on anything"
4168,ViM
4169,"Notepad++ is perfectly fine.  If you want the features of an IDE, perhaps try Visual Studio."
4170,"For C programming there are two options:
1) Vim: editor not an IDE. It's my choice. Vim has a lot of plugin for autocomplete and for customization.
2) CLion: one of the best IDE that I ever used. It's very easy to use, it is configurated perfectly since the first start.
Seeking information about Vim you could discover Emacs, my advice is to avoid emacs because it's very complicated as editor."
4171,">For C programming there are two options

ROFLMAO"
4172,"JetBrains IDEs are just so wonderfully good at what they do.

They index the world, are generally context aware and just generally speed up coding."
4173,Does it have a free version or just the paid one?
4175,Doesn't really inspire me enough to switch from VSCommunity to it.
4176,"I understand the aversion to paying for stuff that you can do for free. But nothing does for free what JetBrains IDEs do.

I dont have too much experience with other C IDEs beyond doing basic vim setup, but I can compare the Java side and IntelliJ makes eclipse look like a childs plaything.

Truly, with eclipse, I can fully understand why some people dump it and go back to the simple life. Eclipse likes to step on your toes and otherwise trip you up a lot.

JetBrains IDEs are more like a **context aware** HUD that you can choose to participate in or not. Context is something that is sorely lacking or outright non existent with other competitors."
4177,"Have you tried Visual Studio Community? Sure, C support goes as far as the C++ demands, but within that set, IntelliSense works, and it's wonderful."
4178,"Intellisense is pretty good. I find that JetBrains stuff just flows more nicely as I type than visual studio does though.

Command line editor completions used to all be laughable and more often than not just got in your way. I havent done much evaluation of them since language server picked up steam, I admit."
4179,"I've used both quite a bit.  MSVC is very good... if you're developing on/for Windows.  This is inherently very subjective, but I think CLion has an edge in user experience and useful code awareness, and it's more broadly useful for more kinds of work.  On the other hand, MSVC's built-in debugging suite is more powerful."
4180,">nothing does for free what JetBrains IDEs do.

emacs will run around JetBrains and spit in its face for free."
4181,"Maybe, but Ill be done a years projects before you get emacs configured to do anything."
4182,Did you say the same thing about your operating system?
4183,"Visual Studio Code (*not* Visual Studio, which is a full IDE) works quite well, with C/C++ plugins. Try it out: https://code.visualstudio.com/

If you don't like telemetry, you can disable it by editing configuration file or just try VSCodium (https://github.com/VSCodium/vscodium), which is Visual Studio Code without Microsoft branding and with disabled all kinds of telemetry.

Both are free to use."
4184,"Atom is a pretty good editor. I use it a lot and it has some predictive capabilities. Limited, but still there"
4185,"Thanks for the responses! Ill definitely give them a try. Also, i am a relativity new programmer and i thought that IDE was just a fancy word for text editor. What is the difference? And what benefits do each provide?"
4186,"IDE stands for Integrated Development Environment. This means it comes with a Editor, usually with code completion, syntax highlighting, formatting, syntax error checking etc... A compiler, usually with tools like Make etc.. And a debugger. All built into the tool."
4187,"Atom? Free, easy to get, less branding then vs code, and pretty bare bones but you can build it up however you need it."
4192,"you should try out the IDE clion. It is free for students. I love it for C++, have little experience with it for C.  [https://www.jetbrains.com/student/](https://www.jetbrains.com/student/)"
4189,"I honestly find that most IDE's are bloated with simple options often difficult to dig out of their gui hierarchy

If you're comfortable with Makefiles (and you can make them much simpler than some do!) then look for a text editor with just a little more....

I quite like geany, it gives intelliguess functionality (""predictive text"") and also will list functions and variables in the side bar which can be very useful for rapid navigation of code.

while it does have an integrated terminal I prefer to alt-tab to a separate terminal to maximize the size of the code window.

available for linux mac and other more difficult to use OS's [https://www.geany.org/](https://www.geany.org/)"
4190,I've removed the duplicates of this comment you posted.
4191,thanks I abandoned it in the end (assuming it wasn't posted) it kept saying there was a problem and hadn't seemed to post....
4193,"you should try out the IDE clion. It is free for students. I love it for C++, have little experience with it for C."
4194,Visual Studio Code.
4195,"My only complaint is the startup time, if I just want to change 1 config option or something the wait is annoying."
4196,"Yeah it's a bit slower than other options like sublime or np++ but its still way faster than a full IDE. It also scales nicely and the text font looks the best to my eyes. 

If you're doing a lot of text file based changes then I would just keep it running."
4197,Most other editors let you change the font. Don't judge a text editor based on its font until you have found out you can't.
4198,"I meant the way it renders the text, and scales it as you zoom in. Useful for HiDPI displays."
4199,Electron...
4200,"VSC is *way* faster than Atom and I have no idea how. The only thing I've (personally) seen conclusively beat at loading it is N++, honestly."
4201,"Yep, it is, but not as faster as Sublime yet :("
4202,"This answer also applies to OSX fwiw (haven't tried it on Linux, but maybe there too)"
4203,It is available for Linux too but I also haven't tried it on that platform.
4204,"I use it on Linux, works the exact same as windows/OSX"
