idx,text
66454,"Mexico has been playing moleros? Idk, past few friendlies have been vs decent/good teams"
66455,and have been looking pretty good against them too. hated when we’d play teams like barbados and think we were world cup winner contenders.
66456,"Worst team we played was Guatemala back in September, but given that it was the first match to be played after the Covid breakout it can be forgiven they couldn't get a better team. 

But after that yeah, some solid teams, Netherlands, Algeria, South Korea, and Japan."
66457,Morelos is Colombian
66458,I always wonder how we (Tunisia) are always that high..
66459,Afcon semis and recent world cup group
66460,Friendlies.
66461,"Team isnt good on paper but the results you produced was exceeding expectations during the last few years. In other words, exactly the contrary of Morocco and Egypt."
66462,sidi mehrez
66463,"Wales 18th, wot"
66464,Bale played a good match so fifa updated the rankings
66465,"A lot of Welsh players play better for Wales than their club. Bale, James, Ramsey and co. turn up. 

Hal Robson-Kanu was doing Cryuff turns to score against Belgium."
66466,Fair cryuff turns do give you at least 5 extra rankings
66467,Adam Lallana's thoughts exactly
66468,How long til we can expect that for us
66469,That was like 5 years ago.
66470,point still stands that Welsh players seem to play their best football for Wales
66471,Is that too high? We’ve won a lot of games recently against decent opposition as well
66472,"Wales are doing really well atm considering the historically low expectations for them. Here's a list of their results: https://www.faw.cymru/en/wales/results/

Unbeaten in the Nations League with 5 wins and a draw, putting them top of their group. Only one goal conceded, as well."
66473,It’s mad that they think Poland is the 19th best international team in the world. Every time I watch us play it’s like a Sunday league team with 1 good player up top. Madness.
66474,"No one thinks it, the world rankings are all numbers and data, so in that regard the machine is saying, there is no thinking involved"
66475,"The machine is not coming up with the algorithms by itself, at least I hope so."
66476,"On the other hand, a IA that only wants to manipulate algorithms to favour Poland sounds preferrable to other options."
66477,Good GK too?
66478,"It's based on data, and thanks to good results from 2015 to 2018 we are still high. Realistically we should be below Sweden, Senegal and Ukraine (they're way better than what their position suggests). Maybe we'll get better under Sousa."
66479,"Polish coaches are brainless, the best generation of players absolutely wasted. Hopefully we can make a statement in the next couple of tournaments before Lewa retires."
66480,I can't believe we actually made it but fuck it we'll take it 🇰🇷🇰🇷🇰🇷🇰🇷
66481,Idk how either our attack is decent but our defense is made out of wet paper bags
66482,*desperately prays for Kim Min Jae to go to Europe and develop into a cornerstone for a solid defense*
66483,I heard he was linked with lazio and Tottenham. Hopefully he gets a a move to Europe
66484,We're ahead of you. The last time we reached a World Cup was last millennium.
66485,"HA! Take that, Czechs !!! Not even in the top 40, you nerds. Slovenskooo"
66486,"4krát som to musel skontrolovať, že naozaj sme tam a Česi nie. Lmao. Lets gooo 🇸🇰🇸🇰🇸🇰🇸🇰🇸🇰🇸🇰🇸🇰🇸🇰🇸🇰"
66487,Nice Mexico is at 9th. Hope mexico gets into the top 8.
66488,"you could say they already are in top 10, look at the bright side bro"
66489,I am looking at the bright side. I said it was nice that rhey are in 9th. I just want them to be top 8 since that would make them a first seed team in a group at the world cup.
66490,"need to be top 7, because Qatar will be the other first seed"
66491,Your right. I forgot about Qatar.
66492,My rightness is a course sometimes
66493,"oooo, did not get that, my bad bro"
66494,"No way Poland is above Senegal, they fucked us sideways in the world cup..."
66495,It's true but that's not how the rankings work. Everyone knows fifa rankings really don't reflect quality.
66496,"By definition teams under CAF will get fewer points than teams under UEFA for the same performance, as CAF teams have a lower coefficient."
66497,"We (Switzerland) have really dropped since the 4th place in the Nations League in 2019. We were consistently ranked somewhere around the 8h place im the ranking, our performance have been quite shit over the last few matches.

Lichtsteiner retiring hasn't really helped us either, we lost a quality leader with him. Not sure if Petkovic should stay much longer to be honest."
66498,"Switzerland plays better than the results show in my opinion. Defensive mistakes and not having a clinical forward are the drawbacks. Seferovic got his god mode on in that incredible match against Belgium, but he's no Lukaku or Lewandowski."
66499,"Part of our 'decline' can be accredited to the change in our tactics and system over the last few months, I think we look better than before, yet our results are worse somehow. 

I've been hoping for a proper forward since Frei and Streller retired, it's the position we lack most besides wingers. Mehmedi and Gavranovic are shit, Seferovic is mostly shit, Embolo can't go to the grocery store without getting injured and promising players like Itten can't really get into the squad.

One thing that bugs me is the lack of passion some players seem to have (not talking about singing the hymn by the way, I wouldn't either).

Players like Senderos, Magnin, Spycher Lichtsteiner are on a different level than some of the planks walking on that pitch today. Surely we have more quality today, but we lack the players who would go through hell for the team."
66500,"Sorry, but I don't think that Itten is it. He was good at St. Gallen, but now is mostly a backup player for Rangers. Ajeti does better at Celtic for example. Still, Seferovic scored more than both of them this season so far, and the portuguese league is way more competitive than the scottish one."
66501,Let’s be honest the old ranking was partially a result of gaming the rankings by playing friendlies against sides you knew you could beat. Nations League shone a light on the true level.
66502,Bruh how are we number 1
66503,WC third place and doing well in Friendlies maybe? Idk I would have thought France would be top but Belgium have a great team too
66504,"France got to the 2016 finals and won 2018. They topped this Nation's League group, so probably friendlies count too much toward this"
66505,Belgium won almost every game since losing to France whilst France lost and drew some. The current model used by FIFA is quite close to ELO so the Friendlies actually don't weigh that much in the formula
66506,Playing in friendlies actually hurts your ranking. It’s beets to do too many subs so the same doesn’t count and doesn’t hinder you. Always scheduling friendlies against the right teams. Certain countries have somewhat gamed the rankings before to get themselves higher seeds. I think Switzerland might have.
66507,Is that still true since they changed the way they calculate the ranking?
66508,"Imagine conceding a hattrick to fucking Seferovic and still being number 1

BelgianThings"
66509,"Texas in 17th, America is really taking over"
66510,IM FUCKING MISERABLE
66511,so is our national team
66512,"SOY CELESTE! SOY CELESTE! CELESTE, SOY YO!"
66513,can't believe my little country is at 26. bit proud ngl lol
66514,"It's not that little when you compare it to most European countries, they mostly have around the same population on average."
66515,how are we 31st... feel like Algeria is always super low in this rankings even after winning AFCON
66516,Because we didn't qualify for the World Cup
66517,I love how Russia beat Spain (#6) and is still #39 while America didn’t make the World Cup and is #22.
66518,It’s been 3 years since the World Cup
66519,Someday Davies and David will drag Canada into the top 40.. Someday
66520,Having anyone ahead of France is a joke.
66521,recent results though
66522,Surely Portugal should be above England?
66523,Slotted in nicely between Morocco and Algeria... Great work philosopher Güneş
66524,Does 21 not exist?
66525,There is a tie for 20th place probably. That’s why 20th comes up twice.
66526,Ahh got it. Thanks
66527,Sweden and Senegal tied for 20th
66528,"Sweden and Senegal have same ammount of points, so they're both at 20th"
66529,Fifa takes the game of twenty plus one very seriously.
66530,Brazil being 3rd place absolutely amuses me. It shouldn’t be that high honestly.
66531,"With Tite Brazil lost only one official match, while being extremely unlucky. In the last few years they won the Copa América and beat Argentina and Uruguay, among others."
66532,Scotland should be there
66533,"Doubt it. Were pretty poor in the qualifiers, lost a couple of nations league games and I doubt we picked up many points in the play offs."
66534,Yeah I was only joking. We’re 48th right now but after 6 wins in the Euros we should be looking pretty
66535,We need more Aussies
66536,*visible confusion*
66537,"Who the F is the one in charge of this graphic?

Some has the top gradient glow(Belgium), some has no gradient glow(Germany), some has edge glow(Italy), some with super low resolution without any glow(England), and some with 'glow' effect that's covering 60% of the imagine(Morocco)."
66538,"Lmao Romania on 37. We're objectively worse than all 3 teams under us and the first 10 above us would probably 5-0 us any time easily. We're beyond trash. We should be 50+ not 37

."
66539,Colombia 15th lol
66540,thats okay I don't like football anyway
66541,Glad to remember we came back into the top40. 31st rn and Im only hoping that with another successful AFCON we can challenge where we were in 2014
66542,Wow cool were actually in the top 10. Number 9!
66543,Feel like the netherlands should be somewhere in the top 10
66544,Nah our games under de boer has been trashh
66545,The results were mediocre at the start but it’s the best football we’ve played in the last 5 years.
66546,Wasn't any better under Koeman though was it? We have been laying like shit for years.
66547,Germany's hitting a new Low I see.
66548,I think it makes it even worse knowing Australia only misses this list by one place. At least if we’d been further off I wouldn’t have gotten my hopes up.
66549,25th!!! VAMOS PERU!!!!!!!!!!
66550,I don’t think they’ve seen us play recently lol
66551,LOL! Lets not talk about it. Lets just be happy that we are here.
66552,Hahaha. Thanks lads.
66553,Wales in #18
66554,10th place baby!! 🇮🇹
66555,Shoutout Scotland
66556,Can't believe we are that high
66557,Always reminds me that Franco fucking Foda is wasting our golden generation. Oh the things we could achieve with a this squad and a good coach.
66558,I hate the FIFA rankings but I guess there's not really any other better way to do it
66559,Anybody else enjoying putting a country to the flair in this thread?
66560,How the fuck we're number 32? We finished last in national league. Is it because we finished second in European Qualifiers?
66561,France not in first place... Lol
66562,"So happy to be in the top 25, hopefully we can win the regional tournaments and get a good world cup spot. 22 is a great number for 95% of us no little to nothing about soccer/football"
66563,African teams absolutely shafted here
66564,FIFA rankings are such a joke. ELO rankings are way better.
66565,argentina is either 5 spots too low or 10 spots too high depending on whether they can sort their defence out
66566,"No idea how the Swiss, the US and Austria are ahead of Ukraine. Ukraine won their group for Euro qualification and was in pot A for Europa League with a big win over Spain. Pretty sure they tied Germany as well. They should be where the Swiss are."
66567,"Clubwise there are a few...

**Milan 1989** Maldini, Baresi, Costacurta, Gullit, Ancelotti, MVB, Riijkard.

**Madrid 2001** Zidane, Hierro, Carlos, Makelele, Figo, Casillas, Raul.

**Milan 05/07** Maldini (Still) Nesta, Gattuso, Pirlo, Kaka, Seedorf, Inzaghi, Cafu. Shevchenko, Crespo Stam..

**Barcelona 2009** Messi, Eto'o, Henry, Xavi, Iniesta, Puyol, Abidal.

If either Barcelona or Real Madrid win the UCL this year, they could possibly be added to this list, especially offensive wise.

International

**Brazil 2002** Cafu, Ronaldo, Ronaldinho, Rivaldo, Kaka, Ceni, Carlos, Lucio, Dida, Juninho, Denilson. That squad was ridiculous.

These are the ones I can think of off the top of my head, feel free to say anymore."
66568,"I'd go with the 2004 Real Madrid squad in terms of name value at least - Zidane, Ronaldo, Beckham, Raúl, Figo, Roberto Carlos, Michael Owen, Walter Samuel... My brain couldn't comprehend it at the time..."
66569,http://www.reddit.com/r/soccer/comments/2g2j07/greatest_champions_league_squad_from_the_past_20/
66570,"Uh... what's the word... Real... Madrid? I think? .-.

Their bench can easily win titles in another countries."
66571,but their starting XI can't win the title in their own?
66573,"Well, Turkish Superlig, maybe."
66574,"The ""new"" galacticos or the ""old"" galacticos?"
66575,Barca 2007-12
66576,"The list also leaves out the more recent Milan side that won 2 CLs and lost a final to Liverpool alongside winning the league and Club World Cup. That side was definently a top 20 team, 2002-2007 ish."
66577,"that team is top 10 easily, perhaps even higher. Sure only one scudetto isn't good enough but in europe they dominated and annihilated so many teams obviously other than that liverpool fuck up. Only Arsenal 02-06 have played more enjoyable football in my adult lifetime in my opinion."
66578,"Yep, that team had one of the strongest XIs of all time too. Maldini-Nesta-Stam-Cafu-Seedorf-Gattuso-Pirlo-Rui Costa/Kaka-Shevchenko-Inzaghi to name the standouts."
66579,"Exactly, with backups like Costacurta and Crespo. Fucking Juve, Milan should've won so many more scudetti."
66580,"True that, fuck Juve :D"
66581,100% agree on that AC Milan team. Literally had 2 Ballon D'or players on it. Plus a stacked midfield and defense
66582,"The United team of the late 90s/early 00s was excellent, but they only got to 1 European Cup final. How are they better than the Inter Milan team of the 60s, who got to 3, and won 2? Or the Benfica team of the same era, who won 2, and got to 5 finals?

They were a brilliant team, but they don't deserve to be so high up this list."
66583,"I'd also argue that the United team from 2006-2011 was better as they reached 3 champions league finals winning one of them and also won 4 out of 5 Premier League titles. The like of prime Rooney, Ronaldo, Tevez, Carrick Scholes, Vidic, Ferdinand and van der Sar were the core of the team!

Great article though!"
66584,"That 90's United team did win the treble mind, first team in England to do so, so i kinda get why they went for the 90's team."
66585,Yeah that's a good point! One of the my first fondest memories was watching that late at night as a kid staying up past my bedtime!
66586,"My dad is a Manc and and I fondly remember him nearly giving my dog a heart attack when Solskjaer scored. While me and my brother (both Liverpool fans) just sat there thinking ""of course they've fucking done this, bastards."""
66587,Bloody hell a United dad and Liverpool kids that house must have been like a war zone
66588,The Inter Milan team in the 60s got 2 European cups but they literally got them through cheating so that doesn't mean much
66589,Evidence?
66590,Paisley's Liverpool is underrated.
66591,The Barcelona side that won 6 trophies in a year should've been number one..
66593,Why does the Liverpool side stop at '83 as they kept on winning trophies throughout the 80s?  Turnover in the squad?
66594,"United 06-09 > United 98-01 

I prefer this [list](http://footballpantheon.com/2011/05/the-50-greatest-european-club-sides/11/). It's better researched. Although do bare in mind it's from 2011."
66595,the guy stand to the right of platini wore longer shorts than platini....so its not like those werent available during that era. what was the rational for those very short shorts though?
66596,"Santos is way too low, how are them behind Celtic and Benfica lol"
66597,Worst list ever!
66598,It's pretty decent but you know beforehand most people would make a different list.
66600,Seemed like the list favoured long-term dominance. I guess they felt that team all went their seperate ways too quickly.
66601,"Just a heads up, whining about downvotes is normally a great way to get more."
66602,bs list
66603,This thread is going to be delicious to browse soon.
66604,"Depends what you want, if you want to watch your team steamroller all opponents then one of the two main Spanish teams (barca and real). But that's no fun, knowing your team is going to obliterate anything before it (sure there are a few slip ups) is pretty boring in my opinion. The fun is in the tension, the highs when you win as the underdog, the fight to avoid relegation to a lower division. I'd recommend one of the mid level English teams, Everton, Tottenham, Southampton, Swansea. There's a good level of banter amongst the fans, there's more passion"
66605,"Like I said, I'm a Chicago fan, so we're usually teams with great tradition that are underdogs. But we'll pull out great runs. Anyone like that?"
66606,"I'd go for Southampton, they seem to be everyone's second favourite team in England. Have a terrific academy and just keep churning out fantastic young talent, Walcott, bale, oxlade-chamberlain, lallana etc. They sold most of their squad last summer, were seen as definite to be relegated, but with a fantastic manager have been toying with the prospect of European football most of this season as opposed to relegation."
66607,That's silly.
66608,What's silly?
66609,"This is a bit like choosing a girl to fall in love with, it's hard to engineer. I'd say you should watch a few matches and see if you suddenly catch rooting for one side rather than the other. That being said, I'll give you a run down of the biggest clubs. Note: I don't really have a clue what I'm talking about, and apart from this, nothing I say should ever be taken seriously by anyone.

* **Real Madrid**: has won 10 Champions League titles, more than anyone else. Their fiercest rivals are Barcelona and Atletico Madrid. They sign big names, galácticos, and have one of the biggest fan bases in the world. Also, [Cristiano Ronaldo](https://www.youtube.com/watch?v=HYDPVBprjFo), the world's best player in 2013 and 2014. And you can't really go wrong with James, Isco, Modric, Bale, Ramos, the little pea or the central defender prodigy that is Varane. Top three in both team quality and club size. 

* **Barcelona**: as of right now, perhaps the best team on the planet, their run in the last months has been fantastic. [Messi, Suarez and Neymar](https://www.youtube.com/watch?v=KeRThkiCK7E) in attack is almost like cheating. This team would be more top heavy than a woman with giant breasts and small everything else, but their defence is almost as solid as the attack is good. Top three in both team quality and club size.


* **Bayern München**: won the Champions League two years ago, along with the Bundesliga and the German cup, completing a treble. The biggest German side, they have a formidable history. They've got [top quality players all over](https://www.youtube.com/watch?v=zNhBnkyt7-o), and a lot of players from the German side that won the world cup. Not to mention a [keeper](https://www.youtube.com/watch?v=dIGqcIYvq6M) with his own [subreddit](https://www.reddit.com/r/justneuerthings/) Top three in team quality.


* The fourth team I want to mention is **Arsenal**. Famous for their optimistic and [fluid football](http://www.dailymotion.com/video/x16uyix_arsenal-vs-norwich-4-1-jack-wilshere-s-goal-of-the-season-hd-720p_sport). You can count on them to always get to the knockout rounds in CL and they will [always almost go through](https://www.google.no/search?q=arsenal+almost+champions+league&ie=utf-8&oe=utf-8&gws_rd=cr&ei=JX9HVYLgLoWasAHKz4GgDQ). Rivals: Tottenham, Manchester United, Chelsea and 15 more London clubs.


* Then you have **Manchester United**, easily one of the most recognizable clubs in the world and the most successful English club. Struggled last year after the great Sir Alex Ferguson retired after nearly thirty years as manager. With the [eccentric Dutchman Louis van Gaal](http://www.nrc.nl/nieuws/2014/05/21/british-journalists-follow-these-ten-rules-for-interviewing-louis-van-gaal/), they are in a good position to qualify for next years Champions League. Top three in club size. Rivals: Manchester City, Liverpool, Arsenal.


* The second most successful English club is **Liverpool**. They have a great history, and I hear they'll have a great side next year.


* While Serie A is in a bit of a rough patch right now, there are still plenty of great teams in Italy. **Juventus** just won the ""scudetto"" for the 31st time, making them the most successful Italian side. With players such as [Buffon](https://www.youtube.com/watch?v=qY9t8n2b_w4), [Tevez](https://www.youtube.com/watch?v=eEwgKAPow9w), [Pogba](https://www.youtube.com/watch?v=gMxPphrgeu8) and [Pirlo](https://www.youtube.com/watch?v=IkyC9ZdHjaU) it's no wonder that they won. 



* But wait, there's more! Even though they're not that prominent in the US (yet), **SK Brann** from Norway is a club of high quality and mediocre values. Except for a minor setback with relegation last year, Brann is now en route for coming third in the highly acclaimed OBOS-ligaen, thereby securing the right to enter a qualification cup with the teams in 4th, 5th and 6th where the winner will face the club that ended at 14th place in Tippeligaen. So you can say it's getting pretty serious. If you start now, you'll be joining on the way up and that's way more fun than jumping on the bandwagon when we win the Champions League in 2019.

Look at all I've written, and I have still neglected several great teams such as Borussia Dortmund, Inter Milan, AC Milan, Atletico Madrid, Chelsea, PSG, Lyon, Ajax, Celtic and Roma. And I have failed to mention several good leagues.


TL;DR it's up to you, buddy. And we all know what you mean by ""soccer"", don't worry about it.



PS! Bayern will face Barcelona and Real Madrid will face Juventus in the semi finals of the Champions League soon, watch those games. Additionally, Chelsea will face Liverpool next week, and Arsenal after that. Manchester is going to square up against Arsenal the 17th. 

Edit: formatting."
66610,Barcelona
66612,Because Messi is the hero we all deserve.
66613,"Name recognition, due in part to being the only worthwhile team in La Liga. 

Plus, *everyone* knows either Messi, Neymar, or Suarez (only because he bites)."
66614,"A few million Real Madrid fans will violently disagree with your opinion. Not to mention, some Atletico fans."
66615,"To which I'd respond by telling them to look at the past two decades of La Liga.



Annual Winnings: 

FC Barcelona: **8**  ('12-13, '10-11, '09-10, '08-09, '05-06, '04-05, '98-99, and '97-98)

Real Madrid: **7** ('11–12, '07–08, '06–07, '02–03, '00–01, '96–97, and 94'-95)

Atletico: **2** ('13–14, and '95–96) 

This pretty much knocks out Atletico. 



Obviously, Madrid and Barcelona are pretty much even, but for a newcomer to football, I'd say Barcelona has been more relevant in recent years."
66616,"> To which I'd respond by telling them to look at the past two decades of La Liga

to which they would respond by punching you in the face"
66617,Haha probably true
66618,"Balotelli is a fucking tit, and he's shite, 1 league goal this season."
66619,[Dalkurd FF](http://en.wikipedia.org/wiki/Dalkurd_FF)
66620,Arsenal.
66621,"Cool logo, cool name."
66623,Are they winners?
66625,Sounds good. Colors?
66627,"That actually might happen. Thnx, man."
66628,If you're a glory hunter pick Man City or Chelsea.
66629,"Chill out, I'm a Cubs fan."
66630,"I don't really understand the feeling of

> I wanna be a fan

Just watch football and you'll see which teams you like and which not. I think ""being a fan"" doesn't work by basing your ""love"" for a club on facts or titles someone tells you.

You like Balotelli? Watch Liverpool and see if you can't miss a match of them after that.

Or watch Bundesliga and be impressed by that brilliant team from Berlin in blue and white with their little flag as logo.

Just watch it and have fun, the rest comes by itself."
66631,"You're right. I jus think it's more fun following a team, especially with such a long season."
66632,Late asf but... Napoli!
66633,"Good god, a whole month? Thnx for the dedication. Napoli? That sounds pretty Italian."
66634,"I know! LOL Napoli is such a cool team and yes, Italian. Currently 5th in Serie A. Should be pushing for Europe continental cup etc. places soon (surely)"
66635,You mean football ?
66636,"Yes, I do. But I'm an American. From America."
66637,"The word ""soccer"" is actually British. It comes from the name, association football, with the ""soc"" bit taken from the word ""association""

read up, actually quite interesting  
https://uk.eurosport.yahoo.com/blogs/the-rio-report/mystery-solved-don-t-blame-usa-real-reason-123344142.html"
66638,AC Milan. We have great history..
66639,I used to use them in the FIFA games that had Ronaldinho. How are they now?
66640,"10th. Mediocre team. Mediocre trainer. And it's not Inter, sooooooh..."
66641,Bayern Munich seems to be a top pick in Germany.
66642,Not in Munich though... München ist blau!
66643,München ist nicht blau ein paar Stadtviertel aber nicht ganz München
66644,Glasgow Celtic.
66645,Crystal Palace.
66646,Didn't Chelsea beat them yesterday?
66647,Lol chelsea beats everyone.
66648,Ugh.
