idx,text
4046,"I'm so glad I found this post/subreddit. I'm in a similar situation in that I have a decent job, yet unsatisfying and doesn't pay well enough for the long haul. I have some school under my belt, but want to finish my undergrad in CS now, hopefully with a software development focus.

I've been doing a lot of self-learning, but now that I qualify for my employers' tuition reimbursement program I want to take advantage of that. But I don't just want a piece of paper from a ""diploma mill."" I want to be challenged and actually *learn* whole I'm in school (novel, I know).

But the only way I see it working is online. I'll be working full time and have a baby on the way. But it's so hard to judge an online school before enrolling. Every school has such polarizing reviews. And aside from that, there are just so many factors to consider.

But I'm going to look into some of these schools listed. This is why I like Reddit"
4047,"Everybody fucks up, to a degree.  Man, I'd love to go back and do my Bachelor's all over.  But now... I have my MS and I'm a college professor.  There was another professor at this school who only had a high school degree and was a forklift driver.  She got hurt on the job, had to go on disability, was all like fuck this, and now has a PhD and is a writing professor.  Fucking up doesn't mean you're screwed for life, and it doesn't matter how old you are or where you are in your education.

The important thing to remember about online education (I teach in a Master's program online) is that, while convenient, it is just as intense, involved, challenging, and time-consuming (or even more time-consuming) as regular face-to-face courses.  Most students do not realize this.  To be candid, if I had a student with a demanding full-time job and a baby on the way, I'd counsel them to wait. I'd counsel them VERY STRONGLY.  If, however, you're getting a degree and you need to take those bothersome courses that duplicate your certificate knowledge, they might be a lot easier; this would make your studies easier, content-wise.  Also pay attention to courses with synchronous (ie, ""live"") components.  If your life is such that you cannot log onto a class every Tuesday night at 7 p.m. (and it will be 7 p.m. local time to the university teaching the course - keep that in mind), it's not a reasonable thing to do.

And do watch out for reputation and credibility of the institution, as previous Redditors have mentioned.  We are unimpressed if we get applications from people who got their degree at Phoenix or Walden.  It's easy enough to see evaluations of specific programs online.

If the Redditors below are making recommendations based on experience, that's excellent!"
4048,"I did Designlabs UX design course, with an art history BA under my belt, and went from making 40k in a career with a low ceiling to 70k with a high ceiling for salary. Took me 1 year from beginning to getting hired."
4049,Did you do the UX academy? The USD 5999 one? Can you please share your experience doing the course? I am really interested!Thanks :)))
4050,"Yes thats the one!

I had a very positive experience, and I absolutely recommend the course. I was skeptical because its less recognized than General Assembly or some of the others. Also, there seems to be mixed perspectives as far as how valuable and worthwhile these courses are. Youll see plenty of UX professionals on Reddit saying how they never hire people from these courses, etc. So naturally I was concerned, but took those statements with a grain of salt and pursued it anyways.

I think my experience was so positive because of my mentor. He was super communicative, encouraging, and empathetic, not to mention incredibly intelligent and successful. 

At the end of the course, I had completed an online portfolio and had gained the language to speak confidently about user experience design. Took me a couple months to land a job, but immediately landed a job after going through a staffing agency. 

Overall, completing the course through designlab truly set my life on the path I had wanted for so long. Im now in an industry that challenges me, and every day I feel so fortunate to have had the fortitude to pursue what I wanted and to have actually landed a job. That being said, I am super passionate about understanding people on a very human level, problem solving, and working with others. I love giving people positive experiences, so the industry very much matches my personality. Definitely do your research before committing to one of these programs because once you commit, you really have to be prepared to work your ass off, even after the course ends. Interviews for these jobs are no joke. 

Can I ask, why do you wish to pursue one of these programs? What is driving you to want to enter this field?"
4051,"I work in an office with some artists turned UX. When I asked each of them that question individually, they all told me different versions of ""I was tired of being poor""."
4052,"I am a front end developer on a big team. We have a devoted UX designer and shes make everything so easy for us.

Creates wireframes, meets with the customer, locks down requirements. 

Shes lets me get back to coding!

&#x200B;"
4053,"Thank you so much for your detailed reply. For me the reason I have been looking into UX courses (I actually considered GA but its outrageous how much that costs) is because since a very young age (I am 30 now) I am always looking at websites or even just everyday products and think how to improve them and make them more user friendly. I do that even with the documents I draft (I am now a paralegal). So when I came to know about UX I was like ohhhh sweet that sounds like something I would like. I do calligraphy and so I also pay a lot of attention to type face, color combinations and illustration on app interfaces, website or even just greeting cards haha. So yeah... haha I am so encouraged reading about your experience!! Very happy for you too!!"
4054,"Second this, I'm considering doing Springboards UX course for ~the same cost. I'm just leery about this paid online courses that *seem like schools* but are really just businesses offering an online product.

^ the key difference for me would be the applicable workforce skills and one-on-one mentorship support/structure other online courses don't offer.  

**Whats your experience been?"
4055,"I will say that with Designlab, the workforce skills youre talking about were highly stressed. No lesson was presented without considering the functionality within an actual workplace. My mentor was constantly training me on how to answer stakeholder questions, etc. 

See my reply to the above comment for more details about my experience. Or feel free to DM me if you have any specific questions!"
4056,"Nice, congrats!"
4057,"Did you go through the whole program? Did you like it? What was the cost? Ive seen similar programs and Im considering it, but any insight would be helpful!"
4058,"I did go through the whole program. I loved it. I mean it helped me leverage my prior experiences (fine art sales and exhibit production) so that Im making much more money in a much more interesting environment. My program was 6k and worth every penny. 

Definitely do your research on the industry and be confident the program is something youre willing to commit to. Its not enough to simply complete the program and expect a job to land on your lap. You definitely need to network and self educate and be genuinely interested in the work. The program is largely what you make it. Youll get out of it what youre willing to put in. Not to mention the hiring process for these jobs can be very demanding and theres nine million other people just as driven and ambitious as you are with just as good portfolios competing for the same roles, so you need to find your edge and really lean into that. For me, its that Im a great communicator and speaker, and add value to the teams Im on because I am a great liaison between the stakeholders and the design team."
4059,"Very cool! Im really excited to dive deeper into this. I have a background in film, photography and marketing so I think they are pretty transferable. 

Where are you located and what type of company do you work for? Im wondering if this is a job I can find in any part of the country (or world) and what type of companies are hiring"
4060,"Go through top of all time on AskReddit, there's a thread full of certifications and programs that are free or low cost there. Lots of then related to business & IT if I recall. Might be worth checking out."
4063,https://reddit.com/r/AskReddit/comments/6k0p7l/what_are_the_best_free_online_certificates_you/
4062,"The top of all time on AskReddit is 

""People who haven't pooped in 2019 yet, why are you still holding on to last years shit?"" here's a link for anyone curious https://www.reddit.com/r/AskReddit/top/


... can anyone link me to the actual post since the above comment wasn't helpful?"
4064,Thanks for delivering!
4065,"No problem. It's delivery, not Digiorno."
4066,"I'm sooo going to use that. Thanks for the laugh. 

A while back I read someone calling weed, the devils lettuce. I started to use that phrase irl and now people are picking it up. lmao"
4067,Haha no problem. Glad my humor is appreciated. I used to sarcastically refer to it as the devils lettuce when I was in highschool :)
4068,You're one of those people. Now I'm curious. Tell me about your life.
4069,"U of Texas Austin has an online computer science Master's program for 10k. That looks like a real deal, ie the same rigor as on campus."
4070,"+1 for online programs in real universities.  OP, look at your in-state system.  That's where you're going to find the cheapest tuition."
4071,"Assuming they are American. Canadian schools also have a lot of online options such as UManitoba, TRU, Athabasca and Laurentian."
4072,University of Illinois at Springfield (UIS) has completely online CS programs for Bachelors and Masters degrees.
4073,"Wow, that's very cool!"
4074,What field is the 10K masters program?
4075,Computer science
4076,"Ok, thanks, that is not my realm. 

How did you like it though?"
4077,Haven't taken it. I think they just started offering it online.
4078,"If this is the one I'm aware of, you need a completed bachelor's of engineering or science equivalent to begin this process. And you get cherry picked based on your results in that degree."
4079,Theres a Shopify sponsored degree program -Devs Degree. You learn on the job for 4 years and get a degree from a Canadian university. This is an all expenses paid program where you learn from mentors at Shopify.
4081,Oh! Thats good to know. Good things are meant to be competitive else it is robbed of its goodness.
4082,"Western Governors University is about $3500 per 6 month term, completely online, non-profit, and competency based. If you have previous education your credits may transfer, and if youre already competent in a subject you can pass a class in a day. They have both business and tech degrees."
4083,"That's the one where you can take as many courses in a semester as you can pass, right? I've heard good things about them."
4084,"That is correct. Check out the WGU sub if you havent already. Im doing my MBA through them, and highly recommend it."
4085,"Oh, cool. Thanks, I will."
4086,I would second this. In the program now and the costs are considerably cheaper for an undergrad if you accelerate.
4087,"I'm thinking about doing one of their programs. Do you feel that it is worth it, for an online school? Are you able to network at all? If it will help your job prospects at all? 

&#x200B;

I'm nervous about it being taken seriously afterward and being able to get a better job."
4088,"I think it is worth it. I did my undergrad at a standard university that cost a ton of money. Even there I didnt have really any networking opportunity, because I was locked out of those career growth things because of a low GPA. Ive been in the work force for over 15 years, and wanted to get a grad degree in a better paying field, but I just wasnt willing to pay the insane tuition costs, work on anyone elses schedule, and sit through traditional classes. I work full time, commute 10 hours a week, and have a disability. Traditional education was not an option. A close friend recommended WGU, and I chose it as best for my needs. It isnt easy, you have to be self-motivated, manage your time well, test well, write well to pass the classes. At the same time, they tell you exactly what they are looking for to prove competency on essays. They take out the bullshit of course work. I dont think much about the networking stuff. I know there are groups that meet online within degree programs and within classes, youre assigned a mentor, and there are course instructors. I believe they can help you network around. That said there are many ways to network, friends, family, colleagues, former employers, volunteer supervisors, meet up groups, church functions, LinkedIn, etc. My friend who recommended WGU to me never had a problem getting interviews or jobs with her degree, and I dont expect to have an issue either. WGU now has several satellite affiliates and they are growing, companies offer tuition reimbursement for their programs, and they take industry standards seriously when determining competency. I understand your nervousness, I was also, and then I decided I just needed to do it so I could get a better paying job. It was the only real option for me. I cant say that all is well yet because I havent graduated, but I fully expect to double my income once I graduate."
4089,"I heard really bad review about this school, especially on [niche.com](https://www.niche.com/colleges/western-governors-university/)"
4090,"All schools have some really bad reviews, but even on niche.com it has 4.5 out of 5 stars with over 2,700 reviews. Im a year in and have no problems with any of it, and prefer the method of education that WGU offers. But Im also in my 30s, have significant work experience, and dont need hand holding. My undergrad big 10 public ivy university actually has a lower average score according to that website. For whatever its worth Harvard, Stanford, and Yale also have lower star ratings than WGU."
4091,is this in the context that you already have an undergrad?
4092,Sorry should have clarified.  Looking for a bachelors degree
4093,"I'm going through UC Denver's online MPA program. it'll be around 26k for the whole program.

whatever you do, look for national accreditation of whatever you're looking for, then compare that to program rankings, and most importantly job projections via the bls"
4094,"Harvard extension school
Masters of Liberal Arts in Finance 
extension.harvard.edu

You can complete the degree with their financial aid package for about 12k which isnt bad for an Ivy League masters. Take a look on the website and see if any of their programs match what your needs are!

Edit: they also do undergrad degrees. I think the cost of the ALB is about 25-30k."
4095,Do you know anyone who has done this? So I know many people who did the Harvard extension masters programs but I did not see them get any job benefit from them.  Maybe they choose the wrong degree to get but from my experience these online degrees just do not count.  I hope I am wrong since I would like to do some online degrees.
4096,"Im doing the ALM in management and completed an internship at a fortune 50 pharma company and interviewing for another position today.

Like anything else dont expect the program itself to allow you to waltz into a role, but in my experience people respect the name, find it interesting and are open to networking.

Also career services has been a good tool for me!
Linda is amazing and helped me navigate my experience effectively and make friends! I highly recommend it :)"
4097,"That is awesome to hear.  I will need to re-look at it.  BTW, what is ALM?"
4098,"Masters in Liberal Arts, its the graduate degree awarded by HES."
4099,"You can also take a look in Europe or Poland in particular. It has interesting and not so expensive Master Programs in english. Plus living there is very comfortable and cheap :) 
Good luck!"
4100,"Also until brexit officially happens, Scotland is free college for anyone in Europe who isn't English"
4101,"Not exactly, Scotland has 4 years free higher education - for Scottish residents. International students - even from the EU (or as you point out the English) must still pay fees."
4102,"""European students who travel toScotlandtostudycan still benefit fromfreetuition after the UK's formal Brexit date. TheScottishGovernment has announced that students from other European Union (EU) countries who start their course in the academic year 2019-20 will not be charged tuition fees."""
4103,Huh. Well there you go. I thought the requirement was being a resident. Apparently not.
4104,"If you have a Bachelor's, Georgia Tech has a few online masters programs for < 10k.  They are getting decent reviews."
4105,"I got a marketing degree from Grand Canyon University and I have a great job. I might be one of the lucky ones though, I'm unsure.

Wouldn't say its inexpensive, but it wasn't terrible since I got my Associatea degree from a community college first."
4106,"Georgia Tech's Online Masters of CS or Analytics are both great. About 10k in total, which is a really cheap investment considering what you get out of it. No GRE required."
4107,"I was going to say the [BS in software engineering](https://www.worldcampus.psu.edu/degrees-and-certificates/penn-state-online-software-engineering-bachelors-degree/overview) from Penn State World Campus, but that's expensive. And there's an online master's in computer science from Georgia that's a good deal, but that's a masters... Maybe the computer science bachelor's from [UMUC](https://www.umuc.edu/academic-programs/bachelors-degrees/computer-science-major.cfm).

Have you considered the Lambda School? It sounds interesting but I don't know a whole lot about it. In general I recommend online programs from major universities, but there are a lot of intriguing offerings out there especially at the certificate level."
4108,Do you consider UMUC a good school?
4109,"Good, yes. Great, stellar, excellent... probably not. But it's far superior to a for-profit, online-only school."
4110,Georgia Tech has an online MS in Computer Science for about $7k. https://www.omscs.gatech.edu
4116,!remindme 1day
4112,"https://www.reddit.com/r/AskReddit/comments/6k0p7l/what_are_the_best_free_online_certificates_you/

Check this out."
4113,"A lot of universities offer online degrees now - like, actual brick and mortar schools that just offer the same degrees online now.

What you want to confirm is that 1) the degree actually shows that it's from that institution, not a sub-organization that operates under the university and 2) that people can actually complete the curriculum through 100% online classes. Some will seem like they're 100% online, but there will be times when you have to show up on campus a few times. 

For example, my state school has MBAs for 13k, instate or out of state. You're not going to get the connections you'd get sitting in class with a bunch of Chads, but you'll get the diploma with the same letters on it. If you're just looking for something to meet a qualification, I'd go this route."
14102,!remindme 3 days
4117,ASU- supply chain
4118,"A community college will almost certainly be cheaper. To defer your federal loans you typically need to maintain full-time student status, so generally 12+ credits each semester. It looks to me like Kansas in-state tuition for CC students is about $75/credit...which is really very low compared to many other states. I don't think you'll find an online ""college"" that is any cheaper than that."
4119,[University of the People](http://www.uopeople.org/) if you're looking for a Comp Sci or Business Admin degree. All online and pretty much free.
4120,"Thanks. Does taking at least 6 credit-hours of classes there defer student loans like at a ""normal"" online college?"
4121,"Great question. As University of the People is pretty much free, I have no idea how that works. You shouldn't need to take any loans to get a degree there. But no idea if it would work to defer any existing loans."
4122,I hope to find their phone # and ask. Thanks.
4123,"I doubt you'll find something accredited that's cheaper than an in-state Kansas school with a strong online component. 

The loan deferral thing is typically between you and your lender, not you and your school."
4124,"My advice-look into Penn Foster and Ashworth college.  Both are accreted, real, legit online schools.  Note-they DO NOT accept federal aid, student loans or FASFA.  Why?  Because they are pay as you go.  They are the only schools that offer low monthly payments (or you can pay all at once per semester) and they do accept nearly all transfer credits. They are 100% online distance learning.  In fact they won't release your grades/allow you to enroll in the next semester until the current one is paid off.  Both colleges run about $1200-1300 for 5 courses/15 credits (3 credits each) and offer AA, BA and a couple masters degree options.

Both offer tutoring, online assistance and availability to instructors and fellow students to ask any/all questions you need to complete the lessons.  Cost is the same per student, regardless of where the live in the states

http://www.ashworthcollege.edu/

http://www.pennfoster.edu/"
4125,Fort Hays State university
4126,Undergrad like from Phoenix? Prob same level as an associates degree.
4127,"I think they are unfairly looked down upon. Depending on the class though I can see how there would be an advantage to have face to face classes vs online courses but that's another topic.

I think online courses are godsends for some people. It allows the student to work on their time schedule while still holding down a job and manage their personal life. It's hard to balance a job, a child, and school enough already. Online classes allow a more even balance for that individual.

I also know some older people that wouldn't go back to school for they feel it's too embarrassing to be a 40 year old in school again. 

One should never be embarrassed to take online classes and they shouldn't have to suffer afterwards for making the decision to get further education, no matter the source (as long as it's reputable of course)"
4128,"As an employer and someone who is working on an online masters degree, I have a new appreciation of online degrees. I don't know about comparing it to a standard degree, but if I were to interview a candidate with an online degree I would at least ask them about the experience and not discount them for receiving an online degree."
4129,"Not a hiring person, but generally if it's from an accredited program, it's the same as any other degree. You don't have to explain where you got it unless it's from a very recognizable ""diploma mill"" institution like University of Phoenix. 

I'm completing my bachelor's online through a local college. I chose it specifically because it's an actual brick-and-mortar institution that I can physically go to if I have an issue, which means a flesh-and-blood teacher and staff that I can talk to. Granted, I haven't been there physically in over two years -I'm what you'd call a turtle-paced undergrad, only taking 6 credits at a time. It's all I can afford, and all I can take mentally with working a full-time job. But hey, end result is going to be the same either way. 

I'm looking at doing my master's degree through John Hopkins University, and their program is online as well. When I get my M.A. it won't read ""JOHN HOPKINS UNIVERSITY - FAKE-ASS PUSSY DIVISION"", it'll just say the name of the school. I'll still be doing real-life internships as well as a two-week onsite seminar to get hands-on experience, and I'll be volunteering a lot as well."
4130,"most community colleges and pretty much all the major universities ranging from AU, UNLV, UCLA, SD State, SRJC, etc etc etc have great online programs and you can visit the teachers who run the online classes.


I know a lot of business owners and dine with them and attend their conferences and what not. Also knowing a handful of proffsionals a lot of them expressed how they absolutely loath for profit schools like ITT tech, Devry (lol), Lincoln College, University of Pheonix, Kaplen college and how they'd never ever hire anybody who attended these schools.


You have to be one dumb mother fucker to attend these schools.


For me, personally when I call in a tech for issues with my computers I make sure it isn't someone with ITT Tech on their resume.


Somebody on reddit went so far as to leak manuals and books and stuff from the school and my head fucking exploded twice."
4131,"I can't imagine that I would. Online programs have a tendency to not be accredited. It really would boils down to what the degree is and what job you are trying to attain. If someone has zero brick and mortar university experience, I'd question that person's ability to be able to articulate within an office setting. You learn so much from the actual classroom environment.

All of the online courses I have taken were far easier than my actual meet with the professor type classes.

Tldr; not likely, but I'd be open to certain disciplines."
4132,"If it's a degree from a normal, accredited university that offers online courses, then it's the same as any other degree. If it's from a for-profit diploma mill like DeVry or ITT Tech or University of Phoenix, then it's worse than nothing."
