idx,text,query
44464,"A shoehorn. So simple and cheap, and instantly turns 5 seconds of the most annoying wriggling and forcing into a 1 second maneuver. I'm amazed they seem to have gone out of style.

Also, a fire extinguisher on every level of your house.",best items under $100
67221,"Yeah, fetch is both readable and scalable. Built right in!",axios alternatives reddit
38801,"Vivaldi, hands down",best web browser
68151,"Hard to choose just five, but some of my all time favorites would be:

* The City and the Stars - Arthur C. Clarke
* Blindsight - Peter Watts
* Diaspora - Greg Egan
* Dragon's Egg - Robert L. Forward
* Roadside Picnic - Arkady Strugatsky",best science fiction novel
33934,"IMO, the creativity and fun spirit of Pokemon was gone after Gen 3. Pokemon became just another corporate moneymaker with orders to churn out content and make cash. Monster designs and anything resembling 'heart' or 'charm' was gone when they just started scribbling random lines, adding an eyeball to it and calling it a new monster. 

This is, of course, highly subjective. I was among the first wave of U.S. Pokemon players for the original Red / Blue version release, so am probably looking at it with some level of nostalgia. I played Fire Red as an adult, and found that it managed to hold my attention, even after years of my tastes in video games maturing.",best Pokemon game
72451,"Unfortunately I will be back in København, Denmark by that time.",best keyboard switches
22922,"Ron Jeremy. He's surprisingly very quiet and sweet.

Edit: I was feeling a bit awkward that I had a Ron Jeremy dildo at home in my pleasure chest and didn't know if I should tell him or not.

I also met Bridget the Midget. She stripped at a super bowl party I went to right after she got her fake boobs. She was very nice as well!",best celebrity
19426,The Youtube comment sections are always pretty cultish. Those chefs are rockstars to their fans.,best YouTube video
35764,"If you go somewhere that can make it, get a moscow Mule. In a copper cup, preferably.",best alcoholic drink
67491,"Axios is all I ever learned,  haven't hit a situation where it hasn't worked perfect yet.",axios alternatives reddit
33515,That is more data than I've read on this matter to date. Thank you for this.,best electric car
10363,"plane is like prison, store everything of value in ass. got that.",best suitcase lock
53970,"> If your toothless and twitchy, you're probably not getting any.

If that was the case I'd completely understand. I normally look pretty respectable, but I swear that day I was turned away because I didn't look healthy. It wasn't a drugged-up daze, it was goddamn influenza.",best medicine for a cold
35939,That's usually my goal. Best way to avoid a hangover is to never stop drinking.,best alcoholic drink
15933,I've had the same pair of Ray-Bans for 5 years. A lot of people I know have had pairs for much longer than I have. I think you underestimate the construction quality of them. Are they overpriced? Probably. But I will never ever buy cheapos again. It's not cost effective if I have to keep buying multiple pairs a year...,best sunglasses for fashion
71431,The ending of The Mist definitely.,best movies with a cool twist
49006,"Just to nitpick, it starts at 27 inch, then 32 inch",best gaming monitor
53682,Someone needs to build this and make it a r/coolguides,best medicine for a cold
34319,Am I crazy for thinking jalen Ramsey should be top ten,best NFL player
29690,"Maybe you want to put Shadow of the Colossus on this list. It is Playstation 2/3 exclusive, i've never played it, but i heard it is pretty great.",best game console
13298,"With Excel: you definitely want to stick to the industry standard.   
When you go outside the norm, it might be great for certain reasons or applications but overall in terms of support (being able to simply google how to do X or Y will be the easiest in excel over anything else).  


It just makes your life easier to stick to industry-standard software unless you have a specific reason not to.",best spreadsheet editor
13011,[kintsugi](http://en.m.wikipedia.org/wiki/Kintsugi) on a pot I made her in high school and accidentally broke + a poem,best gifts for mom
31936,"OPKS is soul crushing, all of the East Coast SPG hotels I've stayed in have been awesome.",best hotel to live in
50513,All Caps gets me every time,best rap album
15749,"I found these: https://www.costco.com/Kirkland-Signature-M38-Black-Polarized-Sunglasses.product.100394883.html

they're the Aviators though, couldn't find wayfarers",best sunglasses for fashion
