idx,text,query
67388,"Sindre Sorhus... This guy is everywhere!

Most of his packages I've used are really good, I'm giving this one a try, thank you!",axios alternatives reddit
63570,Huh never seen that before. What device are you on? Im assuming its not the first iPhone,best package manager ios 14 jailbreak reddit
40931,"Oh boi, classical guitarists are gonna get triggered reading the first few paragraphs",best instrument to play
49425,Hmm I may actually get that one. I have a $40 Amazon gift card and that one is on sale quite a bit. I’m not sure what I’m gonna do.,best gaming monitor
40807,Whatever you can play well.  Women are not impressed by an instrument - they're impressed by skill.,best instrument to play
39388,"Firefox, but using edge by chromium. Edge can be the best I think.",best web browser
33036,So just drink 2x? So u have about 320mg caffeine and after that one espresso or before haha Sry but i think my heart would explode... I couldn't think clear anymore after that content of caffeine.. Good luck :),best energy drink
47089,"Denver and the surrounding areas are also great. I can't think of the town that the Red Rocks park is in, but it is beautiful, and it is right next to the mountains",best state to visit in the United States
23421,"Need For Speed: Underground 2 gives you an amazing sense of progression and customization.
You start out with a choice between incredibly basic set of cars, which you can keep upgrading or you can buy a newer, better car then upgrade. Repeat the loop until endgame.",best car racing video game
68026,"Is the rest of the series worth reading? I just finished Dune, and I while I enjoyed it, I really hated how it got more and more in magic/chosen one stuff.",best science fiction novel
22551,"I've read a lot of Knoxville stories and pretty much since his daughter was born he became the man he is now. Just a genuinely nice guy. He also tries to be a role model and took roles in movies that are ""cleaner"" than his jackass days, and even his roles in jackass are a little less raunchy. Probably hurting himself though, that really changed him. He can only urinate through a cathedar because of an injury during jackass. I think he learned a valuable lesson. But what I really get from him is that he uses his fame for good.",best celebrity
45727,"You just gave me childhood flashbacks of those god-awful taffy atrocities in the black and orange wrappers. I swear it was only old people that gave them out too. Barf. 

With you all the way on Almond joys!",best trick or treating candy
16358,Same as with any brand stuff. I think most of the hate for luxottica comes from them not being an american company.,best sunglasses for fashion
44982,"not an item but a turtle. i have had mine since he was a baby and he will look at me when i say his name, hand feed, and when i play with him he will walk to me. him and my other one both do this. there names are hulk and thor, hulk is a yellow bellied slider and thor is a Cumberland slider

&#x200B;

edit: thanks for the upvotes this really blew up  

btw ik its a weird question but does anybody that upvoted live in or near daytona",best items under $100
69123,"This is a tough one because there are so many. I think I would go in no particular order:

Hitchhiker’s Guide to the Galaxy

Ender’s Game

Dune",best science fiction novel
5865,"I've made an autoclicker and password manager on Java, and right now working on a startup manager with C#. I haven't done anything regarding databases, I assume that's gonna be necessary as well?",best programming language for web development
41641,"I feel like the term ""inspirational"" is a bit soft Nolan straight up steals from the movie.",movies like Inception
41776,UC was amazing. It took me a long time to watch it on Netflix when it was on their so worth it.,movies like Inception
47909,"Dope! I really like Art Deco and modern, post modern type stuffs. The structure is a 1962 compact ranch style brick build & I wanted to keep the idea. Should I ever find myself aboard such a vessel, I'd call it home.",best color to paint with
49030,"I’ve owned the ASUS VG27AQ for around 6 months now and it’s been a dream to play on, I highly recommend it if you’re looking for a 1440p monitor with a high refresh rate.",best gaming monitor
1016,"My dude, mint choco chip is where it's at! Coffee chip is also good!",best ice cream flavor
54170,You can still get it but it's a hassle.,best medicine for a cold
64964,Little Caesar’s on Milpas obviously,best places to eat in Santa Barbara
32334,"I follow a crime scene cleaning company on YouTube (it’s very gross but super fascinating) and I think it depends how long the person(s) have been dead for. The more dead/decomposed you are, the more you’re going to leak (sorry) through the surface you’ve died on. Often they have to dismantle mattresses, box springs, take up carpet, etc. They destroy anything with biohazardous material on it, essentially. But it’s hard to say what hotels would do lol. Especially ones that are stingy with budget. God knows.

[here’s the YouTube channel](https://youtube.com/c/CrimeSceneCleaning) don’t watch if you have a weak stomach. They’re always pretty respectful, they help people with hoarding problems too, which is nice.",best hotel to live in
27694,Shashi Kapoor. He was damn handsome and good actor.,best bollywood actor
