idx,text,query
44179,"False.  My fleshlight's cost me much more than $100.  She always wants to eat out all the fucking time, not to mention jewelry at least twice a year.",best items under $100
21252,"I guess there is, the other guy said something about Disney so I was worried lol",best workout music
37007,"Do not RMC Roar.....  tied for the best at the park.

Other than that I am glad you had a good experience.  SFA is overly hated and it doesn't deserve it.  In all honesty I feel SFA has the edge over KD anymore/",best roller coaster at six flags
63835,"For start, this may be the book you are looking for - [Your Brain at Work](https://www.goodreads.com/book/show/6899290-your-brain-at-work). I am no more procrastinating, at least not as much as I used to do. In this book author is basically serving you lot of science facts baked in stories. Which you can use to make those changes, and don't slip back to old habits (this won't be easy).",best books for building better habits reddit
30057,">\- Has labels in your income and expenses so you can track specific income and expenses (ex: food and drinks, transportation)

so meron syang parang categories?, so yung isang expense pwedeng multiple labels?",best money managing app
47168,"I took a trip last year that was one of the best times of my life (and was great from an outdoor photography perspective), but doesn't really fall under the bar/club category.  I recommend these places to everyone, not just foreigners:

* Zion National Park, Utah - There's no place like it, and the hike to Angels Landing is awesome
* Bryce Canyon, Utah - Stunning rock formations
* Grand Canyon, Arizona - 'Nuff said
* Red Rock - Sedona, Arizona
* Las Vegas, Nevada",best state to visit in the United States
23781,"You misspelled ""hard"" as ""had"" which sounds like someone from Boston saying Hard",best car racing video game
31420,still top 10 :P lemme guess.. your from norway,best country to live in
53430,Correct. Devices pull what ever maximum they can from the power adapter.,best usb c charging cable
52880,I was trying hard to decide on my fave J. Cole project and landed on 4 Your Eyez Only in the moment. Any reason you prefer KOD over his other projects?,best hiphop album
1644,When you make the sweet corn please please post pics and recipe! I bet it's magnificent!,best ice cream flavor
13306,"I am by no means a power user of either sheets or excel, but the one feature i use daily with sheets that excel does not have (to my knowledge) is the ability to copy and paste cells using the drag down while filtered and not have it copy the data into the cells that are hidden.",best spreadsheet editor
28147,Pizza,best breakfast foods
8368,"Dude, I have ONE tooth that needs work this week. $2,300 out of pocket.  USA!",best toothpaste
73659,A friend's Anker burst into flames inside her pack and they didn't refund anything.,best battery bank
8516,Dentist here.  I use Oral B toothpaste.  I used to use colgate but I got a free sample of the oral b stuff and in my opinion it's way better.  It's more abrasive so I feel it removes more plaque,best toothpaste
58929,"Kouros at the very bottom? Sorry, opinion dismissed entirely! :-D",best perfume
40268,"How is the 3300X too expensive? I hate to be that guy, but if you can't afford that, then you're stuck with Pentiums, Celerons and Athlons.",best midrange CPU
13732,His PhD thesis was like 15 pages long.,best research paper archive
7512,Ryzen is generally better for battery life. Apple's M1 is the best for battery life.,best laptop for general use
29680,"Thanks for putting FFXII on that list, playing with an emulator at 1080p is a dream.",best game console
45334,"Well there's Crash Bandicoot, yooka laley, rayman and sonic games on xbox one as well, and like I said before look prettier on xbox than Nintendo",best gaming system
12991,"She's getting two puzzles and a laundry shelf.

Both of these things are so she'll stop complaining about not having anything to do and complaining that her laundry shelf is collapsing. 

Best $28.79 I could have spent.",best gifts for mom
21079,"Usually lifting or on the treadmill.

[TNGHT - Goooo](http://www.youtube.com/watch?v=znvm8ZsoZPQ)

[Chemical Brothers - Escape Velocity](http://www.youtube.com/watch?v=6GqRsmffeVI)

[Red Fang - Wires](http://www.youtube.com/watch?v=WQPfQvLIseA)

[Working for a Nuclear Free City - Je Suis Le Vent](http://www.youtube.com/watch?v=gd5rD3w5B3k)(I am the wind)

[Trent Reznor, Atticus Ross, Karen O - Immigrant Song](http://www.youtube.com/watch?v=L0bD4ts8eWY)

[White Stripes - Icky Thump](http://www.youtube.com/watch?v=1OjTspCqvk8)

[NIN - Just Like You Imagined](http://www.youtube.com/watch?v=TaI2qTpsgu0)

[Gesaffelstein - Pursuit](http://www.youtube.com/watch?v=yB8Ci7X5HUU)

[RJD2 - Perfect Occasion](http://www.youtube.com/watch?v=eHbQXfqnjyU)",best workout music
9650,"FT is most social. 

Manzanita is most isolated. 

Everything else is in the middle.",best dorm hall at UCSB
