idx,text,query
27611,"I honestly do happen to find him the most attractive. It's not like he's the best looking guy in Bollywood, but personally I find him to be very attractive. Something about him is alluring.",best bollywood actor
17023,Everyone calls dead cells a roguelike,best iOS game
11418,My radio told me to get him the giant green egg.,best gifts for dad
41642,Looper is good. Fight Club also a classic. Matrix also,movies like Inception
53732,under 21 does work with boiling water.,best medicine for a cold
27060,"Oh, I love that. It might take me a while to incorporate, but I’m totally onboard!",best board games
4517,"Emacs can be rather beautiful.

Seriously, as this is about **free** software: Have you tried the ST clone [Lime Text](http://www.limetext.org) or - if you like ribbons - [BowPad](http://stefanstools.sourceforge.net/BowPad.html)?",best text editor
20895,Its an absolute banger :D,best workout music
42206,Domhnall Gleeson is pretty great too. The casting was superb,movies like Inception
27154,"This is cool as heck. Thanks for putting this together, I'm really excited to go trough this and evaluate what my next few money-sinkers will be.",best board games
7266,"Hi there!! The XR, if treated well, can last 5-6 years without a single problem. Today (yeah, a big coindicence lol) marks a year since i bought mine (coming from a 6S) and battery life has been fantastic since day 1 (still at 98%), camera is awesome and performance is as good as day 1. Go ahead and buy the XR, youll have a great time with it :)",best iPhone
59487,"thanks! and right on about pretty much everything! i’m a social worker but also do a fair amount of writing, so i’d say that’s somewhat artistic :)",best perfume
47273,"Savannah is lovely. Just don't come in the months of May-October. The heat/humidity might kill you. 

There's also no open container laws here 😎",best state to visit in the United States
7394,I would recommend giving up the 2-in-1 feature. Is that possible for you?,best laptop for general use
65796,"CSU's generally work with a specific UC for PhDs.  CSUs have decent research programs sometimes, but they are unable to grant PhDs on their own.  Not every department even offers Masters degrees at CSUs.",best college in california
42339,"Hard Candy. Definitely one of those ones where it'll leave you saying ""What the fuck"" at the end.",movies like Inception
71016,"Great recommendations that nobody else has mentioned.  And I've been wanting to watch more foreign films, so it's perfect.  Thank you!  I'm definitely starting with Oldboy.",best movies with a cool twist
31323,"My guess: colder tends to mean lower populations, and lower populations tend to make for healthier happier countries. More to go around.",best country to live in
37138,"Oh I completely agree. Last time we were at Cedar Point, we played ""guess which coasters are currently down despite perfect weather"". It was a really fun way to pass the time, because at all hours of the day(s) we visited, we'd find ourselves in line for a ride and we had a blast just going down the list and trying to guess which coasters were down.

The funnest part was each morning, when we would round the park and queue for Millennium Force (told it was opening late), then run to Maverick and be told they didn't know when it would open, only to go to Vengeance and be told it may not open at all that day, then to give up and go to Gemini and see a chain across the front without them even staffing an attendant to explain it wasn't open. Same with Mine Ride which was at least cycling empties. Finally we found Magnum open with no wait, rode it, then made our way over to Dragster which still hadn't opened.

We did this exact crawl through the park in some form each day and almost always found more coasters closed than open in the back half of the park well after the posted open time.

Cedar Point is a damn joke when it comes to ride up time. I've never seen a park with so many problems keeping rides up for a few hours at a time or even bothering to open on time. And I really, really don't want to hear about ""weather"" or ""safety"". Every other park has this stuff figured out.

Now in terms of SFMM being any better? That's not even a debate. CP is still better in their attempt to open things. SFMM just throws up a sign and calls it a day. It's always a major gamble to see just which SFMM coasters will bother to attempt to open. Back in the mid 2000's I have pictures of the ""closed today"" signs outside the park overflowing and unable to hold all of the plaques for the amount of rides down. On any given day, at least 3 or 4 headliners were closed with half a dozen more smaller rides and it was like that in the middle of the summer. I can't remember them all, but my friends and I considered it a badge of honor when all 4 B&M's, Superman, Ninja, Deja Vu, and of course X were all down for the day during Fright Fest in 2005 I believe.",best amusement park
34441,I guess Venitari drove the Patriots 61 yards with 1 minute left and no timeouts on top kicking that game winning field goal right? I don't think I've ever met someone who doesn't think Brady has any memorable playoff or super bowl moments as well as not being clutch.,best NFL player
63945,"[Ebookee.com](https://Ebookee.com) always sends me to [bestbooks.site](https://bestbooks.site) or to a phishing google site , every time I try to download an ebook 

How do you use this ?",best place to pirate audiobooks reddit
14599,"The book I seem to be mentioning all around the internet lately is {Shortcake by Lucy Watson}. Its not even the most wonderful book I have ever read but it's so funny and i tend to comment on funny book suggestion posts the most often. 


I recommend the Fever Series by Karen M Moning everywhere. All the time. If you ask for a random series suggestion with no specifics, this is the one I will give you. If you ask for fantasy, I will recommend this. Alpha hero? Fever Series. Heroine that shows growth throughout the series? Fever Series. It's become a problem.",best romantic novel
37653,Ah there it is.,best Marvel movie
39603,"Depends on what exact area of biology you're talking about, but there aren't many I know of that you'd really call 'hardcore'. Closest might be:

Common Descent podcast which does fairly deep dives on topics that combine evolution, paleontology and a bit of light taxonomy.

Tetzoo podcast, which is a bit random and semi-chaotic but I like it. Covers aspects of tetrapod zoology, with occasional addition of cryptozoology, monster movie reviews, all sorts of odds and ends.",best podcast for biologists
65337,At&t owns both blocks of band 5 in Dallas( and most of Texas ) so Verion has to use either band 2 or band 66 for Nationwide 5G,best phone service company
