idx,text,query
30380,What the fuck are you talking about? Source: I'm a Finn.,best Mexican war to study
66852,"Our best players are quite old so their value isn't high, whereas bunch of younger ones don't play for top clubs. Serbia has Vlahovic and SMS probably who raise value a lot.",best soccer team in the world
48036,Color theory is a scientifically studied and peer reviewed thing.,best color to paint with
67564,Thank you for the breakdown.,axios alternatives reddit
22151,I like chicken fingers.,best celebrity
44471,"I actually tried that before buying the blackout curtains.  I had two problems:

* It was hard to keep light from coming in through all the seams between the pieces of foil.
* There was a slight air flow even when the windows were closed, so the foil made a constant quiet crinkling sound.

I'm sure I could have made it work if I kept tinkering with it, but it seemed like it would be a big hassle.  That and it just looked cheap and messy.",best items under $100
20836,"See You At The Party Richter -Austrian Death Machine
Its a dumb song but it really gets the blood pumping",best workout music
18923,I don't know how many people will have seen [this](https://www.youtube.com/watch?v=dQw4w9WgXcQ).,best YouTube video
33671,Oh man. e-golf GTI or R would be sweet im sure. Or maybe a S3 e-tron,best electric car
52186,Funcrusher Plus,best hiphop album
40101,Bitwarden - best and free passwords keeper!,best Chrome extensions
71720,"Haha same here, it was an interesting watch.",best movies with a cool twist
31256,‘Merica 🇺🇸🇺🇸🇺🇸🇺🇸🦅🦅,best country to live in
37532,"Fiesta Texas needs one or 2 more big coasters. I think a GCI woodie and a Hyper of some sort would give that park one of the best lineups in the nation. Over Texas needs a modern looper, like a floorless or new gen Vekoma, along with a modern multi-launch coaster.",best amusement park
10129,"Yes, charcoal is pretty messy. But I like the depth that it adds.",best pencil for drawing
55998,"Tomb Raider was a decent adventure flick, but skip Cruise's Mummy *at all costs* and watch the Brendan Fraser ones instead.",best action and adventure movie
62882,"Datacamp has the most solid collection of absolute-beginner to mid-level-but-not-in-depth content I’ve seen on data science to date. A lot of courses are taught by the people who created the popular packages they’re teaching you about. I recommend Rosalind more for a comparable self-learning collection for bioinformatics specifically though. I pay for Datacamp because I’m a big fan of the format for efficient bursts of interactive learning, it’s super easy and kinda fun to blaze through a 4 hour course on the weekend on a topic I feel I’m not quite solid on. Is it suitable for deep dives? Hell no. Can it help you think about common problems in your field and jump-start your problem-solving kit when you’re not yet senior level? Yeah, I think so.",Best Data Science textbook
52564,"This album imo defines ""front to back"" masterpiece.  Every song is interconnected with the theme and the crossreferences of lyrics among tracks is pure genius.",best hiphop album
25607,"Awesome. Follow up question: would it be possible to create two sets of rankings, one for home and one for away matches? There are some teams where I think there would be a large discrepancy between the two. 

Looking forward to the interactive rankings, it will be awesome to be able to manipulate the data yourself.",best cricket teams of all time
63868,">Myanonamouse

is it specially for audiobooks?

Damn it's invite only.",best place to pirate audiobooks reddit
52674,None Shall Pass - Aesop Rock,best hiphop album
20008,They clearly forgot Guile's Theme.,best workout music
34131,*woosh*,best NFL player
35661,"Chem/bio labs use 95% ethanol all the time. above that and there's a good chance that there's benzene in it as a drying agent, so don't drink the 99.99% lab grade ethanol.",best alcoholic drink
15330,Doug Firs are pretty common here in the west.....,best tree for the garden
