idx,text,query
2376,">If you want really quality wireless your best bet is a good wired headset and a bluetooth dac/amp like the fiio btr5 or one of shanlings options. 

How would that work when there is a 1m+ long cable? I mean where does that go, how do you ""convert"" I guess a wired to a wireless?",best headphones
27708,"Shah Rukh Khan, there's just something about him that is not describable",best bollywood actor
26378,"Last I checked, something like 3 congresspeople didn't have college degrees. 
(This was on a wikipedia binge a couple years ago though, so grain of salt.)

Not quite what you're asking, but 'average joe' isn't usually included on survey forms.",best politician
71243,Exactly! I loved rewatching it. Definitely holds up on its own.,best movies with a cool twist
9278,Not a dentist (Reddit Bingo) but my goto has been the Arm and Hammer stuff.,best toothpaste
51832,"Ctrl+F: Caudabe

\> no results

/thinkingface",best iphone case
25543,because ponting cant strike at 80+ haha. My comment was more of a joke.,best cricket teams of all time
5105,"Home Depot seems to be marginally cheaper than Lowe’s, at least when I’ve compared prices online before going to the store. Lowes employees tend to be more helpful.",best home improvement store
51186,On this we can agree. It just left me wanting more from the main roster. I surprisingly agree with Complex on that one,best rap album
4538,"VSCoders (looking at you, u/CalcProgrammer1 and u/pnutjam), have you tried [VSCodium](https://vscodium.com/)?

From what I understand it's exactly the same, but without the 'Microsoft customization' (whatever that means). I'm not a FLOSS/FOSS purist, so it doesn't really matter that much to me - just wondering how it compares to the 'official' product. A few of my Windows-only friends swear by VSCode, so I might give that a shot :)",best text editor
35428,I’m intrigued,best alcoholic drink
56360,"Any news on when its coming out? 

Found the CX48 for £998 on QVC and I almost paid for it yesterday but 48 inches just pushes the limits on the amount of space i have for it. I may still go for it if LG dont release the 42 inch by May-June as im impatient and the cx48 is still great but 42 would be optimal for me",best desktop monitor
13652,Google Scholar,best research paper archive
20940,"I fell in love with hooligans the first time I heard it and it's easily became one of my favorite songs by Keem. He definitely owed us those two singles for dropping out the XXL cypher 😂 Jokes aside, I'm really excited for his next project!",best workout music
43110,Elementary is an enjoyable modern day Sherlock Holmes series.,best detective show
24608,Gundam is complicated. There’s multiple timelines.,best anime
41406,"I've been in your position, but I maintain that your wording is confusing.",best instrument to play
14993,"There was a pretty decent (in my opinion) ""sequel"" to Gone With the Wind, written by a different author.  It's called ""Scarlet"" and I really liked it.  The same author has another book, ""Rhett Butler's People"", too, which is on my list to read.",best romantic novel
21568,"That's a good point, but when I watched the new Winnie the Pooh movie last summer, I found myself thinking ""Wow, Pooh is kind of a dick"". He was being so mean to Piglet! And I had intended to watch that movie to relive all the cute childhood memories, but at the end I just wanted to hug Eeyore and put duct tape over Pooh's mouth.",best winnie the pooh comic
25928,"If only these stats showed how many tests were home
Vs away :)",best cricket teams of all time
40186,"Honestly, I think the 10600K/F is a better bet right now than the 11400/F. It's only like $20 more right now, beats it by a bit stock, and beats it by a larger margin when overclocked. Even if you don't want to spend the extra money on a K board, you can always just unlock the power limits on a B560 board and get most(ish) of the benefits still.",best midrange CPU
32865,"This may be of interest too.  
TextRanch  
– reviewed by experts, not automatically.  

https://textranch.com/",best free online grammar checker
56528,HUA is TN.,best desktop monitor
25566,Viv 'only' averaged 50 and some would argue that isn't good enough for an all time xi. Viv was only just edged out in my team by Sangakara who's averaging 58 career and something like 70 in 70 tests as a specialist batsman. That's just to good to ignore.,best cricket teams of all time
2449,"Sony MDR-7506. Cheaper than the ATH-M50x, and just as good, if not better.",best headphones
