idx,text,query
51907,Ahhh thanks. The corners of mine are just loose enough to bug me. Guess I’ll see if I can exchange it or get a leather case instead.,best iphone case
54548,"Hello! What would you recommend to someone who’s new to artisan mousepads but plays a lot of FPS like R6, valorant, overwatch. Thanks!",best artisan mousepad alternatives
59680,L'Imperatrice yes💘,best perfume
23511,"Yeah it was fun but the fun wore off quickly.  There was no apparent advantage to upgrading cars, as it was evident everyone did the same things to theirs, and you're given too much too fast.  It was car overload.  I had to build in my own set of goals in my mind, and that bugged me since I felt like I shouldn't have to.  Horizon 2 was the last good one, in my opinion.  Played like a racing RPG",best car racing video game
20241,"Bad Company never made a song called Five Finger Death Punch... Google... Fuck, I'm old.",best workout music
16785,"Oh man, I was thinking the same thing.. but they are so useless it seems!",best pet for toddlers
50465,Make sure you get the explicit!  I bought the Chronic from Barnes N Noble and then gave me the edited version and yea that was not good.  Thought it was skipping every couple seconds.  Double check that shit to make sure you get the right one,best rap album
24950,"Best movies- Tobey

Best Actor- Andrew",best spiderman actor
47980,"Years ago, people would paint their doors red to signal that they had paid off their mortgage and owned their home free-and-clear. So it was seen as a status symbol and a way to signify wealth.",best color to paint with
34373,I feel like Darren Waller should be up here.,best NFL player
41727,"You bastard, I see you posting this list everywhere. Your reign of upvotes will end one day soon.",movies like Inception
58093,"Three times now I've complimented a man's cologne it turned out to be Hawthorne. They have a site with a short questionnaire about your lifestyle & skin and serve you a semi-custom cologne for work and for nightlife. Not as fancy as the other brands listed in this thread but they seem to nail it every time.

Edit: they do soaps and other bathroom products now too but I have no reference for them. I'd assume they're decent quality.",best cologne
23262,ok thanks for the explanation.,best car racing video game
15435,Dragon blood tree,best tree for the garden
61261,Nier Automata. One of my favorite games of all time.,Best RPG game on PS4
18330,"*Mama mia. Papa pia. Baby's got that diihharriiiiiiiiaaaaaaaaa!!!!

First time I saw that part, I could not stop laughing",best YouTube video
61112,Bobs burgers.,Best comedy show on Netflix
64590,"x2

Really love my Turbo 2's (when my heel isn't bothering me)",Best Nike running shoes
63724,"Seven habits of highly effective people by Stephen covey
Getting things done by David Allen
Maybe
Eat that frog frog bei Brian Tracy

Allen and Covey have other helpful books. Usually it is better to read them after their main work.
for David Allen you can also start with the getting things done workbook.",best books for time management reddit
45081,Sliced bread. I can staple that stuff to trees.,best items under $100
68654,"yeah, they are retro as fuck",best science fiction novel
28631,TIL chocolate bread exists. I need this in my LIFE!,best breakfast foods
24051,"Evangelion

Fooly Cooly

Serial Experiments lain

Akira (it's a movie but a must watch)

Naruto (not shipppuden)

Steins Gate

Not in any particular oder",best anime
61336,"Really? I would think with all of the different abilities and accurate positioning, controller would feel gimped.",Best RPG game on PS4
35628,It's called a John Daly - who was another golfer and apparently an incredible alcoholic.,best alcoholic drink
