idx,text,query
67506,"We currently use a couple adapters:

- does a request return 401? get a new token, save every request that comes by until the token is received, redo all those requests. the originating call will then be resolved with correct data (we handle this flow in 1 place instead of doing it for hundreds of requests)

- certain URL / patters need to be handled differently (remove or add some headers)

- track response time for each request

etc",axios alternatives reddit
18475,Still haven’t gotten my pizza roll,best YouTube video
53813,I'm seeing a lot of Vitamin C consumption on this thread. JUST SO YOU KNOW: Vitamin C is not toxic in large doses...but it will give you diarrhea within about 30 minutes or less. You may want to take your Vitamin C in the comfort of your home and then wait a bit before getting on with your day.,best medicine for a cold
31263,Don't get a job -> every day is vacation -> still live alone,best country to live in
17825,"1. Kendal, she seems the most genuine and kind hearted of them all. She has always been my favorite. 

2. Kourtney, idk she always seems to be the most logistical, she is a strong backbone to the family imo.

3. Kim because kim

4. Khloe, shes hilarious! Always entertaining to watch! I just love her feisty personality. Although I think she comes of a bitch some times, I still think she is an amazing woman.

5. Kris, I love her... I really do. Sometimes she really bugs me but overall shes a great person and a great mother.

6. Robert, my heart hurts for him. I hope he finds happiness someday. .

7. Bruce/Caitlyn, in the early seasons i really liked Bruce, he was so chill and just minded his own business doing the things he loved. After the transition I feel like she was portrayed as this evil  entity. In the later seasons it was always awkward and so so cringey to watch them all interact with each other. I havent watched her show yet so I havent heard her side to then story. 

8. Kylie, by far my least favorite. Im not trying to be a snob but she drives me absolutely insane. I honestly can NOT stand her fake, self obsessed ass. She just comes off like such a bitch. Im sure irl shes a nice person, but I just HATE the way she is portrayed on the show.",best Kardashian
9114,"I was an intern at a telecommunications company.

I basically got to lay my head down on my desk all day and the mother hen of the office kept everyone away from me. 

I would have rather ran payroll and expense reports.",best toothpaste
40900,*Swears in Tableaux De Provence,best instrument to play
64039,"This is great! Back in the day DC++ used to be mainly a Linux thing and it was a huge issue getting it running natively on Windows due to some libraries that were free in Linux buy prohibitively expensive on Windows. 

I gave up on it when I got out of IT and lost interest in Linux. Pretty happy to see it's now convenient for Windows. I didn't know that it was!",best place to pirate audiobooks reddit
4351,"Agreed, Sublime Text seems quite promising to me with a solid foundation, but it seems development has kind of stalled since the guy behind it [got married](http://www.sublimetext.com/blog/articles/just-married). ;) (yes, seriously... even the betas are quite few and far between with no big steps forward now with three minor betas since june)",best text editor
73017,"Pop, elementary, and Solus.

Top 3 💪",best Linux distro
8275,"Good thing I only use paper plates!

JK. Brush your teeth, guys!",best toothpaste
54299,They're called whole cloves. You can get them in the spice isle.,best medicine for a cold
44791,"75$ Alpinetek winter coat from Sears. Basically a Canada Goose ripoff. 

Bought in 2014 thinking it would last me a season or two. I still have it and always wear it. Incredible value.",best items under $100
68862,"Top tier philosophy coupled with overt sexism. 

Which I dont think he should be apologetic for.  It's a dark world and sexism is a dark thing",best science fiction novel
61978,"Most already mentioned but Tales of Berseria, P5, Witcher 3, Neir Automata, and Dragon Age: Inq are all great games. 

DA:I scratched the RPG itch the most after Witcher",Best RPG game on PS4
63494,[[ReduceWhitePointModule]],best package manager ios 14 jailbreak reddit
20874,"Anything by City Morgue, Death Grips, and Suicideboys if you can handle the yelling and shit",best workout music
40439,"Sorry for responding to a 4 month old post, but what do you get when playing a more demanding game like Warzone?",best midrange GPU
25360,"*Peters on comics and themselves on kittens* ♪

*Personalities and warm woolen mittens* ♪

*Superhero movies tied up with strings* ♪

*These are a few of my favorite things!* ♪

---
[sing it](https://youtu.be/kwN3LJdGyuU?t=20) / ^(reply 'info' to learn more about this bot (including fun stats!)^)",best spiderman actor
34968,"I have no idea, some weeks I get +10 upvotes for having more variance between the consensus and what I have.

Maybe it's having Xavien over Jaire? Even though there's an argument for it and it's only a 7 spot difference between the 2 so it's not like I viewed them that differently.",best NFL player
49610,No kidding! I was playing on a 1080p 60hz monitor with mediocre color and low brightness and now on a 1440p 144hz monitor I’m experiencing an entirely new feeling.,best gaming monitor
2488,"Absolutely this, the Monoprice 8323's are excellent headphones. You'll have a hard time finding anything under $150 that comes close, and these are only $25.

Also, http://www.cnet.com/news/how-good-can-21-59-headphones-be/",best headphones
60434,"""Oh David!""",Best comedy show on Netflix
30676,I was in Copenhagen in 1980. I remember the city smelling of pølse and diesel. Does it still?,best country to live in
36713,Mojito!,best alcoholic drink
