idx,query,text
55800,best action and adventure movie,Every indiana jones
17514,best iOS game,"You can complete everything in the game F2P. There are loads of people that have done 0 wish accounts and have been able to complete the hardest content in the game.

The only thing you really need to pay for is characters you want, but even then if u save and plan accordingly you can get the character you want. Though it is impossible to get every character unless u whale.

I think the game is plenty fun, they often have lots of events to get 4 star characters either for free or by the events giving a lot of primogems (the currency used to wish on banners)

Give it a go, its free after all."
62762,Best Data Science textbook,"I don't think so. It's a tricky field to write a book on because of the rapid innovation in research, but the fundamentals in it are solid"
16282,best sunglasses for fashion,"Oh my bad, I totally missed that part for some reason."
43038,best detective show,Ah man... loved Harper's Island.
21324,best workout music,"As a rower, it feels so badass to start a piece on the erg with this blasting in the back"
15764,best sunglasses for fashion,[Garrett Leight](https://www.garrettleight.com/sunglasses/)
228,best terminal file manager reddit,you could do the same with nnn as a selection of files is just a file shared by the different instances of nnn
72373,best keyboard switches,"Of course that would be the best choice for thoroughness.  However, we have a whole wiki that people don't turn to because it's messy and complicated.  We're talking about beginners here--people who have never typed on a mechanical keyboard before and want a decent idea of which one or two switches would best suit them.  I think there's nothing better for that than a flowchart."
19828,best workout music,"Mix of stuff on my playlist this week:

* [Prime (The Seige)](https://www.youtube.com/watch?v=lHN-7xdUIw0)
* [The Drum (The Seige)](https://www.youtube.com/watch?v=7ujRptOjoAQ)
* [Fight Back (Neffex)](https://www.youtube.com/watch?v=FKeFscAUEzQ)
* [Makeshift Kingdom (Sweatshop Union)](https://www.youtube.com/watch?v=ocRUNF_JRB4)
* [San Andreas Theme Song (Young Maylay)](https://www.youtube.com/watch?v=t84ct0lxRms)
* [Living Life Check to Check (Wordsmith)](https://www.youtube.com/watch?v=D7jauBnPOew)
* [Till I Collapse (Eminem)](https://www.youtube.com/watch?v=ikKUceLXdt8)
* [Human (Rag'n'Bone Man)](https://www.youtube.com/watch?v=RpimiNvcRC4)
* [Renegades (X Ambassadors)](https://www.youtube.com/watch?v=kSJhrO2Ydao)
* [Unsteady (X Ambassadors)](https://www.youtube.com/watch?v=pFjryf8zH_M)"
53449,best usb c charging cable,even cheap Cables can be good if they are purchased from reputated manufacturers like Belkin
41534,best instrument to play,He did that with a steel string acoustic.
63658,best books for time management reddit,"Getting Things Done by David Allen.  Very nuts and bolts, if that's what you are looking for."
58767,best cologne,"Awesome post.  One thing to note:  if worn correctly as you suggest, a cologne will not smell the same on another man as it does on you.  If you do not apply too much of it, it will mix with your natural scent as well as the smell of your deodorant.  Your deodorant should complement your cologne, not clash with it.

I have found in the past that having a few female friends smell the cologne you are wearing and offer their opinion helps, since you cannot always smell exactly how it's going to smell on you, since you cannot smell your own natural scent."
12824,best gifts for mom,everyday your mom is tortured by the mspaint background but she cant figure out how to change it and doesnt want to hurt your feelings by asking you.
18805,best YouTube video,"Shit thats really cool! I could've sworn we were part of the Virgo supercluster, but Laniakea sounds way cooler.

[This video compliments this really well](https://www.youtube.com/watch?v=17jymDn0W6U)"
68729,best science fiction novel,"I'd put in for _The Long Earth_ myself. I've tried _The Long War_ with no success, but I love the ideas in _The Long Earth_."
11609,best gifts for dad,:')
4570,best text editor,Vim
30819,best country to live in,"As a german living in Zürich, yes you'd be a foreigner. Especially if you don't speak swiss-german"
26749,best board games,"Crokinole jumping up 5 slots is pretty out there, considering how luxurious that game is to buy."
16378,best sunglasses for fashion,i.c. berlin
33082,best energy drink,I feel you. My boss saw my 'nap marks' and it led to a performance review.
53509,best medicine for a cold,"I didn't know I was allergic to sulfa drugs until I started swelling, hives, and itching in places I didn't know I had...so I called my practitioner and they were like you need to come here for a shot - NOW.  Caught it in time but bet your buns I mention it first thing!  Glad I'm not allergic to other meds."
238,best terminal file manager reddit,Try ranger.
