idx,query,text
51907,best iphone case,Ahhh thanks. The corners of mine are just loose enough to bug me. Guess I’ll see if I can exchange it or get a leather case instead.
54548,best artisan mousepad alternatives,"Hello! What would you recommend to someone who’s new to artisan mousepads but plays a lot of FPS like R6, valorant, overwatch. Thanks!"
59680,best perfume,L'Imperatrice yes💘
23511,best car racing video game,"Yeah it was fun but the fun wore off quickly.  There was no apparent advantage to upgrading cars, as it was evident everyone did the same things to theirs, and you're given too much too fast.  It was car overload.  I had to build in my own set of goals in my mind, and that bugged me since I felt like I shouldn't have to.  Horizon 2 was the last good one, in my opinion.  Played like a racing RPG"
20241,best workout music,"Bad Company never made a song called Five Finger Death Punch... Google... Fuck, I'm old."
16785,best pet for toddlers,"Oh man, I was thinking the same thing.. but they are so useless it seems!"
50465,best rap album,Make sure you get the explicit!  I bought the Chronic from Barnes N Noble and then gave me the edited version and yea that was not good.  Thought it was skipping every couple seconds.  Double check that shit to make sure you get the right one
24950,best spiderman actor,"Best movies- Tobey

Best Actor- Andrew"
47980,best color to paint with,"Years ago, people would paint their doors red to signal that they had paid off their mortgage and owned their home free-and-clear. So it was seen as a status symbol and a way to signify wealth."
34373,best NFL player,I feel like Darren Waller should be up here.
41727,movies like Inception,"You bastard, I see you posting this list everywhere. Your reign of upvotes will end one day soon."
58093,best cologne,"Three times now I've complimented a man's cologne it turned out to be Hawthorne. They have a site with a short questionnaire about your lifestyle & skin and serve you a semi-custom cologne for work and for nightlife. Not as fancy as the other brands listed in this thread but they seem to nail it every time.

Edit: they do soaps and other bathroom products now too but I have no reference for them. I'd assume they're decent quality."
23262,best car racing video game,ok thanks for the explanation.
15435,best tree for the garden,Dragon blood tree
61261,Best RPG game on PS4,Nier Automata. One of my favorite games of all time.
18330,best YouTube video,"*Mama mia. Papa pia. Baby's got that diihharriiiiiiiiaaaaaaaaa!!!!

First time I saw that part, I could not stop laughing"
61112,Best comedy show on Netflix,Bobs burgers.
64590,Best Nike running shoes,"x2

Really love my Turbo 2's (when my heel isn't bothering me)"
63724,best books for time management reddit,"Seven habits of highly effective people by Stephen covey
Getting things done by David Allen
Maybe
Eat that frog frog bei Brian Tracy

Allen and Covey have other helpful books. Usually it is better to read them after their main work.
for David Allen you can also start with the getting things done workbook."
45081,best items under $100,Sliced bread. I can staple that stuff to trees.
68654,best science fiction novel,"yeah, they are retro as fuck"
28631,best breakfast foods,TIL chocolate bread exists. I need this in my LIFE!
24051,best anime,"Evangelion

Fooly Cooly

Serial Experiments lain

Akira (it's a movie but a must watch)

Naruto (not shipppuden)

Steins Gate

Not in any particular oder"
61336,Best RPG game on PS4,"Really? I would think with all of the different abilities and accurate positioning, controller would feel gimped."
35628,best alcoholic drink,It's called a John Daly - who was another golfer and apparently an incredible alcoholic.
