idx,text,query
12396,She should’ve invited them both over to show them how it turned out and hope the one she works with sees that it was horrible!,best gifts for mom
29854,"And are there any that track the whole picture, for example pension plans etc",best money managing app
56645,"I've been looking for a new ultrawide monitor for both gaming and work (spreadsheets). Does anyone have any info on the new Acer Z35? I keep finding reviews of the old version, but the newer one is 3440x1440 with a VA panel and GSYNC. [Costco](https://www.costco.com/Acer-Predator-Z35-35-Ultra-Wide-Curved-Gaming-Monitor.product.100419479.html) will have these on sale for $700 starting Aug 2 and am contemplating getting it.",best desktop monitor
41855,Hang the DJ. I correct you only because it’s a quote from a great 80’s song.,movies like Inception
56495,Wait till May,best desktop monitor
16560,"Sadly, I am in the US. I would never have thought of a snail for a pet though. That would be kinda neat.",best pet for toddlers
3187,"i have a c520, cheap and does the job, whatev lol",best webcamera
160,Author here. I was told this subreddit exists and you might be interested in this. Feel free to share bugs/ideas.,best terminal file manager reddit
33254,"Yes, if it's just a few days of no power and you don't need to actually drive your truck anywhere.

Personally, considering the battery backup feature is only with the highest end Lightning package (which is like $90k+), I'd rather get a cheaper Lightning, and buy an actual battery backup for home solar which will work 24/7 and allow me to drive my truck whenever.",best electric car
21663,"Haha, yep.  Still bummin' around reddit.",best winnie the pooh comic
60448,"I find her character hard to watch - or listen to, really. So OTT that it' s like nails on a chalk
board for me. Worst is Roland though, especially in S1. I'm finding this show OK, has sweet moments, but too exaggerated.",Best comedy show on Netflix
17457,Infinity blade trilogy and zenonia series,best iOS game
45601,You deserve more. Enjoy!,best gaming system
9363,"I've gotten warnings against Listerine, from my dentist, because it has alcohol in it that kills the ""good bacteria"" as well. She says to use a fluoride mouthwash from the pharmacy, not one with alcohol.",best toothpaste
62130,You should play dishonored if you haven’t beat it yet i loved that game….play all of them,Best RPG game on PS4
46632,"Statistically speaking, Reese’s are the best. And they totally are.",best trick or treating candy
67529,"...what?

What kind of creative, crafty stuff are you doing to break Axios? Use it in production (in enterprise) currently - no issues.",axios alternatives reddit
6715,Any phone will last years if you put it in a case and use a screen protector.,best iPhone
68443,I just realized that Cloud Atlas and Atlas Shrugged are not the same books. And only after being flabbergasted that you couldn't put Atlas Shrugged down. 😂,best science fiction novel
43774,I just squeegee my toothpaste tube with my toothbrush. Works pretty well.,best items under $100
68214,Lord of Light was a total trip. After I read the book I had a thousand questions.,best science fiction novel
48756,Fake as FK website with 0 legitimate reviews and just a cr4pload of affiliate links. Fk off.,best gaming monitor
47524,What should I answer if I 've never been to US?  It is still my dream to rent an old Pontiac or Lincoln and make a ride through the whole country.,best state to visit in the United States
3256,"That's fair but for the ones I've looked at for every person going above the given range there's another going below, though to be fair most of them do seem to like getting as close to budget as possible even if that means one much newer/better part than the others",best webcamera
70219,"Same. I work as a data analyst for a very large company and I do some programming and database design. While I got zilch of these actual skills from my time at college and grad school, I directly credit studying logic and argumentation in philosophy and theology courses that caused me to be good at what I do.  I can analyze the shit out of stuff and come up with solutions.  Studying ancient languages such as Greek and Latin only helped me quickly pick up the semantics of programming.  If you are intelligent, transformable and can demonstrate this to a prospective company, they'll consider you.",best major to study in college
