idx,text,query
55879,The Adventures of Tintin was only (checks watch) 8 years ago!,best action and adventure movie
193,MC indeed! https://www.midnight-commander.org,best terminal file manager reddit
25096,[is this your king?](https://i.pinimg.com/736x/62/80/a1/6280a17ffc4f770e18bfdb9177d4897d--marvel-art-marvel-movies.jpg),best spiderman actor
40114,"Ooh, will check it out.",best Chrome extensions
63250,Oh shit yeah thanks,best package manager ios 14 jailbreak reddit
60115,Jovan musk. Chrome by azzaro.,best perfume
14981,"I love Julia Quinn’s The Bridgerton Series! My favorite is Romancing Mister Bridgerton. Also (not part of the series), The Secret Diary of Miss Miranda Cheever.

If you like angst/romance (that heart-clenching feeling!!!!), I recommend Again the Magic by Lisa Kleypas. :)",best romantic novel
60918,You'll laugh your arm off,Best comedy show on Netflix
58367,"I've never even seen Polo Red but I can say Polo Black is pretty good, do you know how they compare?",best cologne
55208,NY! Welcome to /r/earthporn!,best places to hike in the east coast
67974,"I can lurk no more.. 'We' published in 1924 by Yevgeny Zamyatin needs to be in this thread some where! It's the grandaddy of dystopian sci-fi and was a major influence on Orwell and Huxley.  A great read, check it out!

https://en.wikipedia.org/wiki/We_(novel)",best science fiction novel
58321,This is worse than the time that the raccoon got stuck in the copy machine...,best cologne
28439,add chili flakes and this is mine,best breakfast foods
71599,"In The Hateful Eight, when Sam Jackson got shot in the dick",best movies with a cool twist
29126,Google calendar is the best. It has tasks and reminders built in it.,best calendar tool
59955,Rihanna Reb’l Fleur,best perfume
33138,Man! I'm not going to let you poison me.  You must think I'm a [joke](http://www.hulu.com/watch/99944/saturday-night-live-digital-short-on-the-ground#s-p1-sr-i2)!,best energy drink
54242,"I came to post the 7 days to a week comment, but I'll piggy back and expand on yours.  Jewish penicillin  is the way to go.  I make a big batch using a whole chicken, veg, noodles and 4 to 5 times as much garlic and black pepper as you would think to use. 

This will keep you hydrated, fed, and open up the sinuses like draino. Pretty tasty too.",best medicine for a cold
70570,"There are zillions of online resources for this that will give you good exposure to various technologies, from 101 and advanced. Spend some time w some basic tutorials, get a feel for what might interest you, then dig deeper. 

In the end, you're going to have to work hard, there are no shortcuts, only better routes. No one is a natural and just nails math, or anything else, they work at it. Get some late night focus sessions going, make it important to you, find your growth mindset. It's all up to you, no one else is going to make it happen. Want your 6 figures? Go get 'em.",best major to study in college
72675,"Hey man, question about palming the XM1, how is it? I currently am palming a viper ultimate but want a little bigger hump",best wireless lightweight mouse
62483,The Witcher 3. Imo the best story. The world is also gorgeous. The controls might feel a little wonky for some but I didn't think they were bad at all.,Best RPG game on PS4
63909,"[VLC](https://play.google.com/store/apps/details?id=org.videolan.vlc) 
works for me.

It plays in background and i can set playback speed. That is all what i want.

Tip: if you are listening to a audiobook with more than one chaper and have multiple files, make a playlist. It is one time process and free you from navigating file manager each time you want to listen tothe book.",best place to pirate audiobooks reddit
22027,"Kelly Clarkson. The southern charm thing isn't an act. Coincidentally I also met the meanest celebrity the same night, Avril Lavigne. 

Shout out to Blink-182 as well, in my short time working with celebrities, they were the only ones I was actually a huge fan of and they were super cool as well, Mark Hoppus especially.

EDIT: Also now that I think about it, Gym Class Heroes were super cool as well.  Their singer was an especially nice guy.",best celebrity
8204,AMA request: the fifth dentist,best toothpaste
73651,10g. Hot off the press.,best battery bank
