idx,text,query
41081,Yeah to pick up and learn some beginner stuff it is accessible but to get *good* at it is another story. Guitar is VERY mechanically intensive at the high level.,best instrument to play
7160,Side bar: Does anyone know what wallpaper that is?,best iPhone
33909,"I second black/white. I kind of consider them the pinnacle of the series given how much they're able to accomplish and how well-rounded they are. Great story, music, region, etc. It's also pretty technologically impressive for a DS game, especially after the rather basic 4th gen games (Diamond/Pearl/Platinum, HeartGold/SoulSilver). All the pokemon sprites are fully animated which blew me away at the time.

Another thing is that these games (and their sequels) were the last Pokemon games with the ""old"" design philosophy where Game Freak added in a ton of extra stuff so that there was something for everyone. This amounts to everything from little minigame-based distractions to larger and more detailed areas with plenty of places to explore. Recently they have decided to just focus on taking the things that the majority of players will be doing, and just polishing them to an extreme. Sun and Moon suffer greatly from this as they feel lacking in depth even if the basic systems are very smooth.

So yeah, Black and White are great. The sequels, Black 2 and White 2 are awesome as well since they add a couple new cities and areas, and unlike most other pokemon ""sequel"" games, they actually continue the story from the previous ones so it's an entirely different experience.",best Pokemon game
21616,"I actually saved [this](http://i.imgur.com/ltpFM.png) for the next time the above image was posted, in case there were any similar questions.

I know it's not the original link, but that's all I could think of doing at the time.",best winnie the pooh comic
38207,"I agree that is what we should look for. I'm not so educated in this area, so I wanted to get an understanding of the landscape of the print media in terms of where they stand.",best newspapers to read
36807,"Happy birthday! I'm a fan of lemon drops, screwdrivers, and appletinis",best alcoholic drink
51785,Took it back. Case kept falling off,best iphone case
39949,Nano Defender contains Malware!,best Chrome extensions
17900,Kourtney is my favorite and the rest equally annoy me.I prefer the bluntness of Kourtney which is what I feel the others lack.,best Kardashian
56320,"Anything under HDR1000 is shit, along with windows implementation of it. The 10-bit color is damn good, there’s also a few individual color settings I found on /r/monitors that made it look even better.",best desktop monitor
2929,try danon d7200,best headphones
53981,">Original green death flavor NyQuil.

Fucking right. That stuff is nasty, but it works wonders.",best medicine for a cold
22659,"[John de Lancie](http://en.wikipedia.org/wiki/John_de_Lancie) does not like it when you exclaim, ""Q! STOP THIS!"" to him. Otherwise he's cool.",best celebrity
41477,"Piano is so versatile, another vote for that.",best instrument to play
57694,Very Sexy For Him by Victoria secret. It's amazing and you'll probably be the only guy you know wearing it. Don't get VS2 though,best cologne
72835,"> However, in practice many people quit because it's too hard.

If they find Arch impossible, THEN, they can try Debian, Fedora, OpenSUSE and the like.

But I don't think it's anywhere near that hard. Hell, even I can run Arch :P.",best Linux distro
33412,"Electric car development is so full of vaporware, I don't believe in anything until I see it for sale. I say that as somebody whose girlfriend bought a Bolt last month.",best electric car
29648,Isn't Spiderman 2 available for PC as well?,best game console
27873,"Lox Bagel. Salmon, pickled capers, cream cheese, and red onion on top of a poppy seed-encrusted bagel. Just perfect.",best breakfast foods
47427,New Orleans?,best state to visit in the United States
67214,This was my main reason for holding out.,axios alternatives reddit
715,I have been using smartdnsproxy for few months now and it works very well.,best vpn for torrenting reddit
12054,"They haven't been small for a good long time. They're not exactly a superconglomerate or anything, but they've been one of the largest specialty coffee roasters in the US for close to a decade. Pretty decent stuff! It's certainly been interesting to watch their growth and direction over the last couple years.",best gifts for dad
32836,"Does your University have a writing center? I had a job as an English tutor in my University and 90% of students needed help proofreading, including grad students. Also your tuition already pays for their time, so it's a resource worth using if you can.",best free online grammar checker
16962,"Oh yes, I remember playing KODP for hours straight, such a deep and addicting game....and Six Ages is ever better",best iOS game
