idx,text,query
14101,"I will be messaging you on [**2019-08-15 22:58:16 UTC**](http://www.wolframalpha.com/input/?i=2019-08-15%2022:58:16%20UTC%20To%20Local%20Time) to remind you of [**this link**](https://np.reddit.com/r/IllegalLifeProTips/comments/cpzfsg/ilpt_free_ebooks/ewswyjc/)

[**1 OTHERS CLICKED THIS LINK**](https://np.reddit.com/message/compose/?to=RemindMeBot&subject=Reminder&message=%5Bhttps%3A%2F%2Fwww.reddit.com%2Fr%2FIllegalLifeProTips%2Fcomments%2Fcpzfsg%2Filpt_free_ebooks%2Fewswyjc%2F%5D%0A%0ARemindMe%21%202019-08-15%2022%3A58%3A16) to send a PM to also be reminded and to reduce spam.

^(Parent commenter can ) [^(delete this message to hide from others.)](https://np.reddit.com/message/compose/?to=RemindMeBot&subject=Delete%20Comment&message=Delete%21%20cpzfsg)

*****

|[^(Info)](https://np.reddit.com/r/RemindMeBot/comments/c5l9ie/remindmebot_info_v20/)|[^(Custom)](https://np.reddit.com/message/compose/?to=RemindMeBot&subject=Reminder&message=%5BLink%20or%20message%20inside%20square%20brackets%5D%0A%0ARemindMe%21%20Time%20period%20here)|[^(Your Reminders)](https://np.reddit.com/message/compose/?to=RemindMeBot&subject=List%20Of%20Reminders&message=MyReminders%21)|[^(Feedback)](https://np.reddit.com/message/compose/?to=Watchful1&subject=Feedback)|
|-|-|-|-|",best place to get free books
3992,"I highly appreciate the fact that you will do your best to be open-minded in the future (and so will future applicants, I believe). 

You stated it is hard to get over multiple bad experiences with any institution; are you letting your personal feelings affect your professional work?

You also said ""some of the cover letters....from graduates of Capella and Walden..""; did cover letters from other (brick and mortar) schools have perfect cover letters? (I am speaking about every. single. cover. letter. ever. received. from. said. schools.)


I'm not trying to start a war with you (concerning this, or any other thing); I am just curious how integrating personal experiences, with any institution, is beneficial as a hiring manager ? 


Note: I am on mobile right now. I apologize for bad formatting.",best online college
43410,"To be honest, no, when I want to test the ads, I use the ad unit from here :  
[Sample Ad units](https://developers.google.com/admob/android/test-ads#sample_ad_units)

Should I add my device to AdMob testing devices?",best ad service for mobile applications
43273,never heard of any of these.,best detective show
72710,Understandable.  What mice from the ones listed above are we talking about anyways.,best wireless lightweight mouse
66284,"I'm not arguing with you, just adding the perspective of some guys who were old enough to remember the competition from a podcast I happened to listen to yesterday.. I was born in 92, so I can't pretend like I have memories or experience to speak from on the matter.",best soccer team in the world
27754,"Eggs. I love eggs. Sauté some vegetables (tomatoes and onion are my favorite), scramble it with some eggs, add salt and pepper, boom!

Green smoothies! Any smoothie really but I like green smoothies because they are filling and you can get your greens for the day.",best breakfast foods
54340,Ginger  tea with honey and lemon. Soup. Vix,best medicine for a cold
31551,Switzerland. Go.,best hotel to live in
51259,I have one called spigen liquid air armor and I love it. It’s not a bulky case but it still provides protection. I also like how it doesn’t get stuck to clothing when putting it in my pocket. I’ll probably end up getting something from spigen for my 13 pro.,best iphone case
60694,Diet Coke!,Best comedy show on Netflix
63206,"Well firstly I didn’t say faster is better. Secondly I said in my opinion, thirdly the only damage Sileo does to BB is not using the same as Cydia. Nothing is broken with BB on Sileo",best package manager ios 14 jailbreak reddit
34435,"I think going 13/15 for 150 yards 2 TDs in the 4th quarter of a Super Bowl down by 10 points is pretty clutch. Also the last drive of Super Bowl 36. If anything, Montana doesn't have as many clutch Super Bowl plays because his teams were blowing the other opponent out lol.",best NFL player
33988,"for your first game try Let's go Eevee or Let's go Pikachu. They're easier to navigate, takes place in Kanto which is the original region, and has some similarities to Pokémon Go",best Pokemon game
57868,Please tell me there is more where that came from. I literally laughed 30 seconds straight at that.,best cologne
47420,Not Ohio. There's nothing here.,best state to visit in the United States
29609,"#####&#009;

######&#009;

####&#009;
 [**WWE SmackDown vs. Raw 2008**](https://en.wikipedia.org/wiki/WWE%20SmackDown%20vs.%20Raw%202008): [](#sfw) 

---

>

>___WWE SmackDown vs. Raw 2008___  is a [professional wrestling](https://en.wikipedia.org/wiki/Professional_wrestling) [video game](https://en.wikipedia.org/wiki/Video_game) developed by [Yuke's](https://en.wikipedia.org/wiki/Yuke%27s) and released on the [PlayStation 2](https://en.wikipedia.org/wiki/PlayStation_2), [PlayStation 3](https://en.wikipedia.org/wiki/PlayStation_3), [Xbox 360](https://en.wikipedia.org/wiki/Xbox_360), [Wii](https://en.wikipedia.org/wiki/Wii), [PlayStation Portable](https://en.wikipedia.org/wiki/PlayStation_Portable) and [Nintendo DS](https://en.wikipedia.org/wiki/Nintendo_DS) [video game consoles](https://en.wikipedia.org/wiki/Video_game_console) by [THQ](https://en.wikipedia.org/wiki/THQ) in November 2007.  [Amaze Entertainment](https://en.wikipedia.org/wiki/Amaze_Entertainment) oversaw development for the Nintendo DS version. 

>The game is the ninth edition of the long-running *[WWE SmackDown vs. Raw](https://en.wikipedia.org/wiki/WWE_2K)* (later renamed to simply *WWE*) video game series based on the [professional wrestling promotion](https://en.wikipedia.org/wiki/Professional_wrestling_promotion) [World Wrestling Entertainment](https://en.wikipedia.org/wiki/WWE) (WWE). It is the sequel to [2006](https://en.wikipedia.org/wiki/2006_in_video_gaming)'s *[WWE SmackDown vs. Raw 2007](https://en.wikipedia.org/wiki/WWE_SmackDown_vs._Raw_2007)*, succeeded by *[WWE SmackDown vs. Raw 2009](https://en.wikipedia.org/wiki/WWE_SmackDown_vs._Raw_2009)*, and is the first WWE game to include the promotion's [ECW](https://en.wikipedia.org/wiki/ECW_on_Sci_Fi) [brand](https://en.wikipedia.org/wiki/WWE_Brand_Extension).  It is also the first WWE game to be available for all [seventh generation](https://en.wikipedia.org/wiki/History_of_video_game_consoles_(seventh_generation\)) game consoles.

>====

>[**Image**](https://i.imgur.com/mT4hB8v.jpg) [^(i)](https://en.wikipedia.org/wiki/File:SmackDown!vsRAW2008.jpg)

---

^Interesting: [^WWE ^SmackDown ^vs. ^Raw ^2009](https://en.wikipedia.org/wiki/WWE_SmackDown_vs._Raw_2009) ^| [^WWE ^SmackDown ^vs. ^Raw ^2007](https://en.wikipedia.org/wiki/WWE_SmackDown_vs._Raw_2007) ^| [^WWE ^2K](https://en.wikipedia.org/wiki/WWE_2K) ^| [^CM ^Punk](https://en.wikipedia.org/wiki/CM_Punk) 

^Parent ^commenter ^can [^toggle ^NSFW](/message/compose?to=autowikibot&subject=AutoWikibot NSFW toggle&message=%2Btoggle-nsfw+clm05k0) ^or[](#or) [^delete](/message/compose?to=autowikibot&subject=AutoWikibot Deletion&message=%2Bdelete+clm05k0)^. ^Will ^also ^delete ^on ^comment ^score ^of ^-1 ^or ^less. ^| [^(FAQs)](http://www.np.reddit.com/r/autowikibot/wiki/index) ^| [^Mods](http://www.np.reddit.com/r/autowikibot/comments/1x013o/for_moderators_switches_commands_and_css/) ^| [^Magic ^Words](http://www.np.reddit.com/r/autowikibot/comments/1ux484/ask_wikibot/)",best game console
56091,"Stephen Chow's Journey To The West (2013). 

Stardust.

Madagascar 3.",best action and adventure movie
11955,The blowjob is a nice thought....but shouldn't happen so infrequently that it's considered a treat.,best gifts for dad
38138,"Oh ho ho, you're a sneaky one u/timnuoa. You ALMOST tricked me into sharing a Marvel opinion online. But NOT TODAY, MY FRIEND.

What's next? You'll have never heard of these ""Star"" ""Wars""? I ain't fallin' for it, buddy!",best Marvel movie
12159,"Cash.

Look I know it's considered tacky, but don't try and surprise me with things if you have no idea what I want.",best gifts for dad
30317,"Yeah, when trying to imagine casualties in the millions........I don't know.  America has never experienced such carnage in this magnitude.  Needs to be taught in high schools.",best Mexican war to study
69134,"1- Isaac Asimov: End of Eternity
2- Frank Herbert : Dune
3- H. G. Wells: Time Machine",best science fiction novel
55407,"I'm a huge fan, as well. This book was the reason I hated the movie ""Deep Impact"" so much.",best action and adventure novel series
59408,Bamboo by Gucci or Bright Crystal by Versace.,best perfume
