idx,text,query
56983,I just know Arrowhead tastes like ass.,best water brand
12674,A full day of uninterrupted me time followed by dinner with my BFFs (you're not invited),best gifts for mom
5060,"Yea they never really look now, most of them know me....damn new old house lol.  I used to not use for cheaper stuff but really saving 1-5 bucks 2-3 times a week starts to add up!",best home improvement store
66914,The 50s where they only lost 1 game which was unfortunately the World Cup Final,best soccer team in the world
63226,"Right now I’m just testing them all out to see which one I like the best. The way I see them right now is:

-Cydia is of course Cydia. 

-Zebra acts like a proper successor to Cydia. 

-Sileo tries to be a spin-off of Cydia with inspiration from the App Store. 

-Installer 5 is its own thing with inspiration from the App Store.",best package manager ios 14 jailbreak reddit
64530,What about NIKE Kukinis? Why were they discontinued?,Best Nike running shoes
10483,"""We lost your bag.""",best suitcase lock
71095,You are absolutely right!,best movies with a cool twist
58178,"Yes, Le Male is a compliment puller for sure.",best cologne
15038,Surprised no ones mentioned Kristen Ashley yet. Her Rock Chick series is a great place to start but the rest of her books are excellent as well! I’ve reread them over and over!,best romantic novel
6583,Staircase is solid. Definitely a fun show to watch in the evening.,best Netflix documentary
8191,"I believe the reason they recommend soft bristled is because hard bristled toothbrushes can erode tooth enamel. Its the same reason they say don't brush within an hour after you eat. The acid from the food will soften the enamel, and your toothbrush will just take it right off. Once you lose your enamel, you don't get it back.",best toothpaste
48422,Your house looks just awesome. I wonder why you are onto change color? If your job includes stress and tension then you may go with stress reducing color like light blue. With that color and some good beautiful [window coverings](https://www.usshuttersandblinds.com/orangecounty/) can do magic in relaxing your mind.,best color to paint with
7672,"Hi I’m looking for a laptop for dual use of light gaming/college schoolwork. I’m looking for a balance of everything. Medium size, medium weight, decent battery life with as much performance as I can get for my money. I don’t care about a 2 in 1, but an ssd would be nice. The games I play are primarily league of legends and Skyrim if that helps. My price range is around $800, but that can go up or down a few hundred in order to get what I’m looking for. Thank you!!",best laptop for general use
15938,"Definitely not worth it, can get fake polarized wayfarers for $30 on aliexpress which are identical in every way.",best sunglasses for fashion
53649,Would be great if you could edit with the PSA about never mixing acetamenaphin and alcohol. That stuff will destroy your liver.,best medicine for a cold
37621,Thank you! To me IM3 is by far the worst.,best Marvel movie
53350,Amazon Basic Nylon Cable for me. I've had like 5 or 6 of them for years now and no issues.,best usb c charging cable
15246,A Smoke Tree!,best tree for the garden
35977,">But I feel like beer just has so many calories makes me not work out as hard the next day.

Thats not how it works... Thats not how any of this works.",best alcoholic drink
1901,Marty’s pizza on De La Vina is my favorite,best pizza place in Santa Barbara
66529,Fifa takes the game of twenty plus one very seriously.,best soccer team in the world
44243,Nigella Lawson once quoted some Italian bloke as saying your pasta water should be salty as the Mediterranean. I've never looked back.,best items under $100
8175,Apparently my auto correct sort of outed my love of flogging my gums.,best toothpaste
32999,Well there r Energy Drinks I like and Energy Drinks I don't like. I think taste ij general is too different to say worst and best,best energy drink
