idx,query,text
38369,best newspapers to read,"The New Yorker does some of the best-sourced longform investigatory journalism, and I really like their arts coverage, though that can be a matter of taste."
43698,best items under $100,Oh man I would love zoo tycoon 2 for mobile! I was thinking about that today when i was playing RCT
20478,best workout music,YOU WANTED TO!
73035,best Linux distro,Exactly.
61244,Best RPG game on PS4,"Absolutely nailed it, the only game I would add is Tales of Vesperia. The Tales of series can be shaky at times, but this is seen by many as the pinnacle and it is a ton of fun. Put 80 hours into it, would definitely recommend!"
41043,best instrument to play,"Definitely Wurlitzer, or pipe organ. Good luck👍"
27303,best stocks to buy,puts on therapist's free time
69794,best major to study in college,"Business degree, then a sales career."
23901,best anime,"It shouldn't 😊, my list my preferences. I like what I like, I don't know why a stranger's list should bother you. Curious, what's your top favorite anime?"
45888,best trick or treating candy,Floss.
29709,best game console,"Saturn

Dreamcast

Genesis

PS4

Neo Geo Pocket"
43991,best items under $100,"[RPG Maker VX Ace](http://www.rpgmakerweb.com/products/programs/rpg-maker-vx-ace) is $70, and allows you to make 90's JRPG games like Final Fantasy II.  Throw in $30 of resource packs and will give you countless hours of creative fun producing your own games."
39355,best web browser,"Seconded, it’s been pretty great so far plus I dig the the concept of how they handle opt-in ads that pay back to sites you choose (which roughly translates to some ad revenue for them). Great for smaller sites that haven’t monetized yet but you still want to support."
6692,best iPhone,Get the mini. That’s all.
60829,Best comedy show on Netflix,its on you tube Patrice Oneal elephant in the room!
42355,movies like Inception,Blue Velvet.
57107,best water brand,RO filter?
63599,best package manager ios 14 jailbreak reddit,"~~ It does have that ~~, misread the comment ignore me"
26260,best politician,"I recently started that book. Goddamn, LBJ sounds like the most horrible teenager ever!"
51404,best iphone case,Clover Silicone over Graphite Pro Max
1732,best ice cream flavor,Pistachio
67300,axios alternatives reddit,The issues come when you want interceptors or the like. Then you need to wrap fetch in something.
63622,best package manager ios 14 jailbreak reddit,Zebra is great... few little issues however.
59273,best perfume,I recently purchased the rollerball before committing to the bottle. But I feel so damn expensive and luxurious when I wear it. It also helps that I match the scent to my YSL wallet and feel so great haha
4674,best home improvement store,"I do a lot of work for a large vendor that sells to both Home Depot and Lowes. They tell me that Home Depot is specifically designed for contractors while Lowes is more designed for DIYers. The layout of the store is indicative of that, usually."
