idx,query,text
17471,best iOS game,"From arcade I can 100% recommend Bleak sword and Grindstone.

From non arcade, I absolutely adore Polytopia. It’s like civilisation but very simple and you can play on one phone with another person by passing the phone to each other."
52832,best hiphop album,Dude Billy Woods is fucking great. Such interesting rhyme schemes and beats on that project
43118,best detective show,American Vandals both season
29749,best money managing app,"They just updated it! It's now basically the full web app on mobile, so you can move money from categories etc. On mobile now!"
26238,best politician,"**FDR**    
He began his career in public service after flunking out of Columbia Law School. He then decided to run for governor of New York. He eventually turned America into a superpower and was elected to 4 terms. He was so devoted that the strain of leading the nation through a world war eventually killed him, although his legacy will never die."
41864,movies like Inception,Adaptation
10600,best suitcase lock,"Your bags got checked on the way to Brazil?!  I've never had issues on the way to Brazil, only on the way back into the US."
14864,best romantic novel,"😘

closed door means if there are any sex scenes between the characters it happens as fade to black...or behind closed doors...without explicit description.

open door means if there are any sex scenes they are explicit and described on the page."
57361,best water brand,All of them. We should not need bottled water
30305,best Mexican war to study,"That podcast is some great listening. Thanks for the link, I am a new subscriber!"
603,best vpn for torrenting reddit,"Many of the suggested vpn's on here are pretty good, but I still used this [nord deal](https://www.morecyberdeals.com/NordVPN/) for torrenting and have found it to be flawless for the past few months."
12884,best gifts for mom,"This.  This.  My husband thinks it's a holiday I should spend with the family and the only thing I want is time alone.  I'm not an asshole, I love my daughter, but the best Mother's Day I ever had was when he let me go to the movies alone and he took care of her."
30121,best Mexican war to study,"Very, it was the match that lot the fuse to the American Revolution, and besides that,heavily influenced the geopolitical/cultural boundaries of the U.S and Canada, even to this day."
60646,Best comedy show on Netflix,"brooklyn nine nine 

the good place

community 

schitt’s creek

santa clarita diet

derry girls

agrettsuko"
18083,best Kardashian,I once ubered Kim’s body guard to Kim’s HOUSE and yeah he was so handsome and nice. Gave me a big tip and left me a compliment. I wish I could remember his name :(
37261,best amusement park,"Its not that surprising that KI is more popular than Holiday World in Indiana. Its about the same drive time from Indianapolis to KI as it is to Holiday World and the prices between the parks are not that different. KI is a much bigger park with more coasters and a lot of schools in Indiana take field trips there. Holiday World is great, but its in southern Indiana, which is less populated and is a much smaller park."
40480,best midrange GPU,Gpu mining is already dying so we might see the oppsite
10421,best suitcase lock,"Brick, where did you get a hand grenade?"
30617,best Mexican war to study,"Because laws are an absolute standard for a defined community of people in ways morals can never be. If you ask a hundred people to define right and wrong, you'll receive a hundred definitions. Ask them whether an act is illegal or legal, however, and you receive one."
37504,best amusement park,"Disney really improved in the past few years. Think about it, Pandora, Toy Story land, Galaxy's edge, with all the new additions I really wanna come back here soon."
50709,best rap album,Thank you for putting Gold Fronts on there that songs crazy good
19805,best workout music,"No, that's for dining."
10230,best pencil for drawing,"These are fantastic, I've tried out a few types and really love the sliding lead pencil as well as the gel grip one. I hate using anything else at this point lol."
21443,best workout music,"Some rock songs I like listening to: 

Its called Rock Workout. There is a bit of Danish stuff in there.

https://open.spotify.com/user/1112201362/playlist/5muTrCoWn0GHYjRIQz2s35?si=boY0e7grTci4chTYRwUVcA"
30216,best Mexican war to study,"In the NYC area, I was taught that Texas (unsurprisingly) decided the rules of the Spanish Empire didn't apply to them and went of of their way to cause a conflict to happen, knowing they would win.

This caused the mouse trap to spring when Mexico (justifiably) saw he annexation of Texas as an act of war. The US side knew that the crumbling post-Napoleonic colonies of the southern border were not going to be able to put up even a half decent fight, and so brutally rocked a weaker opponent.

It was a strategy to consolidate the resource rich lands to the south west as per Manifest Destiny."
