idx,text,query
64125,"If you're on android, you can check out Tachiyomi. On pc, I think you can use an emulator for it, not completely sure though.",best place to pirate audiobooks reddit
40762,"Bass guitar. I've been playing guitar since I was a kid, but I find more satisfaction when grooving on a bass. Of course, I'm by no means great at the instruments I play..",best instrument to play
31167,Russia,best country to live in
34777,It’s Brady.  Second is Rice.  Third is Walter Payton.,best NFL player
40733,"Electronic synthesizers.

With some technical knowledge you can design completely new kinds of instruments and expression. You can just make them sound funny and weird, too. You don't even need to buy expensive software/hardware: you can grab any free VST capable music application and rape it with one out of thousands of free VST synthesizers available.",best instrument to play
295,"None, just the CLI.",best terminal file manager reddit
63295,Easy to do when you cut corners,best package manager ios 14 jailbreak reddit
5387,"[Flying Bulldogs](https://www.flyingbulldogs.com/) sells discounted bathroom & kitchen hardware, light fixtures, and designer quilting & home-decor fabric! They're a small family owned & operated business.",best home improvement store
19219,"""And the chills have **ab-so-lutely** ***nothing*** to do with how cold it is here! Ah!""",best YouTube video
61962,"Dark Souls Remastered. I never originally played it on PS3. I absolutely loved it. 

Nioh is one of my favourites. DS style but in Japan, can't go wrong 

Nier Automata was a really well made game and has a very unique style. Music was awesome as well",Best RPG game on PS4
18115,"I’ve heard that Kim is like, the nicest in person. I’ve heard that Khloe is nice too, but a little more standoffish. I’ve never heard anything about anyone else in the family except what I’ve read on here lol 😂",best Kardashian
11765,God dammit Kyle.,best gifts for dad
3612,"Thank you for your Original Content, /u/cankadir! I've added [your flair](https://www.reddit.com/r/dataisbeautiful/wiki/flair#wiki_oc_flair) as gratitude. **Here is some important information about this post:**

* [Author's citations](https://www.reddit.com/r/dataisbeautiful/comments/8h5m8n/top_1000_universities_based_on_research_scores_oc/dyh9fro/) for this thread
* [All OC posts by this author](https://www.reddit.com/r/dataisbeautiful/search?q=author%3A""cankadir""+title%3A[OC]&sort=new&restrict_sr=on)

I hope this sticky assists you in having an informed discussion in this thread, or inspires you to [remix](https://www.reddit.com/r/dataisbeautiful/wiki/index#wiki_remixing) this data. For more information, please [read this Wiki page](https://www.reddit.com/r/dataisbeautiful/wiki/flair#wiki_oc_flair).",best college for research
21429,"Sabaton, Alestorm, Gloryhammer, and Powerwolf? My man.",best workout music
55589,Sabriel will always be my favorite fantasy book! :),best action and adventure novel series
64255,"Im just gonna throw this out there but if anyone has a link for the textbook Strategy An International Perspective, 7th Edition that would make this semester a bit better!",best place to pirate audiobooks reddit
12949,Let's hope she doesn't decide to decorate her house herself!,best gifts for mom
62634,"Depends on what you’re looking for. It’s incredibly well written, does a really good job of managing its tone (so things never feel absurdly out of place, but also you never have that heavy feeling from reading/playing a never ending serious story.) Failing at something you try to do is usually amusing, and (almost) never stops you from moving forward. It’s an interesting story/plot, and well done as a murder mystery. The world is very different and interesting. The leveling system integrates thematically with the story. All that being said, it’s not gonna be interesting if you want fights. Or high fantasy. Or a power fantasy. Those things are great, but this isn’t that. Disco Elysium feels unique to some degree.",Best RPG game on PS4
45669,I want candy corn just so I can [turn it into homemade Butterfinger bars.](http://candy.about.com/od/halloweencandyrecipes/r/Candy-Corn-Peanut-Butter-Bars.htm),best trick or treating candy
3714,"I agree completely.  And regarding your last sentence: this is the other side of the same coin. ""Boring"" or tedious validation is hardly being rewarded, similar to more ""far out"" ideas, regardless whether or not they prove to be innovative in hindsight. In this respect, academic competition means getting ahead WITHIN the mainstream consensus view - mainly by not questioning it too much. And while not without its merits, I feel that this model produces a lot of unintended consequences. I would love to do a 10 year experiment of scientific micro-environments in which these classic notions of competition are suspended.",best college for research
10544,Are you a cia operative or just paranoid?,best suitcase lock
13014,Or get her something she wants. Jk that's nice of you.,best gifts for mom
48309,"What a shitty tip. If you have already chosen your furniture, linens and curtains, chances are you have already bought them, since you want to be sure they don't sell out or because you get a good deal on them. Where do you put them? In your new home, where you'll regret not painting BEFORE you start filling the room up.",best color to paint with
36864,"It might not be that bad, but in a park filled with great coasters it’s very forgettable. It sucks that the coaster it replaced was a great coaster (the chiller).",best roller coaster at six flags
69039,"Stainless steel rat, Chrystal Singer and....can't pick the last one.",best science fiction novel
