idx,query,text
25425,best cricket teams of all time,"WestIndies : Greenidge, Haynes, Richards, Lara, Sobers, Walcott and Weeks

Australia : Hayden, Warner, Bradman, Ponting, Border, Waugh and Gilchrist 

India : Gavaskar, Sehwag, Dravid, Sachin, Kohli 

England : Hobbs, Hutton, Hammond Barrington, May, Compton, Botham

Australia has Don Bradman but the WestIndies and England teams looks more legendary IMO."
9193,best toothpaste,"I'm in dental hygiene school... And I use kids Colgate because adult toothpaste is too spicy for me. Plus, it's got transformers on it and transformers make everything more exciting. I also have a children's darth vader electric toothbrush.... As for flossing, I hated doing it but then I started keeping floss in my car. I floss stopped in traffic, red lights. Now I floss every day."
52254,best hiphop album,I’m pretty sure Aquemini is their highest rated on rym
20085,best workout music,Rick and Summer know what's up.
70877,best movies with a cool twist,"TIME CRIMES

12 MONKEYS

Both are pretty mind bending! Enjoy"
11074,best backpack for college,http://www.jansport.com/shop/en/jansport-us/backpacks/right-pack-backpack-typ7
69443,best major to study in college,"Top 5 students in my graduating class? shitty, meanial, low paying jobs. The cokehead who shows up late for every class (if at all)? $30/hr highway inspector job straight out of school."
11525,best gifts for dad,Blowjob
21885,best winnie the pooh comic,Top notch shit dude. Truly disturbing.
38113,best Marvel movie,"Black Panther and Dr Strange are overrated but other than that, pretty spot on"
5953,best programming language for web development,"In case you didn't know, there's also:

 
* https://www.reddit.com/r/linuxquestions/
* https://www.reddit.com/r/linuxadmin/

And of course: https://www.reddit.com/r/linux/"
23038,best celebrity,"Gordon Ramsay - genuine bloke, very friendly, true family man, great with kids"
1893,best pizza place in Santa Barbara,Hmm not sure
54462,best artisan mousepad alternatives,"So far otsu v2 durability has been fantastic! Same as zero and hien. Raiden is also in that category.

I'd say if you like control and don't want to get too wild with your first artisan, the zero is perfect! Very safe artisan to start with!"
25653,best cricket teams of all time,"They also had Glenn McGrath, Shane Warne, Jason Gillespie and Brett Lee at the same time. All of them are among the top wicket takers of all time. 

As good as the batsmen were, McGrath and Warne were better. I was too young to really appreciate it 100% at the time, but that team was insane all round. On top of that Andrew Symonds damn near revolutionised fielding as well - what a lot of people forget is that Australia was an era ahead of the rest in the field for the early stages of that team."
68424,best science fiction novel,"Nice, I haven't met a lot of people who have read it. Really loved it.

Any recommendations for similar books? Always a sucker for the post-apocalyptic."
49403,best gaming monitor,samsung cjg5
24618,best anime,Gintama as your favourite anime I have to say you have supreme taste and aot depending on season 4 would be in my top 10.
52010,best iphone case,"I got that one, liking it a lot so far."
59194,best perfume,Angel by Thierry Mugler
63956,best place to pirate audiobooks reddit,"I felt I divulged a little too much so decided to delete it

abb is over a decade old I believe. there are a few really active members but 99% of their traffic is just non-interacting consumers. I agree the search is in need of a revamp

someone else suggested myAnonamouse, I haven't tried it yet since it's invite only, just waiting until I can make time for the interviews they hold

other than that, abb is the only free, public aggregator specifically for audiobooks"
9693,best dorm hall at UCSB,Most of the Mountain/Ocean clusters do have common areas. From what I've seen it's the suites with singles that do not have it.
68209,best science fiction novel,I'd never heard of Worm before. Nearly 2 million words! Did you read it all at once or over time?
7689,best laptop for general use,"Im really confused between [Lenovo Flex 5i - Rs 65k](https://www.amazon.in/Lenovo-IdeaPad-Convertible-Graphite-81X10085IN/dp/B087D4S5N7/ref=sr_1_1?dchild=1&keywords=ideapad+Flex&qid=1611672840&s=computers&sr=1-1)
 and [Lenovo Thinkpad L14 - Rs 67k](https://www.amazon.in/gp/product/B08TLYH1HF/ref=ewc_pr_img_1?smid=A24HQTPJ3PNIWV&psc=1)

I am interested more in durability, but im just getting drawn by the cosmetics for the flex. What would you guys suggest?

I'll be mainly using this for daily browsing and coding a lot."
43901,best items under $100,"What *cant* you do? release them in a movie theatre, or a subway, or a DMV office, or a department store, the possibilities are endless, really..."
