idx,text,query
5487,"That's one of the many reasons I *don't* like going to Lowe's -- too many clowns that can't leave home without bringing along their yappy little pseudo-dogs. Some of these damned animated dust-mops Never. Shut. Up.

Don't get me wrong, I love dogs. *Real* dogs. But I leave mine at home when I go shopping.",best home improvement store
377,"Dolphin for the GUI, nvim-tree from CLI.",best terminal file manager reddit
34196,Can't wait for him to have his billionth meltdown on twitter over this,best NFL player
20635,(https://www.youtube.com/watch?v=o5YJfPBqPNE),best workout music
24999,You also forgot Dolph Lundgren as the Punisher.,best spiderman actor
35518,This was the most memorable drink from my 21st birthday. By most memorable I mean the very last thing I remember. I pulled a set of stairs off of someone's front door that night.,best alcoholic drink
2303,mountain mikes 👌🏻,best pizza place in Santa Barbara
55892,And Superman,best action and adventure movie
46491,I was coming to say that. I've lived here for close to 20 years and NEVER seen a Mars bar. Our grocery stores around here dont even carry them. Where is all the Mars bar Googling coming from?,best trick or treating candy
20629,Eminem ft. Obie Trice and DMX - Go 2 Sleep,best workout music
39629,"I can't remember for sure, as I used to listen to them years ago. I think [this](http://embryology.med.unsw.edu.au/Podcast/podcast.htm) might be the one, though. Looks like they have some other interesting stuff....might be gone for a while :-)",best podcast for biologists
66817,Our attack is a bit lacking though. Depay isn't a super star.,best soccer team in the world
8679,Yeah.  I can imagine that generational instruction happening. It can be hard to break this patterns.  Even when the evidence stares you in the face.,best toothpaste
66892,"The Netherlands' way of playing football is probably one of the most influential of any team ever, and I'd say that them to 3 world cup finals is quite significant, especially considering Uruguay's 2 world cups came at a time when there were only 13 teams in the finals.",best soccer team in the world
7132,"LED, LCD or OLED?",best iPhone
20984,Bubbles Buried in this Jungle - Death Grips,best workout music
46239,Scariest fucking episode ever.,best trick or treating candy
14086,"Audiobookbay, Mobilism",best place to get free books
1589,"* sweet potato ice cream
* i've also had a scoop of soy powder ice cream filled with [mochi](http://en.wikipedia.org/wiki/Mochi) (japanese rice paste), which was also delicious.",best ice cream flavor
1216,Those are both my nicknames!,best ice cream flavor
67729,"so, in short the polyfill extension is useful for only wrapping chrome APIs in promises? But, can i use the polyfills.js library to perform async/await on a chrome extension the way  puppeteer does it by clicking on a link in  a page, getting the req elements and so on using async/await???",axios alternatives reddit
69990,What were his connections like? Seems like it would be tough to break in unless you already knew some people.,best major to study in college
28945,"If up-n-go works for too, couple of weetbix, a banana and a decent slug of low fat milk in a blender, quick whizz then put the whole lot in a keep cup  (or similar) and you're done.

3/4 fill the blender with water and run for 10 seconds to rinse. Empty it and clean it up when you get home.",best breakfast foods
23566,"Such an underrated game. Its so good. The only reason it didnt do well when it launched was everyone was still attached to most wanted and carbon and wanted a sequel to those, and they got a track racing game.

Pro Street is honestly one of my favorite Need for Speeds ever.",best car racing video game
16750,"I do not recommend rabbits for kids. They are expensive(you need to see an exotic vet), a lot of work (dietary needs are very specific) and are not good with kids due to them being very skittish(prey animals). Bunnies don’t normally like being held and some only tolerate petting. They can easily die due to GI stasis in a day if they don’t eat.

*I have two rabbits",best pet for toddlers
