idx,query,text
65274,best phone service company,"Thanks! I do have hotspot plans listed on my website, they are just a little tricky to find. You can view [all hotspot plans here](https://www.bestphoneplans.net/all-hotspot-plans)."
13397,best spreadsheet editor,"I work with large spreadsheets as well. I don't like the concept of ""power users"" for Microsoft Excel; the truth is that there are very few people who are true power users (I.e. have the ability to write macros and create code to support programming through Microsoft Visual Basic for Applications). 

I had similar problems using Microsoft Excel for Mac until I increased my RAM to 8 GB.  Microsoft Excel for Mac is very unwieldy code in order to provide support for legacy features and functionality including and especially Visual Basic for Applications.

Microsoft really screwed Mac users by deprecating Visual Basic for Applications integration with Microsoft excel for Mac.  

In the case of macros I have used AppleScript to re-create some of the functionality of Visual Basic for Applications integrated with Microsoft Excel for Mac.  

In the case of pivot tables, Apple Numbers offers table categories which is not quite the same but can reproduce similar functionality without the overhead of running Microsoft Jet database engine.

The only real issue with Apple Numbers is a much smaller user base resulting in a much smaller community to offer off-the-shelf macros and scripts. The truth is that few people have really explored the capabilities of macros and scripts and Apple Numbers regardless of what they might have you believe."
14474,best romantic novel,I saw this thread and leapt on it to recommend the Brown sisters books so now will be looking up everything else you recommended 😊
11206,best backpack for college,"i have had the oakley kitchen sink for almost 4 years.  never had a SINGLE problem with it.   it attracts attention in all the right places, holds everything you will need, and is 100% tsa friendly."
54512,best artisan mousepad alternatives,">isartisaninstock

i cand find any twitter page with this name"
20150,best workout music,King Kunta is solid for a workout playlist imo
31554,best hotel to live in,"Six Senses. And if you like food and wine, it’s a little more rustic but amazing family owned with great service - Sao Laurenco do Barrocal."
44548,best items under $100,Weighted blanket.
72090,best movies with a cool twist,"It will always be this, just this, mostly this. Sometimes."
63820,best books for building better habits reddit,I will start with improving my sleeping habits it won't be easy with my crazy schedule but if I lay it out on paper I can do it.
32150,best hotel to live in,"I can’t choose but probably Marina Bay Sands in Singapore. My partner and I went back to Singapore just for the hotel. The pool really lives up to the photos.

Other places I really enjoyed were the Grand Hyatt in Dubai, Mira Moon in Hong Kong and The Sofitel in Vienna."
14526,best romantic novel,I'm reading my first JoBev Medieval right now and I love it so much...and am in the middle of a 2 week long medieval deep dive that started with Laura Kinsale as part of my AJH rehab...so i suspect my top 25 will be in for another shake-up soon. \*sigh\* 😘💗
60693,Best comedy show on Netflix,....No
30968,best country to live in,"England or Italy perhaps, I want to get out of expensive, dark and cold Finland."
26202,best politician,"Nelson Mandela.  He wasn't perfect, far from it.  But I think he recognized that just as he was imperfect, other people were too.  You can't live in a world of absolutes, where good guys win and bad guys lose, because in politics, everyone is a bad guy to someone, and most are a good guy to someone else.  He was a realist in that he would work with what he had, and an idealist because no one believed what he wanted was possible."
9290,best toothpaste,"Great advice. I would also like to add to avoid snacking as much as possible. It’s bad for your teeth. Also in addition to water to rinse out your mouth xylitol gum, celery or a hard cheese help to neutralize acids after a meal

 If you have sensitive teeth GC tooth mousse is great or a paste with recaldent or novmin/ biomin technology"
33856,best Pokemon game,"You know that’s exactly what I said, at the time I’m sure it’s great, but a few years ago I found my red and yellow game and I tried playing it I couldn’t like it was just terrible, animation was piss poor, color is terrible, psychic type off balance etc. I think it’s amazing how gen 2 foxes all of that and went above and beyond with beautiful scenery and increases depth and plot. And I agree as well lead green is the only game where I caught all 150 Pokémon."
29924,best money managing app,"You may find these links helpful:

- [Budgeting](/r/personalfinance/wiki/budgeting)
- [Tools and spreadsheets](/r/personalfinance/wiki/tools)
- /r/mintuit: all about Mint
- /r/ynab: all about YNAB

*I am a bot, and this action was performed automatically. Please [contact the moderators of this subreddit](/message/compose/?to=/r/personalfinance) if you have any questions or concerns.*"
47030,best hand santizer brand,Nutrition major: alcohol is absorbed in the stomach like aspirin. it typically doesnt reach your lower GI
58424,best cologne,"Best compliment I ever received: ""You have no right smelling this good in the morning"" after a night of drinking and waking up in her bed."
63631,best books for time management reddit,Thanks I’m gonna read one of them
51596,best iphone case,Black silicon ( iPhone 11 )
8872,best toothpaste,"It's also important to remember that if your municipality does not fluoridate your water, tooth paste is an important source of fluoride, even if it doesn't help with the mechanical cleaning of the teeth."
46584,best trick or treating candy,That you're aware of...
72718,best wireless lightweight mouse,"GPX. Unless you really hate the shape or the price is too high for you, there isn't a better mouse on the market right now.

RVU is significantly heavier.

MOW is heavier, has holes, and has a questionable sensor (I'm not sure if they've fixed the angle snapping yet or not)."
