idx,query,text
56983,best water brand,I just know Arrowhead tastes like ass.
12674,best gifts for mom,A full day of uninterrupted me time followed by dinner with my BFFs (you're not invited)
5060,best home improvement store,"Yea they never really look now, most of them know me....damn new old house lol.  I used to not use for cheaper stuff but really saving 1-5 bucks 2-3 times a week starts to add up!"
66914,best soccer team in the world,The 50s where they only lost 1 game which was unfortunately the World Cup Final
63226,best package manager ios 14 jailbreak reddit,"Right now I’m just testing them all out to see which one I like the best. The way I see them right now is:

-Cydia is of course Cydia. 

-Zebra acts like a proper successor to Cydia. 

-Sileo tries to be a spin-off of Cydia with inspiration from the App Store. 

-Installer 5 is its own thing with inspiration from the App Store."
64530,Best Nike running shoes,What about NIKE Kukinis? Why were they discontinued?
10483,best suitcase lock,"""We lost your bag."""
71095,best movies with a cool twist,You are absolutely right!
58178,best cologne,"Yes, Le Male is a compliment puller for sure."
15038,best romantic novel,Surprised no ones mentioned Kristen Ashley yet. Her Rock Chick series is a great place to start but the rest of her books are excellent as well! I’ve reread them over and over!
6583,best Netflix documentary,Staircase is solid. Definitely a fun show to watch in the evening.
8191,best toothpaste,"I believe the reason they recommend soft bristled is because hard bristled toothbrushes can erode tooth enamel. Its the same reason they say don't brush within an hour after you eat. The acid from the food will soften the enamel, and your toothbrush will just take it right off. Once you lose your enamel, you don't get it back."
48422,best color to paint with,Your house looks just awesome. I wonder why you are onto change color? If your job includes stress and tension then you may go with stress reducing color like light blue. With that color and some good beautiful [window coverings](https://www.usshuttersandblinds.com/orangecounty/) can do magic in relaxing your mind.
7672,best laptop for general use,"Hi I’m looking for a laptop for dual use of light gaming/college schoolwork. I’m looking for a balance of everything. Medium size, medium weight, decent battery life with as much performance as I can get for my money. I don’t care about a 2 in 1, but an ssd would be nice. The games I play are primarily league of legends and Skyrim if that helps. My price range is around $800, but that can go up or down a few hundred in order to get what I’m looking for. Thank you!!"
15938,best sunglasses for fashion,"Definitely not worth it, can get fake polarized wayfarers for $30 on aliexpress which are identical in every way."
53649,best medicine for a cold,Would be great if you could edit with the PSA about never mixing acetamenaphin and alcohol. That stuff will destroy your liver.
37621,best Marvel movie,Thank you! To me IM3 is by far the worst.
53350,best usb c charging cable,Amazon Basic Nylon Cable for me. I've had like 5 or 6 of them for years now and no issues.
15246,best tree for the garden,A Smoke Tree!
35977,best alcoholic drink,">But I feel like beer just has so many calories makes me not work out as hard the next day.

Thats not how it works... Thats not how any of this works."
1901,best pizza place in Santa Barbara,Marty’s pizza on De La Vina is my favorite
66529,best soccer team in the world,Fifa takes the game of twenty plus one very seriously.
44243,best items under $100,Nigella Lawson once quoted some Italian bloke as saying your pasta water should be salty as the Mediterranean. I've never looked back.
8175,best toothpaste,Apparently my auto correct sort of outed my love of flogging my gums.
32999,best energy drink,Well there r Energy Drinks I like and Energy Drinks I don't like. I think taste ij general is too different to say worst and best
