idx,text,query
67748,"Fetch is not as straightforward as Axios and it behaves differently. For example when you get a 400 or 500 response it does not throw an error which some people prefer.

An alternative is using Wretch which works on top of fetch.",axios alternatives reddit
68510,Wow back to back comments I agree with 100%. Now if only we can get a Heinlein hate train going...,best science fiction novel
1894,"There are some new places that have opened up recently, but this is my favorite. The Polpette is my GoTo.",best pizza place in Santa Barbara
67821,"Never heard of this one, interesting! https://www.npmjs.com/package/postman-request

Seems to be a fork of the original request module with additional fixes.",axios alternatives reddit
11415,"- A quality wallet, belt, briefcase, or really anything from [Saddleback Leather](http://www.saddlebackleather.com/). All of this stuff lasts literally a lifetime.

- A quality safety razor or a new badger hair shaving brush. 

- A new pair of Red Wing boots. These also last a lifetime. Dark brown goes with everything. 

- A new knife. Gerber blades are good quality. If he's an outdoors kind of guy get him a fixed-blade survival knife. If not then get him a folding knife. Don't get a small knife, and don't get a ridiculous knife.

- A leather bound journal. Find one that has acid-free paper. Get a nice pen with it too.

- An engraved flask, or an engraved zippo lighter. Get the bourbon or cigar to go with it.

- Don't get him a card. Write a hand-written note instead. It can be short and to the point, but make it genuine. Trifold it.",best gifts for dad
23150,"Maybe things have changed, I haven't applied to a social media company since early college... but I do distinctly remember a requirement on the software internships at Twitter being you should be a strong user of Twitter.

That's when they were still a pretty young company though. No clue what the market's like now, but yeah, I agree with you at the end of the day.",best social networking site for CS
3706,"Welcome to literally every league table since the dawn of time; a semi random, completely politicised process designed to mislead future minds.

My school actively discourage parents from paying attention to them, even though we are one of the top departments in the UK.",best college for research
26067,Even if you hate Bernie I don't think you could make an argument that he's dishonest.,best politician
64086,Any other well known rlly good private/public trackers that aren’t listed in the post that I can know about? Thanks.,best place to pirate audiobooks reddit
26029,I don't hate him but he's insane.,best politician
39765,https://chrome.google.com/webstore/detail/earth-view-from-google-ea/bhloflhklmhfpedakmangadcdofhnnoh?hl=en,best Chrome extensions
21818,Fuck you. Fuck whoever made this. Take my upvote and fuck you from the very depths of my heart.,best winnie the pooh comic
42461,Vanilla Sky,movies like Inception
37757,Almost all are 7/10 with a few exceptions being 5/10.,best Marvel movie
34511,"I watched a cooking show with my mom and they had a segment where the contestants cooked sausage for Gronk. He hit on the host, made a big penis reference when talking about sausage, and referenced his ""big muscles"" three times. Normally I'd hate someone like that, but if I looked like Gronk, I would probably act the same way.",best NFL player
37305,How did you determine most popular - the highest average index over the 5 year period?,best amusement park
67879,"In only a vague sort of order:

*Player of Games* by Iain M Banks

*Hydrogen Sonata* by Iain M Banks

*The Expanse Series* by James SA Corey (bit of a cheat but it's basically one long book right?)

*The Long Earth* by Terry Pratchett & Stephen Baxter (but not really the rest of the series)

*The Collapsing Empire* by John Scalzi. I loved *Old Man's War* but there's some wonderful phrase turning in *The Collapsing Empire* series

*Sea of Rust* by C Robert Cargill. Recent but I loved it.

*The Quantum Thief* series by Hannu Rajaniemi

*Bloodlines* by Karen Traviss. Star Wars books may not always be considered proper sci fi, but hey there's aliens, space travel and I'm really fond of this book!

*The Algebraist* by Iain M Banks. 3 separate entries for Banks while others get 1 mention from a whole series but hey ho.

~~*Children of Time* by Adrian Tchaikovsky.~~

**Edit**: *Hitchhiker's Guide to the Galaxy* by Douglas Adams. My view of this is slightly tainted by the 5th book, but after thinking about it a bit I remember really enjoying the 1st one so it deserves a place in my top 10, edging out *Children of Time*.",best science fiction novel
62769,"Without repeating what others have already said, another one that comes to mind is [Advanced Data Analysis from an Elementary Point of View](http://www.stat.cmu.edu/~cshalizi/ADAfaEPoV/) by Cosma R. Shalizi",Best Data Science textbook
14154,"Thanks, that's good to know, I've never heard of malware in epubs before, so I guess they are not that popular target (also I'm pretty sure ebook readers are way less vulnerable to viruses).",best place to get free books
22762,I always forget that Tony Hawk is a real person and not just a character made up for those video games,best celebrity
15863,"All the classic styles have huge gaps at the sides. That's why I always wear active wear type sunglasses. Are there any ""stylish"" glasses that actually block the sun when it's beside you?",best sunglasses for fashion
55893,*Jumanji: Welcome to the Jungle* was a recent and rather fun adventure film.,best action and adventure movie
42914,The Night Of on HBO,best detective show
32068,"The Mira Hotel in Hong Kong. 

Apart from the basic amenities they have (e.g.: mini bar, complimentary water, coffee and tea, hairdryer, bath tub, etc), what I loved about it is their Pillow Menu. And they're all complimentary. You can request for a full body pillow, a lavender or rose-infused pillow, a hypoallergenic pillow and others. They have like around 6 kinds of pillows to choose from besides the two regular pillows included. I asked for a lavender-infused pillow and a full body pillow and they are glorious to use.

I know one of my coworkers tried to request for 6 pillows and her bed started to look and feel like a coffin lol. But she says she had the most amazing sleep.",best hotel to live in
16377,I recently got Ray Ban CATS 5000 Classic and I love them.,best sunglasses for fashion
