idx,query,text
39807,best Chrome extensions,To be fair sometimes a period just sneaks up on you
24000,best anime,I disagree
14069,best place to get free books,u got a clown school 😂
41282,best instrument to play,Harpsichord. Almost everything sounds good on the Harpsicord.
33955,best Pokemon game,"I'd suggest either Ultrasun/Ultramoon OR Heartgold/Soulsilver.

I'll be honest that I'd learn towards the last two I mentioned though. They generally encompass everything good about the games. Sun/Moon and the Ultra versions are good and the most polished ones, but it's story-heavy (lots of cutscenes, even though in Ultra the beginning is much faster) and the story is not even that good. Although, in that case, I'd definitely suggest to go for the Ultra versions. More content, more Pokemon, in general it's better. You don't need to play the original Sun and Moon to play it.

And for the last question: no, there's no reason to play the other version. Unless you want to complete the Pokedex, but in case of the latest games, there's always the online trades for that (online play is not available anymore in Heartgold and Soulsilver).

Another good one is Omega Ruby and Alpha Sapphire. That ones had loads of legendaries you can catch in the post-game, but that could be my nostalgia blinding me since Sapphire was my first game, so naturally I loved the remake :p"
18201,best YouTube video,I suppose this is the closest I'll ever get to synethstesia
6157,best Netflix documentary,"This was entertaining, not what I expected but it did brong back fond memories."
69022,best science fiction novel,"*Snow Cras*h, by Neal Stephenson

*All Systems Red*, by Martha Wells

*Accelerando*, by Charles Stross"
28731,best breakfast foods,No such thing.
35894,best alcoholic drink,It [glows](http://www.youtube.com/watch?v=RlRi2mF3vUw).
21575,best winnie the pooh comic,No need to be redundant.
69564,best major to study in college,"Nursing degree, there isn't a place in the US right now that *doesn't* need nurses, which may be an exaggeration to an extent, but as the demand goes up, so does the salary."
55176,best places to hike in the east coast,Last week was pretty bad.
18238,best YouTube video,"So good. Cracks me up every time.

Booooo boobadboooo"
27839,best breakfast foods,"Gained 40lbs in about 6 months because I ate biscuits and sausage gravy for breakfast every morning. Fuck if it wasn't delicious though. I had to stop, and change my diet, because that shit was killing me. I've always been a skinny guy, but in your mid-20's, metabolism slows down. Lost the weight and still love biscuits and gravy, just not every day."
3592,best college for research,"I think what is maybe a bit more useful is looking at rankings of the specific departments relevant to your field. Both US News and the Chronicle do that. I've found from interviewing before my Master's that professors are definitely aware of those rankings.

[example for ecology and evolution](http://chronicle.com/article/NRC-Rankings-Overview-Ecology/124723/)"
19889,best workout music,DEATH GRIPS
19775,best workout music,Here's a link to a spotify playlist with the hip hop songs I found in the comments here (and available on Spotify): [https://open.spotify.com/user/1213298390/playlist/0ssyyCbQ6cMJGJ0OUjuN07?si=Elxx624ZRB-OIwTXhmmvaA](https://open.spotify.com/user/1213298390/playlist/0ssyyCbQ6cMJGJ0OUjuN07?si=Elxx624ZRB-OIwTXhmmvaA)
63192,best package manager ios 14 jailbreak reddit,"I mainly use zebra 75% of the time but on occasion it has issues with some repos or packages mainly because of the way it handles dependencies differently than Cydia. I love cydia, never have any problems and is my go to should I encounter any issues with other package managers. It is a little slow to launch/load to get into the app which is one of the main issues I have with it. I really like installer and am still tryna acclimate to the odd organization of it. I’d like to be able to use the queue without having to wait for all my repos to update, it’s inconvenient if you simply want to remove something. I also use saily which is pretty cool, it reminds me of rock (rock your iPhone) if it had a baby with sileo. It has a lot of potential but a few things aren’t in English, like the news source but you could make your own as they give you the info to do so. Would like someone to port the zebra or installer news sources to saily. I don’t fck with anything coolstar creates. I have used sileo but my experience with it was awful. 
All that said, anyone know if Lime is still in development?
I’m staying on 12.2 because the whole point in jailbreaking for me is to use my device however I see fit and iOS 13 isn’t feature rich enough to compensate for the lack of tweak compatibility and I depend on many unsupported tweaks that will not be updated. I absolutely love unc0ver but on occasion I will use checkra1n. Checkra1n definitely runs more like stock but I don’t have any issues with any of the 335 packages I have installed using either unc0ver or checkra1n.
I’ve been tweaking my setup a lot and as is with everything enabled my scores in Geekbench are higher than a stock iPhone X. I plan on making different setups via flashback for aesthetics and for performance but I haven’t gotten around to it just yet."
24149,best anime,"Welcome to the NHK 
FMA Brotherhood 
Pong the anime 
Naruto Shippuden 
AoT"
59675,best perfume,"It really depends on what you like. Do you like light, powdery scents? Floral? Citrus-y? Green? Personally, my favourite light scents are Frederic Malle L'eau d'Hiver (as the name suggests, like a first snow), Prada Infusion d'Iris (powdery iris), Jo Malone Wood Sage & Sea Salt (although this one isn't really that light on me), and Annick Goutal Mandragore (almost a spicy, green citrus; rather hard to describe). I like the Hermes Jardin line very much as well - they're fairly light and aquatic/green, like if Monet's watercolours were rendered into perfume form."
29900,best money managing app,"Share your honest feedback and review on particular Budget app based on your experience, it helps a lot for other to choose the right one."
16097,best sunglasses for fashion,"Sunglasses are incredibly marked up items. If you want to get a pair of ray bans that are pretty much identical to retail and dont want to directly support the company, go to /r/fashionreps and look up ""Aooko"" in the searchbar. I have a pair of his clubmasters for 45 bucks and they look and feel identical to the retail my girlfriend has."
63395,best package manager ios 14 jailbreak reddit,Wow!
4716,best home improvement store,"The Lowes' in my area have absolutely awful customer service. I've had to make so many complaints. To me it seems like they don't pay shit, due to how much the employees don't give a crap."
