idx,text,query
33602,What are your parameters? Daily range? Want to take the car on road trips (150+ miles)? Level 2 charge (240v) available at home? Price? Size? AWD? Workplace charging available?,best electric car
11195,I have been rocking out my kelty since starting undergrad in 2003 and it's been great,best backpack for college
68009,"OP also refers to it as ""perhaps his best known work"".  Putting aside personal favorites, my understanding is that *Stranger in a Strange Land* is, and has always been, Heinlein's most famous (""best-known"") book, by far.  Maybe I'm old, but have perceptions of his work changed *that* much?  Or has it just been the impact of the *Starship Troopers* movie?",best science fiction novel
25904,West Indies were beast during 80s bruh.... Their bowling lineup was epic,best cricket teams of all time
18290,I'm ashamed of all of you for failing to linking said greatness. [Leeroy nnnJenkins!](https://youtu.be/mLyOj_QD4a4),best YouTube video
65578,"That’s interesting! Didn’t know, thanks for sharing. I guess I wasn’t affected.",best phone service company
25817,"I thought about Lloyd. Probably should have mentioned him. Mark Waugh was probably a stretch. In all fairness I was born in 1990 so my knowledge of the Windies team is lore and highlights based. Where the 00s Australians hit their peak while I was getting into cricket, as an Australian, so they take a high spot in my mind.

But I still stand by that overall point that Australia was absurdly dominant batting and dominant bowling where Windies were absurdly dominant bowling and batting that was good, anchored by Viv.",best cricket teams of all time
64018,Try mobilism.,best place to pirate audiobooks reddit
35618,"This should be marked NSFW.

It's not even noon and I want to get drunk already.",best alcoholic drink
5716,Rails is a framework. Node is a runtime,best programming language for web development
30211,"Believe it or not our history classes are very honest to us about our fucked up history, we are not North Korea",best Mexican war to study
23275,"I mainly play Car Mechanic Simulator 2015 although the loading screens are a bit long and therefor for car games I stick to BeamNG , which I completely recommend. The game started out in 2012 although since then it's came a long way. The game is a realistic car crash simulator although you can free roam, do made up scenarios, 4x4, do a $1000 car challenge and much more. Atleast look into it :)",best car racing video game
73893,What do you recommend instead of matte but good for the pencil?,best matte screen protector for ipad
6970,"Honestly the SE 2020 Is a great device for parents to get their kids for a first phone. If parents have an iPhone, they'd want their kids to probably stay in the same OS as well",best iPhone
28947,"At Walmart you can get a set of 50 eggs (large) for cheap
My best suggestion is to look at r/mealprepsunday and look at what people have made for breakfast and some people show recepies and shopping list, if not you can always pm them.",best breakfast foods
35652,"Master Bomb: its a shot of Everclear dropped into an FDA-banned Four Loko and you pound it.


**EDIT:** Thanks u/Spitball_Idea, Tsar Bomb is a way better name!",best alcoholic drink
25112,*carnage is the best symbiote*,best spiderman actor
53162,"I guess I don't really love hip hop, because I couldn't name a debut album from this year, and the only person I know on the list that got posted is Pooh Shiesty. Yikes.",best hiphop album
66954,"Not particularly successful ? Lol France got third place in 58, and was excellent during the 80' and Platini generation, with an Euro and a fourth place after the bullshit game against Germany.",best soccer team in the world
73744,"After rereading what I wrote, I kinda feel like I didn’t give the paperlike a high enough praise. I actually *really* like the feel of it, so much so that I don’t really care what it does to the way my screen looks.

Since you’ve tried both iCarez and the Paperlike, do you think that there is a difference in the way the pencil feels on them? I wanted to get iCarez at first because that’s what most people have been using, but I couldn’t easily get it here in the UK.",best matte screen protector for ipad
3478,">It offers stronger undergrad education

That feels pretty subjective, no? And you're comparing a 7% acceptance rate to a 9% acceptance rate. Not to mention acceptance rate is a wack way to measure prestige, generally -- and you say just as much in one of your comments here! There's no consistency lmao",best college for research
8906,"Hydrogen peroxide is an oxidant and acts as a bleaching agent, but it is not an abrasive.",best toothpaste
35306,Hopefully a student rather than an alcoholic!,best alcoholic drink
13780,"Yep. [So says the Nobel prize's own page.](http://www.nobelprize.org/nobel_prizes/peace/shortfacts.html)

>There is one posthumous Nobel Peace Prize, to Dag Hammarskjöld in 1961. From 1974, the Statutes of the Nobel Foundation stipulate that a Prize cannot be awarded posthumously, unless death has occurred after the announcement of the Nobel Prize. Before 1974, the Nobel Prize was also awarded posthumously to Erik Axel Karlfeldt (Nobel Prize in Literature 1931).",best research paper archive
6960,"Best for it’s time either the original iPhone  ( game changing ) or the iPhone 4 ( better design imo and display than anything else at the time ).

Worst... I’d say iPhone 7 due to sub par battery life even when it was new, it became dire after a year or so.",best iPhone
