idx,query,text
43311,best ad service for mobile applications,"u/NJOY_Tech so instead of using a lot of ad networks, I need to use the Mopub only for mediation ?, please correct me if I'm wrong"
52933,best hiphop album,Run the Jewels 2
14450,best romantic novel,"My top 5 as of now, subject to change with out notice. And, in no particular order.

 Ever Yours, Annabelle by Elisa Braden.

 Ravishing The Heiress by Sherry Thomas.

 Wicked and The Wallflower by Sarah Maclean

 One Good Earl Deserves A Lover by Sarah Maclean

 Storm by Carian Cole.

  I say that I'm not really a big fan of HR, but, yet, four out of my top 5 books are historicals. Go figure."
71088,best movies with a cool twist,Identity w/ John Cusack
2976,best webcamera,"It depends on what you're looking for. I think it's unfair to compare them to Bose. Especially their mouse lineup is very serviceable for both gaming and productivity. Plus, their customer service is exceptional in the states at least. I used to have a mouse from a very ""gamer"" brand, but after the shitty product support and customer service, it'll take a lot for me to consider anything not Logi for mice."
48980,best gaming monitor,"Buy whatever you want

I'm just being facetious to get some laughs. :)"
46171,best trick or treating candy,Baby Ruth
22432,best celebrity,"Was a server for Tom Cruise. Pretty cool dude, tbh. Was a bit out of touch, but that's to be expected. The funny part was he didn't know what he could order off of our menu, so he had to call his nutritionist to find out what to get. Ended up getting fried chicken"
30248,best Mexican war to study,"Since I live in Texas, the Mexican-American War is only touched up on during our unit on the Texas Revolution.

So much Spanish vocabulary assignments.

***oh god.***"
52001,best iphone case,Following. I want a bumper case as well
59686,best perfume,Omg thank you so much 💕🥰
21273,best workout music,"I don't see why they cringed, I want people to play the Katamari theme at my funeral"
21280,best workout music,Gonna Fly Now
30,best terminal file manager reddit,Mc
47373,best state to visit in the United States,"New Orleans has a unique vibe that I haven't found anywhere else. Portland is quirky, very hipster. Chicago looks the most similar to New York but it's less diverse and the people are nicer, slower. Beautiful in the summer."
28737,best breakfast foods,upvote for super helpful pronunciation guide.
21874,best winnie the pooh comic,I hate that I love this so much
66209,best soccer team in the world,It's apparent that almost everyone misunderstood your poll. All discussion in this thread is based on European success and the voting seems to align with that for the most part as well.
53488,best medicine for a cold,I use the Dayquil/Nyquil pack. And if you can handle the flavor Theraflu is pretty good.
16091,best sunglasses for fashion,"Got them for running, ended up wearing them for all other occasions as well."
1614,best ice cream flavor,"Yeah, it's just like putting pepper on raw strawberries, that's really yummy too. Love the theme on the subreddit, btw!"
9544,best toothpaste,The fifth dentist is the one who didn't give in to bribery and is sticking to the real answer.
43280,best detective show,"Netflix: - The End of the F***king World (dark comedy, “escaping from the cops” theme, short episodes, binge-worthy)
- House of Cards (U.S Version 2013-2018; great political thriller, focuses on corruption and has great narrative, created term “binge-watching”)
- The Spy (short-binge worthy drama that goes straight to the point)
- The Sinner (great psychological crime drama) 
- Sniffer (just try it out at first, crime)
- Jessica Jones (a detective, crime-related, great first season, not as comic book ish as you might think)
- Deathnote (anime — simply incredible, questions morality, very good crime drama)

Amazon Prime: - Mr. Robot (currently on its final season, this show is just great — many genres built into it but for good reason, underrated, a masterpiece imo)
- Beat (German show; focuses on a club murder and then leads into more, suspenseful, fun and interesting)"
62981,Best Data Science textbook,"You can never go wrong with reading anything. If you went through your list, you'd know what you need to read next. You'd be amazed what you can find in PDFs with some googling.


Here's the Deep Learning book on that list.

https://github.com/janishar/mit-deep-learning-book-pdf

Data Science with R - not on the list, but hey, it's free

http://r4ds.had.co.nz/

Machine Learning with R - not the one on the list, but hey, it's free

http://books.tarsoit.com/Machine%20Learning%20with%20R%20-%20Second%20Edition.pdf"
10870,best suitcase lock,I had a liter of alcohol in my carry-on and TSA was totally cool about it - they let me go back downstairs and put it in my checked luggage.
