idx,text,query
47504,Thanks :),best state to visit in the United States
4097,"That is awesome to hear.  I will need to re-look at it.  BTW, what is ALM?",best online college
63170,I use zebra too. Loving it since i’ve installed,best package manager ios 14 jailbreak reddit
47547,"To add to this as a Michigander:
If you're looking for some non-outdoorsy fun check out Ann Arbor and Detroit, and if you're a beer fan go to Grand Rapids, die and go to heaven.",best state to visit in the United States
19863,https://open.spotify.com/user/notdavidg/playlist/5J0dYhqTo3qwxybcfONCn8?si=GniS7WUETkeazEDJMM_IWA,best workout music
13969,"There is a subreddit for everything!

I thought that this would be a neat idea, looks like it was already implemented. Sometimes there are just some papers that I don't have access too / interlibrary loan doesnt work.",best research paper archive
34069,"\- oras  
\- bw  
\-bw2  
\- sw/sh  
\- gsc  
\-xy  
haven't named others cause im too lazy",best Pokemon game
47934,"Mid-century modern, blended Modern (30's) and Contemporary('44-45) minimalism(60's-70's). I feel like it was/is The Benjamin Button, of the American visual design arts movement.  

I've never been formally educated in interior design, but I'm totally open to being corrected on the subject!",best color to paint with
22641,...go on,best celebrity
51087,Tu préfères en français ? Désolé qu'on ne soit pas tous anglophone. Reddit est mondial.,best rap album
14788,Yes! It is magnificent.,best romantic novel
6092,"Filmworker is a really food one if you’re interested in Stanley Kubrick at all, and even if you’re not it’s still a pretty fascinating watch.",best Netflix documentary
52869,"i didnt know how basic i was until I read this thread. in no order

illmatic

tha carter 3

reasonable doubt

late registration

MBDTF

Ready Or Not

The Chronic


Doggystyle

ATLiens

MM Food

also Famous Cryp gets an honorable mention because I have the utmost respect for blueface's cryppin, as should you",best hiphop album
62817,"is anyone here reading Deep Learning by Ian Goodfellow et al? 

How did you find the book thus far ?",Best Data Science textbook
50591,"Yo much love for Q, I can only hope Oxy takes that next step (this question should be reposted after the album drops)",best rap album
23154,"I've only ever used Linkedin and Twitter, yet at a minimum, I would suggest Linkedin. 

Otherwise, you should have a spreadsheet or rolodex and email folks every now and again to check in and update them on your life.",best social networking site for CS
53284,I used to have a similar problem I started buying longer angled plugs so I wasn't bending the cable as much or yanking on the wall side either.,best usb c charging cable
21391,"Here's a workout mix I made.  It's geared toward pumping you up for max effort lifts, so it's all aggressive house music. http://youtu.be/dkPS1Nx1Q80

I'll definitely use this thread for suggestions on a more mainstream mix.",best workout music
20185,"My go-to choices are [The Prodigy - Smack My Bitch Up](https://www.youtube.com/watch?v=MoURQz1_c0U) NSFW, [Motorhead - The Game](https://www.youtube.com/watch?v=F_JF8oSxXtM) and the montage theme by [Vince Dicola for Rocky IV](https://www.youtube.com/watch?v=wuzZmWVNlkQ).",best workout music
13512,Could still donate that cash!,best research paper archive
34052,"3DS games, not good ones",best Pokemon game
17728,"Yeah, I saw that. Usually Reddit likes jokes. That or completely hates them like this one.",best iOS game
71401,"Sometimes I feel like I'm the only person who saw the twist from The Prestige coming from a mile away. I mean, they foreshadow it and beat you over the head with it in the first couple minutes of the movie.
  
I liked the movie. But it was so obvious with the Chinese guy and the cat and the twins and everything that it kept me from enjoying the movie as much as I think I otherwise could have.",best movies with a cool twist
30589,"You forgot the French and Indian war. Or the entire war against the Indians. I think we all agree that was pretty unjust, but we wouldn't all be here without it.",best Mexican war to study
36865,"But it didn't directly replace Chiller because that was out of commission long before TDK came along and awesome as Chiller was, it was very unreliable.",best roller coaster at six flags
