idx,query,text
58336,best cologne,Ralph Lauren Polo Classic
21889,best winnie the pooh comic,Incredible
37275,best amusement park,Yes. The map excludes Disney and Universal parks.
32465,best vacation resort,"What did you check? 

You checked the trip advisor top all inclusive rankings and read every review did you? So much so you’d prefer a handful of Reddit opinions over thousands of verified reviews on TA?"
37221,best amusement park,"I am not, half of my trips to Magic Mountain involve me wishing I had just gone to Knotts instead.  Often before I even make it into the park.  Twice I have been at SFMM stuck in lines at security, ticketing, and at the gate which left me waiting in total more than two hours to just get into the park.  Both times to find the lines inside the park moving with at worst like a 45 minute wait, frankly the park did not even feel that busy, those kinds of lines just to get into the park are unacceptable.

Combined with single train operations, frequent downtime, terrible food, lack of just about anything but coasters.  I have a much better time at Knotts.  A local might have a better opinion of the park, but as a tourist there are better ways to spend your day."
4034,best online college,"You can find a ton of these if you spend like 5 minutes on google. I'm not sure why you haven't done this.

I googled these. These are all state schools.

http://mis.uis.edu
http://www.umuc.edu/academic-programs/bachelors-degrees/information-systems-management-major.cfm"
61979,Best RPG game on PS4,Dragon's Dogma. Good variety of fantasy creatures/monsters to fight and some of the funnest combat in any game I have played.
32323,best hotel to live in,"we don’t want you to know that the people who stayed in the room before you were fucking nasty.

housekeeping gets the brunt of it. i’ve seen them carry out bags of used sex toys, peel used condoms off of every surface, and scrub shit - actual human (presumably) shit - off places there’s no reason for human shit to be.

the worst, though, was the couple that wanted a home birth but not, you know, at home (because gross). we had to deal with that hazmat situation. fucked them as hard as we could with penalties and fees, though."
39823,best Chrome extensions,Wait...is *THIS* an ad?
57122,best water brand,not in chapellhall
55684,best action and adventure novel series,"I'll second that.  A bit of a slow start, and the NONSTOP."
51754,best iphone case,Oh I love holding the real phone for a while when I clean it.  I just wish it was safe that way.
67415,axios alternatives reddit,wreck https://www.npmjs.com/package/wreck
29051,best calendar tool,"I gotta say that Timepage may be the one with the best design, but I just can't get around the idea of subscribing to a calendar app. Do you use Timepage constantly throughout the day? What would you say are its key features?

Edit: BTW Fantastical user here"
8768,best toothpaste,"Thank you to everyone who has posted! The turnout on this has been far better than I expected! 

I've been browsing the dentistry subreddit (and posted this question here as well), and found some useful information on the abrasiveness of different toothpastes. 

[As you can see here](https://preview.redd.it/5t02mtxz4r161.jpg?width=2317&format=pjpg&auto=webp&s=5f6906fe985cbb23c34f3d27e781fe565cda7fb0), some toothpastes (mostly those branded as ""whitening"" pastes) are so abrasive that the FDA actually considers them harmful to teeth, as they simply do too much damage to the enamel. Most of the users in the dentistry sub recommended toothpastes in the blue category, or the first half of the green category. Colgate Total was an often-recommended one, as it's low in abrasiveness, and uses Stannous Fluoride instead of Sodium Fluoride, which is better for the teeth in a few ways (but sometimes tastes a bit weirder to people)"
18771,best YouTube video,Lovely Finnish lady. I wouldn't mind finishing off with her...
3089,best webcamera,"You are conflating the quality of the video that is captured by the camera and the quality of the compressed video that is streamed. 

A high quality video compressed to hell is still waaaay better than a low quality video streamed in 4k"
5939,best programming language for web development,"> The differences between modern programming languages are incredibly minimal.

No. 

Ex: Js, Go, Rust/ Swift"
42239,movies like Inception,Just saw this movie! It reminded me of [Triangle](http://www.imdb.com/title/tt1187064/)
54788,best water filter,"I liked my Britta pitcher when I lived in town. It wasn't  too expensive, and I didn't have to replace the filter often. I did only get it for taste reasons though."
41388,best instrument to play,Either. Guitar is portable though. Unless you keytar it up!
36177,best alcoholic drink,My favorite part about that list is Ron Burgundy is the only name I read as a question.
65123,best phone service company,"I had to re-read this a few times but I think I get it 

So after a bunch of loyalty rewards, you pay what I pay for a line normally? Except my carrier pays for my Netflix too.

I'm not sure you're helping the ""overpriced"" reputation."
14376,best romantic novel,Wow. Love your list!! 😍😍
20568,best workout music,"For a more pumped up version, I prefer the cover by Save Ferris - actually pretty much anything Save Ferris/Ska is awesome music to pump you up for a workout."
