idx,query,text
27894,best breakfast foods,"A sausage, egg, potato, and cheese breakfast burrito, with plenty of hot sauce from one of the many ""-berto"" restaurants here in Phoenix.

(eg: Filoberto's, Rigoberto's, Eriberto's, Humberto's, Dagoberto's, etc.)"
28526,best breakfast foods,Not while someone likes turkey bacon more than regular bacon
31020,best country to live in,"Depends on your culture. Your going to have an easier time making friends if you fit in with the general culture, religion, education. If you go somewhere where there is a big difference in any of those things it can get lonely very quickly. Also think about proximity to family when having kids."
21222,best workout music,X GON GIVE IT TO YA
37374,best amusement park,Idk if they still do it but when I was there in 2014 they turned their car ride into a drive through haunted house.  You’d drive through the ride and people would jump out at you
32635,best vacation resort,"We're still around. You'd be surprised, really. And we're thriving."
31151,best country to live in,If clean cities and public spaces then skip Denmark.
12027,best gifts for dad,I love practical gifts. My gf got me a claw on a pole for picking up trash in the neighborhood for Christmas. It's perfect.
18058,best Kardashian,North
610,best vpn for torrenting reddit,[Fastest VPN](https://go.fastestvpn.com/affiliate/pap?a_aid=611b8885dae14) is the best VPN in 2021. I used it for ageeeees now to hide my ip and fpr tprrenting. It never let me or my friends down
38239,best newspapers to read,"Oh yes, that's another publication I saw mentioned. Is there much difference between the weekly and the daily versions?"
44747,best items under $100,"American Express Cash Back card, it aaved me $500 on my new furniture!"
57800,best cologne,Armani Code Black
26098,best politician,"I suppose part of it depends on what you mean by ""respected.""  I think a lot of people have it in their heads that a politician has to agree with them 100% on everything, or else he's a hack/sellout/traitor/etc.  And while, yes, there are issues that I consider make-or-break deals just as everyone else does, I think people need to recognize that you're never going to agree with your elected officials on every point.  You gotta figure out which issues really matter to you, and realize a lot of the little stuff doesn't matter so much.

When I was living in Minnesota (I moved this summer) I was honestly proud to have Al Franken as my Senator.  I agreed with him on a whole bunch of things, only disagreed with him on minor ones, and in general, every time I heard him talk on CSpan or whatever, he wasn't just saying things I agreed with, but things no one else was saying.  And that's what really made me respect him, that as a junior senator he was willing to stand up and speak his mind against things the political establishment favored.  (Him chewing the fuck out of BP's officials in the Senate hearings, while almost everyone else was playing softball, was one of his highlights.)

Plus, his bipartisan friendship with Rand Paul is pretty cool.  It gives me a little hope that maybe our parties could actually talk things out, if enough people quit just doing what their political machines tell them to.  

So, uh, pretty much I just want someone with intelligence, integrity, a cooperative spirit, and maybe a bit of a sense of humor.  Shame that's in such short supply in Washington."
44106,best items under $100,My fucking roommate washed my grandmother's cast iron skillet that she willed to me. Three generations of seasoning......gone...the damn thing was fucking glimmering.
15241,best tree for the garden,"I'm from NZ so im unsure if you can get them there but white flowered Magnolia, very elegant tree with beautiful leaves"
57054,best water brand,"As you well know, ozonation is one of only four disinfection steps in Pepsi's water treatment: hyperchlorination, reverse osmosis, ultraviolet light, and finally ozonation. The little buggies don't have much of a chance.  BTW, Pepsi has used several different ozonation technologies worldwide."
21519,best winnie the pooh comic,This broke my legs and put me in a feelchair.
35581,best alcoholic drink,"Oh Fireball, guaranteed heartburn in the morning."
15405,best tree for the garden,You can always tell an Aspen tree because the way it is.
57304,best water brand,They released Dasani in the uk and after a week it got cancelled immediately because someone found out that it was just filtered tap water the people of the uk were not happy
56657,best desktop monitor,"For those of you on a budget, I want to give a shoutout to the Acer R240HY bidx. For around $120 you get a really great 1080p IPS monitor that can be overclocked to ~75hz. I just built my first setup a few weeks ago and that monitor is by far my favorite component. Coming from a smaller, cheap laptop TN panel the difference is like night and day"
62543,Best RPG game on PS4,"Persona 5

&#x200B;

Dragon Quest XI"
39981,best Chrome extensions,"Youtube Ratings Preview, it lets you see ratings on the thumbnail with a blue bar that doesn't get in the way. 

Youtube Magic Actions which gives you a whole load of other options while watching youtube you may find useful."
66732,best soccer team in the world,This England team has got to the semis and finals of the two most recent major tournaments. Don't think it's fair to say they've underperformed
