idx,text,query
64434,"I started making this last week. You're welcome to use it as a launching point. 

https://docs.google.com/spreadsheets/d/1ctJecQS6mBLu8Y4knzmhpnxzGUMqP1S4nTTFCR7idXU/edit?usp=sharing",Best Nike running shoes
57363,Seriously. Get a camelbak and a brita.,best water brand
4768,"If both are the same distance, spend a day going to both and talking with the staff/managers. If one seems to have more knowledgeable or friendly people, go there. The product quality is about the same.",best home improvement store
63912,!books,best place to pirate audiobooks reddit
41670,thank you!! I’ll check those out :),movies like Inception
50711,Do you have a sweet tooth? ^^[context](https://www.youtube.com/watch?v=9S1EzkRpelY),best rap album
44980,A water pick. An absolute gamechanger.,best items under $100
56220,"I'd definitely include Early Jackie Chan Hong Kong films such as:

Police Story(s)

Armour of God

Drunken Master

etc.

Star Wars films.

LOTR

Natural Born Killers",best action and adventure movie
73119,"My laziness to install anything else, actually...

Manjaro is working tirelessly on my machine since 2014 where I installed it just to test :D",best Linux distro
30632,"Seems to me that would be more acceptable than a meaningless war that has lasted longer than a decade. If you get him out of Afghanistan and into the custody of a third party country, you have much better options than wasting the life of US soldiers and pushing the country further into debt by chasing him around the mountains.",best Mexican war to study
4403,"No offense, but you're probably using vim wrong if you're still typing \`:w\` to write a buffer. For example, in my config I have \`:w\` mapped to \`<leader>w\` in normal mode  (where I set my leader to be the space bar). I also have \`<esc>\` mapped to \`jk\` in insert mode. So to write a buffer from insert mode, I just type \`jk<space>w\`.",best text editor
27587,"Mod Note - **Ignore this message if your post is within Rules of this Sub**


 Hello ZeroDullBitz
 We have strict Posting Rules. Read Rules on Sidebar for detailed Posting Rules. Remove this post if your post 
 is one of following :

 Religious/Political post - There is immediate and permanent ban for such posts

 Non Bollywood posts

 Promotional/ Self Promotional Youtube link / Blog/ Website or anything else. All Promotional Accounts will be 
 banned without warning
 
 Meme Post Meme only r/BollywoodMemes 
 
 Low Quality picture/Screenshot of tweet
 
 Tagging u/EccentricBai

*I am a bot, and this action was performed automatically. Please [contact the moderators of this subreddit](/message/compose/?to=/r/bollywood) if you have any questions or concerns.*",best bollywood actor
39627,"Ah I'd forgotten all about Kahn Academy, I used those for my A-levels!

And I'm willing to try any podcast really :) I mainly want them just for information in addition to revising etc, because I've found learning audibly to be quite useful, so it'd be nice to have something to stick on when playing video games etc :p",best podcast for biologists
27635,"SRK, Aamir Khan, Hrithik Roshan, John Abraham, and Shahid Kapoor",best bollywood actor
31059,But the weather there is pretty extreme in winter,best country to live in
52171,"I think you can skip Jesus is King from Kanye

I'd also add The Eminem Show and The Chronic",best hiphop album
58184,I like the smell of clean clothes on men.,best cologne
64741,"I'm at the point now where I look for certain specs in a shoe - weight, offset, type of support, amount of cushioning - so I usually will try out a few brands with the specifications I'm looking for and go with the one that feels the best in the store.  In my 8 year running career I've worn New Balance, Saucony, Asics, Adidas, Brooks, On, and Mizuno.  I don't really have a preference but I've taken a liking to certain models.",Best Nike running shoes
3523,"Thank you for that suggestion. I have been thinking about the UK universities. I like the fact that it is easier to figure out if you will make it or not, because they are very clear on what they are seeking from an academic standpoint. 

The thing as you suggested though is that they also force you to specialize very early and the system is very different from the US system in terms of a well rounded liberal arts curriculum. 

Besides my Mom is kind of nervous to send me so far away :-) but they are also on the list for now!",best college for research
18785,"""Now the trick here is to make it look like you've been jamming dicks into your eyes"" 

wut.",best YouTube video
22510,It makes me so happy that she called you a boob.,best celebrity
28055,And you can eat it while you drive to work.  It really is the best thing ever,best breakfast foods
66713,"To us, he’s priceless",best soccer team in the world
3113,"pcs and laptops dont have good image processors, phones do have them, 3 in the sn888 and 6 in the ex 2100. Also good cameras costs much money, pc brands just cheap out or forget about them.",best webcamera
9317,"My teeth look kinda stained though, and I brush and floss. Is there any way to whiten them without harming anything?",best toothpaste
