idx,query,text
34880,best NFL player,That’s a lot of acronyms
49511,best gaming monitor,BenQ EX2510 if you want accurate colors and AOC 24G2 if you want more vibrant colors. They're both really fast. ViewSonic XG2405 is also great if you want slightly deeper blacks and vibrant colors but it's a bit slower. Avoid XL2411K and XL2411P. They have terrible picture quality and are only good if all you do is play CS:GO with backlight strobing.
29748,best money managing app,Is YNAB good on mobile yet? Last time I tried it most things I had to do on computer
973,best ice cream flavor,"peanut butter and chocolate, not with peanut butter cups, but with salty peanut butter chunks in rich chocolate ice cream"
27259,best stocks to buy,Yeah I’m also confused on the comparison there.
30100,best Mexican war to study,"The Dead March by Peter Guardino. It came out last year and is consider a “New Military History” meaning it is not so much about campaigns and commanders as it is about the social constructs of both Mexico and the United States. Why did the US win? Why did Mexico lose? How do race, gender, class, nationalism effect soldier and citizen?"
38578,best newspapers to read,"Dude, things went too leftist when Siddarth Varadarajan was at the helm and have improved now. They ignored Modi's rallies, yes, but when it comes to reporting they have the best in the country. I rarely agree with their editorial stance but still would prefer it over other rags."
44986,best items under $100,fair enough
326,best terminal file manager reddit,Primarily dired (emacs) but also pcmanfm and CLI when appropriate.
21550,best winnie the pooh comic,"Little pooh, you shit."
14004,best research paper archive,"shameless plug: [/r/environmental_science](http://www.reddit.com/r/environmental_science/). the goal of this subreddit is to foster discussion, analysis, debate, and to aid research in the area of environmental science or geoscience."
6234,best Netflix documentary,"I know it’s not a Netflix production, but did Mars get renewed? The second season was half the eps of the first and I haven’t seen any signs of it continuing.

Edit: I thought s2 was shorter, guess I was wrong. Both about the same. But nothing new since 2018.

Edit 2: from Wikipedia: “The lead actress Jihae confirmed that the series was cancelled after only two season's on her official Instagram”. I’m sad now. It was a good series."
26663,best board games,"Everyone should own, at least, ten games that I don't own. Game nights would be _really_ boring if we all owned the same ten."
802,best baskin robbins flavor reddit,Rocky Road
15498,best tree for the garden,"Black haw is a great tree, or nanny berry or indigo bush it’s a shrub that can be canopy cut and it can grow aprx 12 feet tall"
54493,best artisan mousepad alternatives,"Thats 51 cm/360 :) its just an easier way to compare sensitivity across different games. My sens is quite close to yours so looks like my arm will sink in too 🤔

Btw if you could only have 3 mousepads, what will they be?"
15991,best sunglasses for fashion,"This is my only pair too! Mine are prescription though, so i can't ever just pick up cute/cheap ones whenever, but honestly these have been working for me for years."
5706,best programming language for web development,"HTML CSS JS, definitely learn those first, no doubt about it. I'd hold off on MySQL, you _might_ not end up using it depending on your spin. _After_ learning the 3:

1. Wordpress.  A quick-n-easy path to cash, highly recommended. If you go this route, learn MySQL. You code less in WP (unless you're a themer =  CSS); you build more through it's web interface. So if you're more for getting sites out the door in minimal effort, go this route.
1. Angular. If you enjoy coding, give front-end dev a spin per that post (Angular & React are good choices). For this stack, use NodeJS for your server. It's JS, so you don't need to learn new stuff (compared to learning Ruby on Rails), big learning-curve-saver. Use MongoDB as your database, it's the path of least resistance for this stack. You can actually skip glueing everything together and get the whole shebang [here](http://meanjs.org/). Or if you're feeling more experimental, try this [one instead](https://www.meteor.com/). A big benefit of learning Angular or React is you can transfer that knowledge to building mobile apps as well (see [Ionic](http://ionicframework.com/), [React Native](https://facebook.github.io/react-native/)).

I personally prefer option 2 (obviously), but I love code. I come from a background of option 1 (actually using Drupal, not Wordpress) and it's really solid for dishing out websites hand over fist (read $$$); but it's pretty boring IMO. All personal preference."
54213,best medicine for a cold,Suicide. Cold is gone in a flash.
3688,best college for research,Or waffles
61016,Best comedy show on Netflix,"Archer, most definitely"
52398,best hiphop album,lmao
52598,best hiphop album,In da graveyard
15965,best sunglasses for fashion,"Identical in quality, materials, and construction?"
55351,best action and adventure novel series,"Seriously, this series is utterly enthralling. I began to read it and was totally hooked in the first few pages. The characters are the most 3 dimensional I have ever seen. My wife wanted to watch the TV series on HBO, since she had heard myself and others talking about the books.

I sat with her through the first 10 minutes of the first HBO episode. I then realized the book could NOT be captured on screen. So much of what happens is in the minds of the characters, and there is NO way to translate those thoughts to the TV screen, no matter how good the actor.

I turned the TV off, mid-episode, and said to my wife, ""Trust me. You want to read the books. THEN watch the series.""

My wife does trust me, completely, as I do her. She bought the books and within the hour was glued to her Kindle. And she understood, within the first chapter, why I stopped the TV show. It is that good. She just caught up to and passed the TV episodes in her reading. It led to some close calls, as spoilers are everywhere it seems, but she made it and is now beyond the TV series. Safe, in other words, from encountering memes or online jokes or posts that are spoilers.

I suggest you stay far away from anything that might be a spoiler, once you actually start reading this series. It is huge and unfinished, but I think any serious reader will enjoy it.

Sorry for all the words. I am feeling a bit like George myself, though he sure tells a much better story than I!"
