idx,text,query
5137,Lowe’s credit card gives you 5% off all purchases. HD just sends you offers to borrow money.,best home improvement store
73224,I'm a big fan of Mint.,best Linux distro
58599,Drakkar Noir is around that range and always smells terrific.,best cologne
30726,"I certainly don't think you're wrong but I think that these rankings shouldn't be only thing people consider. For example taking into account average life expectancy, education, you are taking averages which can be skewed by outliers. Take example in America, more people are obese which largely contributes to life expectancy. But statistics are just that, generalizations. It doesn't dictate your own life. If you want to be healthy, you can be healthy. Education is the same. American k-12 schools are not as highly ranked as other countries, but it certainly doesn't mean that students are incapable of doing very well academically, and can't excel in American Colleges which are generally very high ranking. I'm not trying to say these global rankings and standards like public schooling, violence, standard of living, etc are wrong or insignificant, but they aren't like rigid truths. America is an extremely diverse country that is just huge, which makes it a harder to manage and budget properly than a place like Japan which is ranked very highly in a lot of these standards. This isn't an excuse for slack, but more so and indicator of outliers that drastically skew the rankings and data of things like education quality and income inequality. Take example the average salary in America. Around 30-50k. By no means is that a ceiling you are limited to. Just a few examples.

TLDR: Statistics don't tell the whole story, just part of it.",best country to live in
51903,"Yeah, I went with midnight. Wished it was saddle brown.",best iphone case
12361,My ~2.5 hour flights round trip to school can be under $100 on good days if you fly the budget airlines,best gifts for mom
70347,Business Administration,best major to study in college
39246,if u care about privacy brave and hardened firefox if u dont care about it add edge to that list.,best web browser
18151,"my favorite part is he says ""Jesus"" to the burning bush",best YouTube video
36466,"Fuck, nothing like doing some shots before work because anxiety makes it hard to talk to people",best alcoholic drink
66830,"This is based off of Transfermarkt’s valuations, not actual transfer fees.",best soccer team in the world
30807,DANSK JÄVLAR!,best country to live in
56693,http://i.imgur.com/YkiDIWu.gif,best desktop monitor
16494,"I've recently gotten more into sunglasses, but I'm no where near as knowledgeable as some of the other posters in the thread. Anyways, I still wanted to share my experience in case it might be helpful! At the moment, I have three pairs of sunglasses that I wear in heavy rotation:

1. A polarized pair I mainly use for driving. Seriously, polarized sunglasses will change your life. This is the pair that I spent the most on ($100+), and they are a classic wayfarer shape. Some brands I like are Smith (I have these), Maui Jim, and Cole Haan. Ray-Bans are ok, but not worth it for the price if IMO. Polaroid and SunCloud also have some really affordable polarized options.

2. A ""fashion"" pair, that I spent the second most on (~$70). I uses these for walking around, hanging out with friends, traveling, etc. Essentially situations where I need sunglasses but will not be driving, and will have little opportunity to lose them. I get a ""fashion"" style with these. My current pair is a jet-black over-sized cat eye silhouette from Le Spec, my personal favorite sunglasses brand. Quay is also a fun brand. 

3. Cheap pair. Spent no more than $10 on them, mainly get them from fast fashion stores. I use these for when I'm doing a high-action activity (hiking, boating, theme parks) and have a high potential of losing them. I get these in a classic silhouette (current pair is a wayfarer), and I found my pair at Forever 21 for $6.


For the more expensive pairs, I would recommend either getting them directly from the brand if you can, in order to qualify for the warranty, or a retailer with an awesome return policy (in the US), like Nordstrom or Zappos. I get my fast fashion ones from places like ASOS. Discount department stores like Nordstrom Rack and Off 5th also have great quality options at good prices. I've seen polarized Cole Haan sunglasses for $35 at the rack, and $75 Ray-Bans at Off 5th.",best sunglasses for fashion
73777,"Or you will be in the sun with a screen protector, the glare will be so bad it will blind you and you wont be able to use your iPad ever again 😂",best matte screen protector for ipad
35718,"hahaha, that's fucking awesome. I love that their Hail Mary is cheap long islands. wave that booze flag in a last ditch effort to save the ship.",best alcoholic drink
63972,"Legend, thanks for this. Couldn't find what I wanted anywhere, wasn't on MyAnonamouse",best place to pirate audiobooks reddit
16418,Good to see the future Back to the Future promised is now.,best sunglasses for fashion
15985,"""Shit be looking way different through these thousand dollar frames""

-Problem",best sunglasses for fashion
68358,"> I'm surprised The Three-Body Problem isn't on that list!

The list is several years old, so it pre-dates a few highly recommended reddit crazes like *The Three-Body Problem* and *The Martian*. I've read those and loved them, but haven't gotten to the rest of the Three-Body trilogy.",best science fiction novel
52988,"War Ready, Givenchy, Flava.


On the *same* fucking album.",best hiphop album
2577,"I can attest to them from personal experience, and they do have issues with comfort -- their cup size must be designed for French folks because they don't fit me (and since I'm pretty average, i suspect a bunch of other folks) well.  

But to be fair I must also add that the Spirit Pro has one of the most unique looks of any headphone I have seen, with the spackled paint finish that looks remarkably like [the headphones are wet] (http://medias.audiofanzine.com/images/normal/719797.jpg). IMO pictures dont do it justice, you have to see it in real life to get a sense of how gorgeous it is.",best headphones
65011,Galanga if you’re into Thai,best places to eat in Santa Barbara
15789,#mega cheap[!](https://www.youtube.com/watch?v=cHkaIHRK35g),best sunglasses for fashion
23297,Wow I had no idea people played street legal racing still. That game was my childhood and is what got me into cars.,best car racing video game
