idx,query,text
39208,best web browser,luakit.
43202,best detective show,I've watched S1 like at least 5 times.
35302,best alcoholic drink,Whatever has the highest alcohol content per ml at lowest cost per volume.
47455,best state to visit in the United States,"Alaska for sure. Though I really wanna go out west to Colorado or something, I’ll let ya know which is cooler when I make it out there"
17445,best iOS game,Cod mobile?
14913,best romantic novel,"Thank you, I’m so so so excited 😄💖"
8014,best laptop for general use,"How would you say it compares to the acer predator helios 300? I noticed it has 512 gb ssd while acer nitro 5 only has 256 gb ssd. 
The price difference I see is $1,023 vs $1,199. Is it worth paying a little more?"
44235,best items under $100,"Upvote for houseplants. I got about 10 and it makes a world of difference in the aesthetic and quality of your indoor living space. And for those who say they can't keep a houseplant alive, houseplant411.com will tell you everything you need to know about just about every type of plant.

Houseplants. Yes."
12426,best gifts for mom,Etsy is the bane of both my existence and my bank account.
58447,best cologne,"I always thought this one was popular. Time to get something new, I guess."
56465,best desktop monitor,"You're missing the point. They can never sell it as new again. I don't have a problem with someone returning something they aren't happy with, but buying multiple models knowing full well that the PLAN is to return one is just screwing over the seller, and screwing over the rest of us because the loss will always be passed down to the customer in the form of higher prices.  


Returns happen, but at least give the seller a CHANCE to not take a loss."
5249,best home improvement store,never noticed this sub grabs independant comments in the spam filters... nice to know
27546,best bollywood actor,Me too! I loved him in Zindagi Na Milegi Dobara! I'm planning on watching Socha Na Tha and Raanjhanaa next :D
55563,best action and adventure novel series,"Well, I don't think anyone has mentioned Harry Potter yet, probably because everyone is assuming you've read it. 

If you have not. 


Read it. It's difficult not to love."
8107,best toothpaste,Let me put it in perspective 50 double cheeseburgers or 1 toothpaste
73050,best Linux distro,"I agree it is something to appease management.

However say I'm running software by... Vendor X. Something breaks. I call them up because we have a support agreement... 

Me: ""Oh Hai, your software is broken""

Vendor: ""Are you running it on a certified platform?"" 

Me: ""No"" 

Vendor: ""K, you're on your own.""

Me: ಠ_ಠ"
1642,best ice cream flavor,"Just found out about [this ice cream place in 
Brooklyn, Odd Fellow Ice Cream](http://www.oddfellowsnyc.com/flavors.html). They have had a lot of interesting flavors. I'm definitely inspired after seeing some of these."
26882,best board games,"The designer of Santa Monica said an mini expansion is on the making and will bring events to the game and not much more stuff. Its expected to be ready by the end of this year.
Sadly its just a mini expansion that will cost 10 dollars or so, its a order from the Publisher."
65445,best phone service company,Visible should be changed to $25 but also have Party Pay mentioned. But nice job!
65861,best college in california,"http://www.mercurynews.com/education/ci_25731300/uc-nonresident-students-increase-californians-admissions-slow

This has been a common criticism of UC for the last few years. They are enrolling more out of staters to help with finances."
43813,best items under $100,"I'll second leatherman, but not gerber. I've never had anything from them that Ive had luck with. Not even their knives."
52885,best hiphop album,"/u/21Mazza21, Please dont link to spotify.com.

*I am a bot, and this action was performed automatically. Please [contact the moderators of this subreddit](/message/compose/?to=/r/makinghiphop) if you have any questions or concerns.*"
58757,best cologne,"It isn't so much a burning joint smell as a earthy leafy cannabis smell. If you are looking for it you will notice it, but it doesn't really smell like you are smoking weed. It is actually a pretty amazing fragrance, just not something for every day."
67331,axios alternatives reddit,"Welcome to the world of front end frameworks, if it didn’t have a commit in the past 24 hours it’s dead!"
8163,best toothpaste,Ask your parents if some patients lick their fingers as they touch their teeth.
