idx,text,query
19706,"Git me a chicken sandwich, and some waffle fries...***FOR FREE***",best YouTube video
73695,I love ESR like paper less and best for longlife tips,best matte screen protector for ipad
17213,Jet Car Stunts 1 and 2,best iOS game
64416,BrokenStones. Nothing comes close IMHO.,best place to pirate mac apps reddit
39609,is this something a google search will yield results ?,best podcast for biologists
25035,"That's a fuckin cinematic perfection of a sequence

Now the song and dance with gwen stacey was shitty",best spiderman actor
37063,"Putting grass under a coaster instead of concrete is still not themeing it. Have a look at Black Mamba (Phantasialand) or Blue Fire (Europapark). That is themeing! The coaster diving into dips and through caves, winding through the African desert like a snake or flashing through the scarce and rocky landscape of Iceland.",best roller coaster at six flags
55729,"Gotta do Wheel of Time if you haven't!  Adventuring all over a rich world, tons of different characters, epic battles, magic, and it will keep you busy for months!  I'm doing a reread right now and I can't get over how good it really is.",best action and adventure novel series
53079,"I like some death grips but we’re really
Going to pretend their style/sound isn’t experimental to the point of being a turnoff for the average person? I’m just saying this sub praises tons of weird experimental mashups of genres. Where you been?",best hiphop album
58106,Chrome has been my go to for like 20 years. Love it.,best cologne
20039,"When I do my speed workout, a bunch of the songs that I listen to are on here:  Wolf Like Me, Till I collapse, Lose Yourself, Enter Sandman.  However, many of these songs are terrible for working out.  Another One Bites the Dust?  Remember the Name?  Ugh.

I like that there are two songs from Rocky on the list, but my favorite one to work out to is missing... ""No Easy Way Out""",best workout music
22616,Which is evidence of some of her issues I referenced earlier. She tends to bite the hands that feed her.,best celebrity
59345,I get comments on Viva La Juicy too! At first I worried it was too sweet when I smelled it right out of the bottle but it must just work well on my skin,best perfume
68352,"Surely you read the first book; Hyperion? The way that the pilgrims' stories are told was very clever, and Sol's story alone makes the book one of my favorites.",best science fiction novel
63876,">Yep, it's tough because most torrents are VIP.",best place to pirate audiobooks reddit
59586,"Haha well I did my best! The most important thing is for fragrances to project the image of yourself that you want the world to see, and it seems like you’re def doing that! You have great taste!!",best perfume
35087,If the question was most marketable he’d be #1 for sure.,best NFL player
64585,"Because they look good. If I’m paying $120 Plus for running shoes I want them to be stylish enough I can wear them casually once they’ve run their course. I’ll pick up other brands if they’re discounted, but I’m not paying that much for shoes that look like shit. Granted I’m lucky in that almost all running shoes feel good on my feet, so I have many options. I know that’s not the case for everyone.",Best Nike running shoes
11350,Damn son that's cute as fuck,best gifts for dad
24341,Sigh... I havent watched even 20% of the list and I already stopped watching anime.,best anime
19509,The show with hot questions and even hotter wings (pointing finger up).,best YouTube video
60346,"Norsemen

A Good Place

The Kominsky Method

&#x200B;

&#x200B;",Best comedy show on Netflix
58770,"How much should I expect to spend if I do this? Will I have to break out $100+, or can I get something good, not cheap or too common, for like $40?",best cologne
69329,I didn't go to school. So I gotta do something. Worked on rigs 8 years. Still got all my fingers and toes.,best major to study in college
40216,"> Remember that usually a few cores in consoles are available only for OS operations

They use 1 core in the PS4 and X1",best midrange CPU
