idx,text,query
20614,"I don't know that I have just one song but my go to bands lately have been Lamb Of God, Meshuggah, and The Dillinger Escape Plan.",best workout music
13228,"Wow! I hope my boyfriend has an attitude like that when we have kids :) good on ya!
I agree a spa say would be awesome, provided that she was completely comfortable with whoever was looking after bubs as it could be difficult for her to fully relax. 
Ask her what she needs from you! Better to get a loving neck rub every night than one expensive gesture IMO!",best gifts for mom
29661,i think gears judgment should be taken off. i hated that game and halo wars should maybe be added,best game console
19708,"[All Your Base] (https://www.youtube.com/watch?v=8fvTxv46ano)

This meme is older than the internet.",best YouTube video
8092,I'd like to hear from that 10th dental detractor. What's his angle? Is he in bed with the mouthwash people? Is he just trying to be a dental hipster? There are many questions.,best toothpaste
11919,Bag of chips.,best gifts for dad
19416,This is the best and most wholesome description of Brad Leone,best YouTube video
64774,I love del Pueblo. I don't think it's a whole in a wall. Its authentic Mexican decor.,best places to eat in Santa Barbara
21478,"Guardians of the Galaxy soundtracks!

Inspired by recent Marvel movie marathon that me and my GF started.",best workout music
15059,"If Princess Bride counts, Princess Bride. People shit on the book but its hella good and funny.",best romantic novel
197,Try out vifm,best terminal file manager reddit
33430,"Who cares. They strap a motor to a shell and call it “drivable”. Whoopdee fuckin do. Its still a concept and not production. Most of the “concepts” companies show off arent drivable vehicles. Theyre shapes with just enough parts to get to and sit on a display stand. Thats the way the industry works. 

Who cares if the commercial was cgi either. News flash, most are. The fact remains, gm has a much better capacity to deliver on their products and promises than tesla.",best electric car
28799,"Yeah that’s fair, they’re not for everyone. I have this special made Tupperware thing that poaches them in a microwave in 45 secs, fits the description.",best breakfast foods
44105,Cast iron is very heavy and so it holds a lot of heat.  When you slap a piece of meat on a pan a lot of heat goes from the pan into the food and cools the pan until the burner can heat it up again.  With cast iron the pan doesn't cool as much since it has a lot of mass so you get a more even cooking experience.  Also you can put a cast iron pan in the oven so you can do things like a shepards pie all in one pan.  Plus the things are near indestructable and good for hitting burglars with.,best items under $100
61602,"Skyrim
Assassins creed odyssey

My top 2 for sure. Others are kind of loosely rpgs or don't quite appear as rpg.

Haven't played the witcher yet",Best RPG game on PS4
6999,"Same, even the best LCD screen seems washed out after using OLED.",best iPhone
27801,How do you find motivation or time to get up and make this sort of epic meal? The only time I can do it is the weekend and I usually want to catch up on sleep.,best breakfast foods
34748,Jerry Rice.,best NFL player
43465,"Vertical mouse. $20. Saved my wrist using it at work all day.

It looks odd but it feels so much more natural. I even got a bunch of people at my office to buy one after they tried mine.

Edit: [Here’s the link](https://www.amazon.com/Anker-Wireless-Vertical-Ergonomic-Optical/dp/B00BIFNTMC/ref=mp_s_a_1_3?dchild=1&keywords=vertical+mouse&qid=1595422956&sprefix=vertic&sr=8-3) to the one I have for those interested.",best items under $100
943,"That's actually really cool. I was thinking about building a section on my desk where I can stand. Also using stuff from IKEA, there was this blog post a while ago: http://iamnotaprogrammer.com/Ikea-Standing-desk-for-22-dollars.html

I probably will do this the next time I make a trip to IKEA.

Here is a pic of my desk with the monitor stand. It's still clean as I recently moved it from one room to another. http://i.imgur.com/wOai0kr.jpg",best desk lamp
70217,Everything on the list of worst options are the only things that sound interesting to me :(,best major to study in college
3517,Pomona is for you,best college for research
900,"35,5 cm",best desk lamp
34407,Reggie White.,best NFL player
72095,"Signs is primarily about religion, though, which makes the twist and God making things happen for a reason have the ending not really be a twist in the slightest.",best movies with a cool twist
