idx,text,query
36876,"I agree with /u/provoaggie \- I'm pretty sure the above order is order of thrill or intensity, and NOT the order you should ride it in. The park is basically a large circle. Just do rides in the order of that circle, skipping some if you don't want to ride or don't have time.

X2 is the most intense, and *can* break down so that may be a good place to start, or at least, do earlier in the day. You can always circle back and ride again later.",best roller coaster at six flags
56607,"I only mentioned anti aliasing because the higher the resolution, the less jagged edges you are going to see. AA can have a large impact on performance, but I find I can turn it off or at least lower it without noticing a difference since I play at 1440p. At 4k, it'd be even less noticeable",best desktop monitor
71333,"My favourites: Prestige and Memento.

&#x200B;

 I also like to mention""Gone Girl"".  That movie completely blow my mind.",best movies with a cool twist
7722,"Hey I was the other user you helped decide on a a Zenbook 14.  Is Amazon typically the best place to order this laptop? I was hoping I could pick it up at my local bestbuy (or equivalent), but haven’t found it.",best laptop for general use
71238,The sixth sense. Bruce Willis was bald the whole time!,best movies with a cool twist
72444,"I personally like Greens the best, but those tend to bother those around you. I like heavier actions while typing because it helps avoid accidental keystrokes",best keyboard switches
6446,Senna. Its about Formula One racer Aryton Senna. I have never watched Formula One and really enjoyed it,best Netflix documentary
62909,"If you follow “uncle bobs” path you will be a gate keeper, unpleasant to work with and misogynistic. Some of his stuff is good,  but to many others it’s the equivalent of saying “I’m an asshole”. 
 
Obviously you can choose to use whatever references you wish. 

Some of these are based on my own interactions with him and general knowledge. Google will tell you enough if you’re so inclined. 

Do not assume everything he writes is correct or worth following. 

I’m sure I’ll get downvoted to hell but that’s why there’s a block function.",Best Data Science textbook
38006,Black Panther had a bigger audience and many believed it had a large social impact,best Marvel movie
28926,"Fruit, yogurt, oatmeal, bake eggs in muffin tins and store in the refrigerator, etc. But if you are not much of a meal prep person or don't like to cook I would recommend healthy oat bars from the grocery store. I keep them in my purse in case I'm ever running late or forget breakfast. I enjoy the Belvita brand and they have many flavor and texture options.",best breakfast foods
51269,Looking at this as well or the black!,best iphone case
39973,Which extension had the malware? It had *zoom* in it's name or something.,best Chrome extensions
35345,ahh the amount of times i've puked off those is absurd,best alcoholic drink
4522,"Damn, you're right. I'll see myself out.",best text editor
59676,Thank you for the recommendations 🙏🏻 I’ll definitely look into these 💕,best perfume
8911,"oh, and prescription fluoride rinses and toothpastes are useful in certain situations. definitely not for permanent use though.",best toothpaste
41215,"I'm a big fan of metal, but I think the violin is the most beautiful sounding",best instrument to play
6068,I saw the original series but heard they added more to it decade later. Are the extra episodes any good? I tried to get into them but failed I think because I knew so much about the case and aftermath.,best Netflix documentary
31725,That's cool! how big is your room? can you share any pictures of it?,best hotel to live in
54520,"Hard to say... Likely hien is more durable, but that's just cause people have had them for a couple years and still going strong! We just don't have the data for the otsu v2 yet, but I can say it's very durable.

They're both insanely good pads and my top 2 overall.",best artisan mousepad alternatives
63732,"You can check The Willpower Instinct: How Self-Control Works, Why It Matters, and What You Can Do to Get More of It.",best books for time management reddit
37105,Ok so I was looking back at the coaster rankings and HOLY SHIT lost coaster is actually ranked higher than steel Hawg wtf,best amusement park
35113,"Lawrence Taylor, Ed Reed, Troy Polamalu, Ray Lewis, Brian Dawkins, Julius Peppers, Warren Sapp, Jerry Rice, Dan Marino, and Barry Sanders.",best NFL player
17108,Dragon Quest 5,best iOS game
42556,Totally agree! Not as good as the first 2 seasons,best detective show
