idx,text,query
33659,Waiting for them to be cheaper but I would get one for commuting.,best electric car
55199,"Letchworth is near Buffalo, opposite side of the state.",best places to hike in the east coast
19616,"that guy actually tried to get that video removed from the internet

Edit: [The Sauce](https://www.youtube.com/watch?v=zoOSa1P50i8)",best YouTube video
10675,How to break open a travel bag with a pen is going to be a ULPT by the end of the day.,best suitcase lock
46296,Keep your lights on and hand out as much as you want.  Just make it last.  When you run out shut the porch light off.  Nobody tp's on holloween.  Its the night before they go crazy.  Just have fun with it.  Last year was my first year....went with king size.,best trick or treating candy
32642,"I travel a lot, and often on a budget. I have always looked at the bad reviews (3 or less out of 5). Look for consistency in complaints (same thing repeated) and see if they are complaints about things you would care about. An example is that at one resort that we were looking at the consistent complaints were that the bartenders didn't know how to mix good fancy tropical drinks. We drink jack and coke and other simple mixed drinks, I could care less about the fancy umbrella laden ones. Another place complained about lack of cleanliness in the rooms ... We are neat freak germaphobes, so that was a big NOPE!

It takes some time, but it Is usually worth it, especially for a honeymoon (congrats!).",best vacation resort
63873,What about regular e-books?,best place to pirate audiobooks reddit
67475,"So hold on, is the issue at hand (unable to resolve a body multiple times) only an issue for node-fetch or is that actually specced?

My initial impression was that's it's node-fetch specific, which in that case I'd expect it to work to spec ... But if it _is_ working to spec than its purely a non-issue ...",axios alternatives reddit
3005,"It's a great option if you already have a halfway decent camera though, since these Chinese USB capture cards can be found for less than ten bucks and work perfectly.",best webcamera
12422,My mom loves cute salt and pepper shakers. She also has this 4 peas in a pod necklace. One pea for each of her kids. I got her peas in a pod salt and pepper shakers. She loves them so much she hasn't used them because she's afraid of them getting broken. She keeps them on her nightstand so she can see them all the time.,best gifts for mom
21246,Push it to the limit,best workout music
49393,Online is cross platform except destiny no?,best gaming monitor
26233,"Well as a millenial I've only witnessed 3 presidents.  Obama, Bush, and Bill Clinton.  Any love for Bill Clinton or am I just having nostalgia?",best politician
59905,la vie est Belle by Lancome,best perfume
16879,That's weirdly specific,best pet for toddlers
6326,Tiger King 😂,best Netflix documentary
9200,"On behalf of myself and all the other crappy-teethed individuals in the world, fuck you very much. :(",best toothpaste
14722,"*Women*, by  Charles Bukowski.  Trust me, it's a perfect Romance book.",best romantic novel
20950,I was expecting this at the top tbh,best workout music
45591,"Cracking choice of console, massive selection of games and now beautifully cheap to buy games! 
I think overall I got more joy with my time on the 360 than the One.
What games you playing?",best gaming system
66051,"To counter your point, how many good people have come out of Harvard? I think a better way to put it is that the social elite go to Harvard, which gives them access to more positions of power, and more exposure to those already in power. If a bad person goes through that process, well now we have a bad player in a good position. Remember the old saying “it’s not what you know, but who you know” to an extent obviously.

Quick edit: I do agree on your opinion of those people though",best college in california
58107,Absolu acqua do gio is perfect for me. Give it a smell next time you’re looking,best cologne
36180,You are a god among mortals.,best alcoholic drink
14650,"Anything written by Julie James. Her females are strong, sassy and snarky. I especially like her FBI series.",best romantic novel
47450,Been there. Awesome place,best state to visit in the United States
