idx,query,text
55270,best places to hike in the east coast,"There's a great two day loop that starts at the woodland valley campground in the Catskills. Summits wittenberg, Cornell, slide and panther. Dispersed camping spots available."
69701,best major to study in college,Don't have to ctrl-F when my major Is the top comment 😭😭
13346,best spreadsheet editor,"Not for 20 years.. It hasn't been relevant since before my college days, and I never saw it in the work place, not even as a legacy app for some old project."
35282,best alcoholic drink,Oh man. Love Lagavulin. Sipping on an Ardbeg Uigeadail that I'm absolutely loving right now.
36774,best alcoholic drink,Gin tonics & Soju with any soda
48419,best color to paint with,I like it! I might try a lighter shade due to the floors being so dark. Thanks for the suggestion!
22036,best celebrity,I met Santa at the mall. A very nice old man
68555,best science fiction novel,No Iain M Banks? Not a sci fi list.
22495,best celebrity,"When I was in high school, Michael Keaton offered me a ride on the rural Montana road my dad lived on. I'm talking, town of 300 people. It had started raining and he pulled over in his nondescript Jeep. I was almost at my dad's house, I said no thanks (also, total stranger). It wasn't after he drove off that I realized who he was. This was at the height of his Batman fame. 

I told my dad when I got back to his house. His response: ""Sure! Was he driving the batmobile?"" Totally didn't believe me. A few hours later, he gets a call that MK was in town that day looking at property."
67270,axios alternatives reddit,"+1 for fetch! You really don't need a library for this stuff unless you're doing something other than just downloading a file.

Edit: the use cases that are difficult or unsupported with fetch are perfectly valid, I didn't mean that they weren't. Just a silly choice of words. My point was only that you don't need a library for simple stuff like just downloading a file."
9353,best toothpaste,"you assume too much, mine was 100% leaky.  
  
and it also burnt oil.....i love that car."
364,best terminal file manager reddit,"There is [joshuto](https://github.com/kamiyaa/joshuto), written in Rust. Not sure if it is fully there yet.."
2299,best pizza place in Santa Barbara,Korean Barbeque. Gogi house in Santa Clarita is fantastic.
22645,best celebrity,"Yeah, my friends sister was actually offered a full-time position on her staff after interning on her show, but she turned it down because Rachel Ray was such a bitch."
35335,best alcoholic drink,Woo hoo! Me too!! Idk people who drink tequila with tonic & it always gets a confused look from people when I say this.
58870,best perfume,"My long-winded top 10!

 1. Twilly d’Hermes - creamy ginger tuberose. It’s like putting on my favourite cashmere sweater. Both comforting and stylish. 

2. Terre d’Hermes EdT - originally bought it for my husband, but I wear it more than he does, especially when it’s hot and I crave the refreshing citrus woody punch

3. Tardes Carner Barcelona - a slight plasticy vibe at first spray, but dries down into an almond, heliotrope powdery dream

4. J’adore Dior - my first fragrance love and associated with so many great memories. It’s a bit too fruity for me to wear every day, but when I put this on for a date I feel very womanly and feminine. Also my husbands favourite. 

5. Eau des Merveilles Hermès - this one makes me feel like I’m eating oranges in a pine forest at the edge of the sea. Very laid back cool girl vibes. 

6. Champaca Ormonde Jayne - notes of rice and tea and flowers. When I wear this I can’t stop smelling myself. I can’t wait to wear this to a garden party or something. 

7. Chypre 21 Heeley - probably not a favourite for long as I am on a quest for the perfect Chypre. This one does a lot of things right - very mossy with a lovely floral edge. The longevity is really bad. 

8. Chloé EdP - another early love that I can’t quit. This one is so light and clean and feminine. I feel like it’s too young for me, but sometimes I crave it’s simplicity. 

9. Fragonard Eclat - bought this in Paris because I mistook it for another perfume I liked (Belle de Nuit - the knock off of J’adore) but ended up loving the sweet marshmallow anise dry down. The scent is discontinued, so I use it sparingly in the winter. Better than any other gourmand I’ve tried. 

10. Joe Malone wood sage and sea salt - this one makes me so frustrated. I adore the scent so much and I love wearing it. But the price! If they could make this in a version that lasted all day I’d be hooked for life."
27189,best board games,"If you dive any deeper into the hobby than Catan you'll find games that do the things you like in Catan, but much better than Catan. It's a great gateway game, to the point where it has honestly replaced Monopoly as being the ubiquitous ""everybody has that game in their closet"" game (which I'm glad about, I actually enjoy Catan as opposed to Monopoly), and it's got great things going for it. But it doesn't belong on a list of the ""top 100 games ever"" from hobby enthusiasts."
42618,best detective show,Form your own opinion. I absolutely love Supernatural and never once lost interest. So I am looking forward (though saddened too) to watching the final season (15).
57411,best water brand,"I worked for “big water”

Taste- Dasani
Ethics- Nestle"
71961,best movies with a cool twist,The Good Place is such a great show!
53950,best medicine for a cold,"Oh, what I'm taking about is more like lactose intolerance.."
60972,Best comedy show on Netflix,Will do. Doctor's orders!
70775,best movies with a cool twist,"Fight Club, Primal Fear, The others, Sixth Sense"
53901,best medicine for a cold,"IIRC the british had an ""institute for the common cold"" where they spent many years testing different things, and the only thing which they found effective was zinc."
55705,best action and adventure novel series,"Robopocalypse is basically a novel length action scene. Different from the sci fi I usually read but it definitely fulfills your criteria. Enjoyed it while it lasted, and its sequel Robogenesis just came out."
