idx,query,text
64125,best place to pirate audiobooks reddit,"If you're on android, you can check out Tachiyomi. On pc, I think you can use an emulator for it, not completely sure though."
40762,best instrument to play,"Bass guitar. I've been playing guitar since I was a kid, but I find more satisfaction when grooving on a bass. Of course, I'm by no means great at the instruments I play.."
31167,best country to live in,Russia
34777,best NFL player,It’s Brady.  Second is Rice.  Third is Walter Payton.
40733,best instrument to play,"Electronic synthesizers.

With some technical knowledge you can design completely new kinds of instruments and expression. You can just make them sound funny and weird, too. You don't even need to buy expensive software/hardware: you can grab any free VST capable music application and rape it with one out of thousands of free VST synthesizers available."
295,best terminal file manager reddit,"None, just the CLI."
63295,best package manager ios 14 jailbreak reddit,Easy to do when you cut corners
5387,best home improvement store,"[Flying Bulldogs](https://www.flyingbulldogs.com/) sells discounted bathroom & kitchen hardware, light fixtures, and designer quilting & home-decor fabric! They're a small family owned & operated business."
19219,best YouTube video,"""And the chills have **ab-so-lutely** ***nothing*** to do with how cold it is here! Ah!"""
61962,Best RPG game on PS4,"Dark Souls Remastered. I never originally played it on PS3. I absolutely loved it. 

Nioh is one of my favourites. DS style but in Japan, can't go wrong 

Nier Automata was a really well made game and has a very unique style. Music was awesome as well"
18115,best Kardashian,"I’ve heard that Kim is like, the nicest in person. I’ve heard that Khloe is nice too, but a little more standoffish. I’ve never heard anything about anyone else in the family except what I’ve read on here lol 😂"
11765,best gifts for dad,God dammit Kyle.
3612,best college for research,"Thank you for your Original Content, /u/cankadir! I've added [your flair](https://www.reddit.com/r/dataisbeautiful/wiki/flair#wiki_oc_flair) as gratitude. **Here is some important information about this post:**

* [Author's citations](https://www.reddit.com/r/dataisbeautiful/comments/8h5m8n/top_1000_universities_based_on_research_scores_oc/dyh9fro/) for this thread
* [All OC posts by this author](https://www.reddit.com/r/dataisbeautiful/search?q=author%3A""cankadir""+title%3A[OC]&sort=new&restrict_sr=on)

I hope this sticky assists you in having an informed discussion in this thread, or inspires you to [remix](https://www.reddit.com/r/dataisbeautiful/wiki/index#wiki_remixing) this data. For more information, please [read this Wiki page](https://www.reddit.com/r/dataisbeautiful/wiki/flair#wiki_oc_flair)."
21429,best workout music,"Sabaton, Alestorm, Gloryhammer, and Powerwolf? My man."
55589,best action and adventure novel series,Sabriel will always be my favorite fantasy book! :)
64255,best place to pirate audiobooks reddit,"Im just gonna throw this out there but if anyone has a link for the textbook Strategy An International Perspective, 7th Edition that would make this semester a bit better!"
12949,best gifts for mom,Let's hope she doesn't decide to decorate her house herself!
62634,Best RPG game on PS4,"Depends on what you’re looking for. It’s incredibly well written, does a really good job of managing its tone (so things never feel absurdly out of place, but also you never have that heavy feeling from reading/playing a never ending serious story.) Failing at something you try to do is usually amusing, and (almost) never stops you from moving forward. It’s an interesting story/plot, and well done as a murder mystery. The world is very different and interesting. The leveling system integrates thematically with the story. All that being said, it’s not gonna be interesting if you want fights. Or high fantasy. Or a power fantasy. Those things are great, but this isn’t that. Disco Elysium feels unique to some degree."
45669,best trick or treating candy,I want candy corn just so I can [turn it into homemade Butterfinger bars.](http://candy.about.com/od/halloweencandyrecipes/r/Candy-Corn-Peanut-Butter-Bars.htm)
3714,best college for research,"I agree completely.  And regarding your last sentence: this is the other side of the same coin. ""Boring"" or tedious validation is hardly being rewarded, similar to more ""far out"" ideas, regardless whether or not they prove to be innovative in hindsight. In this respect, academic competition means getting ahead WITHIN the mainstream consensus view - mainly by not questioning it too much. And while not without its merits, I feel that this model produces a lot of unintended consequences. I would love to do a 10 year experiment of scientific micro-environments in which these classic notions of competition are suspended."
10544,best suitcase lock,Are you a cia operative or just paranoid?
13014,best gifts for mom,Or get her something she wants. Jk that's nice of you.
48309,best color to paint with,"What a shitty tip. If you have already chosen your furniture, linens and curtains, chances are you have already bought them, since you want to be sure they don't sell out or because you get a good deal on them. Where do you put them? In your new home, where you'll regret not painting BEFORE you start filling the room up."
36864,best roller coaster at six flags,"It might not be that bad, but in a park filled with great coasters it’s very forgettable. It sucks that the coaster it replaced was a great coaster (the chiller)."
69039,best science fiction novel,"Stainless steel rat, Chrystal Singer and....can't pick the last one."
