idx,query,text
9573,best toothpaste,"I thought cleaners just *did that*, not because of some other shit put in them.

Now you're gonna tell me that bread only leavens because they use yeast in it. Ha."
71860,best movies with a cool twist,"I was impressed by Prisoners. The movie does a good job of setting up severel red herrings as to who kidnapper is, but each leaves important clues that tie together to hint at the actual kidnapper. That plus Hugh Jackman and Jake Gyllenhal as the two protagonists each with differing oppinions and approaches to how to find the truth, you find yourself picking sides over which one of them to root for."
54464,best artisan mousepad alternatives,"Not really. A little adjustment, but you'll get used to it. Also depends on what you play....faster stuff like cod or apex you might really enjoy that added speed and tracking! More tactical and slow shooters like cs, valorant, and R6 it'll be more of an adjustment, but you'll get there. I'm more on the tactical side myself and I adjusted all the way to shidenkai! Just takes some practice."
28377,best breakfast foods,We have a Matt Peake here. /\
23149,best social networking site for CS,"Even this is probably overboard. In all honesty, companies don't expect that you use their products. It's more about being able to maintain their code and implement solutions.

The only reason twitter would care if you use their media platform is if you're going to be working on design or something, and even then, it's likely you could make a strong case for bringing a fresh set of eyes to the table."
57429,best water brand,BBQ burnt ends
60156,best freezer brand,"Ok, well, no one's saying anything, so I'll say it. Frost free ones are slightly more complex and on that basis, might be more likely to fail. They will also dry your food out faster because in order to stay frost-free, they need to fluctuate the temperature so that any frost accumulated on the walls can melt.

Basically, to save on electricity and effort, get yourself a non-frost-free (frosty or frost-filled?) chest freezer with a drain plug *near the bottom* (some have them higher up so you have to tilt the damned thing to get all the water out) Make sure you can attach a hose to it. On winter days, you just take the food outside and let the freezer drain into a drain or a bucket.


Edit: Also make sure the baskets are not made of plastic. Some manufacturers still haven’t clued in to the fact that plastic gets brittle in the cold.  I'd rather have something hint at me that I'm about to break it and temporarily bend a little than snap and permanently break after I've overloaded it."
18160,best YouTube video,"**WARNING**

PUT YOUR HEADPHONES ON FOR THE FULL EXPERIENCE"
10410,best suitcase lock,"Depends on where you are.  Flying back from Asia, they went through my bag and even nicely folded all my dirty underwear which had just been stuffed in the bag.  They certainly aren't afraid of a little dirty laundry."
48021,best color to paint with,Is this sarcasm? I just looked at a few threads and it seemed ok so far...
21536,best winnie the pooh comic,Dat jvass
73257,best Linux distro,No worries! Really if you're happy with your choice there should be no reason to change. But it's still nice to have the option. Like it's not like Windows or Mac where you're stuck on their upgrade cycles. You want to change it's as simple as downloading a new distro.
50529,best rap album,Be (Intro) is one of the best beats of all time. In my Top Ten for sure.
31531,best hotel to live in,"Grand Wailea in Maui is unbelievable

Edit: changed from Kauai to Maui bc I mixed up which island it was on."
24811,best anime,"Monster and Legends of the Galatic Heroes should be in any top 10, true master pieces."
22952,best celebrity,"Tip: If you are trying to impress the cashier, demonstrate your value by buying a box of magnum condoms, thus demonstrating that you have a monster dong"
65529,best phone service company,"Not sure about JBER, but I spent time in Juneau and Fairbanks with T-Mobile. They don't have towers, so you don't get T-Mobile service. I believe they have a contract with GCI so you get their service, but I couldn't get any data transfer at all. I was stuck with phone calls and texts that often dropped or wouldn't send. I switched to AT&T."
55133,best places to hike in the east coast,46'r reporting in... ADKs have some of the most beautiful lakes and streams in my opinion. There are few places on earth more calming than an ADK stream along a trail.
3750,best college for research,"From the site:
The entirely student-focused nature of the WSJ/THE US College Rankings means that the results differ significantly from the THE World University Rankings, which have a heavier emphasis on research excellence on a global scale.

My understanding from working in higher education is that in this case the US ranking focuses primarily on student experience / teaching quality, where the world university rankings focus more on research. 

Just my $0.02"
66883,best soccer team in the world,damn when did they win TWO world cups? i some how never knew that
31090,best country to live in,"If you find Avalon, please let me know."
114,best terminal file manager reddit,Coreutils ftw
42766,best detective show,In the US they are on PBS.
30178,best Mexican war to study,"""Yeah we really screwed the Mexicans over, but what else is new? We were determined to get the land one way or another. When we asked and they refused, we stopped asking. Then we won, the end"""
13551,best research paper archive,My first stop is always http://sci-hub.tw
