idx,text,query
13897,"Fellow scientist/academic, came here to say exactly this. Never draw conclusions from one study.

Regarding reviews and might be obvious - several reviews might be written on the same subject. *Try to always find the most recent one*, if it's a well-studied subject you might find critically different data.",best research paper archive
25005,The HUMAN-SPIDER,best spiderman actor
47243,"Should be easy to get tickets to the Titans.

Tennessee might seem to be an unusual choice but it is actually a great idea! Good food, music, etc. Nashville is the worldwide nexus of country music recording, and Memphis is a very important Blues music town.

There's some nutty hotel in Memphis that has duck bellhops or something like that. Also I think there's gambling.

Little Rock, AR is a do-able drive from Memphis if you rent a car and you could go to the Bill Clinton Presidential Library.

I don't know about Nashville but outside of heavily traveled downtown areas, both Memphis and Little Rock can be a little bit dangerous from a crime standpoint.

Oh yeah, any Simpsons fan wants to see Nashville's Fabulous Sun Sphere (it still exists).",best state to visit in the United States
55447,"No problem, thanks for writing some awesome books. I'm starting Chronicles soon.",best action and adventure novel series
27009,I didn’t know you could do this!,best board games
33399,"Mach E and ID.4 both look like good entries in the EV market.  Ford and VW will have incentives to get these off the lot, let's see these on the road.",best electric car
17244,How do you enable cheats?,best iOS game
22581,"The guy who got famous with ""I'm Chevy Chase, and you're not"" is a dick? No way.",best celebrity
26184,Longest serving member from Kentucky I believe,best politician
647,"NordVPN -

&#x200B;

 No Logs, Nordlynx (for Speed), Tons of Servers around the World, Kill Switch etc",best vpn for torrenting reddit
54456,"Zero has only a touch more control over otsu v2. I'd say 5/5 control for zero and 4.5/5 for otsu v2 on control. Speed for otsu I'd give a little over 3/5 whereas zero is a solid 2/5. Otsu v2 is basically hien speed with comfy surface and more control than a hien 👍.

I'd say try zero only if you want a bit more control.",best artisan mousepad alternatives
19485,"Other great cooking channels:

Sam the cooking guy 

Foodwishes

Joshua Weissman

Internet Shaquille

Edit: Also cowboy Kent Rollins! Thanks for reminding me /u/SaigaExpress",best YouTube video
46087,"Yeah I mean, or you could teach your kids not to be entitled dicks.

A well raised kid should be judging exactly nobody by the FREE CANDY they are handing out to children they didn’t even birth.",best trick or treating candy
25295,Tobey,best spiderman actor
67830,Are you using Ky in frontend or backend?,axios alternatives reddit
31142,"Canada isn't a terrible country. I'd rather live here than much of the world. But there are plenty of European countries that are a lot better. There are lots of faults with Canada that most immigrants don't see as they have rose coloured glasses on looking at Canada like the promised land.

Transportation systems here are horrendous. Unless you live in downtown of major cities a vehicle is essential to get anywhere.

The suburbs of major cities are just neighbourhoods of houses for kilometres with nothing else. Parks are just pieces of grass with nothing else in them with exception of a few such as High Park or Edwards Gardens in Toronto.

There is little culture, beautiful buildings, and restaurants for the most part are the same chains over and over again which aren't very good. Housing is very expensive in major cities and there's nothing in small towns. Crime is higher than most of Europe but Canadians only compare themselves to the United States so they think the crime is low.",best country to live in
23963,badass selection,best anime
45234,"Very true. But, value for money is with an xbox with gamepass.  Additionally, somewhere along the line Bethesda is going to even up the the exclusives market",best gaming system
59366,"Jo Malone Velvet Rose & Oud. I actually smelled it on a colleague, and it’s been my go to ever since. Fortunately she’s more of a Black Opium girl, so we’re not overpowering the office.",best perfume
33707,"I looked pretty hard at the Niro EV too and if Hyundai hadn't soured things it was a real contender. From everything I looked at they were damn near the same vehicle but with a different battery supplier, a longer wheelbase on the Niro, and like 2 or 3 options differences. The lifetime warranty that Hyundai gives you on the Kona is a big selling point too though. The discounts that Bolts are apparently starting to see is what I'm hoping to see more of in another few years. Since they're no longer the only mainstream long-range EV in that price range they need to work harder to make sales. Though the phasing out of the rebates might hurt that...",best electric car
26241,"Henry A Wallace, a progressive champion who was FDR's third-term VP and was almost president himself had he not lost the spot to Truman for the 4th term. He was pro-New Deal, wanted to end segregation in the 40s, was a spiritualist and theosophist, a controversial Ag secretary during the dust bowl, and someone who wanted to head off the cold war by normalizing relations with the USSR.",best politician
33283,For sure! Considering the tax write off for my solar system and my school I won’t be paying taxes for awhile! Haha,best electric car
10482,Was this hosted by Ron Swanson?,best suitcase lock
15304,"Oh man, those are awesome looking, I saw one in a store once that had been taken excellent care of, so the price was incredibly high. But the colors are very pretty. I used to have a Carmona Retusa (also known as Fukien tea tree) but it died because I didn't take proper care of it, now I have a new bonsai, though I forgot which species it is (it looks somewhat similar, but it has no white flowers and the leaves aren't as pointed) that is still alive after about a year, although I really need to trim it one day, but I lost my bonsai scissors, so I'm going to buy a new pair in a few days.",best tree for the garden
57213,r/hydrohomies is where its at for water,best water brand
