idx,query,text
48387,best color to paint with,no. more. repose. gray....no!!!!
883,best desk lamp,But the people here DO want to BIFL. They want something quality they never will have to worry about replacing.
18954,best YouTube video,The recent mario kart 64 world record video was truly well done. What a dramatic story!
64485,Best Nike running shoes,"Awesome job on this - answered many questions I had about Nike's lineup.    

I've never run in the Flyknit shoes, I wonder if they allow stretch/splay like the stretch fabric that Newton/NB uses on some of their shoes, that LunarRacer looks really appealing for the cushion/weight ratio."
12250,best gifts for dad,Not possible
57422,best water brand,Budweiser
55143,best places to hike in the east coast,"Yes, exactly. I'd definitely need to quit my job.

Honestly, I'm sure I won't ever complete it in one go. There are just so many other things I would do if I quit my job.

Hopefully one I'll accomplish most if it in different steps. Not as gratifying, but it'd still be cool."
8550,best toothpaste,"I'm not a dentist but

I'm not a dentist but

I'm not a dentist but"
29423,best game console,"Final Fantasy Tactics (PS1)

Chrono Trigger (SNES)

Shadow of the Colossus (PS2)

Zelda: Wind Waker (GC)

Star Wars Knights of the Old Republic (XBOX)

(if we allow PC then I would like to maybe change a game!  But you stated consoles so..)"
59901,best perfume,Dolce & Gabbana The One
8186,best toothpaste,"That's what my dentist said.  It's more about gums and getting that area right where the teeth emerge. A hard bristle can irritate the gums causing them to swell a bit and prevent proper access.

I have really bad teeth and I also swear by a flosspik."
15072,best romantic novel,"I mean, I've talked to quite a few women who were involved and there was without a doubt a tonne of underground slash fiction trading. At that point there really weren't that many male Trekkies in comparison and not many, if any, were involved like they were. I'm also going to point out that dude, it was underground. They were hiding it. If you weren't on the mailing list you weren't going to find out about it because a lot of it wasnt legal to share around."
68669,best science fiction novel,"Looks like I’ve got a reading list seeing as I loved anathem and blindsight.

Ever read embassytown? Good stuff."
28761,best breakfast foods,[SUPER DELICIOUS CRUNCHY NUT](http://www.youtube.com/watch?v=qB3MD4i2Hac)
333,best terminal file manager reddit,For windows there is file manager ++ or something like that
24867,best spiderman actor,Tobey Maguire is the best Spider-Man.
15270,best tree for the garden,###SHHH
45082,best items under $100,r/breadstapledtotrees
24297,best anime,"Despite the negative connotations of the word, the ""elitist"" anime tend to be my favorites.  I've seen several forum threads about elitist anime, like [this one](https://myanimelist.net/forum/?topicid=1362444) and [this one](https://myanimelist.net/forum/?topicid=1807052) and [this one](https://www.reddit.com/r/anime/comments/5otlxq/what_anime_do_you_generally_associate_with/).  But having a list is convenient."
13514,best research paper archive,"Just get it on Sci-hub for free, like every academic I know."
19425,best YouTube video,BA is an institution at this point.
29414,best game console,Another thrasher fan! Good stuff
52585,best hiphop album,[Ain't No Fun](https://www.youtube.com/watch?v=V8qgp3yT1rQ)
65791,best college in california,Not as good as SLO but better than the other LA area counterparts. Plus they are extremely well funded by the Kellogg Foundation.
42268,movies like Inception,"Tiiiiiiime is on my side, yes it is! Hey pal."
