idx,query,text
52116,best iphone case,"I have tried a few but the best for me is the [clear Urban Armour Gear (UAG)](http://www.amazon.com/URBAN-ARMOR-GEAR-iPhone-Display/dp/B00LCAVRLS). For additional protection I also suggest the [Tech Armor Ballistic Screen Protector](http://www.amazon.com/Ballistic-Protector-Tech-Armor-Premium/dp/B00EL94RQE).

The UAG is stiff enough that I think it helps to reduce the chances of the iPhone getting bent. The UAG, especially the clear version, is not bulky but the lip is high enough to reduce the chances of damage to the screen when the phone is dropped accidentally. Word of caution though is you have to be careful when removing it as it is a tight fit."
12607,best gifts for mom,"Better yet, clean the house without me even asking. While I sleep in. And wake up to fresh coffee made."
59401,best perfume,Happy Heart by Clinique. It’s bright and lightly floral. It ages well. So lovely.
30018,best money managing app,"[OpenBudget](https://openbudget.us) might be a good fit. It's an envelope budget system that has a free tier. Nearly every feature is free, though it has a small subscription/one time fee for a few features"
18429,best YouTube video,LUIGI BORD???
14896,best romantic novel,"This is really cool, thanks for creating it! 

That being said, I really don't understand why people like The Hating Game. I read it after seeing it recommended so many places, and it was so bad I'm not even adding it to my Goodreads. 

Courtney Milan's Cyclone series on the other hand... Books usually end with me just sitting on my couch clutching a tea and bawling. They're just so human. Can't believe they didn't make the list!"
47962,best color to paint with,Warm greys and dark jewel tones.
16252,best sunglasses for fashion,"Check out Sunski glasses. They feel great, look great, are incredibly durable, and only cost $50. I would highly recommend them."
63629,best books for time management reddit,Nice! The GTD system is great. I hope you get a ton of benefits from it.
15231,best tree for the garden,I like the idea of a dogwood but I'm a huge fan of Japanese maples - so beautiful.
12673,best gifts for mom,As a mum I would love that.
12484,best gifts for mom,I gave my mom ballet tickets.
60100,best perfume,"Out of my personal collection it would be Versace the dreamer, absolutely expensive smelling and is around 30€, and Hugo Boss man extreme, fantastic fresh clean but not at all boring and long lasting - also around 30€."
43751,best items under $100,"Such an awesome post. I had the same thing happen but with a cat. 18 years together. He passed when my daughter was a few months old. Every child should have that bond with a pet, especially kids who have a hard time with friendships. He was my first best friend and my best."
64164,best place to pirate audiobooks reddit,"Here are some more;  
[PDF Room](http://pdfroom.com/)  
[Epub Hunter](https://ebook-hunter.org/Books/1)

[PDFGet](https://pdfget.com/)  
[SoftArchive](https://sanet.st/full/)"
37003,best roller coaster at six flags,Lol I didn't even ride GL:FF
21233,best workout music,"god bless you for remembering the time DMX sang Rudolph the Red Nose Reindeer. 


Edit: link - [Feast your eyes!](https://www.youtube.com/watch?v=AXca4WcCzlo)"
9343,best toothpaste,"This is so true. My mum has been a dentist for like 30 years and she only ever uses samples of whatever toothpaste she's given. Whenever I see her she always asks if i want any toothpaste because she gets given so damn much.

I just asked her what she recommends and she said ""Anything with flouride, everything else is just bullshit companies are using to get you to buy it. Toothpaste is toothpaste"" Thanks mum :)"
39934,best Chrome extensions,!remindme 6 hours
2099,best pizza place in Santa Barbara,my roommate and i used to get Rusty’s every month and split the whole pie. their veggie pizza is 🤤
23587,best car racing video game,"Man, if you can find it, I can’t believe no one has said Tokyo Extreme Racer Zero."
26000,best politician,"Yep, us Westerners.  We're more pure out here.

[cue riding off into the sunset.]"
65135,best phone service company,"T-Mobile was great for me until a few months ago. All of a sudden there was no reception at my house. I'm pretty sure they lost a nearby tower and didn't cop to it. I spent a month working with them to ""troubleshoot the problem"". Having that happen during covid was extra frustrating. We had to change providers."
68983,best science fiction novel,"1. Spin by Robert Charles Wilson
2. We are Legion (We are Bob) by Dennis E. Taylor
3. The Hitchhikers Guide to the Galaxy by Douglas Adams's

To be fair I have at least 10 favorite books on my top 3 list."
21030,best workout music,yes but how to you refrain from destroying the entire gym ?
