idx,text,query
19028,Down the Rabbit Hole is an amazing series of videos about a wide variety of obscure topics. They all end up fascinating  me.,best YouTube video
8843,"Isn't this relevant to OP's question? Some whitening toothpastes actually do contain things that alter the color of your teeth. The fluoride in toothpaste is there to help your enamel, is it not? Wouldn't that make an actual difference between toothpastes, and give regular toothpaste a purpose?",best toothpaste
63638,"Getting Things Done, by David Allen.",best books for time management reddit
65626,"Can I shove it in hotspot and use like ATT iPad plan? Or did you use only in ipad/mobile maybe?

Thanks",best phone service company
8441,"I live in a developing country that doesn’t really sell Crest, and I don’t like Colgate at all, so I started buying the ClinPro from my dentist.  I love the flavor and the lack of a lasting taste in my mouth.  But it was expensive, about $12 a tube, and the tubes were kind of smaller than a US sized one.",best toothpaste
30581,"I have to say, living in a place that has its fair share of conspiracy theorists, I wouldn't actually take his word on it. From what you've said, I can interpret the economic partnership with Britain as a pretext to all of the scenarios you described.",best Mexican war to study
6535,Glad you liked. Most all of the the Documentary Now  episodes and their documentaries they parody are top notch imo. Not all are on Netflix but those that are make sure you watch.,best Netflix documentary
30510,A number of them who were US citizens and we’re taken POW late in the war were executed in a mass hanging timed to coincide with the raising of the US flag over Chapultepec palace.,best Mexican war to study
6104,the keepers and evil genius!,best Netflix documentary
51249,"Yes but Amazon is $20 vs direct from Spigen $45, I’d rather just buy Apple 20W and still save a couple bucks",best iphone case
1680,"Cookie Dough is my favorite now, but I can't disown Blue Moon because that's the stuff that got me through my childhood.",best ice cream flavor
38802,"I would have said Brave  but only if you like your computer to be highjacked for field trials.  


Bug, because that's just what it is, reported in March  
  
https://github.com/brave/brave-browser/issues/14640#issuecomment-961790800",best web browser
14535,She's the Queen of dirty talk,best romantic novel
60541,"11.22.63, on Hulu if I’m not mistaken, best series I’ve ever seen",Best comedy show on Netflix
31610,movenpick hotels in Europe and middle east.  As a bonus you get free movenpick ice cream.,best hotel to live in
1083,What is stracciatella?,best ice cream flavor
46391,"What my family has always done:


Give no more than 3 pieces to each kid.  If they are young they get more.  If they are really young then they only get one.  Kids that look to old get one piece and and criticized. 


edit: if they are dressed really cool the get more.


Put the candy in the bag, don't let them pick out of the bowl.


Candy sounds good.  250 pieces should be enough.


Just turn on the front lights. And have the door open.


5-8 should be fine


If you run out of candy: Set an empty bowl out side in front of the door and close it.  But keeps the lights on.  Lights off will make you look like someone who wasn't giving out candy at all.  (then hope.  TP isn't bad eggs are)",best trick or treating candy
20559,Well that was odd.,best workout music
7500,"Last question I swear. Would it ever be worth an addition $120 for this Lenovo IdeaPad 5? Same internals. (I can get this Lenovo for $680). Thanks so much for the response

https://www.lenovo.com/us/en/p/laptops/ideapad/ideapad-500/ideapad-5-(15%E2%80%9D,-amd)-laptop/82ln0008us",best laptop for general use
33001,"Best current: Monster Pacific Punch
     
Best ever: Pimp Juice
     
    
Worst current: Reign Strawberry Jalapeno
     
Worst ever: Monster White Dragon Tea",best energy drink
47638,"Smokey Mountains National Park! And if you visit them through Gatlinburg TN, they have a lot of super gimmickey tourist traps and shops. The Ripley Aquarium is cute. And Pigeon Forge has all the go karting, fair rides, laser tag, dinner shows, etc. that you can think of. And of course, the mecca of Tennessee..DOLLYWOOD",best state to visit in the United States
44353,"> Sometimes, it's the little things.

This is wisdom. Just having a pen I like writing with makes me happier.",best items under $100
18624,Nice hiss!,best YouTube video
31297,the ocean,best country to live in
16582,I'd recommend rats or guinea pigs.,best pet for toddlers
