idx,query,text
62684,Best RPG game on PS4,I remember playing it and blowing my mind when i was younger
72378,best keyboard switches,THERE IS NO BEST SWITCH ^^^navy
57190,best water brand,"pH is a scale that(typically) ranges from 1-14, from 1 to 6.99999... it is a measure of the concentration of hydrogen ions(H^(+)) (how acidic it is), from 7.000...01 to 14 it measures concentration of hydroxide ions(HO^(-))(how basic it is), and 7 is neutral(neither acidic nor basic, roughly where tap water is).  The scale itself is logarithmic (each increment of 1 is an increase of 10 times, i.e. a 6 is ten times more concentrated than 7, 5 is one hundred times more concentrated than 7, etc), and changes from measuring acidity to basity because when you mix an aqueous acidic solution with an aqueous basic solution the hydrogen ions bond with the hydroxide ions, forming H2O.  However, drinking water that is more than one step away from 7 can be dangerous, both because of how reactive acids and bases are, as well as toxicity from whatever substance is dissolved in it.

TL;DR: Yeah, pH does relate to waters purity.

Whether water is hard or soft refers to concentration of dissolved minerals, like limestone or calcium carbonate.  Water extracted from rivers or lakes *tends* to be softer than water extracted from aquifers, however local conditions can cause significant variation.  Hard water is more of an issue for maintenance of infrastructure and plumbing than a health issue, worst it will realistically do is dry out your hair or skin.

Aquifers are large underground volumes of water, typically found in formations of porous rock that are between layers of impermeable rock, as opposed to being underground lakes (though water can dissolve away enough rock to form them).  Springs are fed by aquifers, as they are often under pressure.  They are replenished chiefly by rainfall and snowmelt that percolates through the ground.  However, due to the fact that they're underground it can be difficult to protect them from pollution, and very difficult to clean up should they become polluted.  Additionally, many aquifers are being drawn at a rate that exceeds their rate of replenishment, meaning that unless aquifer water usage is decreased they'll run dry, which is bad for a multitude of reasons."
3350,best webcamera,Yup. Plus only spending $20 on a webcam and then $19 a month for stream labs is luckily my only expenses. So as long as I’m enjoying it even if people aren’t watching and it’s just my friends tuning in perfectly ok with that lol
18741,best YouTube video,**[The UK gets turned into a garbage dump and the rest of Europe floods]**
12926,best gifts for mom,To be able to sleep in. Nothing more. Nothing less.
59417,best perfume,The Fresh and Clean scent by VS Pink. I only use the lotion and get compliments every day!
72542,best keyboard switches,I had blues now I have MX speeds on the new K95.  Typing I prefer the speeds for gaming I can't tell much of a difference.  Sound I prefer the speeds.  Speeds sound closest to reds for reference.
67418,axios alternatives reddit,"Nah, it uses it under the hood."
1069,best ice cream flavor,mint chocolate chip
18338,best YouTube video,Oh shit. OH LAWD JEEZUS! JEEZUS!
56860,best desktop monitor,"LG 27GL850-B vs Gigabyte M27Q (or maybe something else?)

&#x200B;

Looking for monitor that will be little bit hybrid for PS5 gaming and connecting with gaming laptop etc.

Any advice?"
64364,best place to pirate mac apps reddit,mac users are so salty
60792,Best comedy show on Netflix,I had never seen him before this one. I'd like to see his older stuff though.
48502,best color to paint with,Oh cool! I hope someone replies with a name of it so I can test it out. I’ll search on the App Store though just in case. Thank you!
23766,best car racing video game,Assetto Corsa.
53037,best hiphop album,That 454 album is crazy good
6158,best Netflix documentary,Apparently the doc makes are huge dicks. They interviewed and videotaped a  wrestler or two who have huge collections of wrestling toys and the wrestlers opted not to let them use the footage. The guy is far to nice to directly call them out but definitely talked about parts during his and  others podcasts. Stuff like being disrespectful/damaging the toys and then asking to cut them out of the movie all together but use footage of their collection with out credit too...
56857,best desktop monitor,"Lenovo G27Q-20 or AOC Q27G2S?

Both are IPS, 1440p and 27”. Lenovo is 165hz while AOC is 155hz. Which one is better? Or any recommendations? My budget is within the price range of these monitors. Thanks"
2992,best webcamera,"Why don't they care? Because streaming isn't very good still! Why would you get a 4K webcam, streaming is still gonna look like shit unless you have a hella WiFi package."
25073,best spiderman actor,"Only Toby was able to keep people from killing themselves from that scene in Spider-Man 3, you know exactly which scene I'm talking about."
32292,best hotel to live in,"First week of university we had a mixer for our dorm for everyone to get to know each other, I ended up talking to a guy and he asked me if I liked to ride the white pony, in all seriousness I responded, ""I mean, I've ridden horses before but I don't remember if they were white or not."" Sketchy dude got freaked out and walked away. Thankfully a buddy I grew up with was there to explain that he was trying to sell me coke."
49411,best gaming monitor,[https://www.amazon.com/dp/B07MQBPMJ2?tag=pcpapi-20&linkCode=ogi&th=1&psc=1](https://www.amazon.com/dp/B07MQBPMJ2?tag=pcpapi-20&linkCode=ogi&th=1&psc=1) i just picked this one up this weekend. checks all  the boxes but for only $299. (plus a $10 display port cable but you may already have one lying around)
65030,best places to eat in Santa Barbara,Some people have a genetic issue which makes cilantro taste horrible.
13592,best research paper archive,We put all of the world’s science behind a paywall and we wonder why antivaxxers exist 🙄
