idx,query,text
35883,best alcoholic drink,">tonic water..... Loaded with HFCS

I have never been more crushed. And my lady friend recently left me and kept our kid."
51325,best iphone case,"Have you used these clear cases before? They tend to go yellow pretty fast

I think I will go for spigen liquid armour navy blue"
31045,best country to live in,"Any of the Nordic countries really. Northern Sweden, Norway and Finland may be too cold for you, but the southern parts and Denmark have mild, 4-season weather. In 2018, 26 of July's 31 days went above 25 degrees C (79 degrees F)  in Denmark.

If cycling is your thing I would seriously consider Denmark. More than 12,000 kms of bike  paths. 26% of all trips less than 5 kms are made on bikes.

37 hr work week.

Progressive country, social democratic government newly elected with plans to heavily turn up  environmental policies, and limit previous restrictions on skilled immigration.

Universal healthcare.

Unemployment about 5%, GDP per capita about 56k USD according to Eurostat. The economy is currently experiencing a ""balanced upswing"" for the 6th year in a row, accrding to the Danish central bank (March 2019)."
58388,best cologne,"old spice $ < Acqua Di Gio $

im poor so this is the only point that matters lol"
29720,best money managing app,"www.ynab.com

Best comprehensive budget app there is"
25755,best cricket teams of all time,It's the gold old British optimism coming out in that description.
36811,best alcoholic drink,vodka cranberry or a screwdriver
60757,Best comedy show on Netflix,Bill Burr and Tom Segura. All stand up specials available for both of these guys are great.
21702,best winnie the pooh comic,"I read that as ""Pooh IN an ASSHOLE"". shamefully clicked it anyway.."
9238,best toothpaste,i have NEVER heard of anything like this in my entire lifetime
59611,best perfume,"In no order -

-	Cowboy Grass (DS and Durga)
-	Rose Atlantic (DS and Durga)
-	Santal 33 (Le Labo)
-	Rose 31 (Le Labo)
-	Orange Blossom (Jo Malone)
-	Santal Blush (Tom Ford)
-	Vetiver and Golden Vanilla (Jo Malone)
-	Wood Sage and Sea Salt (Jo Malone)
-	~~Saks for Her (Bond No 9)~~ edit to swap this for Sacred Sandalwood (Aroma Sanctum) 
-	Tobacco Vanille (Tom Ford)

I will come back later when I have a bit more time to give some impressions based on other’s lists."
73252,best Linux distro,I started using Ubuntu for Radio Astronomy in my undergrad.
27679,best bollywood actor,Shabana Azmi
57101,best water brand,why is this not higher???
58454,best cologne,That is great stuff.
35655,best alcoholic drink,That sounds terrible
63417,best package manager ios 14 jailbreak reddit,thank you
11987,best gifts for dad,Shit when is Father's Day?
31670,best hotel to live in,does it get lonely? scary?freaky? do you ever miss home?
36476,best alcoholic drink,"Holy shit, drink it already."
69531,best major to study in college,The one you're selling.
188,best terminal file manager reddit,"`nnn` seems to be popular with the minimalists, but I prefer the expansive view and file previews of `ranger`. I haven't tried it, but I hear `mc` is the OG."
50551,best rap album,EL-P definitely deserves mentioning here.
56732,best desktop monitor,So I just bought an Asus VE247H from a Microcenter which is about 45 minutes from me. Box is unopened so I'm wondering if it is worth the drive to return it so I can buy this Acer IPS which looks amazing
2948,best webcamera,"When you're interviewing for remote jobs, I'd want the best camera and microphone possible to create a good impression for their subconscious biases."
