idx,text,query
18931,"Jokes on you, that link was already purple!",best YouTube video
44648,"> so I look homeless but I don't die when I'm outside in - 40.

This describes me so perfectly I should tattoo it",best items under $100
70612,Geology/ earth sciences (technically two separate majors) have like 20 undergrads total,best major to study in college
27789,Oats are a blank slate to add almost anything to!,best breakfast foods
54884,"We have well water, and it's been stinky lately, thanks for this. Would've never though about R.O.",best water filter
10126,"Not really. Yes. No.

With only HB pencils, you're going to suffer from a drawing that lacks dark shadows, and highlights are going to be washed out, because HBs put down value too quickly for the upper threshold of highlights.

However, if I was only allowed to have one pencil for a drawing, I'd probably choose an HB. They are pretty flexible.",best pencil for drawing
56684,Will be getting i5 8600k and the gtx 1180. Unlikely to buy anything until new gpus release.,best desktop monitor
64341,"Download from one of those sites, AdGuard premium, works like magic.",best place to pirate mac apps reddit
25876,"Some lightweights like Roberts, Garner, Marshall, Croft could roll their arms over a bit. 5-6 bouncers per over.",best cricket teams of all time
44309,"""I want something that says, 'I'm a dad who likes leather.'""",best items under $100
17346,"Ohh i didnt know of that one, my bad.
I thought dragon warrior was the same as dragon quest monsters. Thanks for the info.

I apologize for sounding ignorant",best iOS game
15546,"Okay, targeting a region will really be key, or rather, picking a crop you want to grow will tell you where to get land...

I am in the mesilla valley around the rio grande. Pecans are a HUGE crop in the valley. You have to wait 15 years for the trees to get to size and shape enough for the production to start. But still that 15 year point they are just cash falling off of trees basically. A low maintenance and lower chemical need crop compared to a lot of nuts.",best tree for the garden
22990,"""He hung out with all the guys who came to see him"" But did they see him?",best celebrity
53098,"Selling bowls was fine and dandy, but I prefer the white girl like the royal family",best hiphop album
28675,"Two somewhat contradictory answers-

1. Really, I think very few people actually have that for breakfast on a regular basis.  Cereal or toast is more typical.  Full breakfasts are for weekends, hangovers, special occasions etc.

2. UK is the [3rd most obese](http://www.nationmaster.com/graph/hea_obe-health-obesity) nation.

Edit: quite a few people are quibbling with this stat.  It was just the first result off google tbh.  Maybe we're not 3rd, maybe we're 4th, or 7th, not really important tbh, the relevant part was Britons are pretty fat already, in the grand scheme of things.",best breakfast foods
50751,"Not saying you’re bullshitting, but it’s crazy to me to think about. If we’re talking A L B U M S, in their E N T I R E T Y, I’ve maybe got 30 under my belt? Including all genres. Are you like a journalist or something?",best rap album
7065,Fuck me I just bought an  11 Pro and didn't even look at the 11. How much bigger are they? I went with the pro mainly because of the OLED and the camera for when I travel.,best iPhone
44695,Icebreaker Merino. You can often find them at 30% off.,best items under $100
35318,Mojito or White Russian.,best alcoholic drink
7055,"Smearing can be seen by reducing brightness and using a dark theme. Scrolling on Reddit right now clauses smearing. In sunlight it's fine 

Not a massive issue but it's not great.",best iPhone
66856,"SMS, Kostic, Jovic, Vlahovic, Tadic from the top of my head.",best soccer team in the world
25429,"Compton a bit of an odd-one out there. Can we put WG in instead? Partly for the memes, but a Test average of 32 for his day is ridiculous.",best cricket teams of all time
22757,Do you have any of the pictures? They sound great.,best celebrity
361,Emacs and dired,best terminal file manager reddit
12444,"I made her a tie blanket. (Most) women love blankets, and the fact that it’s home made makes it that much better. 

Also, an instant pot",best gifts for mom
