idx,text,query
56970,Is it bad I thought they were real brands until the last paragraph?,best water brand
67208,"Try PHIN. one of the lightest library in nodejs. I am using in two of my projects, even with Typescript and its going great.",axios alternatives reddit
13597,"/r/Scholar 

http://libgen.io/

https://sci-hub.tw/

Or just Google-fu (limit search results to PDF's, always check Google Scholar first to see if there is a PDF/full article link already available etc.)

And you can find most things.",best research paper archive
8113,Cheeseburger resale sounds hard.,best toothpaste
55950,"If I changed your mind, you'd be wrong.",best action and adventure movie
63954,yes audiobookbay is great but it's a bit lacking in the audible collection. it also relies on user-submitted torrents which are generally okay but a bit hit and miss. with the recent surge in seedboxes eventually it might be as reliable as website hosts,best place to pirate audiobooks reddit
44249,"While I agree with you, I once baked pork shoulder in a roasting pan with some root beer. So good..",best items under $100
61729,Divinity 2,Best RPG game on PS4
32899,Monster Assault.,best energy drink
54842,do you know what specific factors influence AC adsorption? what sorts of organics are likely to stick?,best water filter
55010,"My rule of thumb is that if you're asking that question, the answer is no.

If you've got enough years of experience and the right gear, you can, but it's one of those where going in without knowing what you're doing can kill you quite easily.",best places to hike in the east coast
6875,"If you tend to keep your phones for several years, the extra $200 is fine.",best iPhone
70223,"I think it's looking bleak now but it's already starting to rebound. They'll need many new pilots after so many retirements this past year. I think Alaska and JetBlue (could be very wrong) are already hiring.

In the distant future though? There is the potential for full automation but it's so far out I think we need not be too worried yet.

(I'm a mechanical engineer major looking to get my PPL eventually, and do aerospace engineering with a commercial plane manufacturer/airline)",best major to study in college
70980,"I’d agree with that, completely transforms the tenor of the movie",best movies with a cool twist
3208,"see this is the thing, i saw a youtube video razer kiyo vs c922hd pro ... basically 0 difference, c922hd pro quality etc was better... so just confusing ...

&#x200B;

what reviews? based on what parameter they claimed kiyo is better... i assume 0 facts, just someone said something. Yes it has a lightning but during the day its not needed that much and during the evening it wont help that much.",best webcamera
7898,The G7 variant is,best laptop for general use
66493,"oooo, did not get that, my bad bro",best soccer team in the world
30705,"because french, duh",best country to live in
13829,[Fire and Mello RNAi paper](http://www.nature.com/nature/journal/v391/n6669/full/391806a0.html)  Not only is the paper a pleasure to read its importance can't be understated.  They were awarded the Nobel Prize 8 years later and this paper has been cited approximately 2x per day since publication.,best research paper archive
17516,I think most botw comparisons are just skin deep. Genshin is nowhere near the depth of botw,best iOS game
9678,DONT LIVE IN SAN NIC,best dorm hall at UCSB
12619,They won't do it right,best gifts for mom
23648,OK thanks one more question is the replayability good in the game and how is the multiplayer?,best car racing video game
65511,Hickam - VZW or AT&T. T-Mobile and Sprint users have significantly less coverage throughout the islands.,best phone service company
12756,Thank you for sharing this.  I need to go talk to my 11-year-old now.,best gifts for mom
