idx,text
43298,"I think i understand what you mean. Given that most used in-app adservers are Mopub/Admob and they do not offer servicing, i thing you might need a specialized agency that performs both technical integration(of any of the adserver) as well as any kind of servicing you'd need (e.g. campaigns/inventory management). Honestly i dont know any specialized for in-app inventory, but if they sell you anything else then Mopub/Admob (and maybe a few exceptions for some formats, e.g. Fyber or Aerserv) - it would not be nice of them. 

Ah, somewhere in the middle between the 2 (adserver/servicing) might be Pubmatic (which also is a good name, more known in standard display)."
43299,"Yeah I’m super on the fence about going with a smaller / more unknown platform unless you really know what you are doing. In my experience most of what I have learned has come from talking to people within the community so the more you work with a partner that other app pubs or networks don’t have as much experience with you end up limiting yourself when dealing with an issue. 

Ultimately I worry that you would be limiting yourself from maximizing on revenue

But that’s my opinion so take it for what it’s worth"
43300,"The problem is we've been using our own home grown system since the company was conceived 10 years ago and if I go with one of the bigger players like GAM then my own internal ENG team will be relying on support forums and documentation when they need a real tech team to rely on. Please note we're not doing programmatic so if any answers have programmatic tied then that's not a factor for us. We are a consumer technology company with all native advertising, no IAB standard banner crap and all our buys are CPA based."
43301,Ah gotcha maybe talk to Adzerk? If you pm me I can intro you
43302,"Talk to [Airtory](https://airtory.com), GDN 3PAS Certified adserver, and they offer dedicated account managers, custom creative offerings, DIY Creative Builder, realtime reporting and an easy pay-per-use pricing. DM me your email and I can setup a call."
43303,"Use mediation and stop using Admob. I've written about MoPub mediation in one of my post so you can check it out and see for yourself. I'd say use Facebook audience network because they have pretty good support to help with your issues. And it's actual humans that reply. I've been using FAN from one year and I haven't seen any issues with it till now, and I'm not the top earner too."
43304,"u/AwkwardShake thank you so much, I will check it out"
43305,"Yes, FAN's support is really good."
43306,">Hi, I tried to integrate it into my app, my app is still under review, but when I test it, the ads showing normally? I don't understand, should I submit a new update to Google play or wait till FAN accept my app?  
>  
>Also I load the FAN ads onAdFailedToLoad Admob method, what do you think?

 

Hi, I tried to integrate it into my app, my app is still under review, but when I test it, the ads showing normally? I don't understand, should I submit a new update to Google play or wait till FAN accept my app?

Also, I load the FAN ads onAdFailedToLoad Admob method, what do you think?"
43307,"Don’t show real ads. Check how to enable test ads. You can enable test ads for your particular FB profile. 

Don’t fully rely on onAdFailedToLoad. Use remote config."
43308,The best alternative one is Facebook Audience Network.
43309,"Hi, I tried to integrate it into my app, my app is still under review, but when I test it, the ads showing normally? I don't understand, should I submit a new update to Google play or wait till FAN accept my app?  


Also I load the FAN ads onAdFailedToLoad Admob method, what do you think?"
43310,"Good alternative to Admob is Facebook audience network. Apart from facebook, thete is ad mediation library as well call mopub which is now owned by Twitter. You can give these a try"
43311,"u/NJOY_Tech so instead of using a lot of ad networks, I need to use the Mopub only for mediation ?, please correct me if I'm wrong"
43312,"Yes, you understanding is right. Ad mediation allows you to show ads from different sources. Although now a days, all major ads serving platforms supports mediation.

Check Mopub, iron source etc"
43313,"I'd look for sponsors and cut the middle man ad network or create a ""Advertise with us"" section that redirects to your website for marketers. Make sure you implement your own analytical tracking if you go with that route."
43314,"Try Appodeal, great network, high eCPM and waterfall / header biding solutions, meaning that you will have the most profitable ads among 30+ networks.  


Support is also super reactive and money is very easily manageable."
43315,"Thanks bro, I will lose my mind lmao, I've read some comment on Reddit talking about how bad Appodeal, and you recommended it to me, what should I do now?"
43316,"I guess everyone has a different feedback using all of those networks. However, if I was you, I would give it a try. You have a great number of impressions per day, Locations are great (USA has a high eCPM average) and in the worst case, if you are not satisfied, just wait for 50$ threshold then get the cash and that's it."
43317,What's wrong with admob?
43318,"u/creati8e For some reason, they stop serving ads on my account, it's been now a 19 days passed, when I got an email from AdMob telling me that my ads serving has been limited due to invalid traffic, although my apps published on Google play only, so the traffic is 100% organic"
43319,"Let me guess, you were also limited on June 18th?"
43320,"Yeah, June 18,2020, too many devs get the same email in the same day"
43321,"Yeah i wonder what actually happened. My fill rate is back again now, but still have the warning"
43322,"The warning will disappear soon (it takes 7 days), did you do something to solve your issue?"
43323,"No. 4 days after being limited, they allowed fill rate again, it lasted 3 days, then it stopped. Now is filling ads again since 2-3 days. I didn’t do anything, all happened automatically. Hope this time will stick and the warning will go away."
43324,"I've read about this, they test your traffic, unfortunately, since 18th, they didn't serve ads again even for test (like your case) :/ I think I need to give up of my account"
43325,My account is not limited anymore :)
43326,">limited

Congrats bro, unfortunately, the issue still present in my case"
43327,"I actually work for an AdMob alternative!

We're a pretty big publisher that started to offer our inhouse ad monetization SDK a year ago to certain devs. We use AdMob, FAN and about 30 other ad networks to optimize eCPM. If you are currently only using admob, I'm willing to bet you would see a pretty big uplift from a service like ours.

Feel free to pm me if you are interested in specifics: I could also recommend some alternatives"
43328,What’s your ad network company? Feel free to pm me
43329,"PMed! Mobile Gaming is a really small world, so I would rather not say here"
43330,"You can test:

inmobi

tapjoy

smaato

taptica

mobusi

appnext"
43331,I think the best alternative for AdMob to monetize your app is the Facebook audience network! AdMob are the worst when it comes to monetize traffic don't mention to use if you arent using it yet.
43332,May I know name of your app
43333,"I have same issue. No ads just state that admob is reviewing activity. They did this to me a year ago. I do not do anything shady, just make simple apps. There is no way to contact admob and find status either."
43334,"Very frustrating from this issue, I've always respected the AdMob policies, but they do such an Incomprehensible behavior, they did not even explain the problem to us, I don't understand why!!"
43335,"Ya, I just randomly get notices from time to time about ad type promoting inadvertant clicking. All my apps are the same design, but just randomly I will get these. I give a response back and it goes away."
43336,"**Before integrating Ad Mediation Networks, Read this.**

&#x200B;

I am an indie developer, I have an app in Play Store and App  Store, I have been living off of them from last 3 years. Recently, I  decided to use ad mediation on my Android app to increase ad revenue, so  I mentioned this to couple of my friends who works in app development  companies, one of those friends suggested me an ad mediation network,  which basically integrates their SDK as well as other ad networks SDKs  to your app (just like any ad mediation) and serve ads using their ad  units, not ours. But for admob, they use our app's ad units.

Anyway,  I integrated their SDKs, after that, I couldn't sign the app to publish  to store, it was showing 'GC overhead limit exceeded' or 'Out of  memory: Java heap space' error. None of the solutions from stackoverflow  worked, but I could be able to sign the app by disabling Progaurd. I  contacted this  company on their website chat service, they responded  promptly, asked few questions, later they asked me to send my app's  Gradle file and Proguard file, which i did, then they told me to do few  changes to Gradle & progaurd files, I obeyed. Still the error did  not go away, when I told this to them, they asked me to send my whole  project. I was very busy on that day because I wanted to update the app  on that day itself so I told them, I'll send it later. Then I updated  the app by sigining with proguard disabled.

In two days, our app  got over 100k impression but their ads are very intrusive and full  screen ads are unskippable , so I removed their SDK from the app and  updated the app only with Admob like it was before. After couple of  days, one of my ad units in Admob started showing more impressions than  usual, and impressions are increasing 20% each day but clicks were same  as before. So I suspected something unusual happening in my app, I  looked where my app getting more impressions, one day it was USA, next  day Hungary another day it was Brazil and so on. I disabled that  particular ad unit, then in next update, I replaced all the ad units  with new ones. Now ads are serving normally like it was.

I  looked up about the ad mediation company's social media profiles, they  are deleted. Also, I found out couple of their ex-employees shared how  this company cheating developers. My guess is, this Ad mediation company  knew my app's ADMob ad units, so they artificially (using bots?)  inflated ad impressions, when Google finds out ad impressions are fake  Google will ban apps/developer from ever using Admob.

This Ad  mediation company trying to ban me from AdMob using these tactics, so I  would go back to them again, at least I think that was this company's  intention. Also, they asked me for my app's source code, I don't know  what could they do with source code, considering they can't do anything  to my app's listing on Google play, but asking for source code is  unusual. So I think, this company try to scam me, at least that's what I  think though I do not have any proof to prove that, so I am not  mentioning that company's name.

I am just sharing this here so if  any one wants to try ad mediation, be careful and mostly stick to  reputed mediations like AdMob, MoPub etc"
43337,Scary man. Thanks a lot for sharing.
43339,"I do not have any solid proof , so I do not want to share the company name publicly. I'll PM you the company name"
43341,Mention the name publically? What's there to hide? They deserve the shame!
43342,I would have if I had proof. Without proof I do not want to shame anyone publicly.
43343,"I use MoPub and have had very good luck with them. I'm curious what ad networks people have had good luck with? I use MoPub, Admob, and Flurry mainly. I used to use Facebook and they did well as well. Amazon did well for banners and/or interstitials, can't remember which, but I've since moved to mostly natives and they don't have that."
43344,Ideally you should have >5 ad networks to maximize the bid.
43345,"I have had that in the past but it is really hard to manage if they don't have auto cpm and there are very few with auto cpm for natives. 

&#x200B;

I do have InMobi and Smaato as well but didn't mention them as they make a tiny fraction of what those other ones make."
43346,How many impressions do you show per month? I figure you have to be quite big to get amazon integrated
43347,"I actually used amazon a while back, didn't have anywhere near the volume I have now back then."
43348,"I am using admob along with Facebook Audience Network.

Works Fine"
43349,Did you try mopub? I have seen mopub giving higher cpm for other team in my organisation.
43350,Havent tried Mopub yet.Will have to try
43352,Mopub is a mediation from twitter just as admob is mediation from Google. You can add even admob network on mopub.
43353,How do you handle GDPR when using mediation with Facebook Audience Network?
43354,"I do around 100-200M impressions a month, I've tried every network under the sun. 

Here are the networks I avoid like the plaque (eCPM sucks with Volume)

- Facebook
- Applovin
- AdColony
- AppNext
- ChartBoost
- Tapjoy
- Vungle

Networks worth using

- Ogury Mediation
- Admob
- Unity Ads
- Iron Source"
43355,"Impressive. Can you share your app. 
Is ogury mediation is better than mopub?"
43356,"I don't share links anymore, there was a time I did and it brought a bunch of problems.

Yes ogury mediation is better, you need to disable the networks I listed though, those networks just want cheap traffic, they'll buy your USA traffic and pay you next to nothing for it, the other networks I listed pay good eCPM with volume, which is what you really want.

Ogury Mediation pays net-1 as well with a 2% fee and net-30 without fee, slightly steep but, cash flow is important."
43357,Oh sharing links can cause problems? Could you elaborate more? I was about to do after development of my app.
43358,"I would be cautious for sure, I've never shared them on reddit but I've shared with other developers who I thought were just wanting to casually look at the app but later I found out a few I shared links with were actually making many google accounts and 1 staring the app basically out of jealously and competition. 

The community on reddit seems decent though, but still, I would be careful who you share your app with, for all you know they could submit a fake DMCA or anything."
43359,I'm using adMob in my current apps from last 2-3 years & everything seems Fine till now.
43360,Did you try using mopub? In my last organisation one of the team has used it and the revenue has gown up by 30%.
43361,"Oh! Seriously. It sounds better, I'll try it."
43362,Try it and late me know. I just want to see everyone else observation from the post.
43363,"I've also heard about Facebook ads, but never tried it out. Did you?"
43364,But it will be configured in ad meditation right?
43365,"Yes, https://www.facebook.com/audiencenetwork/products/overview?utm_source=1H2019_AudienceNetworkSMB_Search&utm_medium=Search&utm_campaign=20190108_APAC_ENG_India_Brand_Beta_2018&utm_content=facebook_in_app&gclsrc=aw.ds&&gclid=CjwKCAjwg-DpBRBbEiwAEV1_-BsfSmCVfq3cNRu2vZUJwPXUUepNb9Jtcx_6Ob8iBmyoyF7-BMD-mBoCOCkQAvD_BwE"
43366,Thanks. Will check it out.
43367,Purple Brain (or Ogury with the new name). It is good.
43368,"I use Adaway for global, and lucky patcher for app specific. As a result j never have to deal with ads. YouTube is a different ballpark, for that I have to flash YouTube Vanced."
43369,"I think you've got the wrong idea, buddy."
43370,Sorry :/ I'm new here
43371,"All good! But hilariously, the discussion is around putting ads into android aps (and which ad 'providers' are best) rather than taking ads out of apps :D"
43372,"I would recommend Mopub's mediator.  They are not ban happy like admob is.  You can use many networks server to server or via html tags.

Other than performance, which varies for everyone, you also want to consider:  
1)payout delay  
2)payout minimum

Most of the following copied from me [here](http://www.reddit.com/r/androiddev/comments/1ijrjc/admob_account_suspended_for_no_apparent_reason/)

Tapit .. avoid. I finally got paid 5 months late after sending about 20 emails. net60/$100  
Jumptap.. not bad, but payout terms are net90/$100  
Hunt.. took 6 months to approve my account (They supposedly specialize in Latin America) Trying them out now, but can't find their payout terms anywhere.  (I've quit using them bc fill rate is terrible even if targeted)  
Mobfox.. not great, not bad. Just another basket to keep my eggs in. payout terms are net45/$50  
Mojivia.. Tried to register with them, but I used to use Mobclix, so I can't 'double register'  
Millinial Media.. decent. payout terms are net60/$15 after you reach an initial $50. requires native SDK which is somewhat large.  
Chartboost.. I think that they only have intersatials. I looked into setting them up awhile back, but it was really confusing, so I just gave up.  
Lifestreet.. starting using them awhile back and have been pretty impressed. Payout terms are net14/$10. They pay each week.. so you wait no more than 3 weeks.  
InMobi.. deplorable performance. Maybe it's just me. Edit: they have gotten better lately.  
Appbrain.. Requires SDK. They always pay me within 10 days of month's end.  
Applovin.. requires SDK. They were okay for awhile. Always paid about 2 weeks after months end (net15).  
Tap for Tap.. requires SDK, nothing special. They pay quick but not enough IMO.  
Leadbolt.. I'd say that this is my 2nd favorite behind LifeStreet. They always pay in the middle of the next month (net15). Please Consider using my [referral link](http://www.leadbolt.com/advertisers_signup.php?ref=10040531) if you sign up. To add them, just create a custom Mopub network and paste your tag from leadbolt in there. Leadbolt approval is automated and generally takes an hour (A bot checks the market for your app. Note that names must match. ""My Cool App"" != ""My cool app"")  
Smaato - Just started trying them because they have tags. net60 min $1  
Edit:formatting"
43373,"2 questions what do you mean by Net90/$100?  

I want to avoid ad networks with adultish kind of stuff, like Airpush with has some crappy adult chat app they advertise, does lifestreet have that?  I only ask about them since you liked them."
43374,"NetX/(Payout min)

NetX means they pay you X days after the end of the months that you reach the minimum.  For instance, if you break $100 in September, you would be paid early December. 
I used to get emails about adult ads, but haven’t in a long time.  I remember having to explicitly disable them with a few networks."
43375,"it varies from time to time i hear. i wouldn't really know, i concentrate on paid apps.

best source of info i think is this forum:

http://forums.makingmoneywithandroid.com/advertising-networks/"
43376,"**Note**: this website makes money from affiliate links to ad networks and probably some extra from ""other benefits"" from ad networks so I wouldn't trust 100% this data, but hey...it's better than nothing."
43377,"Don't get married to just one network, use a mediation layer instead."
43378,"Couldn't agree more.  
I'd like to add that it's not wise to use Admob's mediation.  Banned account = no mediator."
43379,using Admob as one of many networks in your mediation gets your admob account banned?
43380,"What I meant was the if you admob account is banned, and you are using their mediation for peace of mind, you are SOL.
  

Also, Admobs TOS states that a minimum percentage of fills must come from Admob if using their mediation service.  Of course, you will never know why your account is banned because they will not tell you."
43381,Mobfox pays you pennies
43382,They have been better lately.  At least for me.  I suspect they they used to suck for me bc I was using an old version pf Mopub
43383,"BTW, is there an ad network that specializes in China? My game has lots of users there for some reason."
43385,I've already gone with Lifestreet but I'll have a look.
43386,"I use admob, haven't had any problems in almost a year"
43387,"There is only one problem that people have with admob.  Everyone thinks that admob is great until it happens to them. [This](https://www.google.com/#bav=on.2,or.r_qf.&fp=cba72ab729d2fd6&q=admob+account+banned&safe=off)  No email, no recourse, no reason given.  Just STU, GTFO, and leave you money at the door.  

edit:typos"
43388,That's harsh...cold blade in your back when you least expect it from your partner.
43389,If you give us app names we will reveiw them if they are iOS
43390,Have you considered getting rid of all ads and monetize your audience differently?
43391,">Have you considered getting rid of all ads and monetize your audience differently?

Do you mean in-app purchase?"
43393,"Unfortunately, Google does not support this feature in my country, all I've to do to monetize my apps is Ads"
43394,"May I ask, which country is not supported by Google IAP?

 Do they support the Google Play store for downloading the app?"
43395,[https://support.google.com/googleplay/android-developer/answer/9306917?hl=en](https://support.google.com/googleplay/android-developer/answer/9306917?hl=en)
43396,"Wow that's great information, looks like about 10% of the Play Store countries don't support merchant operations.

I wonder what the percentages are in terms of populations and payment volume."
43397,"For quite a long time my country wasn't supported as well. I was offering in-app purchases via 3rd party e-commerce provider. Google did not complain about it. I kept this option even when Google Play Billing became available for developers from my country. Actually, I am still using it as the deadline for switching to Google Play Billing is September 30, 2021."
43398,DM me I have very valuable information abput Google..
43399,"You can try MoPub, AppNext, Appbrain but they are a lot worse than AdMob and FAN"
43400,MoPub mediation with AdMob/Ironsource/AppLovin/etc
43401,"Unity ads, appodeal. You could also try placing banners from affiliate programs if nothing works. Like fiverr or amazon. They pay based on CPA."
43402,I've used Appodeal in the past which is a bit better than plain Admob and about as easy to implement.
43403,"Thank you, what about the revenue, which is the best one?"
43404,Appodeal had better eCPMs for our app by about 30%
43405,appodeal are scammers dont use them at all
43406,How so? Which Mediation should i use?
43407,"|  AdMob start to place the ads limit in my account randomly   


It's a shame, did you get any response from them?"
43408,"No bro, I'm tired of this issue since June 2020, I've never promoted my apps, so all traffic is 100% organic, I tried to contact them, they replay with the same message :  


***Hello,***

&#x200B;

***Google is constantly investing in measures to protect and improve the experience for advertisers, publishers, and users of AdSense and AdMob.***

&#x200B;

***As we have been unable to verify the quality of your traffic, your ad serving is currently being limited. Your sites or apps may experience less demand from Google while we continue to evaluate your account compliance and traffic quality.***

&#x200B;

***We understand that you may want to know more about the activity we’ve detected, but in order to ensure we maintain a healthy ecosystem for all stakeholders we are unable to provide you with information about specific account activity.***

&#x200B;

***You can view details about this account level enforcement in your Policy center, and learn more about ad serving limits and what you can do to address them here.*** 

&#x200B;

***We encourage you to be proactive in making sure your account complies with the AdSense Program policies, as well as checking out our Help Center on Invalid Traffic to learn about how to prevent invalid traffic and improve your traffic quality.***

&#x200B;

***Best regards,***

&#x200B;

***Google AdMob Team***"
43409,"Wow! Thanks. It looks like a standard response.

You probably tried and did it, but let me ask - have you tried to add all your testing devices in AdMob?"
43410,"To be honest, no, when I want to test the ads, I use the ad unit from here :  
[Sample Ad units](https://developers.google.com/admob/android/test-ads#sample_ad_units)

Should I add my device to AdMob testing devices?"
43411,"Yes, add it all your test devices - it is a good practice because of Google Invalid Traffic. It can help you."
43412,"ADMOB is the best, don't waste your time"
43413,Best is AD FREE
43414,AdMob can provide fill rates but doesn't guarantee the highest CTRs. I'd recommend trying Admixer.Network. They offer a holistic monetization approach: at least 20% revenue growth through the optimization of fill rate & eCPM.
43415,"dont use appodeal , they are scammers , when you try to request payment they create a fake story to terminate your account dont use them at all"
43416,"Reddit, the best place on the world wide web."
43417,"If your problem is retention rate, finding a better ad network won’t do anything for you. You should be looking at why you can’t retain users in your app and keep them coming back, not find more users. Ads are not meant to retain users, it’s to gain new ones."
43418,"That's true, but targeting users is very important too.  If an Ad Network manages to show the Ads to the correct users you will have a better retention rate for sure."
43419,"Beyond promoting your app and getting the word out, how are you monetizing the users that you are getting?"
43420,my monetization is mostly earned from advertising revenue aka banner ads and interestials as well as rewarded video ads. I also have some apps with in-apps
43421,"Have you heard of Enhance? 
We support a wide range of networks and services and eliminate the need to integrate SDKs.[https://enhance.co/](https://enhance.co/?utm_source=Reddit&utm_medium=Online%20Forum&utm_campaign=2018%20Feb%20rozek_forum_post_signature&utm_content=Chris%20R)"
