idx,text
69607,"Depends on the person as to whether or not they can handle the stresses of being one. My mom is a registered nurse but her attitude is just so incompatible at dealing with injured people and she gets stressed so easily, she wasn't cut out for it in the end."
69608,"My mom stresses crazy easy as well, she doesn't handle trauma well, but discovered she could handle elderly care and peaceful death, so she's actually ended up a nursing home RN for about 10 years then a hospice RN the past 15. Although in my mind, it'd be a lot easier to deal with trauma than to literally dedicate your career to taking care of people who are actively dying, but she claims it's easier"
69609,"General Studies.


Just pick a major. Being undecided all 4 years won't look great on your first resume unless you leave undergrad with some amazing experience that translates into an immediate position."
69610,My associates is in general studies. I changed my major so many times that my advisor just pooled my credits together and told me to show up in may for graduation.
69611,"An associate's degree in general studies from a community college before transferring to a university is not a bad way to go, especially if you use a lot of AP and early enrollment credits from high school. It can save one a lot of money. They transfer really well to the state universities, actually having the associates degree (as opposed to just a bunch of credits) helps with making sure that all the credits are accepted as transfer. But doing it because of indecisiveness or to anything beyond an associate's degree is never a good move."
69612,In Oregon you can major in transferring at a community college.  It's basically a general studies degree but every public Oregon university has agreed that you don't need any 100 or 200 level classes if transfer with it.
69614,"""I'm going to be the first person to get a PhD in Undeclared"" - xkcd"
69615,"_Just put me down as Undecided, every major's terrible!_"
69616,I did this and oh my fucking god. I did eventually decide on a major but I'm going to school for a lot longer than I would have had to
69617,"Got my associates in General Studies, then got my Bachelors in American Studies. Changed my life ."
69618,"Foreign languages if you plan on moving to the country you are majoring in. At least double major so you can do something there. I can’t tell you how many people I knew majoring in French that wanted to move to France and work there.

I double majored and so far it has worked out for me, but not so much for the people who planned to move abroad with no other degree or plan."
69619,"I’m always amazed at students who are “In going to learn X language to go to Y country and work!” Cool man, how are you going to be competitive to native bilingual speakers with a degree in something else besides the native language?"
69620,Oh!  I know!  I'll teach English!
69621,"I was a history major, ‘‘twas fun but no money 

Now I’m a Zookeeping major 

Tons more fun and even less money"
69622,I'm just here to check if my major is listed.
69623,Me too! So far it's not.
69624,Biology here :/ mine is
69625,this is the most tense I've ever been scrolling through Reddit.
69626,"If you don't plan on getting at least a masters degree, avoid psychology. I've known several servers, bartenders, and receptionists that have their degree in psychology. Even a few that have ended up in retail. Not that I look down on those jobs, just that they clearly don't require a psychology degree. To get a job in the field you pretty much need to have a masters at least."
69627,Wish I could have figured this out when I was 18.
69631,"My degree was a Bachelor's in Psychology.  I started out in a financial aid position at a for-profit college, but I didn't know that much about for-profit schools at the time.  Did not like it at all.  There was high turnover and they advertised the position with little detail to begin with - so I sort of got into financial aid by accident, but I learned the system, which is fairly complex.  Now I work for a community college system, but it helped me to build the experience with FAFSA at the for-profit school first.  I really don't mind the job now. I am working in a situation where I am separated from the customer service aspect - there was a lot of conflict resolution when I worked directly in the school.    

What was your degree?"
69632,"Shit, I wish I could have figured out even more things at 32.  Am 45."
69633,"Agreed. Source: am bartender with psych degree, now looking at law school or grad school."
69634,"I went back for computer science for my master's. Highly recommend going back, also Protip: get a graduate assistantship. Most schools practically give them out to grad students and you either teach a 100 level course or do some menial labor for the school and get your tuition paid for AND a moderate stipend. You end up paying fees each semester which for me was about 2 grand a semester out of pocket but it's only 2-2.5 years vs 4 and if you work a second part time job and really cut expenses you can usually pay off everything without taking on more debt!"
69635,"Just piggy-backing off this. B.S. in Psych, worked retail for 3 years, then went back for my masters in Fall 2015. I got an assistantship which paid for 75% of my tuition and gave me a $200 a week stipend. I worked in the disability services office 20 hours a week and taught a section of the ""Welcome to College"" class to freshmen. Now I work full time in a disability services office at a different school and I adjunct teach for fun. Literally my assistantship is why I'm employable and I'm not even in that much debt from a 2 year grad program!"
69636,"Master's in psych here, this is a truth.  We hire a lot of psych BA-level people as care coordinators, but honestly, it's a crap job.  They get the hardest clients, the worst pay, and the least attractive tasks."
69637,"I think its one of those degrees you need to have a plan for. My bachelor's degree was in Behavioral Science (basically psychology). I joined the military (something I planned on when I started college) as a....behavioral scientist. Making officer pay. YMMV, I guess."
69638,Eh people just need to reframe their psych degree. I focused on consumer psych in school and now I have a really neat job in brand consulting.
69639,"Ditto.  I had in interest in I/O psych, now work in Corporate Learning & Development.

Can't just expect a B.s./B.a. to land you a job.  You have to focus it on some specific function."
69640,"It really depends on your school and how much work you're willing to put it. If you get research positions, that can easily translate into research jobs after graduation, without a master's degree. That's what my friend did. I also have my psych degree, and I work for a non-profit in my area of interest while preparing to go back for my masters. Many of my classmates went into marketing and consulting (we went to a very business-minded school). So it really depends. I'm honestly so sick of this stereotype. My psych classmates have all been very successful so far, some advancing their degrees, some not.

Edit: Psych is also a huge field. Figuring out what area you want to work/specialize in will help you be successful."
69641,Art History.  My current roommate (out of college now) was an art history major.  She doesn't do any art herself.  Just really likes art.  Spends a lot of her weekends going to museums and galleries.  Can't find a job in what she wants to do.  Has an entry level position as an office administrator and she hates it.  Can't really move up much in her company because she doesn't have the knowledge of the industry shes in.  She went to a private university for it and will be paying off loans for a longgg time.
69642,"It's such a shame that this is the reality, because if I could have majored in anything without worrying about money it would have definitely been Art History. I managed to get a few classes in while I was in college and they were definitely my favorite."
69644,"A close friend of my mom has a daughter with two masters degrees, Art History and Art Education. The best she could find in art was giving kids tours one day per week. It was unfortunate :/"
69646,I’m happy to help!
69647,"Unless you're 10000000% certain you're going to be a priest/preacher/rabbi/imam/ whatever, don't waste your time getting a degree in theology/religion/etc..."
69649,"""Please, call me Dr. Jesus."""
69650,*Dr. Christ
69652,Jesus Bourne it's Jason Christ
69653,"You actually have to have a Masters to be a priest, and seminary (priest school) usually takes 6-8 years. If you go to seminary straight out of high school, you go to what's called minor seminary for about 4 years and get your BA in philosophy. Then you go to major seminary for 3-4 years (4-6 if you already have your BA) and get your Masters. Your Masters is in Theology/Divinity and you have a concentration in a variety of fields such as Scripture, Church History, Systematic Theology, Moral Theology, etc.

Bishops and Cardinals pretty much all have doctorates. Some priests also have them, and the ones that do are likely to become bishops at some point.

Source: am Catholic, discerned the priesthood, and have friends who are priests."
69654,"Was your seminary free or less expensive than your average college? I just imagine that student loans would take a long, long time for a priest to pay off."
69655,"I ultimately didn't end up going to seminary, but seminary studies are typically covered by the diocese (a bishop has to sign off before you enter the seminary). Costs are about equal to the average tuition for any other private U.S. college, but you only have to pay for it if you end up deciding not to be a priest. You also have to be debt free in most cases before you enter the seminary"
69656,"similarly jesuit and benedictine monastic orders (maybe others, but IDK) require an undergrad degree to join, and a grad degree to become a father."
69657,"Jesuits are legitimately some of the most intelligent people I’ve ever met, as a general rule."
69658,"Back in the early 19th century, people were scared that the Jesuits were so smart and powerful that they'd wind up taking over the world."
69659,I've met with a Jesuit Priest somewhat regularly for the last few months (I am not catholic) and every conversation has resulted with me walking away with a shifted perspective on things.
69660,"I think education is one of the core values of Jesuits. That's why so many private schools (Dominican University of California, University of San Francisco, Boston College, Claremont McKenna for example) are Jesuit in nature, because they founded them!"
69661,"You're not wrong. A major source of inspiration in my life is a Jesuit priest who claims he speaks, no kidding >6 languages, including Arabic, Hebrew, Greek etc. It's been ages, he's helping out in Syria right now, practicing what he preaches."
69662,"I'm surprised *and* impressed. My old church requires zero training at all for any of the leadership positions, which I think is really detrimental to the congregations. For example, how good do you think an engineer is going to be at marriage counseling without any formal training whatsoever? Or a car salesman?"
69663,">marriage counseling

>car salesman

Well, at least he'd be pretty good at getting you into a newer model."
69664,Or an old broken down model made good enough to get you off the lot
69665,As a Christian in a denomination that values education: I now refuse to attend churches where the head leadership people don't have at least a bachelors. I grew up in churches full of uneducated people in positions of power. It's as ugly as you'd expect it to be.
69666,"I'd love to hear some stories like that, if there's anything to say other than 'No one knew what they were doing and everything sucked.'"
69667,"Just a lot of spiritual abuse, bullying, ignorance, inaccurate theology. Many whom acted more as mouthpieces for Fox News than anything that's actually in the Bible. I didn't realize how bad most of this was until I began attending my (Christian) college, where my classes were taught by world-renown biblical scholars."
69668,"Most Bishops actually get doctorates, Cardinal is just another honor that only allows them to vote on the Pope along with a few different responsibilities. 

And most priests get a degree in philosophy, it makes there be fewer classes in Seminary."
69669,"It's in part an effect of the Protestant Reformation. At the time, a lot of people opposed to the Catholic church complained that ministers were not educated: barely knowing latin, not being educated in theology, some of them not even having actually read the Bible. They felt that those qualities made it so that they just did whatever more educated higher ups in the church told them to and didn't offer true religious services. Once the Reformation got going and the Catholic church figured out that there were significant problems, the Catholic counter-reformation took measures to correct them with things like establishing more seminaries and making it so that some random guy couldn't be ordained in an afternoon and making it so that priests became some of the most educated people in Europe at the time."
69670,Many of the oldest universities in Europe began as monasteries.
69671,"As a dude who has a BA in theology, I 1000000% agree with this. 

I was studying to be a catholic priest. Left seminary, but continued with my undergrad theology degree. I don't want to teach high school. I don't want to go on to get a masters and PhD so I'm not going to be a professor. I absolutely hate the way catholic youth ministry is run so I'm not going to do that. Those are my options. Fuck em all. I now teach gymnastics to preschoolers and assist with the team coaches for the older kids."
69672,Lesson Learned: You don't need to be a priest to get close to kids.
69673,Woooow
69675,"kinesiology is popular but has a very very very limited job pool, atleast where I live."
69676,"Kinesiology, for the most part, does a good job of preparing you for graduate school/med school/PT school etc. The problem is that only a small percentage of grads end up getting into those grad programs and a BS alone won't get you far unless your goal is to work in the fitness industry or as a PE teacher. 

What your area of study is in also matters. Biomechanics and motor behavior are probably the most lucrative in terms of careers since there's so much application to rehabilitation, device design, robotics, etc. Exercise physiology and the like not so much."
69677,"Be careful when studying music. Most universities offer Music Performance and Music Education. Getting a bacehlor's in Music Education means you're certified to teach at a school, and therefore has more potential of getting you a job. Music Performance just means you got really good at playing your instrument. You still have job options, such as giving lessons, starting your own studio, joining a professional symphony, or just being a freelance musician. But those all have varying levels of difficulty and instability. For example, to get into a symphony, you have to be the best of the best (at least for top-tier symphonies). So your probability of being hired depends solely on your audition. And to be a freelance musician means that there may be periods where you're unemployed. And even when you are hired by someone, you will go most of the time without insurance or a retirement fund. 

And then you have to factor in the location you're in. If you're in an area that's musically dry, you won't be finding any paying gigs unless you're a teacher. There may be plenty of people wanting your services, like churches, community bands, and musical pit orchestras, but you probably won't get paid."
69678,"Non-Accredited Majors.

Even if it sounds like a good degree, Mechanical Engineering for example.  It might not be accredited meaning it doesn't hold anywhere near the value.

Edit:  I only used Mechanical Engineering as an example.  This is normallt an issue with university programs that are new which means their program normally wouldn't have accreditation (it is in application process).  It is quite the gamble when you are a new student because if they do not get accreditation by the time you graduate you are SOL."
69683,"This might be a dumb question, but how do I know definitively whether a major is non-accredited or not?"
69684,"Ask the school. If they are ABET accredited they will have no trouble showing it off, you should get a very firm ""yes, we are ABET accredited"" type of response. If the answer is wishy-washy and they seem to be dodging the question, they likely aren't."
69685,It's buyer beware.  Need to research.  Programs with accreditation are very open about it.  Programs not tend to hide it.
69686,"It's weird to see this concept as an European mechie, but we have a different problem with mech engineering as such. Picking a wrong specialization results in less job opportunities than literature graduates."
69687,"Major in something practical, minor in something ""fun""."
69688,"Major in what will make you money, minor in what you love

That's what my dad always taught me."
69689,"Agreed. This is actually one of the best plans.

Source: Majored in finance, am banker. Minored in Philosophy."
69690,"My daughter did that: chemistry and philosophy. But then she went to law school, and it turns out that philosophy is great preparation for law school, with courses like logic and ethics.

She's now a patent attorney (the science degree is necessary to get hired) and she's doing very well."
69691,"I double majored in criminal justice and philosophy. I wanted to go to law school, so I figured CJ would be good for that, and I thought philosophy was fun. 

Turns out CJ was pointless for law school, and philosophy turned out to be great for preparing for it. The majority of the LSAT is straight up logic. Guess what you learn in philosophy? Logic."
69692,"I can't count the number of CJ majors I know who burned out of law school.

Honestly, if law school's your goal, 1) God help you, and 2) Pick something that's applicable elsewhere and minor in philosophy, especially logic and reasoning courses. Also pick up some political science so you at least understand how laws are made."
69695,"Don't worry, they'll tell you."
69696,Elaborate? Is this something to avoid or something to pursue?
69697,"Pursue, I'd assume. Your major matters much much more than a minor when it comes to employment. If you can find something you enjoy through a minor in college then that's great. 

My brother for example majored in Comp Sci but did a minor in Music Technology. Semi related, but he's working cyber security for a bank now not a music tech thing lol. He just always enjoyed audio engineering and stuff so he decided to add a minor for that for fun. If you're gonna pay a shit ton of money for a school then you might as well add something you enjoy."
69698,"I mean, ideally you'd be majoring in something you enjoy doing too."
69699,"It's what I did - worked well. I majored in Finance and minored in Poetry. They don't go together but it kept the creative part of my mind stimulated, and I've actually found it useful in my career as I often write presentations/policy that benefit from the composition aspect."
69700,I never ctrl-F'ed so hard in my life.
69701,Don't have to ctrl-F when my major Is the top comment 😭😭
69702,Don't have to ctrl-F when I don't have a major 😂👌
69703,"Biology, unless you want to go to med/pharm/vet school or graduate school. A BS in Biology won't get you very far and you'll max out in earning potential early on. A lot of bio majors go back for their MS or PhD because they're stuck at a low pay scale.  If you already know that's what you want to do, you're fine. Make sure you do a BS and not a BA though."
69704,"I'm starting to think that most degrees are like this now.  It's like a bachelor's is the new HS diploma. So many people have bachelor's degrees these days, that they're not worth what they used to be."
69705,"Yup! Has to be job specific now.  Just a degree doesn't get you anywhere... maybe 30 years ago it would've. If I had to do it over, I would spend 4 years at a junior college taking everything they offered until I was sure what industry or field truly interested me."
69706,"> because they're stuck at a low pay scale

If they want to work on the technical side, yes. The business side (Sales, project/product management, field applications, etc for biotech and pharma) want people with biology-related degrees and experience, and they do quite well for themselves compared to a research associate"
69708,Yuuuuup. The S part of STEM is a pretty big trap nowadays...
69710,"I think a lot of students get ""stuck"" in bio because they started off as premed, got a C in chemistry, realized they aren't competitive for med school, but they're 2 years in and don't want to switch majors because they already have so many bio classes completed. I'm teaching intro bio and 90% of my students are pre-med. Maybe  1/5 of them will get into med school? :("
69711,Such is life.
69712,"In my first year in science (In my school science majors aren't chosen until your second year really so it was all students) the assistant dean asked the entire year to raise their hands if they were trying to get into med school. Literally 4/5 of everyone did it in a like 300 person room. He then told us that historically, one or two of us would actually get in."
69713,"Chemists are not in high demand, I know many BS Chem students who are stuck in the same rut as bio bachelors."
69714,"I haven't seen it posted but I'm curious, is an Environmental Science degree worth anything? It's what I'm going for and I was looking at getting a job working in national forests."
69715,">I haven't seen it posted but I'm curious, is an Environmental Science degree worth anything? It's what I'm going for and I was looking at getting a job working in national forests. 

Environmental science is a big field which can be a double-edged sword. People with more specific degrees in things like forestry, hydrology, or fish&wildlife or will beat you out for jobs unless your summer jobs / internships are more directly related to forestry.

Of course, getting a more generalized degree can be a good thing because it gives you more flexibility if you decide to do something other than foresty.

I I think it's a great degree, it just requires a little planning ahead."
69716,"Don't do something you dislike because you think it's a good career path. Work is going to be a major part of your life, so aiming for something that you can't stand doing is a bad idea."
69717,"I’m fighting with that, sort of. I decided to major in something I love, but I hate it now because it’s becoming a career instead of a hobby. The career I want is generally lower pay, but I’d rather major in that because I’d actually be happy."
69718,"An uncle of mine made loads of money, but that meant little because he hated his job so much he eventually committed suicide."
69719,That’s gonna be the tl;dr of my life.
69720,Same minus the loads of money part
69721,"I don't read this sort of advice as ""do something you hate"", but avoid the *trap* of major in some subject just because you like it.  That's fantastically bad advice for a whole host of reasons 

* low skill level.  I have an interest in chemistry.  I'm not that good at it.  Me taking out huge loans to major in chemistry is going nowhere.

* low demand for that skill.  For example, very few people hire philosophers, so you can get really good at that, and still not have the job later.  

* need for a particular set of soft skills to really be successful.  You can't be a good salesman if you aren't outgoing and charismatic.  It just doesn't happen.  You can't be a good accountant if you aren't extremely detailed.  You can't be a good artist if you lack entrepreneurial skills (because your work is its own small business).  

* the job might require sacrifices that you can't afford to make.  The high end jobs are mostly in coastal cities.  If you can't or won't move there, you might as well forget about it.  Google isn't going to have you telecommute from rural Alabama.  And some jobs require huge commitment-- 80 hour weeks, being on call, etc.  if you don't want that, you can't be in that industry.  

* the environment might not be good.  You can't expect to work the trades without lifting heavy things and working outside.  You can't expect to spend lots of time outdoors if you're a secretary.  You can't expect alone time in retail, or lots of socializing in forestry."
69722,"My last job was at a gas station chain, and I met at least 3 hourly gas station managers who had biology *masters* degrees. Blew my mind that they were attempting to pay down $120K worth of loans on $20/hr."
69724,Everyone i know with a bio or biochem masters is employed in research or by private firms. Wtf were your coworkers doing
69726,Criminal Justice. It seems to be the new default major for people who don't actually know what they want to do now that Psychology is out of vogue.
69727,"I work at a courthouse, and I never graduated college. Most of the new people are trying to get in with criminal justice degrees because it will look good on their resume, and there are a TON of people applying with that major. Very competitive."
69728,"I've heard the same thing from people in government agencies. A *ton* of people think ""I want to be in the FBI, so I'll major in criminal studies!"" Sounds fairly straightforward. But the problem is that you're now competing with everyone in the country with the exact same thought process."
