idx,text
62443,70h? You mustve really rushed it. Im like halfway through the game and im at 75h. Im taking the time to max out all my confidants and level up
62444,Do you have to play the other ones to know what’s going on?
62446,"Witcher 3 if you haven't played that yet

Fallout 4 was decent in my opinion

Diablo 3

Final Fantasy XV"
62447,"I have played The Witcher 3 actually, got about 30% in and got really really stuck. But could pick it up where I left off.

I have Fallout 4 also. :)

Not tried Diablo games.

Can you just jump on the band wagon so far into FF? Haha"
62448,"You should give Witcher 3 another shot, great game

Diablo 3 is a must play dude. Get it. NOW!

Each final fantasy game is its own story. They are not connected at all. So yes you can just buy FF15 and play it. Highly recommended."
62449,"I’ve just looked at Diablo 3, and I’m not too keen on them types of RPG, prefer the Witcher style. 

Would you say FF15 is closer to the Witcher style, or Diablo style? 

Also, people say ‘pre FF13’ - why? Is there a change"
62450,"The FF games from PS1-2 (FF7, 8, 9, 10, 12) were all turn-based. 11 and 14 are MMO's. 

15 has more of an active, action-rpg style combat, which some old-school FF fans didn't enjoy as much. I thought it was really good though. Take a look at both - you may enjoy the old-school style ones though; PS4 has a bunch of them remastered."
62451,"FF15 is more like The Witcher than Diablo 3

Just look at some gameplay

https://www.youtube.com/watch?v=fGdPVsTliT8"
62452,"Yes Witcher 3 is the best RPG right now (for me), i got stuck at my first playtrough at 30 % too. But you have to continue the game, unfortunately its a bit boring at some parts around 30% but it will get better"
62453,"Each FF is it's own thing.  FFXV is okay.  There are parts I really liked (surprisingly the characters and setting).  There are parts I didn't like (the last half of the game was very rushed feeling, and a lot of the story is behind DLC paywalls).  Some of the previous FF games are on PS4 and I would recommend them over XV (FFVII, FFIX, FFX, and eventually FFVIII).  FFVI is also one of the best in the series, but isn't on PS4 as far as I know."
62454,"If you got stuck playing the Witcher games, just ignore all the question marks on the map. Most of them are pointless, repetitive slogs.

You can play the game through doing only the main storyline quests with absolutely no issue. Personally I would also do the monster bounties because they are fun and provide some varied gameplay.

I'd also suggest choosing one of the Witcher armor sets ([bear, cat, griffin, and wolf](https://witcher.fandom.com/wiki/The_Witcher_3_witcher_gear)) and doing the quests to get and upgrade that."
62455,Nice one thanks.. think I’m going to pick it up again on way home.. second hand hopefully
62456,"Diablo 3 is shit. It's not an rpg, it's a hack and slash. If you want character, story, immersion then Witcher, Skyrim, fallout etc do a great job. D3 is just wave after wave of bad guys with weak plot points to send you somewhere else. 

The first Diablo was great, it's been downhill since for the franchise."
62457,The first game was good.  The 2nd was great.  The 3rd was just okay.  I really hated what they did to the skill trees.  I also felt like the story/environments just weren't as good as the first two.
62458,"Diablo 3 is the result of blizzard having MMO-mania and forgetting what made 1 & 2 so good. They failed, had to basically relaunch the game, and figured out how to make it fun."
62459,It bills itself as an action rpg but they forgot about the rp bit.
62460,It is not shit and it is a type of rpg. The genre is pretty diverse actually. A game does not have to be like W3 or Skyrim to be an rpg.
62461,"I just dl’ed Persona 5; I admit I haven’t played it yet, but given the amount of extremely good reviews, the fact it has a ton of gameplay hours involved, and it’s around $15 for a couple more days, I couldn’t pass it up."
62463,"Even more stoked to play it.  I bought it and haven’t been able to start it yet, and I’m out of town for a few days - so it’ll be waiting for me when I get back!"
62464,I just bought. It is absolutely amazing. Im 75h in and still loving it
62465,played it for around 150 hours and still enjoy it lol. have fun bro
62466,"I got it on sale last year, and was about 80% sure I would hate it and quit playing. Turn based combat has never really been my thing and I generally don't go for japanese-style games. I was wrong. I don't even know why I loved that game, but I'm so glad i gave it a shot."
62467,"It is a really great game.  It takes a bit to really grab some players, so don't give up on it too early.  I was hooked in the first hour, but others say it takes a while."
62468,This is the best JRPG answer hands down
62469,"No particular order but these are the best ones imo

* Divinity Original sin 1/2 

* Persona 5

* God of war

* Horizon zero dawn

* The Witcher 3 

* Any Final fantasy game 

* Nier automata 

* Skyrim/fallout 

* Assassins creed Origins/Odyssey"
62470,If you're recommending action RPGs I feel like ~~yee-haw simulator 2018~~ Red Dead 2 deserves a mention as well
62471,"God of war...an RPG? It's a great game for sure, but not an RPG"
62472,"It certainly leans more action than RPG, but it does have a ton of equipment/skills to craft/collect/upgrade."
62473,"That doesn't make it an RPG. Just ""RPG elements"" which sadly is all that's required these days :( RPGs need branching paths, dialogue trees, persuasion, multiple ways to solve problems. God of War and Horizon aren't RPGs at all imo."
62474,"Neither is AC: Odyssey, but that was the game OP was referencing so that is why so many recommendations are lax on the ""RPG"" requirement."
62475,"I would argue that AC Odyssey is more of an RPG than AC Origins though. Odyssey has different dialog options, lots of upgradable loot, skill trees, optional side quests and you can totally finish missions in different ways. I agree it's all very light, but in that way it's not that different from the Witcher which Ubisoft clearly tries to mimic with the new AC games."
62476,">  RPGs need branching paths, dialogue trees, persuasion, multiple ways to solve problems

I'll have to disagree with that. What about the RPGs that don't have these things? Like all the Final Fantasy games, Dragon Quest, Soulsborne, etc...? What do you consider those games?"
62477,"Action adventure with RPG elements.

The main thing you do in From Software games is explore and fight. They have a lot of RPG elements but I don't consider them full on RPG."
62478,"I'd say more like action-RPG. The RPG elements are rather important and core to the gameplay. It's like the main factor. It is heavy stat-oriented and you can customize your character in many ways. 

I'd consider games like Horizon Zero Dawn and AC Odyssey Action-Adventures with RPG mechanics since they have some RPG mechanics but it's pretty barebones. While Dark Souls's RPG mechanic is much more heavy and prominent.

What are games like Final Fantasy and Dragon Quest?"
62479,I agree. Monster Hunter World won best RPG last though so I don’t think RPG really means anything anymore to most people.
62480,"Progression has a lot of RPG in it where you get to build your skills and loadouts, including emphasizing different things like speed or strength or boy. 

The story is not choice-driven though, though there are side quests and things that are optional. 

That being said, it's a fantastic game that everyone should play."
62481,GoW is an rpg as much as witcher 3 is lol
62482,God of War isn't an RPG. Horizon barely is either.
62483,The Witcher 3. Imo the best story. The world is also gorgeous. The controls might feel a little wonky for some but I didn't think they were bad at all.
62484,"I got to say I bought the Witcher 3 as soon as I got my ps4 and I was lost AF.  My first console since 2005ish.  I got bored a few weeks ago and went looking through my library instead of spending more money found Witcher and fired it up.  I've been having a blast ever since and I'm 50 hours in.

Might want to give it a nod."
62485,"If you like ac Odyssey and the Witcher you'll like horizon zero dawn.

It's an amazingly beautiful game, and well thought out.

Also where are you stuck in the Witcher?"
62486,I liked AC Odyssey and The Witcher 3 but thought Horizon was a bit shit.
62488,"Lots of running across a world that felt dead and I didn't enjoy the combat.

The robots were cool to look at though and the story was ok despite the robotic camerawork/animations during the cutscenes with dialogue options, shame that the dialogue options were completely pointless too."
62489,It was a while back now but vaguely remember some witches and a cave possibly. I’ll buy it second hand and it should pick up where I left off
62490,"You definitely should! If you're stuck there try doing some other stuff first around the area, collect the right potions to put on your sword! That really does the trick most of the times!"
62491,"I think I snookered myself, ended up in a place where I needed some oil for my sword, didn’t have it, or the money to get it. Have you ever found yourself in a position like that on it?"
62492,"Yes! It's very annoying, I think I just ran for it, and came back at a later time. It was the werewolf quest for me"
62493,"RPG is a broad definition these days, is it third person open world games that you're looking for or any type of RPG?

I'd recommend all the Final Fantasy games pre-13 that you can buy on PS4. (FF8 coming soon)"
62494,"Well I’ve just looked at Diablo 3 on YouTube, I don’t like them types of RPG, prefer the Witcher type"
62495,"What left-ball-sack said. Skyrim, I don't know. I liked it when it was relatively new and I hadn't played many other games, but it's not that amazing. RPG is a broad spectrum of games, though. If you ejoy the process of looting and leveling, give Dark Souls a go. I thought I wouldn't like it, and I think most dark souls players thought the same thing, but it's a masterpiece. If not that, then Horizon Zero Dawn for sure."
62496,Which dark souls? Or any of them?
62497,"That's a bit tough. DS 2 gets a bad rap by hardcore fans, but it's still a worthy entry if you fall in love with the other two. DS3 is really great, and the most polished. DS1 is a masterpiece in it's own right with plenty of brilliant ambition, but you can tell it's a bit older and made by a team still figuring some things out a bit. I go back and forth between recommending 3 first and recommending 1 first. If you enjoy it, Bloodborne is also fantastic (some say the single greatest PS4 game in existence), and there's a whole subgenre that's grown out of Dark souls (the souls-like genre) that also would include nioh and a few other titles. I liked the surge, lords of the fallen is a total souls clone, but somehow fails completely. Surge 2 is coming out in september along with code vein, which is also souls-like. I personally consider sekiro to be souls-like, although it's definitely a brand new path for From Software as well."
62498,If you've not played it then Skyrim or Dark Souls
62499,Witcher 3 and Divinity Original Sin (1&2). Persona 5 if you are into Japanese RPGs
62501,Kingdom Hearts I haven’t seen mentioned
62502,"It gets a lot of flak, but I really like Dragon Age Inquisition."
62503,Ys Lacrimosa of Dana
62504,Persona 5.
62505,Final Fantasy 10 remaster
62506,Shadows: Awakening. It was a fun rpg. The gameplay mechanics were pretty unique.
62507,For the King is a fun little (co-op) RPG that is suprisingly deep.
62508,"First, I wouldn't call Assassin's Creed an RPG, unless you really twist the genre.

That said, here are the titles I recommend:

* MMO:
   * Final Fantasy XIV
* Offline, GCD-based:
   * Final Fantasy XII: The Zodiac Age
   * The Witcher III: Wild Hunt Complete Edition
* Offline, turn-based:
   * Child of Light
   * Dragon Quest XI: Echoes of an Elusive Age
   * Final Fantasy X
   * I Am Setsuna
   * The Legend of Heroes: Trails of Cold Steel I & II (don't play or even buy II until after you've finished I)
   * Persona 5"
62509,"AC Odyssey is a joke. For RPG, try

* Skyrim SE
* Witcher 3
* Persona 5
* Fallout 4
* Divinity Original Sin 2
* Kingdom Come Deliverance
* Greedfall (out in Sept)
* Outer Worlds (out in Oct)"
62510,You’re definitely the first person to say anything bad about Odyssey
62511,"Now this is just my opinion. I was fairly excited to play it when I got it about 2 months ago. Played all the ACs up until unity, and none after. I heard they were like RPGs now and what not. 

Turns out Odyssey was just an unnecessarily large world with some of the worst copy/paste content I've ever seen. Great graphics and combat, but that's about it. Missions are just as bad, story is just as bad, now there's a tiered loot system, mtxs, on and on. 

Again, the world looks beautiful and the combat is nice. But good lord is that game way too repetitive. I'm about 60 hours in and I've given up."
62512,No he's not. It's watered down typical Ubisoft shit where all the quests are the exact same.
62513,"I would say Odyssey is a pretty good game, but I wouldn't classify it as a full on RPG. It's more of an action game, with some light RPG elements (dialogue choices that don't change much, some gear/weapons to swap, skill tree, etc.)

People have all kinds of different definitions of what an RPG is; I think the previous guy was saying he didn't consider it an RPG. Good game, just not a traditional RPG like some others."
62514,How dare you leave out Bloodborne and Dark Souls 3.
62515,"As others have said, Witcher 3 is a great game at a good price right now with the DLC"
62538,Witcher 3
62517,"- The Witcher 3 (Full fledged, huge open world, high fantasy RPG)
- Nier Automata (Action-JRPG, with some of the most unique characters and writing you could hope for. Also, amazing music) 
- Horizon Zero Dawn (Great world and combat, light on the RPG elements) 
- Dragon Quest XI (Tradition style JRPG that feels like it was plucked out of an NES and rebuilt to be beautiful on the PS4)
- Final Fantasy XV (Action-JRPG with a cool road trip vibe that's unique in gaming. Not the best story of the franchise but absolutely worth a playthrough)
- Persona 5 (A fairly unique highschool Sim/Dungeon exploring JRPG that oozes style and plays a bit like a mature Pokémon)
- Dragons Dogma (Some of the best combat in the history of gaming, high fantasy and fun. A bit dated, but a lot to love)
- Bloodborne (It might not scratch your RPG-itch if you're looking for a big extravagant world, but this was my biggest surprise. I expected to despise this game and fell absolutely in love it, so I have to recommend it)"
62518,Divinity original sin 2 !!!!
62519,Bard's Tale IV is coming soon?
62520,Yeah i might have underestimated the amount of hours i sunk into the game seeing as i played it so long ago. Still just an incredible game with some of the most incredible characters
62521,bloodborne
62522,"Divinity 2 is a killer RPG.   


You also have greats like The Witcher, Persona 5, the Tales Of games, and Dragon Quest."
62523,"If you’re into first person games with RPG elements, try Dying Light with the Following. A lot of game, a lot of player customization, and probably the best zombie game that I have played (I was too sick of Uncharted to get into the Last of Us). The only caution is a weak story."
62524,"The Yakuza series. Yeah, its a brawler/beat-em-up, but its also chock full of RPG mechanics like random encounters, leveling skills, equipment, and shit tons of dialogue and various activities. Easily can get 50-100 hours out of each title."
62525,"Persona 5

Dark Souls 3

Bloodborne"
62526,The Witcher 3 and bloodborne. Persona 5 is also amazing but very story focused.
62527,The Witcher 3: Game of the Year Edition is £10.49 on offer on PlayStation store
62528,The Witcher 3.
62529,if you're not familiar with Ni no Kuni then its a must have
62530,Monster Hunter World
62531,"Been playing Skyrim vr, if you don’t own psvr I recommend the remastered version."
62532,Both of the South Park games.
62533,I fell in love with Elder Scrolls Online when I found out you could play it in first person.
62534,I think you mean open world adventure games
62535,"Hype aside the Witcher 3 was a hell of a ride, start to end."
62536,"The Witcher for Western-RPG, Persona 5 for JRPG"
62537,Persona 5 is probably the best modern age jrpg. Dragon quest xi is excellent to. If you aren’t into jrpgs then I would recommend the Witcher 3.
62539,"I just got Kingdom Come Deliverance for 20 bucks last week and I'm really enjoying it. It doesn't always perform that great on my OG ps4 but other than performance, I think it's really great. It's really deep and has a pretty big learning curve, but it's pretty rewarding once you start getting the hang of things"
62541,P5 obviously.
62542,"Regular RPG - The Witcher 3

JRPG - Persona 5"
62543,"Persona 5

&#x200B;

Dragon Quest XI"
62544,Absolutely The Witcher 3
62545,I mean. Hands down its witcher 3 there is no contest.
62546,There is contest.
62547,"TIL that the term RPG is used very loosely.

I actually searched for a definition and I found this:

""A role-playing game (RPG) is a game in which each participant assumes the role of a character, generally in a fantasy or science fiction setting, that can interact within the game's imaginary world.""

So pretty much any video game is an RPG according to that.  

""Play Pac-Man, an RPG where you assume the eponymous role of Pac-Man in the games imaginary world.""

No wonder there's so much confusion. 😁"
62548,"I was thinking the same thing this weekend after going through another sub (I think PS3 something something) where people were hair-splitting RPGs, ARPGS, and JRPGs."
62549,"Personally, I think an RPG is a game that has clear roots in table top RPGs like D&D, etc. Not just a fantasy setting, but some form of character attributes, stats and leveling up systems.

IMO."
62550,Dark Cloud 2
62551,"All the information on this thread is incredible and extremely useful, so up to date. Please feel free to vote up this thread to make it more searchable on Google :)"
62552,Nier Automata or Persona 5
62553,"Horizon Zero Dawn is an amazing game that had the disservice of coming out the same year as Breath of the Wild and doesn't get enough credit because of it.

It's a great game and a great RPG. Definitely worth getting it."
62554,"Persona 5, and I don't even like JRPG's that much. It's such a fun game - likable characters, interesting story and is stylish as hell with some cool visuals and amazing soundtrack."
62555,"Witcher 3, Bloodborne and DS3"
62556,witcher 3 and it's not close
61555,"The Witcher 3: Wild Hunt

Persona 5

Bloodborne"
61556,">Persona 5

I second this!"
61557,"> Bloodborne

this is the first time i'm seeing somebody call Bloodbourne an RPG"
61558,BB and DS are all technically RPGs
61559,i guess i feel thats really stretching the term RPG but alright
61560,"It doesn't seem like a stretch. Leveling up, choosing different stats to build based on what weapon or armor you want. That brings up the variety of apparal and weapons to be found. A lot of factors make it an RPG."
61561,so with that logic God of War is an RPG
61563,huh. ok.
61564,"From wikipedia: ""Bloodborne[a] is an action role-playing game developed by FromSoftware and published by Sony Computer Entertainment for the PlayStation 4."""
61565,"huh, well i don’t know much i agree with that but alright then"
61567,"an action game. it’s not really comparable to an RPG like, say, The Witcher 3. 🤷🏻‍♂️."
61569,I guess leveling up = rpg nowadays? Not like you can role play in bloodborne so idk
61570,As opposed to something like TW3 where you're a predefined character. Where's the role playing in that?
61571,"What a bad argument lmao, at least you actually are a character in the Witcher 3. As opposed to blood borne’ nondescript entity whose sole purpose is to swing weapon."
61572,What you just described makes bb sound more like an rpg than the witcher lmao
61573,Then you have no idea what role playing is
61574,"Your predefined sure but you can choose to act however you want. Ruthless or be the ""good"" guy or in between, you know role playing. You dont get those choices in bb you always kill everything in your way except for a few npcs"
61575,You can do that in Bloodborne too
61576,No you dont. You cant even sympathize with a few bosses and keep them alive instead youre always forced to kill them when you meet them
61577,There’s plenty of characters you can choose to kill or not. Not talking about bosses.
61578,I don't think decisione are the defining factor of an RPG
61579,"Dark Souls Trilogy

Bloodborne

Deus Ex Mankind Divided"
61580,"1. Mass effect 2
2. Mass effect 1
3. Mass effect 3"
61581,"While I agree with your rankings I don't recommend playing in this order

^^^^^^/s"
61582,That’s how a lot of Mass effect on PS3 fans had to play the games. Mass Effect 1 was an Xbox 360 console exclusive
61583,"Dragons Dogma, monster hunter, witcher 3"
61584,Gimmie dat dragons dogma
61585,"The Witcher 3 : Wild Hunt
Bloodborne
Horizon Zero Dawn"
61586,"The Witcher 3

Divinity Original Sin 2

Dragon Age: Origins"
61587,I'd give all the money for an Origins remaster. God I loved(most) of that game.
61588,*deep roads intensifies*
61589,"The witcher 3
       
       
Mass Effect 2
 
 
Skyrim"
61590,"Persona 5

Final Fantasy IX

Star Wars: Knights of the Old Republic 2"
61591,"On PS4 specifically?

* Bloodborne
* Monster Hunter: World
* Stardew Valley

Others I'd recommend: Sekiro, Torment: Tides of Numenera, Fallout 4, Diablo III

I'd also strongly recommend Gravity Rush 2 to fill your free time."
61592,"Stardew Valley as RPG is certainly a weird flex (at least, I don't consider it a RPG...) but I'll be damned if that game isn't worth recommending."
61593,"You are literally creating a custom character to play the role of a farmer in a small town. You level up, dungeon crawl, and select classes (trapper, farmer, artisan, etc.), you form NPC relationships, complete quests, and the overarching story is a hero quest to defeat a megacorporation from ruining your familial land inheritance.

Of course Stardew is an RPG."
61594,i'd argue Stardew is a bonafide RPG while Bloodbourne.....isn't really an RPG.
61595,Bloodborne absolutely is an action RPG
61596,ha well to be pedantic i suppose that means God of War could be an answer to this thread because that has a lot of the same elements
61597,Pretty sure an RPG is just any game with a player progression system. Its very loosely defined.
61598,"i consider that loosely defined to its detriment for sure. when somebody asks me what their favorite RPG is it would be weird to see somebody say ""God of War"". i mean hey, whatever, but it's just weird to me."
61599,Yeah the term is definitely being stretched by some people. It's like trying to call pop music rock because there's a guitar somewhere in it.
61600,"There's been a definite trend towards RPGification of many different game genres ever since 1996, when RPGs suddenly became popular outside of Asia. I agree that they could use more strict definitions."
61601,"i'm certainly not mad about it, all things considered. for example, i much prefer Assassins Creed Origins and Odyssey over the entire system in the games prior to them."
61602,"Skyrim
Assassins creed odyssey

My top 2 for sure. Others are kind of loosely rpgs or don't quite appear as rpg.

Haven't played the witcher yet"
61603,"Bloodborne

Dark Souls

DragonQuest XI"
61604,"For PS4 in no particular order, and not including Witcher 3 since you stated you're starting with that...

1. Dragon Quest XI
2. Persona 5
3. Valkyria Chronicles 4"
61605,"In no particular order 

The Witcher 3,
Final fantasy 7,
Mass effect (if I had to choose, ME1) 

Honorable mention - Dragon age inquisition, dragon quest XI, Suikoden."
61606,"Dark Souls 1 

Persona 4

Final Fantasy X"
61607,"My top 5 in order

The Witcher 3, Dragon's Dogma, Kingdom Come Deliverence, Dragon Age Inquisition, Skyrim"
61608,I've had kingdom come in the back burner for a while now. I need to get into that.
61609,"Persona 5

Nier Automata

The Witcher 3"
61610,"Witcher 3

Dark Souls 3

Skyrim"
