idx,text
43422,"Admob is certainly the easiest to integrate. Mopub is a decent alternative. Amazon ads are okay, with the plus side that you do not have to rely on Google Play Services as you do with Admob. I would probably just go with Admob due to its ease of integration."
43423,"I recommend running Amazon together with Admob with a mediation service (easiest is Admob's). Amazon ads usually pay much more than Admob but the fillrate is low, around 50%. With mediation you can fall back to Admob when there are no ads provided."
43424,It depends on your niche. Just try different ad-networks or use ad-mediation for the highest possible revenue. Good luck!
43425,"Adcolony, Amazon, Admob

They're the best honestly."
43426,"People usually say rewarded videos are the way to go, but it really depends on the game and where do you have most of your users. 
On my experience unity video ads have performed worse than admob, they promise a CPM ~$6 but it is less than $2 for south america  countries (where we have most of our users)"
43427,"When you say ""pay per download"" I'm going to guess that is the same as ""cost per install"" (CPI) which is the term usually used in the mobile space.   And the answer is yes, many ad networks pay out on a CPI basis.  Usually, the company paying for the installs is paying somewhere around $2.50 - $3.50 and the developer/publisher is receiving around 70% of that (but this can vary wildly).  

What it comes down to, then, is conversion rates.  This gets a little tricky as different apps convert differently, and sometimes even differently per network.  For example, we manage over 2,500 apps and we have different ad networks running in different places in our waterfall for each app (mostly game apps).  Unity Ads may do well in one, but not so well in another, for example.

I think fgl_sam gave a great list of ad networks that are currently ""hot"" though it's not a definitive list.  There are many good ad networks out here in mobile and as I said, some do well in some apps and not in others.  Also, some have great fill rates and others don't (so eCPMs will be high, but overall revenue is low).  Some have good campaigns now, but will not do as well when they lose them, etc...

Also, sometimes CPI ads are not the way to go.  ""Brand"" ads are growing in popularity.  These pay out on a flat CPM or CPV (Cost per View) and are aimed at increasing brand awareness for companies and products. Some apps do much better with these types of ads and the have the added bonus of not pushing users out of your app and into others.  I suggest a healthy mix of both types, though. 

As ixidor56 points out, it will also depend on where your users are from."
43428,"With ""pay per download"" I was aiming at a monetization strategy which guaranteed the publisher a small revenue for every install of his/her app. It was in my experience a pretty lucrative model in the past, but, of course, unfortunately based on kinda intrusive ads (like creating an icon on the home screen after launching the app (with the option to opt-out)).

Those intrusive ads were forbidden by Google pretty soon after I started using it and every ad network I know has stopped such a revenue model. However, those cpv ads you've mentioned kinda seem to be comparable to it. Is this also category one would see user-revenue based (unity) video ads in (so the revenue is generated with every ad impression rather than every conversation/click)? Or am I confusing something? Does this revenue model exist with ad formats other than video ads with a minimum viewing duration (which are exactly those unity video ads as far as I know)? Like the common interstitial/banner ads?"
43429,"Ah ok, yeah I think CPV may be the most comparable, but you would need to run them as a pre-roll, I think, and you would have to check with each ad network's terms of service for that.  Some video ad networks require ads to be shown ""moment based"" (at particular points in an app).

I'm not aware of this sort of thing being available outside of video ads.  And not all video ads are cpv.  Many are still cpi (per install).  Some networks focus on one model, some on the other.  As I mentioned before, the best bet is to integrate with a few different networks.  Ideally with mediation."
43430,How do you manage 2500 apps?
43431,My company has been around a long time and has a large community of indie game developers.  These developers make great games and work with us to help monetize and market their apps. The company is [FGL](http://fgl.io/gor)
43432,"Expanding on this question: does anyone know how android app ad-revenue has evolved over the past year(s)? Has it shown increase or decrease? 

Thanks in advance"
43433,The company I work for has worked with game developers for over 10 years. We have seen mobile advertising revenue completely surpass web advertising revenue (around 30x the CPM compared to web) and is now in a cycle of steady growth.
43434,"There are plenty of ad networks out there, offering several different ad formats like:

&nbsp;

1\. Banner ads

2\. Interstitials

3\. Native ads

4\. Video ads

5\. Surveys

6\. Exit ads

7\. Others

&nbsp;

It really depends on the profile of your apps and which mechanisms currently best applies to the concept of your app. When you find which model you want to follow (let's say CPA with rewarded video ads) you need then to find the proper network for your own apps. Each network is stronger in different areas. It is always a good idea to mediate and combine networks to fill gaps in  fill rate, set floors to eCPM and many other options

&nbsp;

You can have a look at AppBrain listing of all ad networks:

&nbsp;

[Android Ad Library Stats](http://www.appbrain.com/stats/libraries/ad)

&nbsp;

where you can see the categories and apps using each network and their popularity/adaption in the Android ecosystem.

&nbsp;

You can read more around monetization on articles I write from time to time. This is my latest one:

&nbsp;

[Rewarded Surveys - The Answer To An App Publisher’s Revenue Prayers?] (http://vourkosa.github.io/monetization/2016/05/17/Rewarded-Surveys-The-Answer-To-An-App-Publisher-s-Revenue-Prayers.html)"
43435,"I know Airpush has a pay per download option. I like them but I didn't like the permissions on their sdk. 

I just switched to Appodeal (I do only banners) and revenue seems higher than anything I've used. (their sdk doesn't need write permission btw)"
43436,Appsflyer just put out a performance report of all the networks that is worth looking at - http://hub.appsflyer.com/appsflyer-performance-index-2016-h1
43437,"The two key things that I've always seen as important to compare are CPM and Fill Rate.

The main networks I've found effective for these two metrix are:

For Rewarded Video:

Unity, AdBuddiz, AppLovin, ChartBoost, HeyZap, Mediabrix.

For Interstitial Ads:

AdBuddiz, AdMob, AppLovin, ChartBoost, HeyZap, Mediabrix, Pretio Interactive.
	
Changing them out can be a pain, but I will mention FGL has a tool for changing ad network SDKs in your app in seconds:

We called it Enhance by FGL, check it out if you have time. http://fgl.io/wdi"
43439,"Almost, but Enhance isn't an ad network, or even an ad mediator. We created Enhance as a tool to speed up using SDKs in apps we were developing and helping others develop too. We are sharing it with others now in the hope it'll be useful to other developers.

We exist to create tools and services that makes developing apps and monetizing off of them easy. With Enhance you can insert SDKs into an app in a few minutes, rather than hours or even days, you can swap out which ad networks you use, or even which analytics you use."
43440,"Fair enough. 

Might wanna put up a link to some docs or guides or something on the website, nobody likes having to sign up before they even know if they want to."
43441,"That's true. I do know our marketing team are currently making a more comprehensive front page as we speak. 

We only soft launched the site 2 weeks ago, I just wanted to share with OP as it sounds like he's in the same boat we were when we made Enhance."
43442,"For being an engineer your posts sound a lot like straight from the marketing department, which is probably what nets you all the down votes."
43443,I'm just excited is all... perhaps a little too earnest
43444,"Two pet ducks. You may be tempted to go for one. But trust me. You need two. And you’ll have about $76 left over.

Edit: Fully humbled by the awards, kind friends."
43445,"They don't tell you this in school, but the ducks in the park are free..."
43446,Nice try Jeff Bezos
43448,Worth every penny to not have that wet plastic ever touch you again!
43449,Another monitor.  Your productivity will increase dramatically.
43450,I have 3. But maybe you are right...
43451,"A nasal irrigation kit - either the electronic pump or simply the squeeze bottles. I started using them both leading up to surgery on my sinuses, and I haven't stopped using them since. It takes some getting used to, but the relief and clean feeling is amazing."
43452,Make sure you only use DISTILLED water for nasal irrigation. There are horror stories out there of the consequences of running tap water up your nose. Brain eating amoeba type horror stories.
43453,Or boil the water.  Pretty sure that was part of the instruction with my neti pot.  And salt as well.
43454,"LET IT COOL after you boil it, though. 

Just trying to keep you from getting sued, Tom."
43455,AeroPress coffee maker. The thing broke my wife of her $200(?) monthly Starbucks habit. The unit costs maybe $25 or so.
43456,"House plants. They will make you happy looking after them. I recently bought a venus fly trap, she caught her first fly today. So proud."
43457,"This is so wholesome I could die. 

I started keeping and growing plants and herbs, and just *not killing them* feels like such a huge accomplishment. Seeing a new sprout is like a celebration. 

Now I understand why people have graduations for kindergarten."
43458,Rice cooker. That fucker kept me fed during depression when I barely had the energy to get out of bed. Takes less than nothing to get some rice in there and flip the switch. Want something sweet? Throw coconut and sugar in there. Want flavor but can’t be fucked to make anything? Get some spanish rice or saffron goin. You can throw tofu in there with it if you need . Yeah it’s not the best for you but hot food is better than no food.
43459,"New pair of socks. If you’ve been wearing the same pairs forever like I typically usually do theirs nothing like putting on a new pair of freshly bought socks, you can totally feel the difference, I never realized til was an adult sadly but I appreciate the feeling of new socks all the time."
43460,"I bought a $1 back scratcher from an asian market in town.      
Best $1 I ever spent."
43461,A decent light wake up alarm clock. Completely changed my mornings. Don’t think I could ever go back to using my phone or a simple alarm clock.
43462,"Would it help wake up non-morning people like myself? If so, link?"
43463,"Hello fellow non-morning person. I have one of these, it doesn't help me that much. It might work for you though!"
43464,"If you have trouble getting up or functioning in the morning, and like a nice cup of coffee or tea, an electric kettle with a timer can be a real game-changer. Or just getting an electric kettle if you don't have one."
43465,"Vertical mouse. $20. Saved my wrist using it at work all day.

It looks odd but it feels so much more natural. I even got a bunch of people at my office to buy one after they tried mine.

Edit: [Here’s the link](https://www.amazon.com/Anker-Wireless-Vertical-Ergonomic-Optical/dp/B00BIFNTMC/ref=mp_s_a_1_3?dchild=1&keywords=vertical+mouse&qid=1595422956&sprefix=vertic&sr=8-3) to the one I have for those interested."
43466,"This was a lifesaver for me. I made a special trip to my office once mandated work from home started in March because I NEED it. After I got it, I got some weird looks from office mates but started to see them picking them up too."
43467,A king sized blanket for a queen sized bed.
43468,"I got a king for a double bed. Best decision ever! The double sheets fit the bed, but I couldn't snuggle completely under them without curling up. Now. I can hide completely under the duvet stretched out. Best thing ever in the winter!"
43469,If I pull the covers completely over myself the boogeyman can’t find me.
43470,Just make sure your foot doesn’t hang over the edge of the bed.
43472,"I have a king size bed, and even king size comforters are kind of small, so my partner and I have two king size comforters — one one each side, so no one has to share."
43476,The eyes?
43477,The demons
43478,"I’m not stuck in there with them, they’re stuck in here with me!"
43480,Fellow raccoon here. Send help please.
43481,This post cost me over 400$ so far
43482,Sharp knives for the kitchen
43483,"I put off buying a whet stone for a long time, mostly because i was nervous i would use it wrong and ruin my knifes, but its not too hard at all if you get one with an angle guide. Makes chopping stuff up faster, easier & safer"
43484,"We bought a whetstone what feels like years ago and it went unused until last week. Everyone in the household is constantly complaining about dull knives and I always tell them, ""well, we do have a whetstone,"" to which they respond ""i DoN't KnOw HoW tO uSe ThAt!!1""

Eventually the dullness started to actually bother me so I spent 30 seconds watching a Youtube video and gave it a crack. Then I learned it had been bothering me my whole life and I just didn't know it. Knives are supposed to cut THAT easily?! Holy crap!"
43485,When I started dating my now wife I introduced to the concept of sharpening knives and she had no idea that it was supposed to be easy to cut veggies and fruit!
43486,No matter the knife my wife would always just use pressure to cut things. She was amazed how I was able to cut tomatoes and bread without destroying them. “Let the knife do the cutting”
43487,"A glass breaker on a keychain. Push it against the glass of your car window and it shatters immediately, helping you get out of a car underwater,  broken door etc. Super cheap and life saving"
43488,"I have [these](https://www.amazon.com/gp/product/B01AXCGJNQ/ref=ppx_yo_dt_b_search_asin_title?ie=UTF8&psc=1) things.  They can cut your seat belt in a pinch, too."
43489,In my opinion definitely a weighted blanket if you have a hard time sleeping at night or have anxiety. They have some at target for $25 currently :)
43491,Something else that really helped with sleeping for me is a bottle that keeps water cold (Mizu or whatever). Being able to drink ice cold water at any time during the night without leaving your bed changes everything.
43492,How do you not pee all night? I force myself to stop water intake by 8:00 PM because I end up peeing twice a night even with my water curfew.
43493,You need a nice water bottle and a good size pee jar for your nightstand. Try not to confuse them.
43494,Motion sensor night lights. Can’t tell you how many stubbed toes or falls they have prevented. Also a cheap intruder alarm.
43495,Get a motion activated toilet bowl light.  They're amazing.  Don't kill your eyes in the middle of the night when you gotta pee.
43496,"Relatedly, a dimmer switch for the bathroom.  Works in the middle of the night, as well as early mornings, as you can gradually increase the brightness to match your current tolerance for the world."
43497,Carbon monoxide detector
43498,Post-it notes are far cheaper!
43499,"Our landlord isn't letting me talk to you, but it's important we do."
43500,I feel happy I recognize this
43501,It's quite legendary.
43502,Such a crazy moment of reddit history lol
43503,More than one 10mm socket.
43504,"Excuse me while I cry, one 7/16th of an inch at a time"
43505,I was just working on my motorcycle last night and picked up my 10mm socket and thought “see ya later good buddy” as I knew I’d prob lose it by the end of the night. lol
43506,Blackout curtains for your bedroom.
43507,"Changes your life if you want to sleep all day, I refuse to have them in my room after living like a vampire for a few years"
43508,Combine it with a wake up light alarm clock!
43509,"Block the sun, then emulate its rise. The future is here, people."
43510,"This is how I feel when I put foundation all over my face to get rid of the redness, then apply blush on top of that to put redness where I want it."
43511,"May sound simple, but a good pillow. It is amazing the change in body aches, and sleep you see when you have a good pillow that fits you."
43512,"I thought that I liked memory foam and other fancy pillows, but the real life changer for me was a buckwheat pillow. I have sleep apnea, and it allows me to get my head into the perfect position and *keep* it there comfortably.

EDIT:

Before you go out and buy one, please research the pro's and cons. They aren't for everyone.

Consider them if you like a firmer pillow, occasionally wake up with an achey neck from lack of support, and want a pillow that breathes well. Someone in the comments has also pointed out that you will win every pillow fight you get into.

Downsides are: if you shift around in your sleep a lot, you'll need to adjust the pillow to fit your new position. Adjusting the pillow and settling in makes a little bit of noise as the buckwheat husks rub against each other, kind of like dry leaves crinkling. Some people are also allergic to buckwheat, but there are other similar fillings such as millet husks. Organic fillings also need to be replaced once in a while, since it breaks down over time."
43513,"Oh man, did my life change when I got my buckwheat pillow. I tried using the standard pillows but could never find one that was comfy. Memory foam got to hot or would compress to a pancake. 

Getting used to the noise took like a week or so, but after that, pure bliss."
43514,"how does one find the perfect pillow

Edit: Time to start my journey into the world of pillow-shopping - thank you everyone for the responses!"
43516,"I entered into my relationship with my wife, who only ever bought cheap 5.00 pillows from Walmart, with a quality/expensive pillow.  She swore up and down she'd never buy one.

Eventually said pillow migrated over to her side of the bed and was the one and only time in 8 years of marriage that she's admitted to being wrong."
43517,So what pillow do you have ?
43518,"At the time?  No idea any more.  I believe it was a Tempurpedic?

Currently we each have one of these -- and I'm ashamed at the price.  But holy hell they are great.  ( [https://www.dormezvous.com/en/polar-tropic-pillow/product/15POLARPIL](https://www.dormezvous.com/en/polar-tropic-pillow/product/15POLARPIL) )"
43519,"Never be ashame of a price for something you spent a third of your life in/on. 

A good mattress/pillow can change everything. Hell everything related to sleep is very important and worth investing into."
43520,"Sunscreen.

No skin cancer for me"
43521,"For anyone that disagrees with this comment.  I've had multiple skin cancer surgeries.  It's not the scalpel cutting flesh away from your body that hurts the most during the procedure, it's whatever liquid they inject into you to deaden the nerves around the cancer that hurts.  The needles don't hurt but that shit they inject into you is f'ing nasty.  

Wear your sunscreen kids."
43522,"I am German Irish and had a skin graph on my temple, and removal of a lymph node on my chest. My wife convinced me to go. Turns out that I should have been going to the dermatologist the whole time. She saved my life. I would have waited it would have went from to lymph nodes to my brain and / or my lungs and that would have been end of story. If my wife did not insist I would not be here right now. So, I get to experience 2020... so, yeah.

in all seriousness, I may not be here. Listen to your wife.

The end result is  I cannot spend  more than an hour a day in the sun. I need to wear long sleeves and long pants and a ton of sunscreen even for a short time in the sun.

What is my motivation? I get to piss off all the people that thought I should be dead. Screw you, I am staying alive to spite you. The only downside is my beautiful wife slaps on a ton of sunscreen everytime I leave the house.

I guess living well us the best revenge.

Update note 1: Wow, thank you for all the kind messages, and yes I am doing well. And yes, I do know my wife is awesome. You all are awesome for all the support.

Update note 2: To clarify, the surgeries were covered my my insurance with a copay. The reason I say this was less than a $100 is the advice from my wife was free and the copay for the dermatologist was $10."
43523,An air compressor to air up your tires. Got one off Amazon for 30 bucks.
43525,"A 10 foot charging cable 

Or a quality pair of shoes"
43526,Fuck me im reading this hunched over with my phone plugged in to an impossibly short charging cable.
43527,"You might consider a USB extender which comes in handy for other things as well.

Then you can just plug it into whatever. Don't wanna sit at your desk for gaming? USB extender. Now you can sit at the couch and use the coffee table instead of your desk and the tv instead of your monitor"
43528,">A 10 foot charging cable 

Only if of God quality. Otherwise it might lose enough voltage over is length for the phone to not charge. Been there done that.

Edit: I meant good quality. God quality is overkill for this application.

Edit 2: Christ if I get another response recommending to buy an Anker cable I'm going to drown myself."
43529,"I once bought a 10 foot charging cable of God quality, unfortunately it was the god Hephaestus and almost burned my apartment down."
43530,He’s not used to working with cables. Give him a break
43531,National park annual pass
43532,"If you’re a veteran with any % disability rating, they’re free for life."
43533,Did not know this thanks
43534,"Even if you are not a veteran, if you have a handicap placard along with the letter you take to your dmv it's free as well."
43535,"If you have a large lawn or a property that requires a lot of yard work get some [3M Worktunes](https://www.amazon.com/3M-WorkTunes-Protector-Bluetooth-Technology/dp/B0723CYHPZ). About $50 and they're combination hearing protection and Bluetooth headphones so you can actually hear your music  without destroying your eardrums.

They're a good gift too for anyone you know with a lawn or wood shop or something.

At my old house it was a 4-5 hour ordeal to mow and trim the property. I'd likely have went fully insane without those."
43536,"Great idea! Useful on a plane too. With minor hearing loss from too many concerts in my 20s, I have to turn the volume to nearly max on a plane, so I usually just put in earplugs and can't watch or listen to anything, but this would help."
43537,"Although more expensive, decent active noise cancelling headphones change your life if you have to fly a lot. It doesn’t matter if you sit at the wing or not the amount of noise that gets blocked out is incredible. It drops the background noise by more than half easily."
43538,"Step 1: Throw away all your socks. 

Step 2: Buy 3-5 packages of the same sock. 

Step 3: Enjoy a life without ever having to match socks again."
43539,I used to only have these specific adidas ankle socks but they stopped selling them/changed them. It was a very sad day.
43540,"A good shop vac. You will not believe how many uses around the house you'll find for it. Cobweb removal, water removal, gravel removal, vent cleaning, soot trap cleaning, (after a good scrub since it's likely dirty from other tasks) car vacuuming, dust sucking, the list goes on. Seriously if you plan to buy or already own a home go get a shop vac."
43541,My wife said we needed a new vacuum and made the mistake of sending me out to get one. I love my new shop vac. Lmao
43542,What's the difference between a shop vac and a vacuum? I've not heard of the former before and Google isn't helping clear it up
43543,"Shop vac can suck up anything whether solid, liquid, a mixture of the two. They can’t be beat overall. Try vacuuming up broken glass and beer with a Hoover or Dyson and you’ll maybe be able to do it once. Lol"
43544,"That makes me wonder; what's the downside? It sounds so good that there's just no reason to buy a regular decent vacuum, as they're hardly much cheaper."
43545,They are bulkier and are probably harder to do routine carpet cleaning with since all you have is a hose and whatever attachments you want to put on it.
43546,"Live in an apartment and this is our vac for everything. Carpet, vinal, bathroom, car. I'll use the blowing side to inflatable air mattres or coals for bbq.

Edit added punctuation for clarification."
43547,You have a bathroom car ? Look at Mr./Ms. Fancy Pants here.
43548,I mean any car can be a bathroom car.
43549,but it's a *vinyl* bathroom car
43550,"Many of them can also reverse and with a nozzle attachment (or a funnel and duct tape) inflate pools, air mattresses, float tubes etc."
43551,"Fitted sheet straps. They keep cheap sheets from popping up at the corners. So now I can use soft sheets that don't cost a fortune and my sleep is undisturbed by them popping loose, greatly improving my quality of life."
43552,Condoms
43553,My dads biggest regret
43554,Womp womp
43555,"A basic skincare routine.

I’m talking like cleanse, moisturize, sunscreen, and if you’re really adventurous/ in need, get yourself a topical for acne or concerns. 
Amazing for your self esteem, and also becomes a form of self care eventually. It’s so easy to forget to take care of yourself."
43556,First Aid Kit
43557,"Similarly, a fire extinguisher"
