idx,text
37110,"I just updated my original post showing all the below-500 coasters that are in each park. As a counterpoint to your argument, please take a look at Six Flags New England, Carowinds, Lagoon, and Morey's Piers on my list. The number of crap coasters in those parks is huge!"
37111,"My comment was mostly tounge in cheek, because obviously the more coasters you have, the more likely they will be ""ranked,"" the more likely you'll place high in these rankings.

I take umbridge with calling unranked coasters ""crap"" though. Wild Mice and kiddies aren't crap, they have their place, but of course you don't plan trips around them (unless you're me and my wife are least.).   I also love Mine Trains and Arrow Loopers, so maybe the rankers have shitty taste 😝.

But mostly I just heavily disagree with the rankings of the poll. I didn't vote so I can't complain, but wooden coasters aren't getting a fair shake by integrating them with the steels. RMCs are wayyy too inflated, and rides like Magnum are comically low. Same things I always complain about..."
37112,"I agree with you on Magnum, but the ranking seems to reflect the average person's opinion about it in this subreddit, though.

I didn't mean to seem disparaging to coasters that didn't make it in the top 500. I used that word as a simple way to make the context of what I'm doing more digestible to the average reader."
37113,"Magnum is a 31 year old Arrow in a park with a huge number of winners. Honestly, I am ecstatic to see it so high up still.

RMCs and other newer coasters are more universally acclaimed, while older coasters like Magnum have their fanbases but naturally lose some sheen with newer enthusiasts. It's predictable, and it makes sense to me to see things laid out this way.

Lovely poll. Thanks for sharing it!"
37114,"I enjoyed this, until Buffalo Bill's was ranked above Morey's Piers."
37115,"Gotta blame the people who voted more highly for Buffalo Bill's single coaster than they did for Morey's Piers' seven coasters combined! None of its coasters cracked the top 500.

(that's kinda wild and depressing, huh)"
37116,My guess would be more people have gone out of their way to ride Desperado.
37117,"By the way, I added more info to give context to the ratings.

Check it out, Morey's Piers has one coaster in the top 500, but SIX that are not. Hence, only one ranked coaster, which essentially means it's Great White vs. Desperado."
37118,"This poll definitely has the right direction given it reflects the Mitch poll's system. It also seems to do a good job of getting a mix of the US and worldwide coasters. However, I can tell that at least so far, it's suffering from a big lack of support for the smaller parks. 

I've seen several examples of high tier rides that have ranked severely below the supporting lineup coasters from the high visited parks. While I'm sure more ballots and support over time will correct this, there should be some weighting to ensure that Cedar Point and Kings Island's coasters don't dominate over everything. I've read a little into Coaster Bot's methodology and he clearly lies out the challenges faced with this. It's been a while, but IIRC, the Mitch Poll did compensate in some way for lower ridden rides.

I don't want to seem to critical, since Coaster Bot works hard at what he does, and is one of the better coaster content creators around. While the statistics are always interesting, I wouldn't put too much emphasis on this year's results until we see if next year's seem to be more accurately reflected."
37119,"Plenty of rankings I find baffling (less than 10% of the top 100 includes wooden coasters which is a crime, as is Batman being around 200 simply because it's been cloned).

Still interesting to see though. Now let's do a ""quality over quantity"" where parks with at least 3 coasters are ranked based on the average spot each coaster landed. I have a feeling BGT, BGW, SWO, Holiday World, SDC, and a few of the smaller parks will receive a lot more love on a list like that."
37120,Is it that baffling considering less than 10% of the roller coasters currently operating are made from wood? Wooden coasters make up only 2.9% of the roller coasters in Europe and 13% in the US. 10% sounds pretty good to me!
37121,"Quality vs. Quantity

Mystic Timbers, Voyage, Ghostrider, El Toro, Lightning Rod, Outlaw Run, Boulder Dash (on a good day), Python in Bamboo Forest, Fireball, Wodan, and Raving Flyer 2 are all in my top 25. Furthermore, I'd put Colossos, Phoenix, Gold Striker, Prowler,  Boardwalk Bullet, Thunderhead, Rampage, Balder, Raven, and American Thunder somewhere within my top 75. I haven't been on them but I'm guessing T-Express, Wildfire, Wood Coaster (Knight), El Toro (Germany), and several of the Chinese woodies there too.

Now of course, that means my top 75-ish is still only filled with 30% wooden coasters, but I still find it surprising that rides like Wodan, Mystic, and Ghostrider are ranked as low as they are and that continues down the list. I guess I just happen to prefer a solid wooden coaster over most people who participated in the poll.

Then again people put Kumba at 90 so the poll is complete nonsense anyway. ;)"
37122,"This is it right, it's entirely subjective. I think most people prefer steel roller coasters over wooden ones. Personally I'm right with you, I absolutely love a solid wooden roller coaster. Hopefully next year we'll have more people taking part who have ridden the awesome wooden coasters in China so they get more accurate rankings. Once that happens I'm sure we'll see more wooden coasters in the top 100. :)"
37123,"So if you think the voters underrate wooden coasters, I'll ask this, Raven or Thunderbird?  Which is better?"
37124,Thunderbird's my favorite wing coaster but unless Raven is running like crap I'll go Raven every day of the week.
37125,"For this to work, I'd suggest averaging only the top 3 or top 4 of each park. Take Canada's Wonderland, for example. 17 coasters, but only a couple that stand out. But then you have Holiday World with five coasters and The Voyage."
37126,One way we could consider it is doing a top three or a top five and averaging those.
37127,"Exactly that, yeah"
37128,CGA BEATS DISNEYLAND LETS GOOOOOOOOOOOOOOOOOOOOOO
37129,"Thank you for doing all of this! It's definitely an interesting way to use the numbers from the Coasterbot poll. Though, shout-out to me living near a home park that has six coasters and ZERO ranked 😂😂 Probably the largest park that has nothing ranked in all of the US"
37130,Every coaster within a 200 mile radius of where I live doesn't make it into the top 500! :(
37131,That sucks too :( Guess we'll both be making journeys to great parks next year!
37132,"Magic Mountain is better than Cedar Point.

I said what I said."
37133,I think we'll all agree that both parks are mandatory to visit on relatively equal footing.
37134,"As a teenager I preferred Magic Mountain to Cedar Point but I considered them nearly even. throughout the 2000s and 2010s Cedar Point has completely separated itself from Magic Mountain in pretty much every metric that I care about- general coaster collection, top tier coasters operations, upkeep, atmosphere."
37135,"I think in terms of great coasters, they seem pretty evenly matched - though there were 4 or 5 closed coasters when I visited CP. The ones I did get to ride were great, but ops were terrible and lines were stupid long. Perhaps I need a few more visits to CP to see what everyone else sees, but I didn't enjoy my trip very much."
37136,I would agree that Cedar Point's operations are not what they're cracked up to be but they are usually running the correct number of trains unlike Magic Mountain who can barely manage to keep one operational train operational. And in terms of a direct comparison between coaster Cedar Point wins almost all of them and it's not close.
37137,"Having great coasters is great, if you can ride them.

Long lines and closed coasters prevented me from doing that, even over two days at CP. Gemini, TTD, Rougarou, Blue Streak, and Wicked Twister were all closed. Millennium Force, Maverick, and Steel Vengeance were hour to 2 hour waits even on a ticket system. 

I'm not saying it's not a good park, or that I won't give it another shot. I'm saying if I had the option of going to one park over the other, I'm going to the park where I can actually ride things."
37138,"Oh I completely agree. Last time we were at Cedar Point, we played ""guess which coasters are currently down despite perfect weather"". It was a really fun way to pass the time, because at all hours of the day(s) we visited, we'd find ourselves in line for a ride and we had a blast just going down the list and trying to guess which coasters were down.

The funnest part was each morning, when we would round the park and queue for Millennium Force (told it was opening late), then run to Maverick and be told they didn't know when it would open, only to go to Vengeance and be told it may not open at all that day, then to give up and go to Gemini and see a chain across the front without them even staffing an attendant to explain it wasn't open. Same with Mine Ride which was at least cycling empties. Finally we found Magnum open with no wait, rode it, then made our way over to Dragster which still hadn't opened.

We did this exact crawl through the park in some form each day and almost always found more coasters closed than open in the back half of the park well after the posted open time.

Cedar Point is a damn joke when it comes to ride up time. I've never seen a park with so many problems keeping rides up for a few hours at a time or even bothering to open on time. And I really, really don't want to hear about ""weather"" or ""safety"". Every other park has this stuff figured out.

Now in terms of SFMM being any better? That's not even a debate. CP is still better in their attempt to open things. SFMM just throws up a sign and calls it a day. It's always a major gamble to see just which SFMM coasters will bother to attempt to open. Back in the mid 2000's I have pictures of the ""closed today"" signs outside the park overflowing and unable to hold all of the plaques for the amount of rides down. On any given day, at least 3 or 4 headliners were closed with half a dozen more smaller rides and it was like that in the middle of the summer. I can't remember them all, but my friends and I considered it a badge of honor when all 4 B&M's, Superman, Ninja, Deja Vu, and of course X were all down for the day during Fright Fest in 2005 I believe."
37139,"We've had very different experiences at SFMM. I've only been there 3 or 4 times, for a couple days each time, but aside from Apocalypse being down while they built West coast racers, I can't think of any rides being down on my trips."
37140,"Eh depends on the time of the year and day you go. Obviously rides like the dragster will pretty much always have long lines but if you go during down season and late at night its so much improved.  For instance on less busy days I can typically get on the millenium force in 45 minutes, raptor in 25-30 and wicked twister, power tower, gemini, max air, and magnum xl somewhere around 15. Ones like corkscrew, blue streak or matterhorn are obviously short. On the other hand rides like the dragster and maverick are always long (also weirdly some like iron dragon), and during halloweekends its so bad. Just depends on when you go"
37141,"Cedar Point probably has the best combination of quality and quantity of coasters in the world, followed by Magic Mountain (depending on who you ask). Fuji-Q has some coasters that are arguably better than at those two, but doesn't have anywhere near the same volume."
37142,Magic mountain or cedar point.  Both are phenomenal
37143,"If you actually want to visit a theme park then your best bet would of course be Orlando and visit Islands of adventure, SeaWorld Orlando & Busch Gardens. If you’re talking amusement parks then it’d be Cedar Point & Magic mountain"
37144,"Yeah I wrongly used theme park , but I mean amusement park"
37145,I consistently think Cedar Point.
37146,Cedar point is the obvious choice. A very well rounded lineup of great coasters and something for all types of enthusiasts.
37147,Michigan's Adventure
37148,"Hey, I know that was supposed to be mean. Don't be mean."
37149,"But I *meant* it. Wooden coasters like Shivering Timbers are what keep people wanting to actually ride wooden coasters. And stuff like SLCs are the eight wonder of the world, why else would there be so many of them? Thunderhawk may be second hand, yes, but who cares? Combine a marvelous creation with a good location on the water, and you get a masterpiece. Why travel to nearby places like Indiana Beach and Cedar Point, where they have unrequited trash like Cornball Express and Steel Vengeance, when you can go to MiA, so close to home, and so fun for the families."
37150,Wait seriously
37151,Carowinds since it has about every coaster you could wish for.
37152,"Once RMC Gwazi opens, I think BGT and SWO will have one of the best coaster collections in the world between them.  They're only an hour away from each other so it's entirely possible to do all of them in one day with time to spare.  Separately though, I think BGT will be top 5 but definitely not #1."
37153,"I would do Busch Gardens one day and Sea World another. That worked out well for me. Let me tell you though, marathoning Mako for 17 rides almost killed me. Don't do that. Lol"
37154,I see nothing wrong with 17 rides on Mako :)
37155,"To be fair, I wasn't used to the Florida humidity and I had already been worn out from riding Manta too many times. I may actually like Manta more than Mako. Kraken being my least. And Kraken is not even a bad ride."
37156,"Don't forget the launch coaster coming to SWO as well. The BGT & SWO combo is strong even without the two additions, I can't wait to get back out there next year."
37157,"Themed: Phantasialand 

Thrill and quantity: Cedar Point"
37158,Six Flags Magic Mountain
37159,"WalibiHolland, Phantasialand"
37160,"I really like King's Island and Hersheypark.  Sure, CP has extreme coasters but the overall  experience just isn't what it used to be.  Also on a smaller level with basically all fantastic coasters look no further than Knoebels and Holiday World.

*Note: Exclude parks out of the US."
37161,"You are right, the overall experience at CP isn't what it used to be. It's WAY cleaner now, events are constantly going on, the food is improved, the employees speak english, and the water park is actually worth visiting now."
37162,There's never been a time that CP wasn't a clean park.  There was a time that they had more of a focus on guest satisfaction though and not on how many fast passes they could possibly sell in a day.
37163,"Nah bro I just disagree. There has been a pretty big shift in the past several years evident in the changes and new marketing. And especially since they just specifically said the focus will be on 'guest experience.' 

Also all parks want to sell fast passes. CP is just annoying cause it's so flippin busy."
37164,KI is great but I have that place a few pegs below both CF CW parks.
37165,"Disney: go here if you love Disney or have kids. If you aren’t a Disney freak (or Star Wars fan?) I’d probably avoid it tbh. 

Universal: compared to other Universal parks in the world, this one is incredibly small and only has one coaster (Mummy).  

Six Flags: go here if you love coasters; this along with Cedar Point are considered the two Coaster Meccas. Not the cleanest park, landscaping is trash, and food is terrible. Quantity>quality

Knotts Berry Farm: go here if you enjoy amusement parks overall. The coasters aren’t as insane as Six Flags, but my favorite coaster in all of California is Ghostrider (I’ve ridden them all). Also has amazing atmosphere, food, and treats.  Quality>quantity 

Sea World: they are focusing more on coasters ever since Blackfish, but I wouldn’t go here unless you are going to stay in San Diego for a few days... there’s better stuff to do in SD than SW imo. 

Other tips: get the flash pass/skip the line/whatever they call it in that particular park. Also arrive 30-60 minutes before the gates open."
37166,Universal also has the Harry Potter ride now! It’s like the Mummy one but even bigger. There’s also a small coaster in the hogwarts area.
37167,"As a dad of two kids and has been through the special hell that are amusement parks here in SoCal, Disneyland is by far the best. 

You pay a premium, but when you go there, it's clean, it doesn't feel cheap or ghetto, and you know where your money went. The other parks, a lot of them almost comparable in price to Dland, are pretty shitty in comparison, with tons of closed rides, closed kiosks, no operational order, and employees with shit attitudes. I'm not saying I want them to be smile robots, but man, if I need to ask you a question, don't stare daggers at me and give me some flippant answer.

I just came back from SeaWorld this weekend and we waiting in line for over an hour to get beer/snacks. Take that in.

edit: just realized you don't have kids...my answer still stands though. If it were just the wife and I, we'd go Dland."
37168,"In rankings from closest to not:

Disneyland & Knotts

Universal

Seaworld & Six flags

Which is best for a day trip?  Well then that depends on budget & preference for rides.

If you like rollercoasters, Knotts.  If you do not like rollercoasters or you want to get fancy insta pics, Disney.

I'm sure, since you can operate Reddit, you can use the internet to determine if you need reservations."
37169,"disneyland will probably be the most memorable. it has a little something for everyone. try to go on a weekday (not friday lol) to avoid the crowds as much as possible.

knotts is also very fun, lots of roller coasters and good food. six flags has better coasters than knotts IMO, but it’s a fair drive.

avoid seaworld at all costs. an unethical and garbage corporation.

can’t say much about universal because i’ve never been, but it doesn’t get as much hype as disney."
37170,"Having grown up in OC, Disneyland and DCA would be my vote for the overall experience, food, theming and rides, but If you're really into roller coasters and thrill rides, I'd say Knotts. It's a good value and the food is getting really great, IMO. Six Flags would be an option but it's a hike from Santa Ana so, meh. Save yourself the drive. 

Seaworld is a skip for me even tho I loved it as a kid. Universal is kinda boring IMO, all the rides there are basically virtual ""put 3D glasses on"", unless you're a big Harry Potter fan it's a skip for me too."
37171,Any favorite rides/attractions in DCA?
37172,"Soarin’, Midway Mania, and the guardians of the galaxy ride (the old tower of terror) are my faves in DCA, but go for the food / drinks too, in normal times we’ll sit at the bar at Lamplight Lounge or Carthay circle lounge, the tasting terrace, etc"
37173,A.F.R.A.I.D.
37174,very cool indeed
37175,Absolutely Disneyland/California Adventure especially based on where you are staying.
37176,"Disney

Also, obligatory PSA - *please, please, please* don't go to Seaworld."
37177,"If you have kids under the age of eight consider Legoland. It’s in Carlsbad in northern San Diego county. Yes, it costs as much as the other places (many people I know think it’s be cheaper ), but little kids can go on every ride."
37178,"Disney is good if (a) you have kids, (b) you want to embrace your inner-child, or (c) you're a couple and want to feel that innocent high school type romance again

Universal is good for media fans, especially Harry Potter

Magic Mountain is good for roller coaster fans

havent been to Knott's in a long time, so can't advise you on the one

dont go to Sea World"
37179,Avoid Universal
37180,Why
37181,"Disney and Knotts will be closest. 

Disney is, in my opinion, the best but it’s also the most expensive and the tamest. Really close to Santa Ana though. You could do Disneyland *or* California Adventure or do both in one day with a Park Hopper. Lines haven’t actually been too and since capacity restrictions lifted, but the *big* popular / new things (Spider-Man in DCA, Rise of the Resistance in Disneyland) require some early morning planning. Good food options, much better if you guys are both actual Disney fans. We used to be annual pass holders when that was still a thing but have gone a few times recently and it was still very fun, despite no fastpass. 

Knotts is, in my opinion, one of the best options for the money. It has the kitschy ghost town area, lots of food, some roller coasters, and it’s pretty affordable. Pretty fun, imo. Still pretty close to Santa Ana. We’re also passholders here. 

Universal is fun *but* imo it’s some of the worst value only because almost all of the rides are simulators. I will say: lines have been short af, Jurassic World and Harry Potter / Forbidden Journey are great, and there are some unique experiences here (specifically the tram tour). More expensive. Tame rides. Farther from Santa Ana but not out of reach at all. We’re also passholders here and go quite a bit, at least once/week. It is a more unique experience, compared to the next one…

Six flags is great *value* if you like roller coasters but is by far the least unique experience (imo) because well, it’s Six Flags. It’s fun - there are a ton of thrilling rides, it’s inexpensive. Pretty bad food and a far drive from Santa Ana. If you guys are all about roller coasters and not theming, this is the one, but in *my* opinion it’s the worst lol. We still have passes for this one too though, only because they’re so goddamn cheap, but as far as a unique experience this ain’t it. 

SeaWorld (all controversies aside) is fun - there are some smaller roller coasters, obviously the sea life, and some actually okay food and drinks. It’s also pretty, and the weather is good. Downside is that it’s pretty far and you *do* have to be into the sea life stuff to really get your value - which may include some of the marine mammal stuff which can get uncomfortable for some. Imo it’s better when there’s a food festival. Honestly I’d skip it though, to be honest. 

All in all if you guys like Disney IP and don’t mind spending the extra money, I’d go with Disney. I think it’s the most unique (very different from WDW in my experiences), memorable, and quintessential, but if you guys will be bored with the tamer rides then you may consider one of the others."
37182,"Born and raised in LA and Disneyland is the best. I’m not a Disney fanatic (in fact, I’m more a movie person so I thought Universal would be more my jam) but Disneyland is pristine. It’s expensive but if you’re gonna make a day out of it, just go to the top"
37183,"PS If you have the money, Disneyland offers private tours where you don’t have to wait in line. It’s insanely expensive but just throwing it out there if money is not an issue"
37184,"Dunno if there are passes available for Disneyland or California Adventure (Marvel’s campus opened 2 weeks ago) but out of all of them: I prefer Disneyland (I am a Star Wars fan) and like snacking and drinking at California Adventure.

If you go I suggest parking across from the park at the Anaheim Hotel- it’s $25 and doesn’t involve a 2 mile hike to a parkade."
37185,"If you're going for the best overall experience inside the park, I say Disneyland. If you're looking for the best roller coasters, then you should go with Six Flags. If you want the best bang for your buck and a great experience outside the park, I'd go with Knott's Berry Farm. 

Personally, I like Knott's, because:

* I felt that the ratio of ride:wait was the best (albeit from my experience a few years ago).
* Compared to the other amusement parks, they were moderately-priced.
* It has lots of variety in rides.
* The food options are decent inside the park.
* There's great Korean food right outside the park, from Korean soups to Korean BBQ. There's also a huge plaza nearby called [The Source](https://www.thesourceoc.com/), which has a lot of things to do and eat.
* There's a [Porto's](https://www.portosbakery.com/) bakery very close to the park. They're a beloved bakery in the Greater Los Angeles area, and I really love their Milk and Berries cake. Their potato balls, Plato de Pollo, and fresh fruit tartlets are also very good."
37186,"I was gonna say that excluding Disney and Universal isn't fair, but then I realized that if they were included they'd just take over every state."
37187,yup
37188,Ohio and Pennsylvania beg to differ.
37189,"Nah, Disney would still win out.  There's thousands upon  thousands of Annual Passholders in OHIO.  It's really insane the reach Disney has for it's parks."
37190,Nah Pennsylvania is spot on
37191,Living in Utah most people out here have never heard of Cedar Point or Kings Island. They are destination parks for enthusiasts but for the general public it's all about Disney...and ever since the Wizarding World opened it extends to Universal.
37192,"Living in Tennessee , I disagree"
37193,You guys are 2 states away from Cedar Point. It's a regional park and you guys aren't that far. When I tell people I'm going to Cedar Point they all ask what it is.
37194,"Despite being a 13 hour drive for me, most of my friends and neighbors down here very much know if cedar point."
37195,"Like I said, you're still close enough for it to be regional for you. You can drive there. Out west it's far less known. Within a few states it's definitely well known."
37196,"It’s “Amusement” parks not “Theme” parks. Although, Knott’s kinda feels like it’s more of a theme park"
37197,I've always considered amusement parks a broader category that also includes theme parks.
