idx,text
69816,"Choosing a degree is about finding a balance between what you will enjoy and be able to do well, and what will bring you income.

Although you don't want to study something you hate just because it will help you earn a lot, if you study something that you love that brings you no income potential, you are likely to end up doing something you hate anyway, but for much less money.

The best case scenario is that you're passionate about something that has a high probability of leading you to a high income career (e.g., Computer Science today).  But for many people this isn't a reality.

What I would do is try to as much data about the earning potential of each degree, and then work your way through the list identifying the ones that you think strike the best balance between what you enjoy and are competent at, and what have the potential to bring you high income.

Also remember that college education is not the only way to secure a well-paying career.  If you are about to go into massive debt for it, it may be worth considering alternatives (e.g., electrical work, plumbing, etc...).  Personally, I am a big fan of higher education, but I was lucky enough to be in the group where my passion correlated well with a field with high earning potential.  Having watched many friends over the years, this is not always the case.

Oh, and all that other stuff about the degree not guaranteeing you anything, and it being just as much about you working hard, and having the right natural ability and skills, etc..."
69817,"Not sure about the US but there are tales of plumbers earning £100k+ in London, so if you only care about the money maybe you don't even need a degree"
69818,"Asking about the ""best"" degree is a bit silly. Earning lots of money is a very poor reason to get a higher education. Based on both of your questions, I suggest you rethink going to college at all. You're not the kind of person who could benefit from an impressive college or an impressive degree program."
69819,"MBA is probably the most consistent earner that I've seen in my career. Everyone has a BA/BS and the MBA, at least in a business environment, seems to have the most broad appeal for a variety of opportunities. I myself have a CompSci degree but found that was limiting in a business environment to CIO/CTO. 
Depends on what you want to do really..."
69820,"The degree won't do shit.. It's your ability to set yourself up in the right place, put in the work and seek the opportunities that will help you earn ""lots of money"".

Everyone here keeps saying CompSci like it's a gravy train to high salaries. The fact of the matter is, a large number of people who do CS are not qualified in any way to become software engineers - they do the degree because they think it'll set them up without putting in the work to build their resumes or get internships or do side projects. 

Aim to get into the best university you can, choose any traditional subject, think about which career path you want to go down and then execute what needs to be done to be successful in both entering that career path and progressing."
69821,Underwater basket weaving.
69822,"Computer science, Electrical engineering, or the physical sciences...but more importantly get a good internship and acquire useful skills as a student. My husband and I both work in STEM areas and have such a hard time hiring. We desperately need students who know how to do something useful coming out of undergrad, and those skills just aren't really taught in the classroom. Make the best of your education by learning how to apply every summer."
69823,"This is a terrible question and mindset. Conversely, so is picking a major solely based on what you like or for prestige. 

Pick a major based on WHERE you want to live and HOW you want to live after school. You could go learn a trade and love like a king in certain places, and you could get a STEM degree with honors and experience and live paycheck to paycheck. Any degree is only as valuable as you make it, and you make it valuable by maximizing your opportunity with location as well as living a lifestyle that fits the job and maximizes how you'd like to live. Example...medical or financial fields can make great pay, but you're going to have to get used to 60+ hour weeks."
69824,"Computer Science, Engineering, almost any STEM field..."
69825,"Computer Science and/or Engineering. I’m doing both and as an intern in college the average chap (if you did the math out on a weekly basis) will earn as much if not much more than most other majors will in their first few years after graduation. Again - there are outliers, but generally speaking we earn the most *on average* while also having some of the best demand possible for our professions."
69826,Biomedical engineeering
69827,"+1 for this, I went this route and now work in financial technology. It’s the easiest degree to branch out into other fields from"
69828,"I haven't heard that often, so that makes me hopeful"
69829,computer science or business.
69830,"Anything with healthcare informatics, machine learning, and software engineering"
69831,"Geology!

Edit: I'm sold!"
69832,"You will forever have to hear some iteration of ""geology rocks"" and other geology puns by people not in geology.

But seriously, it's an incredibly fun major with lots of field trips and camping. Also a lot of hard work with chemistry/physics/math, but still fun. Job prospects are pretty decent, too."
69833,"I respectfully disagree - geologists subject themselves to far more puns than non-geologists could ever dream up.  Most people don't know about gneiss and schist, but geologists abuse them endlessly.  Of course, I'm totally complicit in this."
69834,"You don't know schist about geology, do you?"
69835,Gneiss pun dude.
69836,"**Pros:** 

Field work/being outside all the time

Becoming a rock-pun-master

Drinking a lot of beer

Crazy professors

**Cons:** 

Sometimes you drink too much beer.

Ha just kidding, there are no cons."
69837,"Con: Every horizontal surface in your home *will* become covered in rocks.

edit: Yes, this includes your bed."
69838,"Would you call that (•_•) / ( •_•)>⌐■-■ / (⌐■_■)

Bedrock?"
69839,"Pros: Field trips, beer, and everyone has big science beards.

Cons: Everyone has big science beards, so yours will need to be exceptional."
69840,"It's a great major. You'll learn things about the earth you never would in any other field. Field work is fun. If your experience in it is anything like mine, be prepared to work in a lab for a lot of the first few years. Job prospects are great even with just a Bachelor's. Also, rocks are a good present to give to people if they are particularly nice, I like to give people slabs of Copper ore. It looks really nice when cut and polished and it's cool because I got it myself.

Advice: Invest in a good pair of hiking boots, a rock hammer, a hand lens, pocket knife, and a good backpack. Optionally a tent and sleeping bag and other basic camping gear because you don't want to be that guy who always asks to share a tent/ other essentials."
69841,"Just a word of warning coming from a recently graduated geologist (graduated 2013), if you have the misfortune of graduating during a market downturn things will be really difficult.  My graduating class has about a 25-30% employment rate in our chosen field.  I was lucky enough to know someone in the industry to get my foot in the door, but if I was you I would be networking as best I could during your university years and leave grad school open as an option just in case!

Otherwise, everything here checks out.  Your classmates will probably be a bunch of loveable wierdos who like to drink too much. Your profs will be awesome and field schools are tough work, but a lot of fun.  

Good luck!"
69842,Forestry or park ranger.
69843,"I work in private forestry.   Overall it's a good field.  Obviously you get to work in the wilderness.  I enjoy driving around and seeing some really beautiful country.  The hours are good, just early.  Earning potential is generally good but not amazing.  Timber markets can fluctuate very hard and make job security not the best, depending on who you work for.  I'd say just be absolutely sure you love working outside, rain or shine.  Days where you are working on a steep ass slope, crawling through thorny underbrush in the rain can be really taxing.  On the other hand, good days make it feel like you've got the best job in the world."
69844,"So you said you work outside, see beautiful scenery, work in the rain, crawl through bushes, but can you explain more of what you actually do? Like, what is a typical day for you? I've been interested in forestry for a long time, but I've never really been sure of what I could do with it."
69845,"Sent you a pm.

*Edit.  Sorry, sadly a lot of people these days don't understand or have a negative perception of forestry so I was hesitant to ramble about it.

My experience is a bit different than the usual.  I work for a very small company, so I end up doing a little bit of everything whereas most foresters work for a government entity (Forest Service, BLM, State Forestry) or a timber company and specialize in one or two areas.

Here are some common duties.

* Cruising, if necessary.  This is estimating the volume of timber in the forest using data collection and statistics.

* Unit Layout. Finding and marking property lines, which is often not easy in the middle of nowhere.  If no monuments exist, they need to be surveyed in.  Evaluating access.  If necessary, designing roads and/or obtaining permission to use a neighbor's property.  Protecting sensitive areas from logging operations, such as streams, wet areas, unstable areas, and certain wildlife species.

* Permitting.  This is highly dependent on the state you're working in and its forest policies.

* Logging Bidding.  Finding loggers, showing them the project.  Evaluating bids in regard to cost, timeliness, experience, equipment, availability, etc.

* Timber Marketing.  Timber mills are all different and specialize in processing different species and different sizes of timber.  Working with mills to find maximum value in terms of price they are willing to pay and the cost it takes to transport those logs


* Contract Management.  Checking on the project to make sure all of the above is getting executed properly and timely.

* Reforestation.  Finding seedlings, supervising the planting process, deciding on any herbicides that need to be applied to slow growth of competing species.

* This is the industry side of forestry.  There are many other jobs, like working for the state ensuring people are following rules, fighting forest fires, being a park ranger, studying ecology/hydrology/etc.

[OSU](http://www.forestry.oregonstate.edu/academic-programs/undergraduates/undergraduate-majors) has a pretty good breakdown of different forestry focuses and careers.  There are many jobs that don't require a degree, though."
69846,Why pm? Just post it!?
69847,International Relations
69848,"Pro: Very interesting material, especially if its a topic you like.
Its similar skills as a history degree but more marketable.

Con: Be prepared to work in NYC, DC, or abroad cause thats where pretty much all the IR jobs are. Also can be a pro, depends on how you feel about living there.
Not a bad job market but not great either, it can be tough to break into.
Use as many connections as you can to land a job"
69849,"I majored in International Studies, but close enough. 

Tips:

-study abroad as much as you can

-internships every summer

-learn a foreign language

-specialize in a region of the world (preferably Asia or the Middle East)

-ideally, match your specialization with your study abroad experience and language choice (ex - if you want to focus on the Middle East, study in the Middle East/North Africa and study Arabic)


Pros:

-flexible, more so than poli sci; you can get a lot of the poli sci jobs with International Relations but can also market it to businesses, schools, and non-profits; you can do this with a poli sci, but in my experience having the more international focus tends to draw more attention

-interesting, relevant subject material

-makes study abroad much easier credit-wise

Cons:

-you'll probably end up working abroad/in DC 

-you'll most likely work for the government or a non-profit (although businesses might take you, especially you have honed your language skills), meaning the pay isn't that fantastic

-it's so broad it's hard to narrow down what you want to focus on"
69850,"Aerospace engineering 

Edit: wow lots of advice from you guys, thanks I really appreciate,"
69851,Get ready to question why you did this to yourself for the whole time you're in college. That paycheck will pay off though.
69852,"Piggy backing on this comment. Some of your course work will be insane, but stay on top of it. Also, keep your nose clean and go after jobs that require a security clearance (any level). You will probably not be a millionaire in this field, but you should be very comfortable. 

Source: Aerospace Engineer 6+ years. Graduated from Auburn University in Alabama"
69854,"Cosmolgy/Astrophysics! 

edit: thank you so much for all the advice! I know it won't be easy but hey, no pain no gain right :P I'm actually going to work really hard on my math now after this. And if I slack, I'll just go back to this page and re-read everything."
69855,"Astronomer here!  Good for you! :) Warning: it is *really* hard.  And incredibly competitive at every level, for little pay compared to what you'd get in industry.

That said, I rather love what I do, and can't believe I get paid for it, so ask if you have any questions! (Edit: for those interested, [here](http://www.reddit.com/r/Andromeda321/comments/31omlf/so_you_want_to_be_an_astronomer/) is a good post to get you started on what astronomers do, and how to become one...)

Edit 2: some of my personal pros and cons from further downstream

Pros: getting paid to increase my level of understanding about the universe, teaching is a joy, as is writing, and my colleagues are incredibly wonderful.  And when it works *wow*, there's nothing cooler than knowing something in the universe no one else knows!

Cons: stuff doesn't work a *lot* so everything takes way longer than you think it will, I don't like programming but really need to do a decent amount of it, and sometimes the people I work with can be incredibly frustrating (amazingly, not always completely different people from those listed under the pros)"
69856,"A few of the perks, according to my astrophysics prof:

1. When astronomers get together, they drink.

2. The higher altitude of most observatories means getting drunk is cheaper.

3. The drink helps you forget how little you're getting paid for this."
69857,"Mechanical Engineering

edit: I appreciate all the answers! If it can help narrow things down, I specifically want to work with cars.

edit 2: bc I got this a bunch of times, I am committed to RIT and I will be joining their FSAE team"
69858,"Been doing it for a few years, graduated in 2009

Pros: Great pay, constant need for work, lots of options, fun work.

Cons: There is also a lot of competition, given how popular engineering is right now. College really doesn't prepare you like I think it should, you need real life experience before you'll truly be helpful."
69859,"I've had my degree for seven years. One of the biggest benefits is that mechanical engineering can be used in every industry and there is a wide variety of jobs available. The downside is that once you graduate and get that first job, it is very hard to get into a different industry or a different role in the same industry.

Let's say you graduate and start working in the manufacturing division of a medical device manufacturer. After a few years it grows boring and you want to try something else. Want to work as a designer for a car company? You have no chance of landing that job. You are considered to have the same experience as somebody fresh out of college for that job, but will be needing a bigger salary to match your raises at your previous job. The only way to move from one industry to another would be a similar role in the new industry (manufacturing engineer of medical devices to manufacturing engineer of automobiles). Even then, it can still be difficult. Sure, the overall goals of reducing scrap, increasing production, etc. will still be the same. However, each industry will be held to different regulations that somebody with a few years experience will be expected to know. 

To move to a different role, the easiest way is to take a new position within your company (manufacturing engineer of medical devices to design engineer of medical devices). However, if you are unhappy with the industry you are in this solves nothing. 

I don't mean to use this to discourage you to pursue a degree in mechanical engineering, just a word of caution for when you are graduating and looking for that first job. If you need further examples, look into job postings for Mechanical Engineering jobs that require a few years of job experience. The specific requirements listed will show you how difficult it can be to land the job without experience in that field."
69860,"Just graduated last week.

Pros: Great starting pay. Lots of jobs. Interesting and challenging work. 

Cons: You will work  a lot harder than your friends in school. 

It will definitely be worth it in the end! I highly recommend it!"
69861,What job opportunities are there?
69862,"Look around the room you're in. 

Nearly everything you see came across a mechanical engineers desk in some stage of development."
69863,"There are tons of job opportunities for Mechanicals specifically.  It's the broadest field of engineering.  You could do anything from programming an automated assembly line, sitting on a computer designing, being out on a factory floor troubleshooting a problem, basically anything...  I just graduated last week from Missouri S&T, it is VERY uncommon for a Mechanical to graduate without a job lined up.  I highly recommend it."
69865,It becomes very proof heavy and theoretical. It's almost like another language.
69866,"I just found some of my 400 level algebra and analysis notebooks and flipped through them.  I can't believe that I could ever understand that stuff, let alone successfully complete 20-something credits in the pure math emphasis.  The coder that sits next to me at work couldn't even grasp that .9 repeating = 1."
69867,"Mathematics student here, here's my input:

Pros:

- There seems to be many post-college options, especially if you have to learn programming as well like we do here.

- If you like challenges and love math, it can be very enjoyable at times

- Not that many people want to study just mathematics in college, most take CS or something like that instead, thus, you will have classes that very few people attend, the ones only for math students. Which can be quite fun compared to the huge lectures that have hundreds of students attending. You'll also get more personal attention.

Cons:

- It's hard, often really hard. Even if you were good at math in high school. Being good at math in high school helps but does not guarantee that you will do well when you major in math, especially if you are used to just memorizing a lot of stuff. 

- No matter how much you like maths, some of the material will be boring. Math requires a lot of precision, thus there are so many little details to remember about everything that can make a beautiful theorem seem quite boring. And those little details must not be missed, ever.

- Mathematicians tend to be very strict, I have classes where you can absolutely not redo a test, even if you are sick that day. And details matter, you will lose points on tests even if you understand the general idea but miss details.

- You'll have very little free time, there is a ton of homework and a lot of classes (I just had two big tests today and an exam yesterday). In many majors, you will just have lectures, in math, you will have lectures and classes to practice mathematics. My roommate literally has half as many hours I have that she has to spend at school and very little homework while I also have a lot of homework which is often quite challenging. There is a lot of information to learn and unlike many other majors, math requires a lot of practice.

- (can be a pro, depending on the person!) It is nothing like math in high school, it will be a whole different kind of mathematics. Like one of my professors says ""Mathematics is the art of proofs"". There is a lot of proofs and you have to think about maths very differently.

Overall, I am very happy with my choice to study mathematics but it is not for everyone."
69868,"Pro: Post college options

Cons: Tons of homework"
69869,"Environmental Science

Edit: thank you all for your replies and comments. I will be saving this comment thread as a reference during my college career. I really appreciate the time you all put in to comment"
69870,"Learn GIS and basic computer science.

Thank me later.

I knew a ton of Environmental majors in College. You will want to learn that technology , specifically ArcMap"
69871,"High Schoolers -- please consider a career in public health sciences! There is an enormous need for epidemiologists and biostatisticians, particularly ones with up-to-date coding and analysis skills. Data drives policy and great data can save lives."
69873,"College does help, but don't waste your money going to any big shot art institute. Really look at what your college options are what kind of program they offer, I'd say their web classes are a good indications of how up to date they are with current trends and development.

My college had a decent design program but shitty web classes, pretty much had to teach myself web after I graduated.

In the end though what really matters is the quality of your work. So try to find inspiration from everything. Also finding a job right out of college can be a real bitch unless you have excellent talent and networking skills. But don't expect to get the job your looking for right away.

Also I wouldn't limit yourself to just UI design. Yes UI design is getting huge, but that's just a small portion of what most employers look for. There's print, web, identity, illustration, etc... I have heard it's good to focus, but don't ignore these other areas."
69874,"Graphic designer here! I'm four years post design school, and I can say there are a lot of pros and not that many cons.

Pros: Good money, especially if you're in UI. Fun, interesting work that changes all the time (my clients range from the food industry to healthcare, to non profit, and almost every other thing you can think of). Very satisfying work--solving problems is fun!

Cons / Words of wisdom: Make sure you go to a school that focuses on a design CAREER, not one that only encourages you to express yourself artistically though design. I have friends that went to the second kind, and most of them are at shitty in-house jobs because they didn't know how to capitalize on their skills or deal with real clients."
69875,"Accounting, I've always heard it's a safe bet

Thanks for the info everyone"
69876,"1) /r/accounting - there are many stickied/sidebar posts to help you out there.

Pros: 

* The field is transferable to wherever you want to live

* Wide variety of fields/specializations to work in

Cons:

* The work will be boring when you first start out"
69877,r/accounting is like a cult for the big 4 accounting firms.
69878,"It's an echo of what is being preached at colleges and universities all over.  They only push Big 4, and as a result, a majority of the posts on the sub are from college kids trying to get a little bit of understanding about the Big 4.  There are, however, decent occasional posts where people talk about jobs outside the Big 4."
69879,"Be prepared for a shit storm of work. I'm studying for the CPA right now and it's more work than anything I did in college (and that says a lot). Accounting is a lot of work and even more work in the real world, but it can be rewarding"
