idx,text
3429,"I respectfully disagree with you on that. A webcam is a necessity. I know there are streamers that do very well without a camera, but they're the exception not the rule. 

Also, streaming for the sake of streaming won't get you anywhere on twitch. There are a million other small channels pushing out sub-par content and if you do the same you'll be lost in the bottomless pit that is the browse page. Success on twitch in my experience is very much a quality over quantity situation. You can still get in practice streams while pushing quality content if you plan ahead. 

I do agree with the ""creating highlight reels/clips for other platforms"" that is very much a DO THAT, but again you have to be careful to edit it in such a way that it plays out as more of an ""I'm a streamer and I'm entertaining"" video and less of ""hey look at me play this game"" because there are a billion of those videos out there already. Figure out a way to meme it up, zoom in on your face when you do something awesome to show your reaction, add slow motion to the play of the game or sound effects to make it funny. Anything to stand out."
3430,"You missed my statement then completely.... I see countless time people are not streaming just asking reddit for the best graphics/mics/cameras (which is fine) but they are not streaming too while they are just casually playing. Not even just recording. When you are not streaming/recording you are missing Opportunity to create something to put on another network for discoverability. I understand fully the people without webcams are the exception but no one is blowing up overnight when they buy the best webcam... You start by getting out there on another platform and what better way to do that is just start streaming so you can download the vods to make a clip or even just recording all your gameplay.

I'm just using streaming as an example to have your vod somewhere to download to create clips...you could just record strictly your gameplay instead of streaming but if you atleast press the go live button you can practice streaming cause many many many of us will stream to less than 5 people for a long time

Edit: also, if you are worried about missing up your twitch stats by just turning on your stream with no webcam or whatever you can always have a dummy account that you can use so you can go live whenever you are casually playing and not worry about ruing your (main account) and it's branding."
3431,"Apologies if I missed what you were going for. I'll try again.

&#x200B;

>  When you are not streaming/recording you are missing Opportunity to create something to put on another network for discoverability. 

True, but my point was that a quantity over quality strategy rarely works and when it does work it normally doesn't have any staying power.

&#x200B;

> no one is blowing up overnight when they buy the best webcam... 

Of course not, but at the same time no one is blowing up overnight streaming at 480p. Quality is the top priority if you want it to be more than a hobby.

&#x200B;

> You start by getting out there on another platform 

There are a hundred different ways to start. I was an affiliate and paying the internet bill with twitch money loooong before I started using other platforms to push people to my channel. Heck I still don't use other platforms as much as I should. Like I said in the previous post I agree with you that other platforms are important, but there's definitely a right way and a wrong way to do it. Posting unedited VOD's or highlights won't set you apart from the crowd and that's the real goal. If you're no different than the next new streamer on the list there's no reason for people to choose to stick with you. If I'm still misunderstanding I do apologize, not trying to be argumentative."
3432,"I am a BIG believer in the ""only spend Twitch money on Twitch equipment"" mindset.

Currently using my phone as a camera, I've got my old headset with a mic, it's okay. Will probably get the first payout soon so I'll be investing a part of it in the stream equipment, but so far I've only used the stuff that I had before. My lighting is literally an old desk lamp. I have one monitor, and all my games are windowed and occupy like 3/4 of the screen so I can read the chat.

And everything is going just fine.

Don't invest until you're sure it'll pay off."
3433,"Also got a C270 to start and am still using it. Have you figured out how to set the exposure manually? I play at night and the light from my monitor over exposes my face, besides that it works fine"
3434,I have my room lights 24/7 lmao. Ii only turn it off to sleep or when I leave
3435,Yeah I do too they just aren't bright enough to combat the monitor lol
3436,duke above columbia is bold
3437,Brown above Columbia too lmao I think Caltech and Columbia lead the 6-10 without a doubt
3438,I'd say Stanford should be at #2 or at least in Princeton's place.
3440,"US News and WSJ use ""faculty resources"" as a pretty big metric. This disadvantages places like UT Austin and UW Seattle, since they're public schools.

Georgia Tech is a STEM powerhouse, but I presume Case has a more broad focus.

at the end of the day, I think it's fair they're in the same bracket, and I think it's best to not really consider such tiny differences."
3442,"yup. 

Each school has different strengths though, UIUC is T5 for CS/Engineering, GT is T10 for engineering/cs, UT is t10 for engineering CS, business, UW is at that level for cs and life sciences/pre med etc, UCSD incredibly well rounded. 

To me, those are all STEM T25-30's easily, emphatically, beyond a shadow of a doubt. 

And all of them shine in global ranks like AWRU, THE (globals) which measure STEM faculty research prowess. These schools are an incredible opportunity to learn from geniuses for a much lower price."
3443,i liked this post and its reliability so mcuh i gave the wholesome award :)
3444,i like that
3445,"Penn should be above Brown, JHU should be a bit higher, Stanford should be higher than Princeton, Columbia should be #6 or 7

I think you really nailed 15-25 (which is the hardest part). GTech is probably too low"
3446,"Yeah. For Hopkins to move up, someone else needs to move down, and tbh, I don't see who would move down. Maybe NU, Brown or Dartmouth? But imo those are atleast as prestigious as JHU (outside of med/pre med), and I think it's up to the person at that point .

Penn is probably a bit more prestigious than Brown, but I also think Brown has it's own advantages. People picking between Penn and Brown don't need rankings lmao. And, Columbia could also probably be higher, but I think Caltech at 6 is pretty fair, so maybe 7.

If it was up to me, Stanford would be number 1 or 2 lol."
3448,Ya it’s either HYPSM people care about or T20s.
3449,You talk about HYPSM as the T5 but I don't see Stanford anywhere in the rankings?
3450,"Duh. Stanford doesn’t actually exist, remember?"
3451,oh shit. Stanford is number 5. That's why my whole thing fucked up ughhh. Tysm tho
3452,Lmao np
3453,you saw nothing.
3454,"I think these mixed college rankings are misguided. Any ranking will make subjective judgement of what makes a college ""good"". Popular rankings give methodologies from which you can figure out what they value in colleges. If you combine multiple rankings, you lose clarity on what the ranking considers ""good"". It makes it hard (or impossible) to know what it means for a college to be above another college in the ranking. 

If you make a ranking, you should say exactly what metrics go into the ranking. I doubt you can do that here."
3455,Caltech at 6 and brown at 7 make approximately zero sense
3456,Lol Brown at #6 is a bold choice
3457,"funny because I always remembered it at number 7...

^(you saw NOTHING)

And, also to respond to your point, I don't actually think it's unfair. Brown is as or more selective than Penn and peers, offers a arguably better undergraduate experience, and I would say I always saw it as a T10. It's almost definitely a peer to Penn. 

For example, Brown beats Chicago in cross admits by a bit, and loses to Penn and Duke by a bit (i.e. <10% margin) so it's fair to say Brown can compete with this set for undergraduate."
3458,"Building off of your point, I often see Penn being described as more prestigious than Brown (and Dartmouth, for that matter). That’s probably true in some circles, but I’ve always thought differently. 

Brown and Dartmouth are more like liberal arts colleges than they are graduate-level research universities, given their relative sparseness of grad programs and avowed focus on undergrads. This sinks their rankings but shouldn’t diminish their institutional reputations. As an undergrad there, both in allocation of resources and position in the social/cultural fabric of the university, you’re the protagonist. That’s a pretty great position to be in at an Ivy League school.

Meanwhile, Penn is basically a tad-less-prestigious cast of the same mold as Harvard, Columbia, and Stanford (to some extent): undergrad is just one school among a sea of grad programs. Unless you’re at Wharton, there’s no caveat like for Dartmouth and Brown: it’s just not quite as prestigious as some of its peer research universities. Moreover, Penn’s overall reputation is inflated by Wharton (as others in this thread have suggested), and its acceptance rate is deflated by the same (though it’s still less selective in aggregate than Brown)."
3459,Wharton > Brown > UPenn - I say this as a Brown student
3460,"The school I end up at > Wharton > Brown > UPenn 

I say this as a high school senior."
3461,Huh. I've honestly never heard of anyone refer to or think of Brown as a top 10 school.
3462,"Hmm, I always thought of Brown as a T10, but I don't think it really matters. If someone picking between Columbia Penn and Brown wants to use rankings to pick, their loss lol"
3463,"I mean isn't this a ranking too, that you made? lol"
3464,"Yes lol, I meant to say solely rankings. 

I just don't think Brown, Columbia and Penn are different enough in prestige/ranking to use rankings. It's not like you're comparing Columbia and Chico State, where rankings would be helpful. 

And, yea it is a ranking but it would be dumb to use this to pick between Brown, Penn and Columbia too."
3465,"Idk the way I see it in terms of preteige (with no experience whatsoever lmao) is Columbia, UPenn, brown but I think that’s also cause Columbia and UPenn are in bigger cities and because of that just have more opportunities in general"
3466,lmao hopkins aint 14th its got a billion dollar endowment
3467,"yeah but so does every other school from number 1 to 13. You can make some legit arguments for Hopkins to be higher, but it shouldn't be a contest of endowments at that level."
3468,idk man UCLA is too low
3469,"I would put UT Austin and Georgia Tech higher but other than that I agree with this list more than any other ranking list. That being said, I don’t really know a ton about every school so I can’t really say this with certainty."
3470,"UT Austin, GA Tech, Purdue, UIUC, UW Seattle, and UCSD to me are easily T30 for STEM. Their outcomes reflect that too, though. They all place excellently into grad school, UW/UCSD more than the others place excellently into medical school. 

All great, highly similar schools."
3471,"Yeah I agree. Obviously if this were deciding top school for their focal point, schools like UIUC would be close to the top. Which is why giving colleges an overall ranking is tough, as it depends what kind of school you’re looking for."
3473,"Here's the thing--all the rankings could be more accurately replaced with US News' academic reputation ranking. But you have to pay to unlock that/buy the magazine to see it, so instead everyone relies on a weird methodology that doesn't quite work to dream up the prestige of different colleges."
3474,Not me checking to make sure my dreamie isn't on this list because then I won't get in.
3475,Very informative!!!Thanks
3477,"I always saw Brown as more prestigious than Northwestern. 

It offers stronger undergrad education, and is harder to get into, and 65% of people who get into Brown and Northwestern pick Brown."
3478,">It offers stronger undergrad education

That feels pretty subjective, no? And you're comparing a 7% acceptance rate to a 9% acceptance rate. Not to mention acceptance rate is a wack way to measure prestige, generally -- and you say just as much in one of your comments here! There's no consistency lmao"
3479,"True with regard to the harder to get into part, though my comment was just intended to say that ""there's absolutely no way Brown should be in front of Northwestern"" is probably false. 

Brown is famous for offering a objectively strong undergraduate education, especially when compared to other top schools."
3481,i thought its princeton that consistently ranks n1?
3482,"dartmouth has always been number 1 undergrad for like the last 5 years, but slipped a bit a year ago, still is 4th best ivy"
3483,oh cool
3484,"Emory is ranked 21. Everything above Emory is top 20. People don't see NYU as the same because it's ranked 30.  You cannot combine rankings as the methodologies for each one are vastly different. If you combine them you essentially aren't controlling for anything.

( And how would this work if for instance GAtech is 35 on US news and 71 on WSJ...Why is it only 41 then?)"
3485,"After scaling the rankings, I then resorted them. So, my theory of why GA Tech got to 41 is because when I re sorted, I didn't include LAC's.

Without LAC's on WSJ, GA Tech would be around 45-50. So, then this 41 average makes more sense."
3486,I am almost positive you did this incorrectly. If you took out LAC's then Emory would be 21 on both US news and WSJ and a few other irregularities like Columbia and such.
3487,"This one has Forbes, albeit weighted less which slides Emory down. I also did one without Forbes which I didn't post (although I can, I guess), since they don't have a ranking this year, and seem to be less reliable. 

In the one without Forbes, Emory is 20, mainly because though UCLA is higher on US News and CMU is higher on WSJ, both are lower on average."
3488,Ya post that too to give a clearer picture. Forbes is really a messy ranking so a post without Forbes would give a solid picture. Post it if you can
3489,"Sure, I will. Not sure if I should make a separate post lol"
3490,Emory is def T20 what are you on lmao
3491,Yeah seems about right
3492,"Georgetown >> USC/WashU/ND/UCLA though. Outcomes are not even close. Might as well be racing an f1 car @ k1 speeds lmao.

You may have an argument in the context of aggregate research output, but most ppl on r/a2c, if not all, are looking for an undergraduate experience. 

Gtown is easily t15 for undergrad, and my mind is set on that."
3493,How is northeastern not even on that list rippp
3494,"Northeastern was the next one. It did see a pretty big split though. Forbes ranks them very low inexplicably, (well because they use 4 yr grad rate, so i didn't use NEU forbes)

Out of the other, more well known rankings, US News has them at 49, and WSJ/Times has them at 83 (including LAC's). So they miss out by a little."
3495,But I think they are better than Purdue though right? They have a much lower acceptance rate...
3496,"Purdue has an excellent engineering, CS, science, and math program. It's a world class STEM university.

Don't judge a school by it's acceptance rate. Then we'd consider SDSU better than UCSD which isn't true. Purdue has a small in state population, so a high acceptance rate. Purdue is a world class university.

I don't consider Northeastern as good of a school as Purdue since Purdue is a STEM powerhouse."
3497,"I think this is why rankings suck lmao. It’s so subjective, I think the fact that I’m from the northeast makes me see northeastern as much better than Purdue, because frankly I never heard of that school before this sub."
3498,"Purdue? I'm from Nevada, and I'd heard of Purdue a lot, never of Northeastern lol."
3499,lol people here think northeastern is better than northwestern (central pa)
3500,There’s no way just look at exit salary and sat range
3501,Idk man lol my friend got into northwestern and everyone was like “have fun in Boston” “northeastern is such a good school” and he had to be like I’m going to Chicago and northwestern is better it was pretty entertaining ngl
3502,Literally no one thinks that lmao
3503,In my experience a lot at my high school specifically do. I don’t get why people are so pressed
3504,"Well it's sort of like saying ""people think that Lehigh is better than UChicago"" or ""people think that George Washington is better than Yale"" or ""people think that Villanova is better than Cornell"". You're gonna get pushback because it's an inaccurate statement based on most metrics people are looking at. It is just not an opinion held by the vast, vast majority of people."
3505,I’m from the northeast and I don’t think anyone thinks this.
3506,"Well, in my experience, a bunch of people  think this, specifically at my school. It may not be the same where you live."
3507,This is an interesting ranking system. What was your reason for not including the Forbes college ranking list?
3508,"For me the Forbes ranking was not really relevant. First it uses very suspect data, like Payscale and Rate my professors.com etc, which I don't have any faith in. It also favors particular majors, doesn't take into account the fact that the coasts are more expensive to live in etc.
I feel that my outcome will be dependent on my major, where I choose to live, etc. Since I don't plan to major in Engineering which skews the salary data in a big way, I did not want to make my decision based on Forbes's output based ranking. I wanted to focus on input based measures for myself

I am sure for some the Forbes ranking makes more sense. For me it did not. I am focused on attending an academically good university. I don't want to judge that decision on ""what becomes of my peers, once they graduate"""
3509,"Yeah IMO Forbes, although not really considered by most people because of it's ""against the norm"" rankings, is actually one of the more accurate lists out there. Also, OP this ranking is seriously good, it seems to match the overall consensus here a lot more than most rankings. /u/acadranking 

**Edit:** Also, a general question - why are LACs excluded in a lot of rankings like US News?

Ok what did I say something wrong... why is this downvoted lol."
3510,"I could not get enough data on LAC's from the rankings that I used. Only USNews ranked the LACS among the four that I used

See my reasons above for why I did not use the Forbes ranking for myself"
3511,"Wait, Forbes actually officially admits they use that stuff? Are you sure? That's not good at all. Also by ""accurate"" I just meant by my own standards, obviously it's not perfect and a lot of it I definitely don't agree with, but I think it pairs nicely to counteract the US News low rating anomalies."
3512,https://www.forbes.com/sites/carolinehoward/2016/07/06/top-colleges-ranking-2016-the-full-methodology/#3ed514f85b82
3513,"They do. Also, since I will be a full pay student, their student debt metric while very important for other students, really doesn't work in my case."
3514,Yeah they did.  The Forbes ranking is pretty useless because of the data they use.  Garbage in - garbage out.
3515,This is a great idea. Someone should make an interactive college ranking where you choose how much to weight different factors.
3516,studentreview.com does just that I think- not sure how accurate it is but it's an interesting tool to play around with
3517,Pomona is for you
3518,Thank you. I do plan to look seriously at LAC's as well!
3519,Where's UT?
3521,Is too low -_-
3523,"Thank you for that suggestion. I have been thinking about the UK universities. I like the fact that it is easier to figure out if you will make it or not, because they are very clear on what they are seeking from an academic standpoint. 

The thing as you suggested though is that they also force you to specialize very early and the system is very different from the US system in terms of a well rounded liberal arts curriculum. 

Besides my Mom is kind of nervous to send me so far away :-) but they are also on the list for now!"
3524,They messed up big-time by not including Grand Canyon University in the Top 10.
3525,😀😀
3526,I can't believe people are forgetting that they are putting tons of funding into their non-ABET accredited engineering programs and their College of Doctoral Studies!
3527,"The list isn’t half bad. It generally follows prestige, no rank seems outlandish (although some people may take issue to public schools being in top 15), and shows you how the establishment and students think of a college.

I’d say every college here fits within a 3 spot radius up or down."
3528,"Maybe in the top-20, but as you go further up there are some schools that seem to be far out of place. BYU at 31? Carnegie Melon at 42 (behind UGA at 41?????) RPI at 95, yet WPI sits at 42 (similar schools, but RPI is no doubt more prestigious). UC Merced ahead of UC Riverside..."
3529,"It's a meta ranking. If several of the sources rank school A ahead of school B and students like going to school A more than school B, then A will be ahead of B. 

I think CMU took a hit because it's student ratings are not stellar."
3531,#15
3532,"I like the ranking gives a good difference, but not too unfamiliar. The top 30 is pretty much the same as US news top 30."
3533,Why tf is BYU so high? It's an objectively terrible place to go to college if you aren't a devout Mormon
3534,Right like attending BYU would be a one way ticket to electroshock therapy or immediate expulsion for a lot of people lmao
3535,Weather
3536,This is actually so important
3537,"hahah yeah, but other than noting factors like that, how else do i learn more about colleges?"
3538,"All schools are the same save two factors, amount of pretty people and weather, and usually better weather means more pretty people, so absolutely nothing matters beside weather."
3539,wait is the hotter weather=hotter people thing true? Makes sense lol
3540,Hot weather = more outdoor activities and less clothes so people are incentivized to get in shape and look more attractive. I guess that’s why Southern Florida and California have some of the best looking people.
3541,Yes!!! UCLA and USC have tons of hot people and LA is pretty hot.
3543,not me basing my college list off of this
3544,bump ^
