idx,text
37026,"Cedar Point is literally the worst example for theming. Their ""theming"" is pretty much just the lake setting. None of the rides have themes except maybe for Maverick, but they have done a terrible job keeping the theme up and now it's basically nonexistent. I love CP but that's ridiculous to say they have good theming compared to a place like BGW."
37027,"I don't think Cedar Point really has to use theming. It is just an amusment park. I think what they do right now it perfect: Using the land and great landscaping to make the rides look their best. When I went to Six Flags I hated their theming. It looked tacking, cheap, and ugly. Also, the look of a bunch of differently themed rides next to each other isn't that great. Theme parks should be the only parks that theme their rides. Amusement parks shouldn't have to. Theme parks do it much better because they are able to theme entire parks of the park to make everything match and look its best. I like the direction that the Cedar Fair parks are going, but I guess everyone has a different opinion."
37028,">I don't think Cedar Point really has to use theming. It is just an amusment park. 

I never said CP needs to do theming, I said it's one of the worst parks that you could use as an example of good theming, because it doesn't have any."
37029,"No, what I meant is the trees and the beautification. Cedar Point has no themeing I agree."
37030,"Europe does not seem to push the envelope with roller coasters the way the US does, but boy do you guys have a higher standard for parks than us. I was having this conversation with someone at work the other day (not sure how this came up) and told them I didn't think a Six Flags park would be very successful in Europe. Europapark and Alton Towers are probably the two nicest parks I've ever been to. They just blew me away. That level of dedication to quality is rare over here. 

As someone who has a Six Flags as my nearest park (Great Adventure), I almost visit begrudgingly. I go because they have one of the best rides I've ever been on (El Toro), but almost always have some level of regret at going while I'm there. There are few redeeming factors about the overall experience outside of the few top notch rides they have. 

Busch Gardens Williamsburg is a park that maintains a European level quality standard. I was a season pass holder when I lived in North Carolina and I never got bored of going to that place. It's just a pleasant place to be in outside of the ride experience."
37031,How long ago did you go to Alton towers?
37032,[Last September](http://jonathanhawkins.net/2012/09/alton-towers/).
37033,"The water on nemesis is still dyed red, you were just in the off season, and it was a real shame that the 2005 plans fell through, as Alton towers alternate between family rides and rollercoasters yearly I suppose there is hope for 2015. The smiler (SW7) is my favorite ride there, it's got that same short looping bursts that nemesis has with less G forces and is very intertwined with itself, making all of the loops and bends flow incredibly well.
Edit: [Video]( https://www.youtube.com/watch?v=7UrqbWF9fJ8&feature=youtube_gdata_player) very little pov footage but a good idea of the track based clusterfuck."
37034,"Welcome to the US!  I just recently returned from a trip to Germany and was blown away at how nice most of the parks are in your area.  Europa may be the best theme park on the planet while Phantasialand, Efteling, and Tripsdrill are all world class.

Unfortunately, a majority of the large regional parks in the US are average to poor when it comes to atmosphere, theme, and attention to detail.  The only place that can compare to Europa or Phantasialand is Disneyland which you should definitely visit while you're in California. 

I don't know where else in the US you are planning to visit but Busch Gardens, Hersheypark, Silver Dollar City, Dollywood, and the Universal parks are just a notch below but still pretty good.  Cedar Fair and Six Flags parks have some good rides but don't expect a lot of atmosphere to go with it.  On the other hand, we have a ton of small parks, family parks, and boardwalks that are charming in their own way."
37035,"Thanks for the advice! Unfortunately, we have a very tight schedule because we only have two weeks and want to drive to SF, Yosemite (if it hasn't burn down until next week... ) and LV. We ruled out the Universal Studios because we all are not that into movies and we think Disney land is too expensive and we'd rather see some more of LA while we are here. 


Oh and I'm glad you liked Germany :-)"
37036,Did you ride Apocalypse? It's soooo much better than Colossus (colossus is only good when seated at the front of the train) and I'm really disappointed you didn't get to on X2 -that ride and Tatsu are arguably the two best coasters ever made.
37037,Great to hear that I not only missed the great X2 but also another great ride because both were closed. Thanks for rubbing salt into it :-P
37038,Doubt it. Apocalypse has been closed. Saw they were doing some track work/inspections.
37039,Since when??
37040,"Been almost a week I believe.

http://themeparkreview.com/forum/viewtopic.php?f=2&t=26782&start=32560"
37041,"Welcome to our country! Hope you like Cali, but i have a bone to pick with you. Scream, Riddlers Revenge and Batman almost suck the big one? Seriously? Those rides are fantastic, if a little rocky and relatively ""old"". I do agree with you on the theming though (Scream especially). But they definitely went for thrill over theme, and in most cases it doesn't bother me because frankly the thrill of the ride outweighs any lack of theme or scenery."
37042,Scream used to be great but is aging badly. RR however is still as epic as ever!
37043,"Just constant heat from both above, and below will do that to steel that just sits like that."
37044,"Yeah I definitely agree with you that Scream is a fantastic ride. Very nice elements and a lot of action. But it has seen better times and the dozen punches to the head are a unforgivable deal breaker for me. Same goes for Riddler. Batman however was tolerable, I have to admit that. I very much appreciate that modern coasters tend to get away from over head restraints and try to give the rider a free experience around his head.


Thrill is in fact something we see seldomly in Europe. But as I said, I'd now say that I prefer themeing over thrill."
37045,"Some of the newer coasters do not have landscape features, which I've come to notice (Scream, X2, Tatsu to an extent). Older rides (Gold Rusher, Revolution, Ninja) seem to be built around the landscape. I guess over time SFMM decided to go more for thrill than aesthetics, which I'm perfectly fine with since the newer coasters are pretty amazing. (As rickety as Revolution is, I do appreciate it's designed around landscape). 

As for Viper, it's only fun if you're taller than the headrests, otherwise you're going to have a bad time."
37046,I used to hate viper but I enjoy it now.. Maybe it is just because I am taller :P ... Tatsu uses the landscape well.
37047,"The restrains on Viper dig into my shoulders a bit too much, so I would say that being too tall also has its disadvantages."
37048,"I'm rather small (173cm, convert yourself :-P) and yet I have a nice bruise on my shoulder. Not great for a day at the beach :-("
37049,"I'm too tall for Viper, it's painful."
37051,"Yeah, the fact that the rides at SFMM are mostly over concrete does bother me- particularly Scream. It really does take away from how solid the ride could be!"
37052,At least they finally painted over the parking stripes...
37053,"OP, what about Lex Luthor???"
37054,Lex Luthor? Did I miss something? O.o
37055,"Well its not a coaster, but currently the worlds tallest and fastest drop ride"
37056,"Ah, yeah that one. I don't like those rides but I got a good look while I waited for my friend to ride it ;-)"
37057,I understand where you're coming from. I'm from New York and I've been waiting to ride X since it first opened 11 years ago or whatever. We finally made it to six flags magic mountain and it was closed all day. Biggest disappointment of my life thus far.
37058,I wouldn't go that far but I mourned pretty much all morning and again in the afternoon when we passed it.
37059,"hey, 11 years is pretty fucking long for a 19 year old. I was devastated."
37060,"Alton towers local here, wondering how well themed parks in the US are, any examples/averages?"
37061,"I have noticed that a few Six Flags parks do not do much in turns of landscaping. That is another thing Cedar Fair (and other parks like Bush Gardens) has. They design their rides to not only be fun to ride, but to also look nice. I noticed that at all the Cedar Fair parks I have been to almost all of the thrill rides and roller coasters were placed to fit in with the landscape. The roller coasters had grass, rocks, etc. under them and were not just placed over concrete."
37062,"BG>CF>SF with respect to landscaping.

Cheetah Hunt at BGT probably has the best scenery and landscaping value of all the ~100 roller coasters I have ever been on. Big Bad Wolf at BGW was thrilling due to the trees, especially in the autumn. Scream however..."
37063,"Putting grass under a coaster instead of concrete is still not themeing it. Have a look at Black Mamba (Phantasialand) or Blue Fire (Europapark). That is themeing! The coaster diving into dips and through caves, winding through the African desert like a snake or flashing through the scarce and rocky landscape of Iceland."
37064,"Well they do more than just drop it on a piece of grass. I didn't really know how to explain it. I was just trying to point out that other parks actually theme/landscape their rides instead of putting it on concrete like SF. Most Cedar Fair coasters are not really themed but have beautiful landscaping and placement in the park. Only a very few do have themeing in CF and I will admit that. Some of them do have slight themeing like Maverick at CP. Some of coasters that I have seen really themed are too short or not that fun because they spent so much to theme it or it is too distracting. Also, It just depends on what you think themeing is. Some people might say Maverick is themed, some may not. Same with the Smiler. Some people might want more themeing. Some people might not even liked themed coasters. It just depends on what you like and what parks you go to. I know it takes a lot to theme a ride, but different people may say different things and hate some themeing while liking others. Also, a lot of ""themed"" rides are not that themed.
Also, a lot of the coasters at CO and other CF parks are so fun and look so nice that they don't need to be themed.

Sorry for all the text. I am on mobile and have no idea how big this will be. I will have to shorten it later."
37065,I just went to Hersheypark and it's one of the best parks I've been to. I went to SFGAdv a few days prior and it pales in comparison.
37066,"If you're willing to go 6 and a half hours away, the easy answer is Cedar Point.

King's Dominion is a solid choice also from what I hear."
37067,"Kings Dominion is the obvious answer if you've never been - it's a shorter drive than Busch Gardens and one of the best parks in the Cedar Fair chain.

Pennsylvania parks like Hershey and Knoebels are also great answers. Knoebels in particular is a really unique family owned park that gets [tons of praise](https://www.reddit.com/r/rollercoasters/comments/6siqq8/dorney_knoebels_trip_report_august_5_2017/?st=jhtbue18&sh=95090906) in this sub."
37068,"Echoing Cedar Point, but also I vote Busch Gardens."
37069,"So, these rankings aren't purely done on park quality, but also on distance. I would read each description thoroughly. 

1) Busch Gardens Williamsburg: Fantastic coaster collection, great food/drinks, catchy music, great entertainment, and looks beautiful. You are transported into a new European country with each section. Overall an amazing atmosphere and one of the top parks in America. Plus, there's a lot to do in Williamsburg.

2) Hersheypark: Is it a bit further but is a really charming park with a top notch collection of 13 coasters, including some world class ones like Skyrush and Storm Runner. It's also pretty in most areas too, and you have a zoo and Hershey's Chocolate World right on site. You're getting the full package with it.

3) Kings Dominion: Has about as good of a coaster lineup as Hershey. I305 and Twisted Timbers are two of the most insane coaster experiences you're going to get. Besides the coasters, it has a really good flat ride collection and is shaded in most areas, but doesn't have much for non-thrill seekers. Still, it's a great place to spend a day and is right off of I-95.

4) Cedar Point: This park is only this low if driving six hours from DC is a hassle. Otherwise, Cedar Point is the best amusement park in the country (emphasis on ""amusement"" and not ""theme"": it's an extremely thrill-oriented park). It has the best coaster lineup in my opinion, with 17 roller coasters. The best and most insane ones are Maverick, Top Thrill Dragster, Millennium Force, and the recently-opened Steel Vengeance. You still have many more that would make most parks' top 5s. Besides the coasters, there is a plethora of thrilling flat rides, and other activities in area such as the nearby beach. You will also get great views on some of the rides. 

5) Knoebels: This is a more laid back, family-style park, but it's still fantastic. There are only a handful of good roller coasters but this park is incredibly quirky, shaded, and there are a LOT of activities to do there outside of them. Food is some of the best at any park, too. Something to note- admission is free, but you pay per-ride. Is slightly farther than Hershey.

6) Dollywood: Think of it as Busch Gardens quality but themed to the south. It's ranked this low because it's also several hours away, but it is a must visit. Fantastic theming, food, coasters (Lightning Rod holy shit) and music are rolled into one.

7) Six Flags Great Adventure: This park has El Toro, one of the greatest coasters ever built. It is a must ride for any coaster fan. It also has the tallest and second fastest roller coaster in the world, Kingda Ka. It also has Nitro, a very fun B&M hyper. Besides that? This park isn't that good. The rest of the coasters range from alright to pretty bad (and are mostly clones), but the big turnoff is how unimpressive it is to be in. It's dirty, not well shaded, is plastered in advertisements, and has mediocre food. If you want to do El Toro and Kingda Ka that badly it's worth it to visit once, but if you want a full park experience, you won't find it here.

8) Other PA parks: These include Kennywood, Dorney Park, and Waldameer. They have one standout roller coaster each (although Phantom's Revenge is considered to be amazing) but none are on El Toro's level and none of the three offer anything special either to travel a few hours to.

9) Six Flags America: Bad park overall. Sort of unpleasant to be in and has a mediocre coaster lineup. It is however the closest to you, but it's much more worth it to drive more to a better park."
37070,"Hersheypark, Knoebels, and Kings Dominion are all great. I still think Busch Gardens is the best choice though. There isn’t a bad ride, the park is clean, it’s completely beautiful, and it’s one of the best park experiences around. It’s honestly my third favorite park, only behind Cedar Point and Dollywood. There literally isn’t a bad thing about the park I can think of. Plus the food is amazing and not TOO expensive. Great Adventure is honestly probably the worst option."
37071,"Can concur, if you have done Gadv already and there is nothing new, it's not worth the ride. So much better coasters being built everywhere else. Gadv needs a RMC bad :("
37072,"Europa-Park hands down. The level of details and passion that goes into this park is insane. 

It's also been voted best park in the world for the last 4 years by Golden Ticket."
37073,"Knoebel's

EDIT: I should elaborate....  Knoebel's is an amazing park with an experience that you will not get anywhere else.  There are also 2 world class wooden coasters that aren't to be missed *(my non-enthusiast sisters were having a discussion about coasters and the one said that wooden just weren't her thing even though she'll ride them and the other one who had been to knoebel's told her that she would absolutely change her mind after riding those two)* as well as the flying turns which is a neat experience and a fun little steel coaster.  This is also a park that you could stop and spend a few hours at or spend a whole day at and enjoy yourself either way.

My personal opinion on Busch Gardens isn't horrible but when I went a few years ago solely as a coaster/ride enthusiast I really wasn't impressed.  I've found it to be the most expensive in terms of admission, food, merchandise and didn't rise to my expectations.  There isn't a bad ride there and it is a beautiful park but for someone who is/was focused on rides I felt like I was paying for a lot of stuff that I could have easily done without.  There are 2 new coasters since I've been there so maybe that helps and, aside from that, I also want to stress that this isn't saying it's a horrible park because it isn't but it doesn't rate high on my list simply because of what I'm looking for.  I'm far happier stopping at King's Dominion, paying less, and getting a lot more rides."
37075,"I echo the Cedar Point vote is you are up for a road trip.

If not, Busch Gardens Williamsburg is the way to go.  They have a really good collection of roller coasters and the park itself is one of the most beautiful parks in the country.

Hersheypark would be a close second for me.  They have a lot deeper collection of roller coasters but to me, they lack the top end quality that BGW has.  They have the quantity though.  They have 7 really good coasters.   It is also a really nice park, but not on the level of BGW.  Throw in the zoo that is attached, and Hersheypark is one of the few parks I could do more than a day at without getting bored."
37076,"If you do BGW you could add Kings Dominion to your trip easily.

Also Dollywood is in your area and is a wonderful park."
37077,Couple hours from DC?  Hershey or Kings Dominion would be the best.  I prefer Hershey but I haven't been to KD in a while.
37078,One that I haven't seen mentioned is if you want to combine rides and beach you could check out Morey's Pier in Wildwood NJ. A trio of neighboring piers built off the boardwalk with a handful of coasters including a nice super old school wooden one that goes out over the beach. Plus some good water park sections and you're at the damn beach! A longer drive than say Ocean City but about the same as VA Beach so worth thinking of.
37079,"If neither of you have visited Kings Dominion or Hersheypark, I highly recommend them. I live near DC, too, and I can't choose between KD, HP, and BGW as my favorite ""local"" park. No matter which one you visit, you're going to get amazing coasters, smooth operations, and a nice atmosphere. I think BGW has the best of all three categories, but the other three aren't bad at all. BGW has the most consistently good lineup, KD has the best ""standout"" coasters, and HP has the best variety. Operations clearly vary per visit, and while I can't recall HP or KD having slow ops, BGW has always memorably impressed me with its efficiency. Finally, BGW is a true theme park that has the most beautiful and immersive atmosphere. KD and HP both have parts that are kind of ugly in my opinion, but they also have some totally gorgeous areas as well. 

I've never been to Six Flags in New Jersey, but I've heard some not-so-nice things about it that can be read in this thread. Cedar Point is literally the greatest place on earth, but that's not a day trip for us down here (and you might need two days to cover everything there anyway!) But for a day trip from DC, you can't go wrong with Kings Dominion, Busch Gardens, or Hersheypark."
37080,I don't see why you can't go to both at some point. You live close enough that you're not too far from either.
37081,Cedar Point or Magic Mountain. Both just a couple hours by car or plane.
37082,"You can fly from the east coast to lax, then drive to santa clarita in a couple hours? Seems legit"
37083,If you're fast enough you can probably finish both parks in one day.
37084,Actually yeah. It’s about a 4.5 hour flight followed by a 1 hour drive. Expect 6-7 hours total. Not bad at all.
37085,"Plus you have to get to the airport at least an hour, probably 2 hours, before the plane takes off so there’s that"
37086,Which passes do you have?
37087,In that area? Easily King's Dominion or Busch Gardens Williamsburg. Busch Gardens is a great park but King's Dominion has better coasters.
37088,"Kings Dominion for amazing coasters and good atmosphere. Busch Gardens Williamsburg for amazing atmosphere and good coasters.
I wouldn't recommend anything else. Except maybe Hersheypark."
37089,"Here's the top 25 parks when sorted by median rated coaster

| Park                                        | Median |
|---------------------------------------------|-------:|
| Six Flags New England                       |    472 |
| Waldameer                                   |    430 |
| California's Great America                  |    429 |
| Carowinds                                   |    408 |
| Universal Studios Islands of Adventure      |    408 |
| Michigan's Adventure                        |    398 |
| Kemah Boardwalk                             |    390 |
| Holiday World                               |  389.5 |
| Busch Gardens Tampa                         |    387 |
| SeaWorld Orlando                            |    386 |
| Kings Island                                |    385 |
| Alabama Adventure & Splash Adventure        |    365 |
| Cedar Point                                 |    361 |
| Hersheypark                                 |    358 |
| Fun Spot America Kissimmee                  |    340 |
| Silver Dollar City                          |    339 |
| Six Flags Great Adventure                   |  331.5 |
| Worlds of Fun                               |    326 |
| Walt Disney World - Disney's Animal Kingdom |    323 |
| Knott's Berry Farm                          |    322 |
| Busch Gardens Williamsburg                  |    318 |
| Six Flags Fiesta Texas                      |  307.5 |
| Dorney Park & Wildwater Kingdom             |    303 |
| SeaWorld San Antonio                        |    303 |
| Kentucky Kingdom                            |  294.5 |

The point assignments of ""500 - #rank"" are less valuable than the underlying values used to calculate the original rankings, though."
37090,"I just updated the top 25 parks with all the unlisted coasters and total coaster counts. All unlisted coasters are worth zero points (think kiddie coasters, garbage coasters, Vekoma SLCs and Boomerangs). I also did the work for you and averaged every coaster, including the crap ones. (Sub-500 coasters are all in ""500th place"")

These deeeeefinitely factor when determining a median. Check out Six Flags New England and Carowinds for a hell of an example."
37091,Damn good for KK
37092,Sorry if the list sort was confusing - more points is better. KK is #25
37093,Oh lmao whoops
37094,"Good for CGA, holy crap."
37095,A list that shows Shock Wave at SFOT is better than Titan is a validated list to me!
37096,I don't get how clones like Tigris and Tempesto have such radically different rankings.
37097,Scenery and maintenance can play a huge part in the experience.  For one example that involves both I think FoF at KD is garbage and the one at KI is amazing.  The pre-show theme adds to the experience and when I get off the KD one I tend to have a headache while the KI one I don't seem to have the same issue (even though they both actually seem like similar ride experiences)
37098,"Nice work! As someone else said, it would be interesting to see these ranked by quality over quantity. Perhaps find the average score by dividing each score by the total number of roller coasters in the park? Or in the park that got a rank?"
37099,"I think a simple way to interpret quality over quantity is simply to look at the rankings of each individual coaster in the park and, well, that's it."
37100,Odd to see Wonder Woman vs Railblazer not be right next to each other... is one running better than the other or is it a matter of ridership?
37101,It's more of a matter of this still being an imperfect science. It'll improve each year as more people vote on it.
37102,"Maybe setting/park is an influence, it's mostly hard core enthusiasts who have been on both. Just based on trip reports I'd say WWGLC is actually running better than Railblazer, it doesn't have the three potholes on the hill to the brake run."
37103,Never realized how good SF Great America’s lineup really is. Might just be because it’s my home park
37104,Me neither. It was my biggest surprise when compiling this list. I expected it to be six or seven spots lower.
37105,Ok so I was looking back at the coaster rankings and HOLY SHIT lost coaster is actually ranked higher than steel Hawg wtf
37106,"Might be its uniqueness. Enthusiasts will appreciate a REALLY quirky and unique coaster more when they've already ridden one of the other five El Locos, perhaps?"
37107,Could be. I’ve always liked LoCoSuMo more so no complaints from me
37108,AKA a listing of the parks with the most coasters.
37109,"If you look at it more closely, you'll see that it's definitely about more than that. Parks with loads of B-coasters don't do nearly as well. Lots of those coasters might not even make it into the top 500 at all, hence they won't matter in the numbers game."
