idx,text
3545,"For researching colleges, I would recommend finding the differences within the ""basic differences"". like you said most schools can end up sounding really similar so here are some ways I guaged whether I would actually like it there (and depending on who you are, these might be differently prioritized for you):

1. Size: often low student-to-faculty ratio is paraded as this magic number, implying a high level of support but it just measures the number (not how it plays out). I would look into the average class sizes—do you want class sizes to be small and intimate, or do you not mind having large lectures?

2. Undergraduate Support: I think this would be less important for some, but how accessible are opportunities for undergrads? Would you be competing with graduate students? Do you mind mainly being taught by teacher assistants (usually graduates, more likely to occur in a bigger school), or would you prefer to be taught by professors (a staple of a smaller school)?

3. Campus setting!! A lot of people already mentioned weather, but I would also say considering the setting as in whether it's rural, suburban, or urban can play a big part in how much you would enjoy the school. It could also factor in the opportunities available e.g. if you're in a big city, you may have more opportunities BUT are you someone that doesn't really like the hustle and bustle of the city-scene? In more regards to unis, large urban areas can be more isolating OR have a more thriving social scene—in this case you'd have to research how current students would describe it.

4. Campus Culture!! (The vibes - I liked watching YouTube Day in the Life for this one too) This is a huge one in my opinion. This is solely based on your priorities and how you wanna spend the next ~4 years of your life. How many of the students are involved in greek life? Is there big party culture? How are sports prioritized? I think each of these have implications of their own. For instance, Dartmouth has an extremely high student participation rate in greek life compared to other Ivies and that has often been associated with increased rape culture, ""fratty"" culture, and negative implications of forming those social hierarchies. BUT   if you would like a party scene, then it's up to you! 

5. Diversity: this may be just because I grew up abroad, but I prioritized more diverse schools. You can find the diversity statistics of each school if you're interested. 

6. Clubs and strength of the programs you're interested in. Also, simply if they even have the program you want (you'd be surprised how many people apply to schools that don't even have their preferred major)

7. Price and how they expect you to pay or offer financial aid: is it loan-based, do they have merit-based scholarships, do they meet full demonstrated need etc.?

8. Do you want liberal arts education? What kind of curriculum do you like? 

Also, of course you may not know what your exact preferences are yet, but this could be a good start to research universities! Like some others mentioned, Reddit and Quora threads were a nice way to find more genuine opinions!

If you want to find more universities you like, you can
put in parameters you like and explore the results and also find out what the universities you like consider important/not important: https://bigfuture.collegeboard.org/college-search

Hope this helps! ^^.^"
3546,"this is really helpful, thanks!"
3547,"Try to get in touch with a current or former student. You can ask alumni that you or your parents/friends know personally, or you can ask around on the college's individual subreddit. 

I've also seen on a few college websites the option to speak 1-on-1 with current students, as well as your regional admissions officer."
3548,"thanks for the suggestions, i’ll be sure to do some of those!"
3549,"things you want! 

when I was researching colleges my list comprised mostly of the best programs for my major then location. 

after I was accepted, since I already knew that each of them had amazing programs for my major I started looking into things I wanted. I wanted a cityish environment, close proximity to a chipotle, maybe a target too, has club lacrosse, study abroad options, outside opportunities for undergrad in the area. 

I did these after I was accepted into my schools to narrow down where to go but you could definitely do this with your current college research"
3550,woww i'm not picky enough for that lol
3551,"same lmaooo i was like eh so-and-so store would be nice, but I can always adjust lol"
3552,"use Reddit threads! I usually searched things like “pros and cons of XXX university reddit” and “premed bio major at XXX university reddit”. and ofc you can branch out your searches however you’d like, if you’re wondering about clubs/programs/sports/greek life/etc

I usually add reddit afterwards so only reddit threads pop up - there’s tonnnns of different threads full of input from current students and such, it’s very helpful to get a sense of the school!"
3553,"oh facts that does seem like a really good idea, thanks for suggesting it :)"
3554,the net price calculator- #1 most important thing imo
3556,"[http://commondatasets.com/](http://commondatasets.com/)

Note: only good for T30s and nothing about vibes or student life, just what you can find in the common data set"
3557,Talk to students that go there!!
3558,Try to talk to students that go to schools and ask them what their average classmate is like and what a weekday and weekend is like for them. This can be tricky to do for a ton of schools but if you try to do it for a few it’s very helpful. At the end of the day it’s about how life is lived on campus and nothing else
3559,maybe try to look into fly-in programs? ik most of them are closed rn but some are open! my mentor really stresses the importance of “fit” so yes check them out 🤪free vacation too. and there are programs like Reed Junior Scholars and Dartmouth Bound that give insights to their schools and the application process.
3560,ooh good idea! are fly ins limited to urms and fgli or can anyone apply?
3561,"for the ones i’ve looked at yea they are limited to urms and fgil students :,("
3562,ahh ok i’m not a urm/fgli but thanks for the suggestion regardless :)
3563,The Reed one is open to everyone!
3564,Read about their mission and goals.
3565,"Follow them on social media. If you want even create a special anonymous account for it, most schools have at least a minimal presence on instagram and plenty have a lot of accounts to follow, everything from dining, career services, activities planning, sports, and clubs. After a while you can start to get a feel for the campus vibe!"
3566,"The best thing I did was get the Fiske Guide to Colleges. It gives an unbiased overview of a bunch of college, and helps you get a sense of what things you’d like in a school (ex: Greek life, campus housing, male to female ration, undergrad size, etc)."
3567,"1. do the colors look good on you? 

2. is the mascot scary? (im looking at you purdue boilermaker)

Anyone you can talk to that will be honest is a good source. Tours are really helpful or suck depending on what guide you get. Talk to someone you know going there if you can. Virtual student panels hosted by a specific group are good (ex engineering department, a sports team)"
