idx,text
37198,Does this exclude Disney and Universal parks?
37200,Does it also exclude seaworld?
37202,"Wow, I'm surprised that BGT is more popular than SWO"
37203,I'm not. BGT in my experience has been busier than SWO.
37204,Probably because the GP doesn't associate BGT with Blackfish.
37205,"Doesn’t look like it, Busch gardens is owned by Seaworld, and i don’t think it would be the most popular anywhere anyway."
37206,I meant the 3 Seaworld parks not other Seaworld owned parks like BGW and BGT.
37207,Florida is BGT so SeaWorld is included
37208,I'd be curious to see which states preferred Disney vs Universal. I'd imagine it'd be heavily in favor of Disney.
37209,You're probably right.
37210,I'm kinda surprised Knotts is more popular than SFMM tbh.
37211,Personal opinion obviously... I feel Knott’s is the far superior park. SFMM really only offers coasters while Knott’s is a much more complete theme park experience. Knott’s coaster lineup is nothing to shake your fist at either. It’s also much closer to LA proper than SFMM is.
37212,All fair points.
37213,"I live in Anaheim, so I'm only 15 or 20 minutes from Knott's, but about 2 hours from Magic Mountain. I go to MM once a year, and that's enough for me, but I just *love* spending time in Knott's. I go like 2 or 3 times a month, and while I try to ride Ghost Rider at least once per visit, most of my time there is spent just wandering around and enjoying the atmosphere. Imo, Ghost Town is the best themed land in the state, and I'll die on that hill."
37214,"i really don’t think it’s a matter of distance. i live in hollywood and the two parks are almost exactly equidistant from me, and, if anything, traffic going south into orange county is much worse. likewise, nearly two million people in the san fernando valley are much closer to magic mountain than knott’s. i really do think it comes down to magic mountain sort of being a shithole (i love it, but it is what it is) and knott’s being well-manicured and lovely. there also were problems with gangs at magic mountain and LA boomers seem to have never forgotten this (it was the first park that had metal detectors in SoCal, and this was a long while before they were installed at other parks)."
37215,They’re both pretty equidistant to LA proper.
37216,"It may not be on Google trends, though. A lot of people refer to each SF park as just ""Six Flags"" rather than its full name, and if you shorten the search term to just that, the difference is stark.

[https://trends.google.com/trends/explore?date=today%205-y&geo=US-CA&q=six%20flags,knott%27s%20berry%20farm](https://trends.google.com/trends/explore?date=today%205-y&geo=US-CA&q=six%20flags,knott%27s%20berry%20farm)

I compared Discovery Kingdom to Knott's also, so I don't think it's enough to make up for the gap, and even in the LA area SF is leading."
37217,"I see Knott’s still (just barely) winning in California when I shortened to just Six Flags. That’s when I look at them as topics instead of search terms, which I think is going to give a better sense of which park is searched more by the GP"
37218,"Honestly, it’s probably inly due to it’s proximity to Disneyland. If you’re on vacation for Disneyland, might as well set a day aside to drive the 3 miles and visit another family friendly park with more intense grownup rides as well"
37219,That's definitely a factor for families on vacation. I'd say it even affects the local GP cause Knott's has really been killing it with the food festivals and seasonal events that even rival Disneyland's. Scary Farm within the last 5 years alone has been drawing in TONS of locals (remember one maze getting a 3-4 hour wait last year) and its only getting better.
37220,"Theme Parks tend to have a broader appeal. You can't enjoy a day at SFMM if you don't like coasters where Knott's appeals to a lot more than that. They have fantastic food, decent shows, a cool Ghost Town area, fun family rides and coasters. I'd rather go to SFMM for the coasters but a lot of my non-coaster loving family members prefer Knott's."
37221,"I am not, half of my trips to Magic Mountain involve me wishing I had just gone to Knotts instead.  Often before I even make it into the park.  Twice I have been at SFMM stuck in lines at security, ticketing, and at the gate which left me waiting in total more than two hours to just get into the park.  Both times to find the lines inside the park moving with at worst like a 45 minute wait, frankly the park did not even feel that busy, those kinds of lines just to get into the park are unacceptable.

Combined with single train operations, frequent downtime, terrible food, lack of just about anything but coasters.  I have a much better time at Knotts.  A local might have a better opinion of the park, but as a tourist there are better ways to spend your day."
37222,I always see people crap on Magic Mountain for not having much besides their coasters but I never see that complaint about Cedar Point. SFMM could definitely use more but Cedar Point has some even bigger gaps (like a dark ride) but no one ever talks about that.
37223,"I have seen plenty of complaints about the lack of a dark ride, and the general lack of indoor areas at Cedar Point.  The bathrooms are also from like the 60s or 70s, they clean them but they look extremely old.  Both topics which are brought up to management during Q&A events with enthusiasts annually.  But Cedar Point still has a decent flat ride collection it’s mostly older but they have a good number of them.

Cedar Point and Magic Mountain are only really in competition online, and for a handful of coaster enthusiasts.  SFMM’s main competition is Knott’s, and then Disney and Universal."
37224,"Same. No coaster enthusiest would pick it over Knotts, most of the time. That said, walking around in the parks and laying for crappy food does nothing for me so Knotts brings pretty much nothing extra to the table."
37225,Knott's actually has some of the best food found in theme parks.  They really go the extra mile for guests without the weird corpfeel of Disneyland.
37226,It's decent for a theme park I suppose. Definitely better than MM.
37227,That Chicken Dinner and Knott's Berry Punch make Knott's worth visiting for me. Their food is up there with Dollywood and Silver Dollar City for me as the best theme park food. It's definitely a step above the stuff you get at your typical Six Flags or Cedar Fair park.
37228,Funny how KI and WoF are #1 in multiple other states but not their own.
37229,"Probably one of the best arguments as to why Geauga Lake actually served a purpose aside from ""stealing Cedar Point's business"".  People forget that Ohio is a large state and that people frequently travel across borders."
37230,"Not too surprising in WoF’s case considering it’s proximity to Kansas and Nebraska. And it’s hard to argue against SDC being the hot park of its own state. We discuss HW and KK a lot around here but attendance wise it doesn’t hold up to KI mega pass holder base range that’s just a days trip distance for folks in neighboring states. Same for Michigan, you can’t visit CP without spotting tons of MI license plates and guests wearing MI college or sports apparel."
37231,"That’s kinda why I’m optimistic for WoF’s future. Regional park owned by CF, in a fairly isolated area but in a big city. I think it should be moving in a good direction soon."
37232,"Looking at WoF's history, it seems like Cedar Fair had a lot of interest in the park for the first 15 years or so after they bought it and then haven't bothered to add any major coasters in over a decade. An 11 year drought is pretty shitty of them.

Dorney, ValleyFair and MiA all seem to be in the same boat. I hope you guys all see some new coasters, or at least some good relocations, soon. The theme of WoF seems pretty cool at least."
37233,There's rumors that Dorney's getting rid of Possessed (I hope not) and possibly putting in a gravity group coaster. They have room to build without removing Possessed though
37234,"I think sometimes Cedar Fair will remove rides they don't feel is worth the maintenance cost, even when they don't have a replacement lined up. Us over here at KI just lost Vortex and as far as I know there are no plans in place to put a new coaster in its spot.

I get that ridership was probably low but it was still a great ride. I wish they'd not take prominent coasters out until they have a replacement lined up."
37235,"Yeah I get that. It just sucks because Dorney hasn't had a new coaster in about 15 years, newest being Hydra. Possessed has become expensive to maintain it just sucks because it's a fun coaster"
37236,"I wonder if Cedar Fair decided that trying to compete in that area with Hersheypark and Great Adventure wasn't worth it once they bought the Paramount Parks. And at that point they just kind of left Dorney to wither on the vine.

I hope not. We may see some unexpected closures and relocations as a result of the pandemic if it continues much longer so who knows how things will end up. You guys are certainly past due for some new coasters though."
37237,"I hope not as well. Dorney was the park I went to as a kid all the time. To be fair, it can't compete anymore but easily could have if they added more rides"
37238,"There is a certain point that you can build a park to and then it makes more sense to stop.  One of the biggest lessons in this is Six Flags Worlds of Adventure in which Cedar Fair realized just how hard it is to repair a park that has been destroyed by growth.  Dorney has a charm that the big parks don't have and it's a different experience than the likes of KI and CP.  When I go to Dorney I'm really going for something different than the work that's involved in making sure you get to every ride you want to and if you start adding stuff you actually lessen the draw that Dorney has for me.  Even MiA is in this same classification.  Both of these parks also thrive on the combo of dry/water parks in the same day and, even though I'm not really ac water park guy, these are the parks that I wouldn't mind stopping at the water park because I don't feel like I'm ruining the dry park experience.

Bottom line is this: These small parks aren't aimed at the people that just want to spend the entire day going from ride to ride non-stop.  If you start trying to capture that audience you alienate an entire base of their visitors and net a gain of basically nothing."
37239,"That's a valid perspective. I don't disagree. And I think GL is a good example of too much, too fast.

They wouldn't necessarily have to expand the park to offer something new though. A coaster with low ridership could be replaced, or a strip of restaurants/shops which aren't popular.

I could see Thunderhawk and Steel Force staying put indefinitely since they are well known classics. If I had to pick from the list, I'd go with replacing the Wild Mouse with maybe a spinning coaster like Cobra's Curse if they want to stick with a family friendly option, or a compact Intamin if they want to add another ride for thrill seekers. The Wild Mouse model is everywhere and unremarkable, so nothing unique to the park would be lost.

I agree that not every park has to be huge and cater to coaster enthusiasts. But it wouldn't hurt to put something new in some of these smaller parks. Just to remind their regulars that CF hasn't forgotten about them at least."
37240,"I do have no idea how West Virginians could forsake their own Camden, though. It's unirionically the best part of their backwoods ass-backwards state."
37241,"I live in WV and I'm far closer to Hershey, KW, Knoebels, Dorney, KD, BGW, SFGAd, and probably even Waldameer and even CP.....  Even Carowinds might be closer.

Then again, I don't think Martinsburg counts for this argument ☺"
37242,Honestly I’m not sure what there is to do in ones spare time in a state like WV. I also imagine it’s the least contributive of the non-Ohio Kings Island base. It’s relatively pretty when driving through though on the way to Ohio. Guess I’ll have to check out Camden Park one day. It’s just hard to veer off the major interstates when traveling through these random states.
37243,"It's literally right next to an interstate, Dirk. And Big Dipper's airtime is not to be missed."
37244,Also SFGE
37245,"Maryland, Delaware, and Pennsylvania are all for Hersheypark."
37246,"Well I can guarantee no one was gonna be picking Six Flags America lol so yeah, Hershey it is"
37247,"Yeah, it's even crazy ppl in that state search more for KD than SFA"
37248,I went to SFA once and it was the worst experience I've ever had in an amusement part. Never again. I felt so unsafe on the rides and we only got on 4 rides in 5 hours when the park was basically empty
37249,This excludes Disney and Universal parks.
37250,Now I'm wondering what the map would look like if Disney and Universal parks were included.
37251,it wouldnt look very intresting
37252,Probably all Disney.
37253,"Some things that surprised me when looking through data: KD is more popular in Maryland than Six Flags America, KD is more popular than BGW in Virginia, Kings Island is more popular in Kentucky than Kentucky Kingdom and more popular in Indiana than Holiday World, SFOG is more popular in Alabama than both Park at OWA and Alabama Adventure, Great Escape is the most popular park in Vermont."
37254,"I feel like the KD stuff is off, especially considering how low their attendance is."
37255,"Wonder which specific search terms were checked? Almost all BGW-related searches in VA would be for just ""Busch Gardens"", not ""Busch Gardens Williamsburg"". I checked and searches for just ""Busch Gardens"" consistently top ""Kings Dominion""."
37256,"I measured these by topic, not by search term. Usually when one searches a search term, the related topic pops up. The reason I selected topic is because there exists many alternative search terms for theme parks.

Now that you brought it up though, I went back to double check. BGW actually has a slight edge over KD (measuring topics). However, this was unlike previously, as previously I was comparing 5 theme parks at a time. One of the parks I think was Dollywood, and a part of the eastern Virginia area preferred that park, maybe that's why KD was measured as the most popular - because when comparing just BGW and KD, BGW is more popular in those areas preferring Dollywood, perhaps giving BGW the slight edge. It's very close tho, it's the most polarizing measurement out of all the states I've measured."
37257,"KD pulls in 1.5 million+ visitors every year, I wouldn’t call that low"
37258,"I mean, that's like half of BGW. That's why I think it's weird."
37259,"Well you gotta think about it like this, BGW is mostly pulling in from the tidewater region and southern Va. KD pulls from Richmond and DC/NoVa which are much more populated and people from there probably don’t wanna drive an extra 1.5 hours just to go to BGW. If this map is based off internet searches, KD is located near more densely populated areas which in turn results in more internet searches.

I hope this makes sense, I tried to not sound too technical."
37260,"Sure, I mistakenly thought this was based on something else. That makes sense, at least a little bit. Still seems weird that this many areas draw KD without it having that great of attendance."
37261,"Its not that surprising that KI is more popular than Holiday World in Indiana. Its about the same drive time from Indianapolis to KI as it is to Holiday World and the prices between the parks are not that different. KI is a much bigger park with more coasters and a lot of schools in Indiana take field trips there. Holiday World is great, but its in southern Indiana, which is less populated and is a much smaller park."
37262,Kings Island is also far more popular in the northern part of the state than Holiday World. HW isn't even a blip in the northern third of the state. It's cedar point and Kings island by a mile.
