idx,text
61298,"Finall Fantasy X is my favourite RPG on any console since it's my favourite game of all time.

But also Final Fantasy Type 0 - seriously, more people need to play this game. It has a cast of diverse characters an amazing soundtrack and a very different feel to any FF game - the closest would be VIII I think with the military schools.

I really enjoyed Tales of Berseria too. I thought the characters were all incredibly likeable and the combat was super fun. The main character is unfortunately supremely overpowered, rendering most fights a walk over if you play as her but it was still fun.

The story was extremely generic but the combat and characters easily make up for it. Magilou alone makes up for it.

If you're the kind of person that counts the SoulsBorne series as RPG's then all of those too. Personally I see them as action adventure games with RPG elements but a lot of people would say they're RPG's - especially since you can design and spec your character however you like."
61299,"I freaking LOVED Type 0. I wish the combat wouldn't be as clunky and shallow, but the rest is perfection in my opinion. It's the most extremely graphical Final Fantasy I've ever played, the story is tragic and mindblow, the characters are all diverse with different nice playstyles... and the music, holy jesus of RPGs."
61300,"YES! I was surprised by the epic scale of it given it was originally a handheld title.
I actually didn't finish my second playthrough, I need to pick up where I was, at some point. I just need to remember to make the different choices."
61301,"I know what u mean about the souls borne games and I'd agree to some extent but the only reason I had multiple playthroughs on them were the rpg elements, cosplaying as one of the bosses was very fun for me. Bloodborne being called fashionborn shows a lot too."
61302,"Oh I definitely agree on the replay value. I've never got into cosplaying the bosses but I love to come up with themed characters and limit them to only abilities and gear that would make sense for them.

Which in essence, is playing a role... I just can't list them as RPG's personally. I totally understand why people do though!"
61303,"Final Fantasy IX and X, Disgaea 1 and 5, and Dragon Quest XI."
61304,Dragon Age
61305,"Good response, thank you u/SquirtGirl69"
61306,Digimon Cyber Slueth. They are turn based with depth.  Lots of talking but a very addicting jrpg
61307,Whats a Digimon?
61308,"When you say RPG, are you talking more JRPG types? Resonance of Fate got a rerelease on PS4 and it's super underappreciated."
61309,"Ys VIII is a pretty solid rpg for me. The others like p5, FF, nier are a given."
61310,Odin sphere leifthrasir
61311,KINGDOM FUCKING COME DELIVERANCE MY DUDES
61312,Dude Skyrim for PSVR. This stuff is amazing in VR.
61313,"In no particular order...

* **Battle Chasers: Nightwar**
* **Persona 5**
* **South Park: TFBW**"
62500,Dragon Quest XI
61315,"Didn't see it mentioned:

**Grand Kingdom**

Solid turn-based RPG with interesting combat system and lots of customization down to setting up battlefield to your advantage with traps, barrels to block, flags to rally your troops or tunnel enemies and so on. Has semi-active online battles, too."
61316,"Secret of Mana remaster.   
One of the best Super Nintendo RPGs, second only to Chrono Trigger."
61317,Ni No Kuni 2 has been amazing
61318,"Dark souls 3. As my first souls game, I was pleasantly surprised how good the character progression mechanics were in terms of stats and items."
61319,"The Witcher 3, Skyrim VR, Fallout 4 (yes I actually like it), Nier Automata, Final Fantasy XV and Mass Effect Andromeda (again, I actually like it. Embrace the jank)"
61320,"Is Skyrim really one of the best RPGs? I am currently thinking about it, I loved Oblivion but I have also heard skyrim is kinda meh.."
61321,"Yeah it's definitely worth a look, I had it on Ps3 years ago and bought the remastered version for PS4 last week, added a few graphic mods and its great. It does feel somewhat dated in most areas but it's just the exploring and making your own story what makes it great. If you enjoyed Oblivion you should give it a go it's fairly cheap these days."
61322,"Probably you won't read this but... Oblivion was the the Elder Scrolls that I enjoyed the less. Probably because Cyrodill is the classic set up for high fantasy. It has good things like the Oblivion gates and such, but the faction quests ... can't talk good about them.   
Skyrim is definitely an improvement.   
But.... in regards of magic system and set up, Morrowind kicks their buts."
61323,Persona 5. It’s absolutely fantastic. The intro is a bit slow but after that you just wish that the game lasts forever. Best 110 hours I’ve ever spent in a game.
61324,FFXV and Shadow of War/Mordor.
61325,Shadow of War/Mordor are not rpgs
61326,Fallout 4 isn't the best but it's one of the few AAA RPGs this gen.
61327,"Dragon's Dogma

Nier: Automata

Final Fantasy XII

Persona 5

Horizon Zero Dawn


If you can pay for a sub, FFXIV may also be up your alley."
61328,FF XII I've actually been thinking about downloading all day since FF X was my all time favorite but i think that is partly due to nostalgia since I don't love a lot of the other FFs that I've played
61329,"FF XII is so good, oh boy, my fav FF alongside IX.  


Are there psx games on ps4? if so you could try Vagrant Story, that game is HARD and a little difficult to get into but it's awesome."
61330,"It’s not exactly open world, but everyone needs to play Nier Automata. Get on it OP."
61331,Agreed. One of the very best. Also i didn't see god of war on your list. Definitely check that one out if you haven't.
61332,Horizon zero dawn is genuinely one of the best and RPGs imo and is a unique setting. Would highly recommend.
61333,Divinity Original Sin 2 is a must play RPG
61334,"Maybe but I get the impression you could play that on a toaster, and I feel like the interface would be better w mac / PC than PS4"
61335,I disagree. My mouse broke when i was on my first playthough. I had no choice other than to use controller. And i never felt crippled playing it with a controller. It actually felt smoother
61336,"Really? I would think with all of the different abilities and accurate positioning, controller would feel gimped."
61337,Well it’s turn based so you aren’t gonna be needing to rapidly hit a bunch of mapped keys like an mmo or something. I never played it on controller just pc but I think the fact that it is turn based means it would work well even if a controller has less buttons than a keyboard.
61338,"I'm on my 3rd ps4 playthrough right now (and beat the first one twice) and I can say with certainty that it plays very well on controller.

The only thing that's a moderate pain in the ass is inventory management towards the end of the game"
61339,It works surprisingly well with a controller.
61340,"The game is actually really well made for controller and splitscreen play, I was surprised. I beat the game solo on PC but wanted to play with a buddy later on. We split screen co op and both used controllers. The dev's clearly took the time to make it smooth."
61341,Maybe check out the Yakuza series. There’s no character creation though
61342,Ill watch some videos on it right after I finish this ghost of tsushima video.
61343,Dogma's Dragon
61344,"Divinity Original Sin 2, it’s a turn based table top game which I usually don’t care for but this game is basically the pinnacle it’s phenomenal.

Multiple characters with their own story, your decisions have good or bad consequences.

The combat is phenomenal with the strategy elements
Ex: if there’s water on the ground and fire hits it, you get mist to blind your enemies or if you hit water with electricity any enemies standing in the water get zapped.

The story is phenomenal, it’s not one massive open world there’s about 3 big maps, they may look deceivingly small at first glance but they are massive with caves, dungeons, inter connecting areas.  It’s phenomenal"
61345,"I agree with this recommended, as a long time fan of the genre, it’s the best RPG game I’ve played in years. It scratched a big itch too, because there haven’t been any true RPGs released in a long time, we’ve been getting a lot of action RPGs instead and those just aren’t the same for me."
61346,Welp. It's time to replay BG2 again
61347,BG3 early access just released!
61348,I'll pass. I'd rather wait for the full release for the definitive experience
61349,"Normally I’m not into playing early access versions, but I think I might do this just so that I can get a good feel for the classes and combat in the first section of the game, before committing to a character for a full play through. 

In D:OS2, for example, I definitely made some sub-optimal choices for my character build before I had gotten the hang of everything, but I didn’t want to go back and redo Fort Joy when I still had the whole game ahead of me."
61350,">Divinity Original Sin 2, it’s a turn based table top game which I  usually don’t care for but this game is basically the pinnacle it’s  phenomenal.  
>  
>The combat is phenomenal  
>  
>The story is phenomenal  
>  
>It’s phenomenal

I disagree with every fiber of my being. Larian is incapable of making a good game."
61351,"Please, elaborate. I like dos 1 and 2, but certaintly didnt love them as much as some, specifically the writing and story just failed to interest me most of the time, and there is a LOT of dialogue (too much needless fluff imo)."
61353,"Dude who would read that, it sounds like you guys don’t enjoy gaming at all.  Maybe you should focus on building a career making money in something your interested into than bashing a masterpiece game because you don’t like it."
61354,">Maybe you should focus on building a career making money in something your interested into

Already did that. Gaming is one of my hobbies. If you read the review, you would understand that it isn't simply bashing the game because the reviewer ""doesn't like it"". The reviewer brings up some great and valid criticisms regarding several of the core mechanics of the game."
61355,"I actually dont agree with the vast majority of that review funny enough. I liked dos 1 ee a lot, dos2 not as much but that may have been because i played it only a few months after dos1. Theyre good games but in the second, I was relying on cheese tactics wayyyyy too often just to pull through a fight, and would probably enjoy it a lot more on the lower difficulty options where you dont have to do 15 hours of sidequests for every hour of mainquests just to be properly levelled/geared. Optional side content should be just that, optional, and i hate when games force you into them by level gating the main quests."
61356,Dragon Age Inquisition? It’s very detailed and the process while leveling up is tedious but enjoyable at the same time.
61357,"Came here to say this. The characters are well written and storyline is rich, but it isn’t overwhelming if you haven’t played the prior two games."
61358,"Final Fantasy IX is arguably the best one, you can't miss it 

DARK SOULS 1 and 3 --- just do it. It's difficulty is overhyped, its tough but fair and you DO adapt. There is a reason these games are so highly regarded, there is nothing quite like it

Dragon Age is absolutely brilliant, one of the best games you can play 

To that end, so is Mass Effect trilogy ( play all three, don't skip any) 

Horizon Zero Dawn is impressive more than you'd expect"
61359,"Why is there barely any love for dark souls 2? I get why,but if you take a step back and think about it,its a really good game"
61360,"Its a good game in it's own right, but it is (in my opinion) significantly overshadowed by the other two which are much, much stronger."
61361,Dragons dogma!
61362,"Some of old remastered

Rogue galaxy

Star ocean series

Dragon quest xi

Kingdoms of amalur

Dark souls series

Bloodborne

Theres more but those would eat up months"
61363,Persona 5 Royal. Easily one of the best games overall on the PS4. great if you enjoy JRPGs.
61364,"I do love som JRPG, but I find the ""high school"" theme offputting. Is that game good for adults too?"
61365,Absolutely. I'd rank it in my top 3 RPGs of all time
61366,"Shin Megami Tensei is basically Persona without the Highschool theme (if I remember correctly, Persona is technically a spinoff of SMT but overshadows the mainline games by now). 

SMT3 (Nocturne) is getting a HD remaster and SMT5 is supposed to be released sometime in 2021. Both are exclusive to the Switch though, much like SMT4 and Strange Journey were exclusive to the DS.

Still, Persona games are really great, even if you don't like the High school stuff. It's not quite as trope-ish as other takes on it and P5 especially puts less focus on the school setting than P3 or P4."
61367,"Only SMT V is Switch exclusive.

Nocturne HD will also be on PS4."
61368,"Thanks for the correction, I wasn't aware of that!"
61369,"I would go as far as saying Persona 5 is more adult/mature than most games, despite the main characters being in high school. It deals with some dark, heavy themes such as mental and physical abuse, abuse of power, family problems, suicide, free will vs. determinism, and rebellion. It's not a game for kids, to be sure. A late teenager would probably be in a good place to get into the story (I kind of wish this game was out when I was a teenager, actually) but it's relatable to adults as well. I mean, we all went to school once. It gives the story a sense of familiarity. The characters are in that age of life change and finding themselves and their place in the world, which is the perfect perspective to view the game's themes."
61370,Was put off by the high school setting of the series for years as well.  Now I consider it one of my all time favorite franchises of any genre.
61371,Amazing game. Best of the generation in my opinion.
61372,Kingdom Come Deliverance
61373,If you liked Skyrim and Witcher 3 then you’ll probs like kingdom come as it’s similar setting flow complexity etc minus the fantasy it’s so good I’m loving it
61374,"Kingdoms of Amalur was rereleased for ps4, its the same thing as was before, but if you havent played it then and dont mind older graphics and quest design, go for it, its old school rpg, with its own charm."
61375,Assassins Creed Odyssey. Gorgeous open world game. Lots of fun.
61376,Copy paste missions with a progression you can pay to skip. Ubisoft shlock.
61377,"Just grabbed Ghost of Tsushima on sale and imo it’s worth the hype. Open world feels good, quests are engaging, and though there’s no character creation the characters and protagonist are compelling and well written. As a disclaimer though I’m only bout 5-10 hours in."
61378,"Ghost of Tsushima is really good, but there’s no character creation. 
- Dragon Age
- Greedfall 
- Code Vein
- Dragons Dogma"
61379,"Played Dark Souls or Bloodborne? Not open world, but they have great level design and damn rewarding gameplay once you get the hang of things."
61380,I have played Dark Souls 3 and my brother is playing Bloodborne right now and is sending me the disk after he finishes but thank you!
61381,Maybe try Nioh? Its a great masive game.
61382,"Vampyre is free this month on ps+ don't know how good it is not played it yet. I think most of the older final fantasy games are on the store if you want nostalgia, possibly dragon quest 11 I loved every minute of that game.
Seen it mentioned already but divinity original sin 2 is deffo worth checking out.
Kingdom hearts, Kingdom of amular remake is out.
I personally feel detroit become human is a fantastic game, no combat but hell of a story and choices matter."
61383,"Vampyr is an amazing game, but its not a big world and its a lot of ""detective"" work.

Definetely worth buying."
61384,"Dragon Age

Dragon Quest

 Kingdoms of Amalur 

the Tales of series

Persona 5 (my favorite game on the platform)

Horizon Zero Dawn

Less pure RPG with small hubs rather than large open worlds, but God of War and the current Tomb Raider trilogy"
61385,"You owe it to yourself to give Divinity Original Sin 2 a try. It doesn’t fit into what you’ve played before, but it has all of the elements you are looking for."
61386,Yakuza
61387,Not got character creation but since you seem to have the same tastes as I do I highly recommend Ys VIII. I didn't really know much about it when I picked it up but I thought it was an amazing game.
61388,"One thing that really surpirsed me about ys viii lod was how much I actually cared about the story and characters. A lot of jrpg fans talk about how well crafted the stories are and how great the characters are but 9 times outta 10 I end up finding jrpg stories naive at best and rarely surprise me or ever feel remotely close to having believable characters that feel ""real"". Everyone talked about how great the combat feels in ys, and they werent wrong, but the story wraps up on an amazingly bold and surprising way that was so refreshing (assuming you get the true ending)."
61389,"Pathfinder: Kingmaker

Divinity Original Sin 2

Mass Effect 1 - 3"
61391,I'm on tales of vesperia right now.
61392,"Divinity Original Sin 2 has the best roleplaying in a video game and a fantastic story. Pillars of Eternity is also worth trying out; not as good as Divinity, but still great"
61393,"Are you okay with JRPGs? If so, Trails of Cold Steel 1, 2, and 3 might be up your alley as they are semi open world."
61394,HORIZON ZERO DAWN!
61395,All the Fallouts means Fallout 3 through Fallout 4 I'm guessing
61396,"FF XIV
Persona 5
Dragon Quest 11
(Last two don't have character customization but are fantastic games)
Ghost of tsushima is also amazing if your into it
FF7 remake"
61397,BLOODBORNE?
61398,"I’d recommend Dragon Quest XI. If you like Final Fantasy, you’ll LOVE Dragon Quest."
61399,"Dragon's dogma , dark souls remaster , bloodborne,  final fantasy XV , kingdom of amalur reckoning remaster"
61400,"Dragon dogma,  final fantasy xv,  bloodborne,  dark souls remaster , kingdoms of amalur reckoning remaster,  ghost of tsushima,  ac odyssey / origins"
61401,Persona 5 (Royal) and Nier Automata are my two favourite games on the PS4
61402,"Conan exiles
Dark souls 1 and 2 ( not open world but very non linear and alot or replayability )
Citadel
Dragon age inquisition
Elder scrolls online 

Tera mmo but free
Black desert mmo but free
Neverwinter mmo but free"
61403,Trails of cold steel
61404,"Fishing for the new cult followers, are we? The Trails series is emphatically NOT what the OP is after."
61405,"Fishing for upvotes? 😁Let OP decide what they want to play. I just made a simple suggestion, fuk boi"
61406,Killer bean
62409,"Full on RPGs:

- Divinity Original Sin 1/2 (great DnD style RPG)

- The Witcher 3

- Dragon's Dogma (The game feels a little outdated to me but you might like it)

Action RPGs:

- Borderlands 3

- Dark Souls 1/2/3

- Nioh (Soulslike game in feudal Japan)

- Bloodborne

- The Surge (pretty good soulslike game with mech exosuits)

- Shadow Warrior 2 (Borderlands meets Doom)

Games with some RPG elements:

- Nier Automata

- God of War

- Monster Hunter World


If I had to choose 1 of each category I'd say Witcher 3, Dark Souls 3 and God of War are pretty safe bets but honestly, you can't go wrong with any of these"
62410,"Genuinely curious as to why you have listed Nioh as an Action RPG, whereas Nier as a ""game with RPG elements""?

Aside from visual appearance of armor, I can't see any world where Nioh has more RPG traits than Nier... again, just curious as to your thought process, not trying to start a feud. 

Having that all been said, I'd absolutely list Horizon Zero Dawn under your games with RPG elements category!

EDIT: Ask an honest quest, get downvoted. k."
62411,"I don't think you should be downvoted, the RPG genre is very broad and what defines an RPG varies from person to person. 

To me, Nioh classifies more as an RPG because borrows from other ARPGs, It has a soulslike combat and is a loot-based game but going beyond that the game has ways to customize your character, from distributing your stats to different gear types, from battle skills to guardian spirits. Beyond that its endgame is all about min-maxing your gear, doing runs to get better quality gear or materials to forge and reroll stats on your armor, weapons and even change their appearance. You can build a character that suits your playstyle which is I think what an RPG is all about.

On the other hand, Nier has ways to customize your character but they get pushed to the background in favor of other aspects of the game. Sure you can put chips on you and complete quests but you're still playing as 2B and your playstyle is still being dictated by the moveset of a couple of weapon types. At the end of the day, I think Nier is more a story-driven hack and slash game first and an RPG second"
62412,"Completely solid train of thought, thank you for explaining. 

I agree, it definitely depends on the definition of ""RPG"" that you go with. For me, the exploration and multitude of sidequests, while still allowing for intensive character customization (I think the chip-setting allows for far greater customization than most RPGs, just not aesthetically), plus having a huge selection of weapon options, feels very RPG to me, which I why I initially questioned. You make completely fair points though."
62413,I believe Witcher 3 is $15 at the moment which will most likely be the most common answer you'll get as well
62414,Witcher 3 is still the one for me. I just started Horizon Zero Dawn and as much as I like it I wish the world had more to discover for myself like the Witcher does.
62415,"Horizon is hardly an RPG, though."
62416,I feel like it is a perfect example for a modern action RPG. Not saying it is what an RPG should be like but I think it is the general direction the industry is moving to
62417,I would say Soulsborne is a better example of a modern action RPG. The rpg elements in games like Horizon and AC Odyssey are pretty basic and barebones. While in games like Dark Souls the RPG mechanics are far more prominent and core to the gameplay. Soulsborne is far more reliant on stat building and management.
62418,I agree that they use overly simplified basic RPG mechanics. I feel like this is just to make sure that the games stay as accecable and maintstreamy as possible. Dark Souls or in general From games are an entirely different beast to conquer.
62419,">  I feel like this is just to make sure that the games stay as accecable and maintstreamy as possible

Which is funny since games like Assassin's Creed were already pretty fucking mainstream, lol."
62420,"I almost felt the opposite.  I loved the Witcher 3, but I think I enjoyed the World created by Horizon more.  The seemless transition from one half of the game to the other in Horizon felt really good.  In the Witcher 3, everything seemed open at first, but then you realize how it is all cut up into zones.  Then you see how much of the world that is there is just window dressings (buildings you can't enter, NPCs you can't talk to, etc.)  I felt more engaged in the smaller world of Horizon than the larger one of the Witcher."
62422,"It's fantastic indeed! And with each companion having a rich, long story (that may conflict with other companions's stories), you definitely want to play it more than once!"
62423,Is it any more 'guided' than number one? I tried number one and enjoyed the world and combat but found the quests difficult to understand what I was meant to doing and where to go early on.
62424,"I'd say so - I stopped playing in the middle of 1, but with 2 I started a second playthrough right after finishing the 1st one. Never felt lost story-wise either."
62425,"The amount of random things that can happen do in D:OS 2 is nuts. Pretty early in the game I killed a character which I found out much later actually plays an important part. So I reloaded a save from before I killed that character expecting it to go roughly the same, but literally everything went completely different the second time, dialogs were different, it was great."
62426,I just wish you could move faster than a slug in this game.
62427,I actually got this game on PS4 and then again on PC just so that I could download the faster movement mod. 100% would do it again.
62428,I am currently playing this right now and I love it. I am about 40 hours in and havent gotten on the boat yet...Its so good and really deep in its RPG mechanics
62429,Dragons Dogma.
62430,The One True God!
62431,I don’t get why it isn’t mentioned more often. It’s a great game
62432,"The empty world, the busted story, the bizarre mythology, the travel options - don’t get me wrong, I love the game - but there are plenty of reasons to dislike it."
62433,And some very weird difficulty spikes.
62434,"It's extremely underrated.  The story, the gameplay, the rpg elements, this game deserves way more attention."
62435,Look Arisen! Wolves!
62436,They ill like fire!
62437,Dtagon quest xi. I've sunk about 75 hours so far into it.
62438,"Persona 5 for sure. The length of the game alone is worth it, it took me 70 hours to complete and i went through the game pretty fast. Great story, great characters, killer soundtrack and easily one of the most polished games of this generation."
62439,I just wish there was more music.  I’m probably around 80 hours in and going crazy with how much certain songs get repeated.
62440,"I didn't partake in anywhere near the full amount you can do and I finished it in 169 hours. Very stylish game, and it's great to play something so character focused and have those characters be so good."
62442,"Youre probably around 3/4ths of the way through. Granted, its maybe another 30ish hours before you might complete the game"
