idx,text
43558,"My dad was a firefighter.  When my wife and I bought our first house my dad gave us 6 fire extinguishers, a box of 9 volts, and a life ladder.  Man I miss that guy!"
43559,"I can only imagine the pride on his face as he relishes in the “of course you did” look on your face. Sounds like a great guy and a better father, I hope he’s resting easy."
43560,Thanks internet stranger!  I really appreciate that.
43561,"Light hearted, but... a pressure cooker! You can get one for around $100, and it can easily cook a genuinely staggering variety of food, and cook it well.

EDIT: TIL there are two types of people that use pressure cookers... people who use them to cook food, and people who use them to make bombs.

EDIT 2: ... aNd PeOpLe WhO uSe It To StErILiZe ThInGs."
43562,"Every Indian family uses a pressure cooker. I can say with confidence 99% of indians use this. 

I can't imagine my life without a pressure cooker. It makes rice, meat, lentils, pulses, beans almost everything in less time."
43563,"Indian pressure cookers are very uncomplicated though. Which is what i like.

No fancy manometers, no timers, just basic weights for pressure release and stove top use.

I love them"
43565,Yes! I surround my desk with them so I've got something to look at while I'm waiting for stuff at work. It's very satisfying to watch them grow over time and I also think that being near plants is something that's psychologically good for humans on a very primeval level.
43566,If I had them near my desk I'd probably end up slowly pulling them apart cause I fidget with everything in reach
43567,I keep a lego bucket near my desk for this specific reason.
43568,Foam roller
43569,First time I used one it was a girl's house and she let me use it. As it popped my back loudly it also pushed out a really loud fart. She looked at me like I just murdered someone.
43570,A lacrosse ball as well! Get them glutes people!
43571,An electric kettle. (I'm American)
43572,"As a UK citizen, a kettle is on a par with actually having food in the house

Holy shit, just got up this morning and it's all gone mental! Thanks for the award!"
43573,"As an Irish citizen, I'm pretty sure our right to a kettle is explicitly stated in our constitution."
43574,Until I met my (Australian) wife I had no idea this was something I needed. We moved back to the US from Australia and a kettle was one of the first things we picked up.
43575,A dash cam for your car can protect you from wrongful claims also vandalisms and theft
43576,"I got one! Although I have never been in an accident before *knock on wood*, the peace of mind that it gives me to know that I have backup evidence or anything of that sort for future issues is calming. Best 50 bucks spent in the last 30 days."
43577,Or maybe some sweet internet points down the road from catching some happenstance situation. Remember all them rad meteorite videos from Russia because everyone had a dashcam?
43578,"Im not going to lie, when I was installing it that thought also went through my head haha, I dont have many points so I would be banking on that lol"
43579,"I've had one for a few years. Finally paid off when a guy backed into me at full throttle while we were waiting at a red light. Without it, I'm sure I would have been blamed for rear-ending him."
43580,"No doubt, whoever is behind a vehicle, and somehow hits the back of another vehicle -  unless you have complete total confirmation and visual proof, you will always be found at fault. Which is why the current situation I’m in is so stupid. The woman switched lanes right on top of me, and I had no room and very little time to even throw on the brakes. 

And I just hadn’t gotten the dash cam up yet. Life is stupid like that sometimes."
43581,"My Mom had a dash cam in her van for years, when she got into a really bad accident with a 18 wheeler we where able to use that to our advantage"
43582,"A good showerhead. I cannot stress enough how a high quality showerhead can turn getting clean into utterly zen, 30 minute self healing and relaxation session.

Edit: ok clarification, I don't shower for 30 min every day. Modern rain showerheads use very little water and I only have about 15 min to get ready in the morning so this is a rare treat I let myself do once or twice a month. I appreciate the loving comments."
43583,Bonus points for a detachable showerhead and extra double bonus points if you are a lady who enjoys that particular brand of flying solo.
43584,I was reading this and I was thinking if it’s detachable how the fuck does the water get to it? I realised on reading further and thinking rationally that this is pretty much the standard shower head on a hose that we get in the UK. Didn’t realise fixed shower heads were the standard elsewhere
43585,Damn yall dont got wireless water in the UK?
43586,"+1 for a detachable showerhead. I don't enjoy masturbating that way, but I do like being able to clean with a directed stream of water on my private bits because leftover soap gets itchy down there. Squeaky-clean b-hole: A+"
43587,"I need to install my detachable shower head at the new house we moved to.

My husband and I are in a disagreement about it. I like being able to fully clean where the sun don't shine, but he feels like the water pressure decreases when it's installed. So I have to find a better, but more expensive, one that we can both be happy with."
43588,"Look and see if it has a water efficient restriction in the attachment point. Pop out that little white plastic bit, hooray instant pressure improvement."
43589,"I did that hooray, my drain can't keep up with the shower head!

Honestly I cleaned the drain recently,  not much came up since I'm already using a tub shroom.  Could I have a obstruction further down the line than my zip it can reach?"
43590,"24(M), I bought a book online about SQL for like 25 bucks and then a course on Udemy for like 11.99?

But went from a job earning 35,000 to 55,000 because I took time to learn a new skill. 

And if I end up staying and becoming a higher level analyst, salary is around 70~75k 

Maybe data analysis isn’t your gig, but learning a skill can be cheap in terms of money: more time consuming than anything but worthwhile."
43591,"I make $120,000/yr US. My primary skill is SQL and pulling data. Yes I have degrees, but I don't really use any of that shit. Moving data is a skill that makes you a God in the business world."
43592,"A good chef's knife and a cast iron skillet. When you have tools that are satisfying to use, cooking becomes less ""chore"" and more ""hobby"". You'll end up eating healthier, cheaper than takeout/restaurant, and ditching the dull Walmart knife and scratched up nonstick aluminum skillet are the best place to start.

Editing to add:

Since so many are asking what to get: Victorinox 8"" or 10"" chef's knife, and 10"" lodge cast iron skillet. These in my opinion are at the tippy top of the curve on quality to price ratio. 

These probably leave enough room in the budget to get a $2 steel from goodwill and a large butcher block cutting board. As long as you use the steel with some regularity, a good knife should go a long time before it actually needs to be sharpened.

Second edit: I agree that a good sharpener is important, but if you have $100 to spend today you can wait on sharpener as long as you have a steel to maintain the edge. You will need one, but not today. 

Also I am going to take another look at carbon steel skillets."
43593,"I got a great knife at the outlet mall for $52 and a 12"" cast iron pan on sale for $32. That leaves me $16 for ingredients for fajitas."
43594,And you can make alot of fajitas for that price.
43595,Not with the amount of cheese and sour cream I put on fajitas.
43596,"Having plenty of counterspace is a part of this as well though, if you have a small kitchen, consider investing in a couple of taller, sturdy tables to prepare food on. It will make your life much easier. Also get a large cutting board. Once you've found a board you think is big enough, get one a little bit bigger, it really makes cutting/cooking much more enjoyable."
43597,"A hammock.  Bought my Eno a year ago and I have no idea what I did without it, you can literally post up anywhere and everywhere and it will encourage you to go outside a lot more."
43598,"> Hmmm, should I stay inside and lay down?  Or shall I go outside and lay down?

-- Op"
43599,"This is an accurate representation of my activities during the pandemic.

Really thinking about bringing my computer so I can lay in my hammock in the park and watch tv"
43600,An electric toothbrush
43602,"so truee! I've been using one for years so I don't even remember how big the difference was, but recently I convinced my bf to buy himself one and he was like ""wtf my teeth never fealt so.. brushed"""
43603,A used instrument
43604,Geetar
43605,Peeoino
43606,Troompat
43607,"A SSD.

SSDs are a gift from god."
43608,"A passport

Although, it depends where in the world you are ... where I am it is less than the equivalent of US$100"
43609,"Silk pillowcase.

EDIT: I got a silk pillowcase because I have really really long hair (down to my butt) and it keeps it from tangling as badly overnight."
43610,"A Cook Book.

Not like a fad celebrity book but a real oldschool family cookbook.

Best one I ever found was at a garage sale and was like 6"" thick Ring binder full to the brim with yellow pages some with stains.  It honestly should have been a family treasure and I got it for $20.

Hundreds of family recipes with easy to follow hand writen notes.  I'm sad i never met the grandma that this thing once belonged to.

Edit: Wow thanks for all the up votes.  Its nice to read the comments about other people that have found cool old cook books.

Edit 2:  OMG this is my biggest post ever.  Thank you for the awards and all the votes.  You all made my day :)

Edit 3: Sweet Raptor Jesus...I guess i have a project now to scan and upload this book.

Umm a few people asked so here is my favorite recipe.  These things are amazing and disappear so fast.


[My favorite recipe in the book](https://www.dropbox.com/s/b8rrlr5xh5dbfzu/20200721_224518.jpg?dl=0)"
43611,"Or an old school home ec textbook. Found one at a thrift shop and it’s from the early 60s and it’s awesome. It’ll teach just plain old home cooking, but also includes stuff I’ve never seen in other cookbooks. For example, how to time everything so it all comes out at once, a chapter on cooking for the ill, and there’s also a dated chapter on losing or gaming weight. Budgeting is also a big part, as well as just planning tasty, balanced meals."
43612,The part about timing things sounds super helpful!
43613,As a Canadian it is really upsetting to hear about all the things that can supposedly be had for $100 in other places.
43615,This comment was such a roller coaster I am seriously considering buying one.
