idx,text
3348,"Hey man thanks for this, I already have a really insane pc but I just decided to get into streaming and I was about to drop a lot of money on a webcam cause I figured I needed a good one if I wanted to get any kind of viewers but I just ordered the c270 cause I realized that I’m just starting and I’m doing it for fun so I shouldn’t invest to much money!"
3349,"Exactly. Then if you actuallt enjoy it and people are actually watching you, dropping those $50 or whatever won't be that heavy lmao"
3350,Yup. Plus only spending $20 on a webcam and then $19 a month for stream labs is luckily my only expenses. So as long as I’m enjoying it even if people aren’t watching and it’s just my friends tuning in perfectly ok with that lol
3351,"Disagree. If you’re just testing the waters, don’t bother with a camera. If you decide you like streaming, don’t waste money on a 270 and get a 920/922 later. Just get the 920/922 first and be done with it. It’s still a budget camera, it’s not expensive at all and it can be found on sale often. The quality is also a LOT better than the 270. Not talking about pixels, but colors and the way it handles light are all much better. Besides you can use a webcam for more than just streaming."
3352,This is exactly what I said also if you decided to get rid of it you can sell it back for most of the money on eBay or something.
3353,"I'd argue that buying the *right* first camera is better to do before you spend $20 on a camera you'll end up replacing. It's not like the webcam will be useless if you find that streaming is not for you, plus reselling the *right* camera is easy, whereas nobody wants your secondhand $20 camera.

If I want to start playing the guitar, as an adult, I'm not going to go out and buy a $5000 guitar and amp and pedals, but I'm also not going to start off with the $50 walmart brand I KNOW I'll immediately want to replace.

It's about value. The Logitech C920/930 is *really* great bang for your buck."
3354,"When I started out I had a C270 aswell.
What disturbed me the most was the „Field of View“ because the camera had to be far away from you to get you on screen.
I have a C920 since some months now and I‘m happy. 

But for starting out its okay. :)"
3355,I keep mine far away.. with the wide angle lense the c920 can make your face look wider than it is if it's too close . I just use the zoom feature to get closer in.
3356,"It's worth factoring in that if the person later gets more serious about streaming, a second camera can be useful, so that cheaper webcam won't have been a waste. I'm not even a speedrunner but enjoyed using a controller cam, as it made the the stream feel a little more personal. I even got a third cam down the line for games with pedals."
3357,"FYI. There are many webcams around not being used. I posted on my local Facebook group is someone had one lying around they didn't use. Got one for free that is OK. Colors are a bit off but I turned it over to black/white and its great. Also black/white is a bit different so I stand out some more. I ended up just spending money on a six pack that I gave to the guy I picked it up from.
It's Cheap and I feel better not just buying something but reusing something that others don't need any more."
3358,"I agree with you about 90%. I started with a c270 myself and, yes it was ""good enough"", but now it's a year later and I have 2 c922's and a GoPro that gets used occasionally and the 270 is a $20 paperweight. 

I had the money on the front end for the 922 and wish I had just gone with it from the start, but if you, or whoever, doesn't have the money then the 270 is a great little budget camera. That's assuming you spend the $30 you saved on lighting for it. You could buy a DSLR and it would look like garbage if your lighting isn't right."
3359,I mean you can always buy a used one as well for cheap. I got C920 for 20$ off Facebook and works perfect.
3360,Amazon just did a sale on the C920 for €25 so I bought it. I was using a DSLR + Capture card and flipped backwards for the convenience. Even using Magic Latern the DSLR still auto timed off the live video every 30 minutes. Webcam is plug and play and honestly once you tweak the settings it's not a whole lot different.
3361,"With DSLR you need a dummy battery(assuming your DSLR is common search for the model name of your battery with the words dummy battery and it will popup online)... to bypass the powered on limit.

The only reason to be using DSLR is if money is not an issue or you already owned one, if you want a way higher quality, depth of field and 60fps. If you do not really care about those obviously its way simpler and way cheaper to just be using a webcam - exactly like you said its just plug n play."
3362,"I use a dummy battery in the DSLR for the constant power. It's not a turn off problem, it's seems to be the mirror flipping closed or something like that. 

There's a couple of other reasons I switched to a webcam. I don't have a single set up, but instead go between two different buildings so it's a lot easier to pack up and move a webcam instead of a dslr/capture card/tripod and associated wires. Also limited space in the set up means I can't get the DSLR far enough back to have as wide shot as I would like."
3363,"> I use a dummy battery in the DSLR for the constant power. It's not a turn off problem, it's seems to be the mirror flipping closed or something like that.

That seems really weird, which DSLR camera is that one? Or maybe either the dummy battery is not working correctly or a wrong setting in the camera. Although its not gonna really matter since for your usage it does seem annoying if you kept using the DLSR setup because you have to move around(location buildings) a lot plus the extra setup + space requirements yeah not worth the hassle - this is more of a always left forever there untouched streaming setup :P"
3364,But the c920 mic isnt half bad so if your needing a cheap start and are trying to pick between a mic and a webcam you get both...... Also it won't overheat or fall apart like many cheap knockoffs do.
3365,"As someone who has streamed for about 10 months with a c270, I would agree that it fits needs of a basic webcam. I did switch to a c920 though and will say it makes a HUGE difference. If you are just trying to figure out if you want to be a streamer, sure, the c270 is going to be fine. If you want to be on the same playing field as most other streamers though, you want a c920 or better. A good quality webcam, a good quality microphone, and a good overlay/alerts are all a standard of streaming these days and do not make you stand out. They are a minimum now unless you have something else that makes you really stand out."
3366,"I have both the 270 and a 920 and for the most part they are both very nice cameras.

I noticed the 270 takes a more zoomed in picture than the 920 does when they are side by side on top of the same monitor

I think the 270 is a great starter cam"
3367,I believe starting without is the best way af you’re then doubting you can ask it at your viewers.
3368,I’m just starting and got a c920 used on OfferUp for $20...
3369,"Here is my take on it as someone who is also starting out. You should focus on audio more than a webcam. 

If you can't afford a webcam I would just wait till you can afford a better one that you won't need to think about upgrading later. 

Most streamers are moving to DSLR based facecams. That would be an upgrade path of 3 devices if you want to start at that level. Now you might be able to utilize more than one for different camera angles. 

The way I see it as someone else mentioned if you don't think you will want to get a better quality one and see it as more of a hobby then go for the cheaper one up front. 

If you think you will want to upgrade and won't use a two camera setup, then just wait till you can afford the better one. I streamed a few months without one and focused on audio instead until I could afford and wanted to make the jump to a c920."
3370,My camera is mid range decent at best but gets the job done. I do need more PC parts to stop my games from shitting themselves while I stream however. Can’t even stream R6S
3371,"My rig is so slapped together! I want bore you with the stats but it consists of old computer parts that I either saved from the landfill or someone gave me something when they upgraded their gaming computer. I have a tendency to hoard old tech. I found a Blue Spark Digital mic for half the normal price because it had been returned to Amazon. Only thing wrong is that they threw the wrong mic stand back in the box which I don't use anyway, and the USB port is a little hinky sometimes. I originally for the mic for singing. I just bought a desk mounted spring loaded mic stand for 13 bucks which they actually sent me 2 for the price by the way. I will also be buying some chroma key fabric for 10 bucks soon. Everything else I already had."
3372,Thanks for the insight! That's helpful. Do you wanna share your stream here?
3373,"logitech c615 can be found much mroe readily used than the c270... and for like 5 bucks. I have 3. Get that.

edit: Facecam, roomcam, & VR LIV cam"
3374,"True, I started out with a very very cheap webcam from the 2000’s era, kinda just put together what I had. Over the years I upgraded to the C920, although, i’m not big on streaming, its actually a very professional option used by many studios for video work, including company I work for. If you’re into filmmaking, its the choice of professionals, i’ve used it for a few projects, great quality, but very expensive for a hobby. And a total waste if its going to collect dust"
3375,"That reminds me of the streamer who green screened a gamer chair and used a regular kitchen chair.

Edit: while looking for [this clip](https://www.reddit.com/r/gaming/comments/a3sl7m/they_asked_him_what_gaming_chair_he_was_using/?utm_medium=android_app&utm_source=share) I found out it is a pretty common practice to fake a gaming chair. Go figure."
3376,"I spent in total 100 dollars for my stream setup. Most expensive part was my elgato stream deck that was 60, I bought a logitech webcam and mic for the other 40. If you fool around with the settings, and using a lamp pointed at your face, the image can look super crisp with a cheap webcam. It's not dslr quality but it gets pretty close. I haven't had any complaints about my face cam quality so far from viewers either so it must be passable ☺️!"
3377,"I agree , I kind of pushed off streaming for a couple of years due to personal issues. And the last year and a half I was like okay I need to do this and kind of was in the impression that I needed everything top class and was a bit intimidated. But decided let's just roll the dice and got the logitech c920 when it went on sale over the summer for like $35, doing it on a decent laptop (not a gaming or top end) and was running my mic for stream off the webcam. It was pretty decent once you tweak it and set some filters on it. My biggest purchase was the el gato. And recently just saved up to get a hyperx quadcast mic to try it out since it was $40 off over the weekend."
3378,i wanna start streaming so bad but i have a very bad laptop and i got no games on my ps4 :/ my mic is decent though and i could afford a webcam
3379,"I streamed without webcam until I got enough stream revenue to buy one, just because everyone uses webcams doesn't mean it's necessary. Streaming without one, and at a certain follow goal, do a webcam stream face reveal, and keep it up from there! That's what I did, and it went really well"
3380,"You make this investment sound like you are investing into a job rather than a hobby though.  This entirely depends on the person and what their goal is.  Personally speaking and for a friend of mine who both of us just enjoy quality products feel the need to not go to a lower quality (not saying c920 is shit, but if there's better, I prefer the better) when you have cash to burn.  I'm not out on twitch to grind and get the highest sub count, or viewership or follower.  I mutually invested into my stream to play with friends WHILE streaming just for the hell of it, and if people want to sub or help donate so be it.  It's more fun to see people come in and throw a prime at me every once in a while, twitch is like a mini-game of fun while playing a game.  And also it helped expand a network of friends by sharing my knowledge and helping others with their stream.  I get way too bored with real life shit, this is the best hobby I've picked up in a while.  Keeps me in doors and out of trouble too,  If it weren't for streaming I would be at the bar getting hammered every night and end up with some fucking STD or some shit."
3381,"You are 100% right, that's why one of my first sentences were: ""if you have the money to spend, go for it. But a lot of people don't.""

I personaly, I have extremely limited money I can spend forwards my hobbies (jiu jitsu, gaming, audiophile). So, these $40 I saved up on the webcam, I was able to get a new headphone..."
3382,"Ah yes I skipped over that sentence by accident because i was skimming, but generally speaking yeah I know what you mean, 90% of the twitch population shouldnt spend if you dont have any particular goal or the cash to spend on those parts."
3383,"I started in 2018 on an old refurb dell optiplex i5 from 2012, 3 c270’s (one for face, one for midi controller, one flex cam- guitar headstock mount/doggo cam/guest camera, and an elgato hd60 i found on fb marketplace for 25 bucks. Was fine, no complaints, running an ASUS GL703, Strix Hero Edition, 1 c920 and 2 c270’s now and for screen capture I’m running an ethernet hub and doing it via NDI now"
3384,"I bought a c920 not just for streaming, I also bought a Razer Seiren Microphone not just for streaming.

You can still purchase good gear if you want to, they have more uses than just for streaming, if you're looking to drop some dosh on high end gear but are worried that it'll go to waste on streaming, think about what else they can used for."
3385,"But I never said someone shouldn't buy the c920. I SPECIFICALLY SAID, ""There is no need in spending more than $20 on a webcam if you're starting."" on a TWITCH reddit. So I'm specifically saying that you don't need to buy a c920 if you're starting as a streamer. You could buy it, of course, but there are other options. 



I created this post, because after asking people here, it seemed that the only webcam I could possibly buy for streaming was the c920, when in reallity, the $40 cheaper c270 is good enough."
3386,"I am aware of what you said, but regardless of if you're starting, thinking about starting or are already knee deep in streaming, purchase what you like, because they've got other uses that aren't restricted to just streaming, so if you're thinking of buying a c920 and are thinking about streaming, you should take into account the other uses than just streaming if you go ahead and purchase it, because if you find that streaming isn't your jam, you know you've got a c920 for other uses instead of thinking you've wasted money."
3387,"The only reason I still recommend the c920 is because it regularly goes on sale for half off everywhere, and dollar for dollar, it will retain quality and give a huge bang for your buck.

Buying something cheap and then going to a 920 in a year isn't helpful cuz it's much more expensive to do so long run. Better to just not use a cam save another 20 or 30 bucks and buy the half price 40 or 50 dollar c920.

It's not like you need to save up an extra 100 bucks - it's 20 or 30. You can do that shovelling some driveways or mowing some lawns for a few extra bucks."
3388,"Hey. I got a streaming set of web and mic from trust gtx and costs about $35-$40. A good deal.
I can only stream lol and lor for now and that is enough. Will start streaming in a few days on my new channel, wish me luck!"
3389,"I picked up an ASUS TUF laptop from Best Buy, Ryzen 7 3750H for 650 bucks, they had an even better deal on Black Friday for 550. It runs every AAA title effortlessly. Never had any issues streaming. If you position the lid correctly...you could even us the built in webcam."
3390,Isnt 30fps 720p good enough since it will be in a small square anyways?
3391,"Some equipment I agree, but something as basic as a webcam that can be used just to chat with family or friends I wouldn't encourage going under the baseline C920. (which is like 50 or 60 bucks).

If it doesn't work out for streaming, at least you still have a great 1080p webcam."
3392,"Added note, I got 2 of the 90$ cams on sale for $30 each. Local best buy had a sale.


If you want equipment, be sure to look around your area for deals and sales. Facebook marketplace is also a  great place to find a decent hand-me-down camera."
3393,"Revision: There is no need in having a webcam if you're starting.

You could be uncomfortable, your living conditions could be unsuitable or maybe what you do just doesn't need one. Ect, there's no pressure."
3394,"Speaking of webcams, if you have a laptop even the one built into is good enough to get started with in my experience."
3395,This is amazing advice thank you so much. Also any tips to grow the stream or channel? Not really sure how to grow it I have a couple subs here and there but that's it
3396,"I agree, I bought a $20 cam from Target when I first started. As long as your light source is fine (use a spare phone or your phones flashlight) then you’ll be Gucci"
3397,"I wouldn't say there's ""no need"" really. Most cameras are more expensive because the quality is better. Beyond resolution and frame rate there are lots of features that affect video quality

Obviously don't take out a small business loan to buy a $10,000 camera if you're just starting out and you're not sure if it's for you

However there's SO MUCH competition on twitch. For the most part if someone's camera or mic just looks or sounds like shit most people aren't going to bother giving that streamer a chance. Then instead of growing and having fun they're left wondering why no one wants to watch them stream 

Everyone's experience will vary but I think it's a bad idea to assume the bottom shelf gear will be good enough to grow your channel. Unless you're just the most charming person on the planet of course

If $17 is what you can afford then go for it! I'm not judging you. 

If you CAN afford more though then you'll have a leg up on everyone else's production value. For some people like me that's important as a viewer"
3398,(Used) C920 or any 720p + some proper DIY lighting should do the job great.
3399,I would recommend using that money towards layouts and emotes. At least two emotes ready when you get affiliate. I bought that cam and recently I upgraded a year later.
3400,"I have the C270. If you override the exposure to -5 or -6 in OBS's camera settings and set your own brightness, whitdbalance, and other settings with good lighting, it actually looks like a really good webcam. You'll only really notice the quality reduction if you're streaming higher than 720p and you go for a full cam view scene."
3401,I'm just trying to find a cheap mirrorless for sub 200 on eBay.
3402,"I have my set up sourced from a laptop, and I use my default laptop webcam and honestly, for some shits and giggles, it's not a bad way to 'start'. It's a dream to actually get into streaming, but I'm echoing OP here, starting cheap and small is definitely the way to go, rather than investing in something you may not develop commitment for."
3403,"I mean, there are quality limits... I could spend $20 on a PC that would be better quality than the laptop I own and am using right now (1998 Intel Pentium 2 core 2 thread w/ integrated graphics card), it is poor quality, and growth is hard (or harder) when you can only go to 480p on stream. Internet is a whole other story (mine is garbage so...) It depends on the person to invest some money in equipment or not, me, I need a PC of some form before any other upgrade (I do stream it's just really really bad) so I can see the growth I want because I can do what I want on stream and have it not be 480p."
3404,Would anyone be able to recommend a PC for me then? I want to be able to use my capture card without it dropping frames on stream. I want to be able to stream sword and shield as well as other games from my switch/xbox one. The problem is with my 6 year old laptop it's just constantly dropping frames and is unwatchable. I would like to spend around 800-1000. Is this possible?
3405,"Go to r/buildapcforme and ask there, they'll happily help you out. $1000 is definitely possible to build a full setup. $800 for the pc and $200 for monitor, keyboard and mouse"
3406,"Sometimes I regret buying a nice webcam, a blue yeti and a stand for it when I first started streaming.  I got really into but then it fizzled out. So I sank like 200 right from the start but then didn't stream anymore after a month.


My advice is start cheap. I just now got back into streaming and I still wouldn't go crazy on the gadgets until you are for sure gonna stick to it."
3407,C920 is 40 bucks rn
3408,I followed you too! :)
3409,"Honestly, I'd go even further, you don't need a webcam at all. There is nothing that turns people away from a stream faster than bad audio and everyone would be better off investing in a microphone."
3410,"Its the same as saying you don't need to spend x amount on internet, just stream in 360p, sure you can but majority of users will not watch a low quality stream.

If you can't afford to stream with expensive equipment, there's nothing saying you can't get the minimum and do just fine, but majority of people aren't going to recommend a $20 camera based on the simple fact most people will go with quality vs expense, rather than throwing $20 down the drain for a sub par product, spend the extra and get a product that is known to be fairly priced to today's standards and serves its purpose the best.

With that said, they're getting cheaper by the day and there's nothing stopping you from doing a bit of research and finding there are 720p@60fps cameras out there that cost a lot less than a streamer recommended setup."
3411,get what you pay for.
3412,"This is entirely true. I also would like to claim that you don't need to throw hundreds on an expensive mic. Heck, the mod mics today are even good enough. And also there are more affordable options for mics on the desk/on a stand. Here in Europe, Superlux is a good brand for that stuff. They make copies of brand-name products that are still good quality, just at about half of the price."
3413,Superlux makes the drives that are on akg headphones. Correct me if im wrong
3414,Could very well be. I have some of their headphones and I'd say they're not at all far from the model (usually Sennheisers) they were going for.
3415,If you can't afford to get some decent equipment then IMO you shouldn't be streaming. You should be spending your time on improving your life so you can afford things like that.
3416,Why do you not need more than 720p for twitch? Am I wasting bandwidth by streaming from PS4 at 1080p60fps?
3417,"You could, it just depends. At least for a single pc streaming the performace inpact I'll have isn't worth it. Also if you're not a partner people on mobile will be stuck to 1080p60p which sucks"
3418,"I still have and use a C270- it's fine for a face cam and if you have(had) poorer internet like me it's likely you can only pump out good 720p.  I started streaming with a dual core laptop with AMD graphics just to see if I liked it  (Not games though... when I attempted that for a week or two the computer overheated) and upgraded PCs when things got really moving.

Some of the fastest growing game based content creators I've seen don't even have a webcam.  As long as your voice sounds decent, and your content has enough pixels, it's all about your personality really. 

I would definitely say that you should start doing more than you should be theorising.  A lot of my initial thoughts about streaming changed (and continue to change) as I'm doing it longer and longer."
3419,Agree but also look for used c920s on fb marketplace or OfferUp before you buy a cheaper one. Got my second one for $25
3420,"I agree completely. Im actually using my old iPhone 7 with a webcam app, because I have no idea if my streams will be anything and I dont entirely feel like splurging on tech for it if I dont need to. Plus it outputs 1080p footage if I need it to, so it works for now."
3421,Your internet connection is the only piece of tech you should be concerned about having high end of.
3422,"Also depends on your category. So i kinda disagree. 
If you are a just chatting person or a talkshow/podcast streamer i would recommend spending more then 20 bucks on a webcam."
3424,What if I'm 4 years into streaming? Should I aim for a more specialise/complex setup?
3425,It all depends on you and your community. Are they satisfied ? Do you think they will appreciate the change ? Is it financially viable for you ?
3427,Now with corona you can add a 0 to the $20 lol
3428,"100% agree ... And to add if you keep debating on a webcam or asking ""do I need a webcam to stream"" the answer is No.... When you first start out the most valuable thing is to just stream... It gets you practice and it gives you a way to download your vod to ""create highlight reels or clips"" to post to other platforms to help discoverability"
