idx,text
69729,"It's not always just about the major, but what else you do in school. I got my degree in anthropology, which as a bachelor's doesn't mean much in itself, but I managed to get into courses where I did actual research and got my name co-published in a couple professional journals. That was something I've been able to market to employers as much if not more than the degree.

Same goes for something often bad mouthed like women's studies. I have two close friends who went that route, and both are employed in careers. Women's studies, not STEM, prepared them to go on to get social work degrees, which is where they now make their living."
69730,"Agreed. College is the epitome of YMMV. An in-demand major helps, but doesn't mean jack if you don't put in the work to network and intern. A shitty degree held by someone who did internships for at least the latter half of their education will be looked at better than a ""good"" degree holder with no experience. 

So, incoming college goers: INTERN. NETWORK. SCHMOOZE."
69731,"It really depends on what your goals are for your education, your career, and your life in general."
69732,German polka history
69733,Well looks like i’m fucked because i majored in that and a comprehensive history of german beer steins.
69734,"Is a bachelors in psychology a mistake? What can I do with it? Social worker?

Got it but haven’t needed for a job just stayed a massage therapist because I like it. Any good plan b options?"
69735,"For me I went back and got my master's in Computer science after that.

I worked at Starbucks for a year after undergrad and couldn't find a job with my psych degree though I don't think it's impossible it's just fairly tough.

Working as a developer now and digging it."
69736,"Unless you eat, sleep, and breathe architecture do not even consider it as a major. You will spend more money, more sleepless nights, and more of your sanity than any other student. Unless you have the passion necessary to make those sacrifices, forget it. Learn from my mistakes."
69737,"I just finished a dual master's in architecture and urban design. Everything you said 100% except now that I'm out and working, there was indeed light at the end of the tunnel."
69738,"Tried it, switched into City Planning. More fun, more sleep, and similar pay scale."
69740,"Currently going through the program right now. Struggling with grades, social life, money, and doing my laundry but nothing is more satisfying than finishing a project"
69741,Architecture is one of the most strenuous majors and also has the lowest post-graduate employment.
69742,TIL avoid all college majors
69743,Will everyone stop getting college degrees so that my degree still means something?!
69744,"Many people would be better off financially if they went into the trades/skilled labor, but for becoming a well-rounded individual and networking, college is the best route for many."
69745,"I feel bad talking shit about my degree. But Biomedical engineering. 

Maybe not *avoid* it, but make sure you have an idea of what you like at the beginning or early as possible, and tailor your work experience, classes, training, etc. to that specialty.

For example, if you like prosthetics, have things that show you are ready to compete with Mechanical and Electrical engineers over the same position, and that your biology/anatomy knowledge gives you an edge over them. 

All other engineers have obvious fields they can go into. Biomed is simply just not as fleshed out and employees may just pick grads with majors they fully understand. 

In my undergrad, I went more of the bioinformatics route and did a lot of coding, so I load up my resume with that stuff and had 2 internships that furthered my coding ability. But would it have been easier if I just did Computer Engineering? Possibly."
69746,"ITT: Just about every major

As someone who can't do shit with STEM related stuff and has no real talents, I've just kinda accepted I'm royally fucked."
69747,Criminal Justice. I'm about 2 months way from having my AA in CJ but every law enforcement professional I met said don't waste your time getting your bachelors in CJ. Get it in something practical like business or engineering so if goodness forbid something happens to you then you have a degree in something else to fall back on. I want to be a police officer btw.
69748,[Every Major is Terrible!](https://youtu.be/pRexBMPeRTo)
69749,"If you’re not gonna get a masters and attend an accredited school, don’t do architecture."
69750,Don't do a business major if even the smallest amount of math freaks you out. Even in things that aren't accounting/finance you will still have to do a little bit in most entry level positions.
69751,"Any major starting with ""Pre-"". Pre-law, pre-med, etc.

I know several people who became doctors with degrees in chemistry, biology, or engineering. I also know someone who finished pre-med, went to med school, realized he didn't want to be a doctor, and was fucked. He ended up spending 4 years getting a second bachelor's degree.

Likewise, you can easily get a law degree and become a lawyer with degrees in all sorts of things. You can't do anything else with a pre-law degree."
69752,"Graphic Design:

The market is over saturated with designers. 

Design is very subjective. No matter what jargon pro designers may throw at you about color theory and the golden ratio, when it comes down to you finding a job, it's all about if the employer likes what they see.  

The current industry is being devalued by sites like fiverr and 99designs where companies will pay pennies to get a logo or a flyer made. This make companies not value or need in house designers. 

Design agencies are very stuck up and the culture is almost always cut throat. 

The pay sucks. Depending on your city the entry level pay can fluctuate, but you will be making nowhere near the money you could be with other forms of education. 

You most likely will not be doing what you love unless you get lucky. If you become an in-house designer be prepared to only design stuff related to whatever your company specializes in for the rest of your employment there. If you're hired at an agency, you will have more opportunities to work on different brands, but may not be the brands you're interested in."
69753,Also the degree seems to not mean much by itself. I have hired a hand full of graphic designers and have never once asked if they have a degree. I only care about their portfolio and work ethic.
69755,"I'm planning on going to law school at the university where I'm getting my undergrad. One of their recommended degrees is Letters, which is a combination of history, English, and philosophy with both modern and ancient languages thrown in for fun. I'm also doing a political science minor. Seriously....don't do a poly sci major if you want to go to college. It doesn't teach the logic or technical writing skills needed to succeed on the LSAT or in law school."
69756,"First of all, almost every major is useless if you can't show employers what you learned with it (i.e internships, publications, research, papers/projects beyond what is expected of a college assignment, ect.). Also, you may have the risk of making your degree useless If you want to stay in a certain area. In doing so you are limiting your job prospects in that industry. For example you major in art history, but their is only one art muesum in the state and you don't want to leave the state. 

Second, most majors themselves have some degree of usefulness. Supposedly useless majors such as philosophy, history, psyc can be great prep for an advanced grad school degree like pre-law or other intensive writing/research degrees. Others like English, Classics, Journalism show that you can write well which is always valuable, and can lead to jobs in copywriting, editing, ect. 

That being said, their are some degrees I would not recommend getting: 

*Sports Management*: Coming from someone that worked at the highest levels of athletics, a sports management degree is useless. While their are jobs in sports (they just require you to grind and they are really competitive to get) I know for a fact that hiring managers don't give a shit what degree you have (except for like athletic training). They just care about your experience. So sports management itself doesn't get you hired, and it eliminates career options if a career in sports doesn't work out. Its also getting a rep that it is an ""easy major,"" in which I agree is the case with about 98 percent of sports management programs. Again, going to what I said earlier using the art history example, probably isn't a good idea to major in sports management if you attend a small private NAIA school in the middle of Iowa. 

Other useless majors include *dance/ballet* if you have a bad knee or back. And *African American Studies from North Carolina* (google UNC academic scandal)."
69757,If you don't like shit ton of physics or if you're not atleast somewhat good in it don't go into lucrative engineering fields because there's a very high chance you will switch out. If you're in it only for the money there's a big wake up call heading for you
69758,"The one where your entry level salary will be more than what you owe total in student loans (that's what my loan officer told me in the late 1990's). Your major is what is going to help you make money throughout your life, keep your hobbies out of it or make it a minor."
69759,Is this even possible today?
69760,"You have to be smart about it. My degree in a STEM field had an average starting salary around $50K when I went to school. Over four years I went in-state, did Community College for 1.5 years to get the 'basic' classes out of the way cheaper, and then went hard for the nest 2.5 years. I ended up with about $35K in loans that I will be done paying off this December, basically 15 years early. I also paid about 15% more each month than the minimum to eat the principal away quicker. You need to sacrifice a little and be smart about planning, but it can be done with the right major."
69761,"I've seen a lot of ""Foreign language unless you double major"" Nobody has yet mentioned that Japanese isn't a happy life. Period. 

There is literally thousands of other westerners pining for that English teaching job in Japan and they treat you like dirt when you get there."
69762,"In the UK - if you can afford not to, don't do law. Many law firms I stumbled across prefer non-law rigorous degrees (linguistics, maths, hard science) and a conversion to law. If you get good enough grades, you might be able to get your degrees for free because some firm or Inn of Court will pay for it. If you want to do IP law, just do science. Whatever area of science you graduate from is the area that you can do patents. Also, you can work in the patents office. If you don't want to do law, you will always get asked the question as to why you studied law and you are not trying to work in law (as I got when trying to get a job in PR).

Finally, if you want to be a solicitor forget the LPC. A new 'super exam' is coming out in 2020 and you won't need to spend £10-20k on the LPC to qualify. You will, however, still need 2 years' work experience so get that now."
69763,"Don’t go to college unless you know what you want to do. We’ve been looking at this all wrong. 

Start with where you want to be in 10-15 years and then work backwards. What’s between you and that place?

If college is one of those things, then go to college. 

Looking at it the wrong way is how we’ve ended up with $1 trillion in student loan debt. Don’t just go to college for the sake of going to college. It would literally be cheaper to travel around the world. And you’d learn more."
69764,Tai Lopez?
69765,**N A W L I D G E**
69766,Gender studies
69767,"As my Jewish friend said, ""Do you know how many Jews are in Jewish studies?""

""No""

""None.  Real Jews study law, medicine, or finance."""
69768,Was gonna say that I'm Jewish and majored in Political Science and Criminology. Then I remembered I'm in law school...
69769,Most Jews studied Judaism *their entire lives.*
69770,None will make you earn anything.  They may allow you to do so if you're able to do the work.  Doing something you like is a better recipe.
69771,"While I agree that no degree will guarantee you a lucrative job, I think it's important to point out that not everyone has a field of interest that can be readily commercialized.  OP might love medieval poetry, but the reality is that there's not much market demand for people with expertise analyzing themes in 12th century literature.  At the end of the day, he has to weigh that interest against the possibility (or probability) that he'll not only have few job prospects at the end of those four years, but also have tens of thousands of dollars of debt.

I definitely don't think you should do something you hate, or in which you have no talent, but I do think that ""doing something you like"" needs to be tempered by an element of pragmatism.  As rough as engineering was sometimes, I think my adult life would have been even rougher had I gone the liberal arts route."
69772,"A degree isn’t a ticket to a guaranteed income. STEM fields and computer science are good bets now, but not if you’re not good at those things, or if you’re not interested in them.

Choose something you’re good at and passionate/interested in."
69773,+1 on this!  Interviewing potential software engineering interns. So many were not interested in their software engineering field! “Stop wasting your time and money!”
69774,"~~STEM~~ TEM fields and computer science are good bets now

Physical science fields do not pay well.  And certainly do not pay well compared to engineering, technology, and often math (though math is a risk itself).

Chemistry, biology, biochemistry, physics, microbiology, etc. salaries are trash.  Examples of well paying jobs in those fields are highly anecdotal and do not take into account the hundreds of people that wanted that job and did not get it."
69775,"Agree, and wish someone told me this a decade or so ago. ""Research Associate"" and ""QA/QC tehnician"" are the most common jobs for a BS in chemistry/biology, but they cap out around 40k these days. It's hard to fidn these jobs too, because unless you go for an advanced degree, thats the only real jobs you qualify for."
69776,"Can confirm. Was scientist, now engineer. Engineer easier and pays better."
69777,"passion doesn't pay bills. usually tech companies ask for ""insanely passionate"" people. translation: workaholics."
69778,"No, but neither does a piece of paper with some words on it. 

I would hope that these tech companies are also looking for people who are good at whatever they’re hiring for, and are actually interested in their job."
69779,"Tech companies are not expressly looking for workaholics.  Sure, it's great if we have people who work hard, and we want people who are motivated and so on.  We even want people who will work long hours at times (and they get paid a commensurate salary).

But when we ask for passion, we're looking for people who are excited about the domain they're in, and who draw meaning from accomplishing something in that domain.  Those people will be the ones who come up with the best and most innovative solutions.  They're the ones who are willing and able to tackle a problem that other people say is too hard.  Or who will raise the bar on what is ""good enough"", and not settle for status quo.  Now obviously passion alone isn't sufficient for this - we're actually looking for passion and brilliance - but those two often go hand in hand.

Those qualities are much more important than being a workaholic, and we will bias towards those every day of the week."
69780,"Of course they do. People with passion tend to do the best. The guy that spends his free time building up a home lab at home and writing code for open source projects is probably going to do a better job than the guy that views tech as a way to make a lot of money, but then doesn't put in any effort outside of work.

I've noticed it a lot when I interview. Confidence + eagerness to learn + seeming excited about the job are the things that seemed to have the biggest impact on receiving an offer."
69781,"Be wary of the popular advice on this thread: ""Major in anything STEM."" I'd put my money on the majority of FI people on this forum are STEM folks who sit in front of their computers all day, hating their jobs... but thats another topic all together. I think Reddit threads in are generally a bad place for these kinds of questions because of selection bias. Just wanted you to keep that in mind. There is plenty of good news for a lot of STEM majors, but not all of them. You can find a lot of articles supporting STEM. Here are some contrary to consider: 

https://www.bls.gov/opub/mlr/2015/article/stem-crisis-or-stem-surplus-yes-and-yes.htm -- Key point: Surplus in academia STEM.
http://www.businessinsider.com/college-majors-producing-the-highest-unemployment-rates-2017-10 -- Key point: Biology and Environmental Science majors have some of the highest unemployment rates.
https://www.census.gov/newsroom/press-releases/2014/cb14-130.html -- Key point: Majority of STEM graduates do not work in STEM 

In my opinion, you should consider if you really love a STEM field? Are you good at math? Do you like using a computer for the majority of the day? If not, there are a plentitude of opportunities out there, with only an undergraduate degree being the minimum qualification."
69782,100% agree. There is a huge surplus in stem. There was a paper regarding surplus and shortage of stem. Cause they want someone from Harvard to do their lab technician Jobs and anyone lesser than that will just have to work at mcdolands.
69783,"Double major in computer science and finance. Unless you have the ability to become a neurosurgeon, this is the answer."
69784,"Becoming a neurosurgeon would probably be the worst way to FIRE... 4 years undergrad, 4 years medical, 3 years neuro residency, 3 years surgical residency, 3 years neruosurgical residency... if starting at 18, and never you never meander, you dont earn your 800k/year until your 35, and by that time, your student loans (which you have been making small payments on during a million years of residency) have probably balooned to 500k.

Fuck neurosurgery"
69785,"You can pay off your entire student loans in one year if you wanted. But yes, of course, you don't go into neurosurgery expecting it to be easy and to want to FIRE. You do it because you have a sick passion and don't give a shit about sleep. My brother's girlfriend is a neurosurgery resident. She can't stay awake for more than 10 minutes when watching a tv show or movie on her maybe 2 days off a month."
69786,No you couldnt... the interest alone on 500k would be like 3.5k a month... and earning 800k/year would mean your taking home around 450k a year after taxes and 401k
69787,You’re just being pedantic now. The point is that student loans are not an issue for those who manage to actually make to the true neurosurgeon point.
69788,"I think the point is that neurosurgery is a terrible way to fire... great way to earn a fuckload of money later in life... but spend your time from age 22 to 35 studying or working 12-16 hours a day, 6 days a week? Not to mention, if you spent all that time learning such a specialized skill that society is in need of, when there is only so many available slots for residencies... probably feel guilty when hanging up your spurs... people that goninto neurosurgery are not the fire type"
69789,"Thought questions!

100 18 year old kids want to be a neurosurgeon, how many make it?

100 18 year old kids want to be software developers, how many make it?"
69790,That's why I said *ability* to become a neurosurgeon.
69791,"Less than one.

50?"
69792,"Indeed!  I think you're being gracious on the less than one too!

Hence also why software development for the ""young person who hasn't gone to college yet"" is such the better choice.

People always like to throw around surgeons and investment bankers as great choices... which for a CERTAIN SUBSET of people that is true... it's just that random run of the mill 17 year old is UNLIKELY to belong to that subset.

It's like saying, ""Hey want to FI?  You should be a professional football player or CEO of a fortune 500 company and not blow all your money.""

I'll get RIGHT ON THAT."
69793,And a minor in statistics
69794,"Business degree, then a sales career."
69795,In the process right now of finishing a business degree and the sales opportunities seem great.
69796,"Once you get good at it, sales is an awesome gig. Outside sales is waaay better than the alternatives too. Freedom and cash."
69797,Finance and economics will tend to earn high salaries over time
69798,"Best advice I can give is find a job (or field) that you think you'll enjoy and excel at, then work backwards from there. Once you have an endpoint, think of the degree that will best get you there. 

The type of degree obviously matters but you also have to consider your interests. If you don't enjoy programming you probably won't be very successful with a computer science degree, or you'll end up hating your job which will make the marginal difference in salary not worth it."
69799,Registered nurses make a lot (2 year associates degree). Finance degree (never not going need that). Civil or mechanical engineering for obvious reasons. Chemistry majors tend to end up in the pharmaceutical industry (unsure if you'll actually need a MS degree later instead of just BS degree). Business management degree.
69800,"I did Comp Sci. Pay is great, but long hours and stress.

If I were to do it again, I would consider:

4 year law enforcement degree at a local school. Become a cop, work your way up. Retire in 20 years with a nice pension, move into some other career at your leisure.

Some kind of trade (plumber, electrician, welder, etc.). Do a trade program and apprentice as quickly as possible. Also do part-time school for a business degree at a local school (even just a 2 year). Grind for 10 years and then start your own shop.

Both of these offer a ""cheap"" education (no crippling debt) and aren't as susceptible to the AI/automation/robot change that will likely come during your working years."
69801,Finance
69802,"Not sure about everyone saying finance unless I'm doing it wrong...my degree in finance gets me a salary of $55k. If I could go back, would do computer science, engineering, or a trade."
69803,"Yeah bro, if you’ve got a good finance degree, you should be making twice that by your 30’s at any number of large banks"
69804,My ex has a finance degree and one of his first jobs right out of college paid him starting salary of 80k. You might want to shop around for different job if you think 55k is it for you.
69805,How are people finding these high paying jobs?
69806,Indeed.com has a lot of jobs. I think indeed is the most used job board by employers for posting their jobs. You just need to put in keywords for the job you want and be flexible with location.
69807,"I have been thinking about trade as well. People know how to code I doubt knows how to wire their house or fix their plumbing. Or better yet, they probably don't want to do that messy stuff."
69808,How long have you been working? I envy you with that much money coming in.
69809,"Something you enjoy that has a job market. Don’t spend the first half of your life miserable in the hopes of enjoying the second half. If you can’t enjoy working at least most of the time, you’re doing it wrong."
69810,"I have a liberal arts degree -- don't get one of those

and I work in IT -- do that.

because I taught myself web development & took some IT courses (programming-related ones) -- do that.


To be honest, 

Sometimes I think if I could do it all over again, spend my teens learning IT skills during summers, evenings, & weekends (basically as much as possible), then skip college and go straight to work.

But then I think... I wouldn't be the same person without the more expansive worldly & historical perspective I acquired in college.

So, I think I'd really try and combine those two--

If I ever have kids, have them go to IT camps, get IT tutors, and study whatever they want.

But at least learn the tools (IT-- I think that's where it's at b/c it empowers work to get done)"
69811,"Something you have at least 50% passion for + what everyone else has already mentioned (STEM + comp sci).

I went the MD route, but only had partial passion from the start. Yes, I makes lots of money and can live on my own, but am banging my head sometimes over why I didn't go the comp sci route (loved math, programming, and cryptography... plus computers >> humans)."
69812,Another vote for computer science here.
69813,Math
69814,"I got double major in math and physics. Insurance companies won't take me but mortgage companies will allow me to data entry though. Fml, not stem."
69815,"Surprising, insurance companies love math majors and the addition of physics with signal processing could put you in line with emerging technology development roles within said insurance firms. I would check out data scientist job reqs in insurance, find what skills are important and focus on those to start. Easier said than done, but there is high demand, RE: Hartford, CT headquartered companies."
