idx,text
1487,"Top 3:

- Coolhaus balsamic fig mascarpone

- Haagen Dazs creme brulee (discontinued; dulche de leche is close but not the same)

- In the 90s Godiva had an amazing white chocolate raspberry ice cream. I’ve tried others but none compare.

Flavor I didn’t think I would like but did: Creamistry has an incredible Capn Crunch flavor. I don’t like Capn Crunch and would have never tried it if they weren’t handing out samples one day. It’s very good.

Weirdest flavor: I thought I would love black sesame but I didn’t like it at all."
1488,"I’ve seen crème brûlé flavour once, can’t remember where it was. Didn’t taste it tho. Will have to try that too, and maybe make it too, crème brûle is my girlfriend favorite dessert. 

Capn crunch is interesting too. Not a huge fan of those  too. More a fan of frosted flake"
1489,"**Top 3**: Realistically my top flavors are all acutely associated with a specific memory. So with that caveat 1) Gelato Messina's pomegranate raspberry brownie - I make my own now (of that exact flavor) and it's my favorite ... but dang nab it nothing compares to that memory. 2) Brandy butter, not because it's the most amazing thing ever, but because it is the perfect encapsulation of childhood Christmas memories, at home with my grandmother, when I now live far far away (in another country). Blueberry citrus - from my friendly semi-local ice cream parlor (and so much better than my attempts), and which we had at our wedding!

**Surprisingly good flavor**: I still remember my first lemon ice cream (not sorbet) as a teenager - it was perfect! (I was never really a fan of 'sour' flavors). Separately, red bean paste (so long as it's smooth not crunch). 

**Weirdest**: Taro (nope!), and durian (ALL THE NOPE!) - they were entirely appropriate for where I was living at the time, but not really my thing :)"
1490,"I have an extract of brandy butter I think. That would be a good thing to try in. Never had this flavour. 
Pomegranate gelato brownies must be a hell of a recipe to make ! And blueberry citrus must be refreshing! 

We had orange ice cream here when I was younger, than is was not “trendy” anymore and companies stopped making them.
Tried once, didn’t taste like the childhood memory! 

Durian ice cream... yuk never tired it, but I heard the smell is terrible"
1491,"> I have an extract of brandy butter I think

I just half a jar of it in my normal custard base :) 

> Durian ice cream... yuk never tired it, but I heard the smell is terrible 

I find durian to be not quite so bad as it's reputation, especially because there are different 'types' of durian, which smell to varying degrees. In ice cream the smell was pretty neutral. But the texture had transferred over too, and that was what really got me. I've had awful luck adapting to the texture of a number of southeast asian desserts (ais kacang ... *shudders*)."
1492,"Half a jar, at least I know what I should aim for :p"
1494,Dark chocolate with peanut butter is very good. I made one the other day!
1495,cookie milk (vanilla base)
1496,Cookie milk? Like milk soaked with cookie ?
1497,yep the milk used in the mix has cookies soaking in it
1498,Mmmmm I definitely will keep that in mind
1499,Do you need to reduce sugar amount since the milk will contain more sugar?
1500,"Favorites: cherry garcia without the chocolate chips (I hate chocolate chips and will pick them out! ), yogurt gelato, mint cookie

I can't really think of anything I thought I would hate but loved, I don't really try anything I think will taste bad.

Strangest would definitely be durian. I had a taster out of curiosity but I couldn't get over the gasoline smell/taste. I haven't had actual durian though so it might have just been the ice cream at that shop."
1501,"Oh god! Durian?? 😱 I would even think about trying it. Never smelled one, never tasted one."
1502,"green tea ice cream is very easy to make, you can get matcha powder at an oriental market and just add it to vanilla"
1503,Asian market... Orientals are rugs.
1504,THANK YOU. I'm sick of people saying oriental and thinking they're being cultural. Phonies
1505,I love green tea ice cream.
1506,They have similarly powdered black tea that makes another variation of typical ice cream flavor quite nicely.
1507,Oh gawd that stuff is so delicious!
1508,Damn. That sounds really good.
1509,Cinnamon ice cream is amazing.
1510,Cinnamon ice cream and chocolate foam is great.
1511,"I haven't made it myself, but a gelato shop near where I used to live made lavender. It was heavenly. It had a delicate flavor, so you would want to serve it as the main dessert and not mix it with brownies or pie or sauce, but I definitely want to recreate it at home."
1512,"We have an ice cream place that makes wild berry lavender and it is yummy. In the summer they make sweet corn and it's also tasty.  
http://www.jenis.com/categories/Flavors/"
1513,"Hmm...those look tasty. None of their scoop shops near us, but it does say some near by grocery stores carry them :)"
1514,"She has a very good book. Her recipes just take a lot of time. 

http://www.amazon.com/gp/aw/d/1579654363"
1515,I wish I lived on the west coast where lavender grows rampant. That sounds divine.
1516,I live in chicago and have a very healthy lavender plant growing in front of my house.  Yields a lot of flowers from which I make a lot of lavender simple syrup every year.  It can be done!
1517,"Made this in France with flowers that are just opening, steeped in milk/cream at a fairly low heat for what seemed to me to be a very short time. Then they squeezed the flowers into the batch and I think this is what really makes the difference."
1518,I live in south Florida... it's typically too hot for lavender. I've seen some people do it but items takes a lot of work and doesn't last very long.  I always come back from Portland with a huge Ziploc of it though.
1519,Lavender grows like crazy in my garden... I think this is going to have to go pretty high up on my list of flavors to try making!
1520,"We also have an ice cream place, [Salt & Straw](http://saltandstraw.com/home.php), that makes a honey lavender ice cream, as well as many other unusual yet delicious flavors. Some of my favorites are pear with blue cheese, honey balsamic and cracked-pepper strawberry, and sea salt with caramel ribbons. They also had one this summer that was chevre with marionberry and habanero jam. Mmmmmm."
1521,Brown Bread. I go to a place call Scoops in Los Angeles. They're always making unique flavors which change fairly regularly.
1522,"...like Pumpernickel ice cream? I'd eat that. Might be nice with sweet, caramelized onions on top, too.  

Don't judge, you know I'm right. ;)"
1523,"Purple yam.

My fillipino mother in law introduced me to it. It is fucking delicious... AND PURPLE."
1524,"Taro? I LOVE taro. To me, it tastes the way chocolate chip cookies smell fresh out of the oven."
1525,"Oh Taro is good, my favorite frozen yogurt flavor *by far*."
1526,"I don't know if it's generally called Taro, but in Filipino we call the purple yam ""ube"" (pron. oo-bee)."
1527,I wonder where I can get a purple yam....
1528,i bet it's taro... asian groceries should have them
1529,Red Bean Ice cream is quite good
1530,...like kidney beans?
1531,like azuki beans.
1532,"What's that like? Are the softened, or mashed a bit? Is the ice cream chunky? What other flavors?"
1533,"In the red bean ice cream I've had, they're soft beans mashed up a bit- not chunky at all, though. Azuki beans are sweet, so they make a great tasting ice-cream flavor. There are actually a couple Japanese treats that put azuki beans in pastries, sometimes shaped like fish (not sure why, though)."
1534,I'm not sure actually. I had it once in a Japanese restaurant and it was delicious. The aftertaste was similar to that of coffee ice cream.
1535,Oh yum; I'll see if I can hunt that down.
1536,"Ya, I definitely recommend it!"
1537,"I was pleasantly surprised by the quality of a tasso ham ice cream I tried.

Personally, I've had textural difficulties with avocado ice cream due to the high fat content, but it works well if you've got a CryoJet.

As for carrot, I haven't had it, but I see no reason it wouldn't work. You could either go in a carrot cake direction or a maple- or honey-glazed direction. Personally, I think I'd either roast them for a more complex flavor, or juice them and make a sorbet."
1538,"Quick google search for CryoJet didn't help me at all. Is this something I need in my life?

The carrot ice cream was one of the first recipes I searched for. It's already sweet, and to roast it or pan fry it before adding it to an ice cream mixture is something that appeals to me. Honey/maple would be nice - but so would caramel. I would eat that. 

How did the tasso ham taste?"
1539,"Sorry, I meant PacoJet. It's a commercial ice cream machine that takes canisters of frozen solid base and makes perfectly smooth ice cream. Saves a lot of the fiddling home ice cream makers have to do to get the right balance of water, sugar, ice, fat and air. On the minus side, it'll set you back $4,000."
1540,"Lol that makes way more sense for me, thanks. 

Yea, most certainly am not at the professional level. Got my ice cream maker for free. It's pretty old and didn't have a manual. Doesn't matter because ice cream.

So, the tasso ham?"
1541,"The tasso ice cream had a lovely balance of savory and sweet with a touch of smoke and a spicy finish. I don't know you'd recognize it as ham flavor if you weren't told, though. It was served with a hot crawfish pie and the contrasting temperatures and texures worked very well."
1542,"Sounds great, actually. My mom has been asking me to make the ""stranger"" flavors, even though they're not really that strange. It's good to know that one worked so well."
1543,"Garlic - courtesy of the Gilroy garlic festival. Had this when I was a kid. The start of my passion for Garlic in general.

http://americanfood.about.com/od/extremeamericancuisine/r/garlicic.htm"
1544,"I had this several years ago-not a strong garlic taste, but it gave you breath that is toxic to small animals.
There are better ways to make ice cream."
1545,I wouldn't have ever imagined.... looks mighty fine. Garlic is beautiful.
1546,I LOVE my recipe for buttered popcorn ice cream. It's delicious when topped with a salted caramel sauce. Mmm.
1547,Recipe yessss???
1548,"It's insanely involved. You have to have ages because you make your own popcorn, butter it, make basically a custard and seep the popcorn in the heated milk, and then make the ice cream. 

It's basically [this](http://almostbourdain.blogspot.com/2010/06/popcorn-ice-cream-with-salted-butter.html) though :)"
1549,Oh my god it sounds heavenly. I'm a sucker for salty sweet anything.
1550,It's really yummy :)
1551,Pisco Sour Ice cream. It's a traditional drink from peru or chile. It's actually xtemly delicius
1552,"Most of the stuff that might be ""weird"" that I've made has been posted, except Pok Pok in Portland has a bourbon coke float, with bourbon ice cream.  I ripped off the recipe.  I make a gelato base with a tsp of vanilla extract.  Once it's cooled I mix in 4 tbsps of bourbon.  I usually use Makers b/c it's sweeter.  And then mix it up.  It's got a nice vanilla/brown sugar/oaky flavor and the coke floats are delicious."
1553,"Ok, number 1, Portland, OR is completely badass so that's that.

2, Do you have the recipe? I know that alcohol doesn't freeze so a lot of the recipes just say to add it in towards the end - is that what yours says?"
1554,"Yeah, I do 2 cups heavy cream and 1 cup milk, 3/4 cup of sugar and a pinch of salt.
I mix that together in a sauce pan until the milk starts to simmer.
I whip 5 large egg yolks together. When the egg yolks are sufficiently whipped I take the milk mixture off the heat and slowly whip in the egg yolk.  Once the eggs are in I add a tsp to 2 tsps of vanilla extract, I add less usually but if I have a cheaper bourbon I'll add more. 
Then I reheat it until I get a custard. I take it off the heat and stir in a 1/4 cup of bourbon and then I chill it. Once it's chilled I throw it in my ice cream maker.
I never have a problem with it freezing b/c there's not a lot of alcohol in it."
1555,Wasabi... I think it was Sorbet however. Still pretty darn good.
