idx,text
3250,How much was your PC if you don’t mind me asking? I’m trying to make the jump from console and would love to do it as inexpensively as possible
3251,"You can see my pc [here](https://pcpartpicker.com/list/2L2fyk). It's worth about $800. But you could get it cheaper by removing an SSD, getting a cheaper Case. Not getting an aftermarket cooler, etc, etc.  Also Im not including mouse/keyboard, monitor, etc.  


I would say to get into pc gaming a good amount of money to buy EVERYTHING, including monitor, etc, would be around $800/1000 new. And $500/800 used."
3252,"Alright, thank you!"
3253,"Plus, r/buildapc would be happy to help after you get an idea of what you are thinking of building, they help make ""budget"" pc's all the time"
3254,"One thing I would say is you may well come across the issue OP was discussing in that subreddit too. I asked around there when building my pc and most people were pushing me to get better parts when I already stated I was spending £1000 MAX.

I have the PC I decided on and stream everything on ultra with no issues at all but the advice I was being given said I'd struggle. People love to spend other people's money."
3255,"YES ! When I say I have a $1k budget, I want to spend $800 not $1200 lmao."
3256,"That's fair but for the ones I've looked at for every person going above the given range there's another going below, though to be fair most of them do seem to like getting as close to budget as possible even if that means one much newer/better part than the others"
3257,Hmm strange I haven't come across any going below the budget. Might just have caught an odd bunch on my post.
3258,"Was it said it was a hard budget, and was it maybe not do-able under budget?

I dunno, just thought it'd be nice to point someone where at least some know what they're talking about and are willing to help."
3259,If you’re gonna start looking for parts join r/buildapcsales it’s got soooo many deals posted every day. Especially with the holidays/sales this season
3260,"I will get down voted for this but you can stream with a inexpensive PC.   Here is a link to a Alpha Gaming Channel video where they were able to stream for less than $150.  

[Alpha Gaming Channel on YouTube](https://www.youtube.com/watch?v=9Gjw5GgjzQs)"
3261,Nope this is exactly the kind of stuff I was looking for!
3262,Just curious. Why not only get one ssd and keep the wraith cooler and use that 120$ on a better graphics card?
3263,"I didn't buy the whole computer in one day. I had a FX 8350 + Gtx 760.
So this is how my upgrades went:
Black friday of 2018: RX 580
January 2019: SSD + Monitor
September 2019: CPU + RAM + MOBO
Black Friday of 2018: Case + Cooler + SSD

So, I basically went upgrading whatever I needed to make my pc better. Now the only thing that's left is the GPU (again). But I can play most games with it, so I'll just save up for a few months and see if I buy a RTX 2080"
3265,"lower chance of frame drops due when streaming at a higher preset due to the extra cores and threads id assume, but the IPC improvement of zen 2 does give a good amount more FPS. 2700x still worth it if you arent picky about that, and if you maybe plan to render things too since the multi core is still faster"
3266,"I bought a Ryzen 7 2700x for a dedicated streaming computer and... well, long story short, it doesn't have integrated graphics. So be aware of that.

I also use this computer when rendering out video files (which I really need to do more often), and it is *substantially* faster at this task than the i7-7700k in my main/gaming rig. I did need to update the UEFI on my board, though. I was having a ton of performance and stability issues before."
3267,If you decide to go with a 2700x then get the 2700 and oc it yourself for additional savings. During the prime day sale I picked up my 2700 for ~150 bucks which was a 50 dollar savings over the 2700x at the time.
3268,">And some people WILL TELL YOU you need at least a Ryzen 7 3700x + 32gb of ram, or a RTX Video card, to use as a stream encoder.

This very rarely happens."
3269,32gb ram and ryx video cards arent super expensive. Nothing wrong with those recommendations. Of course 16->32gb is just quality of life though.
3270,"The toolbox fallacy right there. Refusing to start doing things you want to do because you're ""missing"" something."
3271,"I streamed for over a year doing arts & crafts and gaming exclusively from the native app on my PS4 and using the Streamlabs app on my phone. A YEAR. Now thanks to my hard work and the generosity of my viewers I have a great mid-range PC and I can do way more. But I'm glad I worked my way up to it rather than shelling out up front. If you are considering streaming, do what you can with what you've got. If it's the right path for you, you'll find the motivation and resources  to get better equipment, etc. Besides, it excites your long-time followers to help you achieve those goals! Streaming is pretty much all about those goals... :)"
3273,"When someone asks me what to get for starting out I normally give the ""budget"" option and the ""I'm serious about doing this"" option.

If they want to do it as a hobby it's the c270 ($20), a cheap USB condenser mic ($40), lighting($20), and a $500 PC build (which I need to update at some point because it's outdated now and probably cheaper). all in you're looking at around $700 after tax.

The ""lets treat this like a business"" starter kit is a 922($50), lights($80), XLR mic ($40 used from guitar center), cheap audio interface like the Scarlette 2i2 ($160), a PC north of $1000 (also needs updating might be cheaper now), optional green screen(+$30 if bundled with lights), stream-deck mini ($60 if on sale if not on sale full stream deck at $150). All in there it's between $1400-$1600 and there's still room to grow."
3274,Explaining both options is a great idea.
3275,"What exactly are the benefits of a stream deck? Is it basicly just needed if you play multiple games in a session/want multiple things displayed on screen? like, I mostly play 1 game when i stream, so i dont quite understand the need for the deck"
3276,"It does a lot.  


Any OBS actions can be triggered with the press of a button.  


play sounds or DJ in stream  


You can go live, tweet, post canned responses or scripted messages in chat from a single button(all at once or in intervals)  


Basically it's for automating some of your workflow to make your streaming experience more streamlined."
3277,"I got one recently it's amazing how simpler it makes scene transition etc

Yes I could bind some keys anyway but I like the custom layout and ease of it 

Def worth picking up if you have the money, not essential just a nice QoL update"
3278,"same, picked up a stream deck on black friday for like $69.99 or something rediculously cheap! LOVE it.. being able to change my twitter name when I go live, swap scenes, quick clip, etc."
3279,"Isn't a steam deck basically a bunch of buttons you can bind stuff to? So you can do like quick screen transitions, sounds bits, emote sets, etc. If I'm not mistaken on functionality of course.

Which basically means it's mostly convenience or entertainment purposes afaik"
3280,"I had the same question when I saw the stream deck. I found the mini on sale for 60% off at Best Buy and figured I'd return it in a week. I absolutely can not imagine streaming without it now. It seriously upped my streaming game from the first day I had it. 

The main thing I use it for is super easy macros. The companion app lets you drag and drop actions so you can press one button and have it do countless things. I have buttons set up for camera zooms, sound effects, incoming and outgoing raids, muting and unmuting, switching scenes in interesting ways. I highly recommend picking one up."
3281,"If you use it to its full potential, the Stream Deck is an amazingly powerful tool. It can be used for a whole slew of things, but here's an example of my basic stream workflow:

Press a button that turns on my lights, boots OBS, boots Chatty (IRC-based Twitch chat program), and opens the Twitch creator dashboard. I used to have this also open Twitter, but have kinda moved away from that platform for no good reason.

Here I spend some time getting the game running, setting a title, that sort of thing.

Press a button to enable my setting up scene and toggle a few sources. I actually have one scene handle start/end/brb screens, I just have all the elements for them in layers that the Stream Deck turns on and off based on which version I'm requesting. It then goes live and starts playing my intro media (music, in my case).

Do the normal starting stuff - ensure I have transcoding, the stream is stable, get a drink...

Press a button, and it goes to my normal gameplay scene and unmutes my mic audio source. I have a bunch of buttons that are useful here - I can go directly into a 16:9 gameplay scene, a 4:3 scene, a full-screen camera chatting scene, BRB, etc. I also have a button that toggles the camera I'm showing on all of the above scenes at once, so I don't have to think about which one I'm on currently.

Then, when I'm done, hit a button, and it goes to a version of the chatting scene with my socials so I can plug them right at the end, yadda yadda, and a final 'end stream' button that goes to an ending scene, plonks some links into chat, mutes my mic, turns off my lights, and plays music again.

All of the above could also be achieved by manually toggling scenes and sources in OBS, or with a ton of remembered hot keys, or a smaller number of hot keys that pipe into AutoHotKey. It is, arguably, a device of convenience. The Stream Deck just makes doing it a lot easier, it's simpler to iterate with, and I've never had to alt-tab to use the Stream Deck. (I've found that some games when played fullscreen don't let inputs escape their little sandbox.)

I just added a Stream Deck XL to my setup, and I am planning to add some effects. One idea is to fade to greyscale, play 'hello darkness my old friend', and then revert back to normal after a timer. Again, AutoHotKey could do this, or I could have a dedicated button that does it all for me and will work without alt-tabbing."
3282,"If you use slobs you can use their app to turn your phone in a stream deck. It's cute, but nothing more than a gimmick"
3283,"Know you already got lot of replies, but just to summarize its a very advanced and streamlined macro.. deck? basically. 

But, if you ever did want to test it out without dropping $$$, they do have a mobile app (might only be on iOS not 100% sure) that you can subscribe for like $5 a month and try it out."
3284,"basically for convenience, unless im wrong. please correct me if i am, i dont wanna spread misinformation"
3285,I think there’s a valid point that if the person carries on streaming they’re quickly gonna have to replace a lot of kit... I guess the people suggesting it just underestimate the turnover rate of new streamers though
3286,That's been my biggest regret. I spent a little bit of money on a lot of stuff and it added up. Now I have a graveyard in my attic where all my old stream gear is buried. Pro-tip if you're going to buy a green screen get twice the size you think you'll need.
3287,"Odd. The most common advice I read is “whatever you already have is good enough to start.”. Normally the question is posed as “I want a good x to start, what should I get?”, or “what’s good starting gear for a streamer?”. If you ask for advice on what good starting gear is you’ll get the answer, if you ask “do I need x” the answer is “no, whatever you have is fine until you know you want to invest”"
3288,"I guess we see different posts, dunno. But the ""what you have is fine"" responses are definitely the minority when I read the getting started threads."
3289,"I maybe don't read the subreddit enough then :)

But the advice to ""hey I'm about to do my first stream, what gear do I need?"", the answer is: ""a headset, or a microphone+headphones if you want to talk with chat."", don't even NEED a camera."
3290,"I started on a laptop. The laptop webcam was my mic too. It was fine, don't go crazy on the $$$$"
3291,"People think somebody with 100 subs should have the same setup as someone with 100,000 subs or they shouldn't even bother but that person is in no way filling the niche the other person is and are just talking out of their butt. I don't need a Ferrari to get to work when it's in walking distance."
3292,"I get this & agree things should be added over time. The top end pc part may be useful *IF you are streaming pc games. Streaming can be very CPU intensive & may require the use of some GPU as well. If you're trying to play a new pc game at above minimal settings it may not work. Then you're stuck with a used $300 dust collector. 

I no longer stream, but when I did I has gone with the minimal, had a 720p cap card which I regretted a month in because this meant I had to play my games in 720 not 1080. So I upgraded to a HD60 & enjoyed that, but I had a ps4 pro & 4k monitor. While I didn't care about streaming in 4k the cap card wouldn't push 4k through to the display because it wasn't HDMI 2.1."
3293,thats why you do your own research and not just listen to some wannabe on reddit..
3294,"Exactly. I just started streaming a few days ago. Every video, recommendation, discord user has said you need a 3700x. I have a 2600x, and an RTX 2060 and once I figured out my OBS settings. I think it looks pretty good. Now if I could fix the audio......."
3295,Good light is more important tho
3296,So important. No camera even the c920s looks good in darkness
3297,This. Very true.
3298,Yup. No studio lights needed either. Get them house lamps up if that's what you have
3299,I have an Ikea standing houselight I just drag nexto my PC but offscreen that does the job just fine for now 😂
3300,Nice! I use regular table lamps with LED bulbs in them and tissue paper on the top to diffuse the light. Work with what you got!
3301,This for sure. We got some fairly cheap photography lights off amazon and they're amazing. So many people look like they're playing in a cave by candlelight.
3302,"Haha that’s a cool atmosphere though, also I play better when I can’t see my surroundings, I can zone in"
3303,My webcam can’t even handle a bit of light I swear
3304,"Buy once, cry once."
3306,And so I did.
3307,"I got the c270, I bought it because it was so cheap. It's a great webcam for starting out."
73035,Exactly.
3309,I started with the Microsoft whatever 3000 and with good light it was acceptable.  One of the most important thing with a webcam is lighting.  You can make cheaper look better with good lighting
3310,You can get a c920 for 50 dollars multiple times a year when it's on sale.
3311,"Like I said, if you have the  money, go for it. but a $30 difference for people who don't have a lot."
3313,"While I agree with you. I would never spend $10k on a Downhill bike, as my first buy, because I don't know if I'm going to like the sport. So I'll get a cheaper $2k bike, if I like, I buy the 10k in the future.   


I still will get a good $2k bike, not gonna be cheap and get a $800 bike. However I'll not get the high end. 

Of course, it's different when the scale is in the thousands, but it can apply to low end stuff too. the c270 is a $20 cam with really good quality, it's not a $10 webcam, or just a bad cam. So, as you're entering the hobby, it's better not to spend much if you don't have the money."
3315,"Yeah, if you have the money why not. Also for streaming, if you start to make money from it, then you can use the money from the stream to buy good equipment."
3316,"That's not really apples to apples though. In the realm of cameras, the 922 isn't the 10k bike or even the 2k bike. It might not even be the $800 bike lol.

I think we can all agree that the bottom line for a twitch webcam is 720p like the c270 and the top of the line would be some pro-camera with an Elgato cam link running HDMI directly into your computer pushing close to $1000.

The 922 isn't even technically the middle ground when it comes to webcams when you look at it that way. Realistically it's one step up from the bottom. That doesn't mean it's not professional quality, but it's definitely not professional gear.

If we were to take the bike analogy the 2k bike would probably be a GoPro. Then you have the option for 1080p with an insane frame rate."
3317,Ive used the c270 for almost 3 years before upgrading to the c920. That little $20.00 is still a work horse. Used it as my secondary for a few moths after the upgrade before giving it to my brother to use... 730p30 is def plenty starting out on any platform but twitch especially.
3318,"I can really agree, don't buy the most expensive gear if you don't even know if you are going to grow or like streaming, Unless you use a webcam daily (like me and my friend) don't get an expensive one as first one."
3319,Exactly ! The only other reason I would use a webcam is to play D&D with my friends via discord. But then I don't need anything fancy.
3320,But it would be nice if the people on the other side looked like people. My bfs dad plays with a group online and dang they need a better camera. They look like minecraft characters
3321,That is true hahaha
3322,"I dont even stream but honestly if you are just getting your feet in the water work on more important things first. A webcam is not needed, and thus spend less on it. A good quality microphone however is very important."
3323,"I disagree. $70 is not much and you get *such a better* camera. The color *suuuuuuuucks* on the c270.

Lots of people are saying you never go fullscreen. That is wrong, uninteresting streamers never go full screen. Good streamers have tons of different scenes, including full screen for chatting with viewers.

Stream quality is a big part of what attracts follows, shoot high. You don't need a seperate PC with an El Gato and a mirrorless DSLR for a webcam, but seriously don't cheap out on stuff that costs less than a hundred bucks.

Streamers with bad cams and bad mics are a dime a dozen, be better and you'll get attention."
3324,"As a Viewer ..this so much , if I turn into you're stream and you're cam and audio sucks I'm out in 5 seconds."
3325,"What a lot of people don't realise is that you will most likely have your Webcam around 320x240 size most of the time.

Unless you plan to dance on stream an expensive HD Webcam is a complete waste of money.

A Webcam helps you connect with your audience by letting them see your reactions. A cheap one does that just fine."
3326,I used the webcam on my laptop for a long time.
3327,"I did the same when I started out. Definitely not ideal, but I had better engagement with that than if I’d had no camera at all."
3328,If your looking for the best possible picture from a webcam you are better off going cheap on the camera and then spending the extra money on a pair of diffused desk lamps with adjustable power. Most houses are no equiped with enough lights to get a great video even with an expensive camera. 90% of the time you are going to be so small on a 1080p(max) screen that 720 is even overkill.
3329,"Upping your lighting game is way more important than a super fancy camera. If you can improve your lighting, your video quality will also improve. Pretty much all webcams look like crap in low light."
3330,You don’t need a webcam at all I’d say
3331,"everybodys situation is different, work with what you got in your bank and how serious you want to be.

if you make six figures, heck, go get top end stuff, you obviously can afford it.

if you make minimum wage, craigslist what you need."
3332,"When it comes to webcams/cameras, people tend to forget that you'll more than likely NEVER fullscreen the camera. So yeah, once you've scaled down the camera in your stream, the total resolution it can output is not as important. Getting something that'll output like, 5XXp and maybe 60fps (like a PSEye camera) is pretty good for a stream. What IS super important is good, balanced, and intense lighting. If you give a camera enough lighting, the picture will be great. If you give one of those cheap logitech webcams very little light, it will look like shit.

However when it comes to stuff like audio and general PC build for single PC streaming setups, I do think a lot more consideration and investment planning should be done. If you go the USB mic route, you are really limiting yourself to that mic. Your only upgrade path is another USB mic. Where as if you took the time to save up a little more, you could get a really decent USB audio interface which would allow you to open up your horizon to hundreds of XLR mics. 

Single PC streaming setups have become much better in potential output quality due to the better NVENC encoding options on the newer Nvidia cards. Dual PC setups will still net a better looking stream (and truthfully makes your stream less of a pain with everything stream related getting offloaded to another PC) but you can now achieve pretty great results with single PC setups."
3333,Im doing fine with a Ryzen 3600 + RX 580 8gb. I haven't found a single game I can't stream yet.
3334,At what in-game resolution and frame rate? What is the output settings of your stream? What CPU present for encoding? You can always make your stream look better/keep it consistent while improving your own gaming experience which will make you want to stream longer = more potential success.
3335,"Im using my ipad as a camera for my stream—surprisingly looks ok besides the face tracking. I figure I’ll get a real camera down the road if I feel comfortable enough with it.

Edit: I should probably add that I didn’t get the iPad specifically to use as a camera, i used it for art/digital media things and thought it a clever idea to use it as a streaming camera when I have nothing else. Please don’t go and buy an iPad for this purpose."
3336,I got a webcam for 50 cents at a church’s fair and sure its grainy at times but that’s it. It’s great
3337,">And if you decide streaming isn't for you or it just didn't workout for you, you only spent $20 rather than $70.

This is why I always tell people to start cheap. I have seen multiple online friends decide they want to stream, drop hundreds (or in one case thousands) of dollars on equipment, and then give up streaming after a couple months.

Start small! If it goes well, take the money you get from bits/subs/donos and buy new equipment. It's a win-win because your viewers see that their donos are going towards improving the stream, and you're not spending savings on equipment you may only use for a few months or a year."
3338,"Just as a side note, cameras are by no means required for streaming, I've talked to people who have wanted to start streaming and are just not comfortable with their appearance or don't like the idea of people seeing their face. There are plenty of quite popular streamers who have no face cam and do very well (think soviet womble or RT game). Personally, my feeling is if you arent very animated or you don't think your expressions will add anything to the stream, then I wouldn't recommend it as it can get a bit awkward for you and your viewer's id the only thing on your face cam is you staring at a screen.

Just my 2 cents, good luck in your steaming everyone!"
3339,"Honestly there is nothing wrong with spending lots of money starting out if it's something you're really into, as long as you're having fun enjoying yourself you should just do what you enjoy. Sometimes having nicer equipment and webcam can help bring yourself confidence and motivate you to create higher quality, I know when I started off with fitness/going to the gym, I spent a lump sum of money on supliments like bcas creatine and protein, as well as getting myself some nice gym clothes to workout in, and it help give me some confidence and motivate me to continue to go, I'd assume the same would go for streaming."
3340,"Kind of piggybacking on this, but if you really want to invest in something that will make your stream look good, spend the money you save on an expensive camera and invest in lighting.  Get some floor lamps you can point at you, some clip lights, anything that will brighten your face.  The best camera in the world will look like hot garbage without good lighting."
3341,In the UK here but I got the C920 for around the $20 mark on a sale once before I even started streaming
3342,"I've never seen it that low, I've never seen a better price than Amazon and the cheapest it's ever been there is £25 ($33)

https://uk.camelcamelcamel.com/product/B07QZZS7S1?context=search"
3343,There are actually a shit ton of streamers who still stream without webcam and still be successful. Idk if it’s a necessity but it’s definitely a plus if you have one I guess
3344,"So true, as a number of game streams that I watch don't use webcams."
3345,"> or they rather just spend in other important stuff, like a good Mic, or even save up for a better pc. 

 Don't forget thing like food, rent, etc.... 

 I see people tell others to get these expensive mics and setups in the podcast world when someone says that they are just starting. There is nothing wrong with starting off with inexpensive equipment, as like you said, if streaming or podcasting isn't for you, then you aren't out that much."
3346,"As an avid c270 user, you really don't need anything else for 720p streaming and decent room lighting. We have those fancy 100€+ Logitech cams at work and they're certainly better, but not 80€+ better."
3347,"facts man - go cheap when starting out - because you never know if you are actually going to like it - I had one friend that got affiliate then he was like that's good enough for me, I really don't care for streaming."
