idx,text
36958,"SFNE is my home park, and honestly I don't like Superman that much either because of the restraints."
36959,"From my least favorite to my favorite.

SFA - Only worth it to get the credits. I'll probably return when they RMC Roar.

SFNE - Good ride collection, horrible operations. When I was there (last time was Goliath's opening year I think), they were assigning seats on rides that had no lines. Will probably revisit at some point for Wicked Cyclone and to ride Superman again.

SFGAm - Large collection of rides, has the original Batman, Raging Bull is good, and Goliath is pretty good. Nothing really makes my top 10 steel though. Goliath comes in at number 7 wood for me which, despite being a weaker RMC, is still an RMC.

SFOG - This is a great little park with a quirky layout but very good ride collection. Scorcher is my favorite Stand-up, they have the best Batman (in my opinion). Dare Devil Dive is really underrated. Goliath and Mindbender are both amazing. The one drawback is that the wooden coasters are horribly rough. Both Cyclone and Scream Machine come in at the bottom of the 48 wooden coasters I've ridden. If they get retracked or RMCd, I'd be glad to go back down to experience the park again.

SFMM - This is a destination park. Sure, the coasters could be considered weaker than most, but the park it has a lot of coasters that are definitely in the top half of my rankings. The highlights here are Superman, the first coaster to reach 100 MPH, Tatsu, the most intense and probably best American flyer, and of course X2, which is my number 3 steel and has an experience that can't be described. Last time I was there was 2013, so I haven't experienced Twisted Colossus yet, and I've heard that it's really good as well.

SFGAdv - This and SFMM are really close for me but it really comes down to the fact that I visit SFGAdv more than any other Six Flags park because of how close it is to me. It has a pretty good line-up that has 3 half-decent B&Ms (Green Lantern, Superman and Batman), 2 really good B&M's (Nitro and Bizarro), two really good indoor family coasters (Dark Knight and Skull Mountain), a Vekoma Madhouse (Houdini is amazing), the tallest coaster in the fucking world (Kingda Ka), and one of the absolute best wooden coasters in the world (El Toro). The collection is amazing and makes up for the park's terrible layout. Seriously, El Toro is worth the trip there alone, and when you combine that with the rest of their lineup, you know the price you paid for admission was worth it.

I'll be going to SFStl for the first time this year, so we'll see where that stands."
36961,"SFMM looks a lot better than SFGAdv, which looks very overrated.  I'm not serious, because that's a dumb thing to say.  El Toro looks ridiculous.  

1.) Magic Mountain - Roller coasters galore.  Twisted Colossus fits smack dab in the middle of my top 10 roller coasters.  Full Throttle, X2, and Tatsu are all very good coasters as well, and they have a ridiculous selection following.

2.) SFGAm - A big selection of fun coasters.  Again, the RMC is a standout, but I also really enjoyed Raging Bull, X-Flight, Batman, and the wooden coasters.

3.) St. Louis - 

4.) Discovery Kingdom - 

5.) Elitch Gardens - when it was a Six Flags park."
36962,"I've been to Six. Going to SFGAdv this Summer. 

1. SFOG - With the ride collection and quality of SFGAm, the theming, landscape, and beauty of SFOT, and having my favorite roller coaster Goliath, this one tops it all. 

2. SFOT - The theming, interconnected-ness with the environment and landscape, and just an overall beautiful park with plenty of rides.

3. SFFT - Beautiful park with fun themed areas and a unique setting, and Iron Rattler is amazing. 

4. SFGAm - So many rides, but it's the second most Six-Flags-y out of these. (First is SFMM) 

5. SFStL - Quaint, cute, hilly, and comfy. A great collection of woodies, friendly staff, and just a cozy park with fun rides. Just not as much to do as the other parks, hence its low placement. 

6. SFMM - Terrible experience at this park. If you wanna know the story, ask."
36963,Actually I would like to know the story because I'm going there soon
36964,"The problem wouldn't happen now. I went at a different time. Superman was closed because of Lex Luthor being built. Full Throttle and Twisted Colossus weren't built yet. Tatsu broke down while we were in line. X2, the ride I was most looking forward to, was incredibly rough, music wasnt working, and was in no way pleasant. Scream is one of my least favorite coasters. Aside from RR and Apocalypse, everything else I found to be mediocre. Very dissapointing visit."
36965,"I think SFFT is very underated, it needs one show stopper coaster, and I think people would completely change there tune on it, I also think its the best themed six flags, and literally one of the top five amusement parks in terms of setting, having the rock wall to use in coaster layout is simply amazing."
36966,"""One show stopper coaster""

Like Iron Rattler or Superman Krypton?"
36967,"One other, I really Like both of those and there very good, but I mean something really special, something that stands out as being Fiesta Texas unique stand out coaster."
36968,"What happened at MM? I didn't have the best experience either. Nothing personal happened, the park just sucked for me lol"
36969,"Superman was closed because of Lex Luthor being built. Full Throttle and Twisted Colossus weren't built yet. Tatsu broke down while we were in line. X2, the ride I was most looking forward to, was incredibly rough, music wasnt working, and was in no way pleasant. Scream is one of my least favorite coasters. Aside from RR and Apocalypse, everything else I found to be mediocre. Very dissapointing visit."
36970,My favorite is Gram probably because it's my home park lol
36971,"I would go MM, have been to MM, grAm, and SFoT is my home park. I visited mm on saturday with fright fest so only got to do half the rides, but it was a cool place. 

One of only gripes with sfot is that part of it is like a maze, i still havent figured out how to efficiently get from new texas giant to the gotham section. All the shops and what not look similar, and the signs that point to which rides are ambiguous at intersections of multiple pathways. Dont get me started about the entrance to titan, at least i can now laugh at all the people missing the lack of proper signage when you turn by el aserradero.

Although the view of the parking lot from titan is outstanding, but scream at mm is in a parking lot so it wins there /s"
36972,"Been to SFOT once, completely agree about getting lost in that area."
36973,SFMM. Best variety of rides in the country.
36974,"I've been to, technically, three parks.

Six Flags New England is my ""big"" home park. Staff is friendly, park is small enough to get around, even if the layout is a bit wonky, but big enough to have plenty to do. Also, Wicked Cyclone and Superman.

Six Flags Great Adventure is... monstrous. It's a huge park, with a HUGELY varied set of attractions. El Toro is king. The staff is pretty good, dispatch times can be hit or miss. Did I mention El Toro?

Six Flags St. Louis is weird for me. I was there for an off-season tour last year and it wasn't fully opened. Just Mr. Freeze and American Thunder. Justice League, too. Seems like it's a cool park, and would love to visit it in full swing.


Out of them, I'd probably vote SFNE... But El Toro is so damn good, it's worth the 2+ hour drive alone."
36975,"Been to: SFNE, LR, Sfgadv, SFGAm, SFOG, SFFT, SFA, Six Flags Ohio, TGE, and SFMM.  I think Six Flags Ohio was the best, it was run the best and I had the best time there. Since that park is gone, I'll go with Six Flags Fiesta Texas. It was the least Six Flags feeling park. It has personality and felt... cared for? Well aside from where Pandemonium is, that felt straight up Six Flags and kind of just placed without much thought."
36976,"Of the ones I've visited: 

1. Magic Mountain — Having TC, X2, Tatsu and FT gives it the edge, despite generally shit operations. 
2. Great Adventure — Better run than SFMM, but Nitro and El Toro cannot save a less-impressive ride profile. Not a fan of the layout.
3. Texas — Great variety of coasters and well-themed. Texas Giant is in my top 10, Titan beats SFMM's Goliath, and I could ride Runaway Mountain and La Vibora all day. 
4. Fiesta Texas — Gorgeous park. Iron Rattler also in my top 10, and despite my dislike of B&M floorless coasters, Superman is a great ride.
5. Discovery Kingdom — Well, it looks nice."
36977,"> Great Adventure — Better run than SFMM, but Nitro and El Toro cannot save a less-impressive ride profile. Not a fan of the layout.
> 

Agreed on the ""less-impressive ride profile."""
36978,"The ones i've been to...

1. SFGAdv
2. SFMM
3. SFNE

It mostly came down to the amount of rides and quality, but SFNE is slowly gaining on SFGAdv, especially with its RMC."
36979,"I'm gonna say Tatsu is the best. It's so graceful, long, and an incredible experience. Besides that, don't miss out on X2, Twisted Colossus, and Full Throttle.

As for rides you might not think would be that great but you should DEFINITELY ride, I'd say give Apocalypse, Superman: Escape From Krypton, and Viper a shot. Those rides never fail to impress me."
36980,"Thanks mate, much appreciated"
36981,"Best: Tatsu, X2, Twisted Colossus, Full Throttle  
Next Best: Batman, Apocalypse, Riddler's Revenge, Superman, Scream, Goliath   
Okay: Ninja, Viper, Revolution, Goldrusher  
Not Okay: Green Lantern"
36982,"I walked out of the park very surprised at what ended up being my two favorite coasters of the day when I went for the first time this past march. Going in to the day I was expecting to walk out with Twisted Colossus as my favorite, with maybe X2 or Tatsu right behind it. 

Instead I would actually say my favorites were:

1. Full throttle 
2. Superman: Escape from Krypton
3. Riddler’s Revenge

I got super lucky and almost every ride was a walk on all day, and the only closed ride was Green Lantern. 

My first ride of the day was X2 on the front inside left, and it was one of the best and most unique rides I’ve ever had. But later on I took another ride in the back seat (left, inside) and the final raven turn was so jerky with the rotation that I bashed my head hard against the headrest 3-4 times in a row. Overall it wasn’t a fun ride after the amazing first drop. The rotation just seems to get worse the farther back you are in the train.  If I had skipped that second ride X2 would have been my favorite and would have cracked my top 10. 

Tatsu just verified for me that I’m just not cool with B&M flyers. It’s mainly the shin restraints. I think they just trigger some kind of claustrophobia for me - which is weird cause I’m not claustrophobic at all. 

Twisted Colossus was amazing that one lap that it actually dueled. But it was jerky, short, and terribly paced during the other 7 laps. And those two laps where the station train managed to pass the 1/2 way train on the lift really hurt my head, my feelings, and my soul. 

Superman though?  I wasn’t expecting anything from the ride, and it ducking blew me away. Full Throttle I was expecting to like a lot, but it ended up being so much more fun than I had expected.  And even as a verified stand-up apologist, Riddler genuinely surprised me with how great it was. 

The rest of the coasters were pretty good for the most part. Viper really only for some GASM nostalgia; but ninja, revolution, the mine train, the big mine train (goliath burn), pretty much everything except for Scream was really very good."
36983,"I'm glad you enjoyed FT - it doesn't seem like it would be a great one on paper, but it's just a damn fun coaster!"
36984,"I used to love superman back in the day, when it went forward. I think it doesn't get enough recognition."
36985,It's still fun backwards
36986,"Glad to hear it! It's on my list of ""things I want to do again and repeatedly""."
36987,"X2, Viper, and Revolution are my personal favorites. Goliath and Tatsu are up there too. I think Tatsu is a tiny bit overhyped but maybe I just needed another ride or two on it. Riddler's Revenge was another surprising highlight. Really wasn't impressed by Twisted Colossus; obviously it's still fun but it's one of my least favorite RMCs."
36988,"Tatsu, Twisted Colossus, X2, Full Throttle, Riddler's Revenge, Revolution, Goliath, Ninja and Lex Luthor are the best rides at Magic Mountain.

I also enjoy Viper and Batman. Scream is hit or miss. Superman is worth it if the line is short."
36989,"Best - Twisted Colossus 

Worst - Green Lantern. Take a Vekoma and multiply the pain by 7"
36990,Green Lantern is actually a fun ride. Viper is painful. I would even take Green Lantern over Goliath \+ Gold Rusher.
36991,"Been going to Magic mountain a lot recently so I think I have some valuable input for you. For me the must rides at Magic Mountain are: 
Twisted Colossus - In my opinion the best ride at the park. Typically has a fast moving line since its usually running three trains.

X2 - This ride has mixed reviews but I personally think it's amazing. If you can ride back row inside seat. This thing has the best drop I've ever experienced and is just an insanely intense ride. Typically has the longest line in the park so keep that in mind. 

Full Throttle - short and sweet ride, super smooth and has some amazing hangtime on that loop. Also quite a unique ride. Can't go wrong with this one.

Tatsu - I've heard this is the best flying coaster. It's the only one I've ridden, but that Pretzel Loop is the single most intense moment I've ever experienced on a roller coaster and that alone is worth a ride. Personally I think a front row ride on this is the best. 

Lex Luthor Drop of Doom - Typically doesn't have too long of a wait and is the 2nd tallest drop tower in the world. They have VR on it right now and if you have a chance to experience it twice I'd recommend trying both. Personally for me it feels more intense with the VR but you have to try it without!

Revolution - pretty chill ride, but special to ride just for its historical significance.

Ninja - you have to do this one towards the front. I've ridden this ride a lot and the farther towards the back you get, the more tame the swinging tends to be. Front row on this thing is amazing. Surprisingly intense.

Riddler's Revenge - I tend to thing it's a little overrated but it is a fun ride that isn't super intense. From what I've heard it's one of the only bearable stand up coasters. It is pretty dang smooth, and it's the tallest and fastest stand up coaster, so probably worth a ride! 

Everything else:

Goliath - Honestly this thing is super overrated. It's fine, but it's nothing special. Offers little to no airtime, and the end offers pretty intense positive G forces, but it just isn't that enjoyable to  me.

Scream - An okay B&M, if you miss it you aren't missing much. Definitely has gotten a pretty noticeable B&M rattle over the years.

Batman - I love this ride, but it is a clone, so if you are short on time you can skip this if you've been on the other Batman clones.

Gold Rusher - a fun arrow mine train. I love old arrows so it's a must ride for me, but it isn't anything to crazy and can be skipped.

Superman Escape from Krypton - Not a super intense launch but it is a fun ride. If you sit in the front row (technically the back row since the car is backwards) you really get a sense of the speed of this thing. Your face begins to flap from the wind. If you had to choose between this and Lex Luthor I'd choose Lex.

Apocalypse: A fun GCI but it's pretty dang rough these days. Has a cool queue line though.

Green Lantern: Been closed for the past year or so and haven't seen much signs of it reopening. Super uncomfortable ride anyway.

Viper - an older arrow looper and tends to ride like one. I enjoy it but most people tend to stay away from it. As long as you lean your head forward you should be fine.

Justice League: If you've done any of the other ones you can skip this. It's slightly different but for the most part about the some. If you haven't, this thing is pretty awesome."
36992,">I've heard this is the best flying coaster

Flying Dinosaur is easily the best flying coaster in the world, but Tatsu is the best in the US."
36993,Twisted Colossus and Full Throttle are my two favorites.
36994,"When are you going?  How busy it is will determine how many rides you can get and are you getting a flash pass?  Also do you visit a lot of parks or only a few every once in a while.  There’s a few different ways to look at it, but I would try to get in all of their good/unique rides, regardless of other people’s opinions l, because we all vary.  I would put them in tiers and pick from there moving down.  

So tier 1 of there most widely regarded and unique rides would be:
X2
Twisted Colossus
Tatsu
Full Throttle

Tier 2 is your good woodies, average B&Ms, something that would be a main attraction in the 90s:
Superman
Scream
Riddler
Apocalypse
Batman
Goliath

Tier 3 would be your older Arrow rides and smaller more tame rides, that have some fans and have some historical significance, but would be below average rides to most: 
Ninja
Revolution
Green Lantern
Viper
Gold Rusher

Unless you have a specific reason to hit any of the tier 3, like maybe wanna do Viper bc you haven’t done a late 80s arrow mega looper than you should most likely be able to get the tier 1 and 2 rides.  If you have to eliminate some Batman is cloned so if you have ridden a clone or will soon be able to skip that.  If you have ridden a bigger B&M standup (Mantis, Chang) and didn’t enjoy skip Ridler, if not you may want the experience.  All of the floorless are fairly similar so skip scream if you’ve done things like Medusa/dominator/bizzaro and thought meh.  Point being here it’s all about the B&Ms if your a big fan of their average rides hit these up, if not or you’ve ridden plenty of others go for the more unique ones like Superman, Goliath, etc."
36995,"I’ve been on all the non-kiddie coasters except Apocalypse (though I haven’t done Revolution since pre-makeover, and the ones I have done were spread out over 3 visits from 2010 to 2017). Here’s my ranking...I think:

*Tier 1: Awesome*

T1. Twisted Colossus

T1. X2

3. Tatsu

4. Full Throttle

5. Superman

*Tier 2: Solid*

6. Batman

7. Goliath

8. Scream

*Tier 3: OK*

9. Ninja (would like to ride it again though)

10. Revolution (probably better post-refurb)

*Tier 4: Wouldn’t Recommend*

11. Riddler’s Revenge (probably would’ve rated it higher if I hadn’t been worried the whole ride as my seat kept popping up notches...)

12. Viper (ouch...would like to try again though)

13. Goldrusher (just odd, not comfortable as a single rider)

14. Green Lantern (lots of forward/backward body tossing...it’s like a mild car accident)"
36996,"Twisted Colossus is the best

After that, Tatsu, X2, and Full Throttle are all must rides.  They also have a lot of really good coasters outside of those, and I know a lot of people hate Green Lantern, but I thought it was a pretty awesome ride."
36997,"I have a tough time ranking X2, Full Throttle, and Tatsu.  All three are awesome in different ways.   Twisted Colossus is on another level, however."
36998,"I just went friday, I agree on most things minus riddler. I would probably bump full throttle to #2 because its smooth and reridable. Not really sure where riddler ranks but its high for me,  I love standups. Getting the restraints right is all the difference.

Twisted is in competition for my top #1. After only doing NTG, twisted is insane with the off axis twists, double downs, and inversions, where NTG is only small straight ejector hills. Not to mention I got to race or get close to racing 4/6 loops around."
36999,"Yeah, my feet are really prone to getting sore anyways, so having any form of G's in a stand-up is just hell for me.
As for TC, can we all just agree that it's insane?"
37000,">Ninja:
>This ride exists. 

LMFAO"
37001,"Honestly, I prefer Tatsu to Twisted Colossus. It's much more comfortable, longer, more diversified, crazy, fun, and the atmosphere kicks ass. Mostly it's just so damn fuuuuun.

I love X2, but it sure beat the shit out of me last time I rode it. I rode outside the first two times, but the last time I rode inside, 5th row. And I felt like I was dying the whole time. It was truly just as rough as the fabled legends told. But on the outside I found it to be absolutely incredible."
37002,Goliath too high. GL:FF and Tatsu too low.
37003,Lol I didn't even ride GL:FF
37004,"Enjoyed the report. Small nitpick, Joker nee Roar (West) is at SFDK not CGA."
37005,"Solid report. I went last Monday and actually enjoyed the park for the most part. The staff was great and the park was very clean. None of the rides are stand out for me, but Superman is solid but definitely not running like new, haha. I really liked it in the front row compared to back. Wild One, Jokers Jinx and Batwing I thought were fun. The park needs a big homerun ride like an RMC for sure."
37006,"Haven’t ridden Batwing, but have ridden Nighthawk at Carowinds and I agree 100%. These Vekoma flyers are nothing extraordinary, but man are they fun, the loop especially."
37007,"Do not RMC Roar.....  tied for the best at the park.

Other than that I am glad you had a good experience.  SFA is overly hated and it doesn't deserve it.  In all honesty I feel SFA has the edge over KD anymore/"
37008,"SFA is better than a park with a Giga, RMC, and a solid floor less coaster? Right...."
37009,"Yeah hard agree on that... my takeaway is that SFA is decent for what it is and doesnt deserve all the ire it gets, but I'd go to KD for Dominator and TT anyday. KD has much nicer landscaping and scenery too."
37010,Dominator is the better floorless but it still doesn't do much for me.  And I am not negating the fact that KD has a great thing with i305 and Twisted Timbers but after that KD kind of goes meh.... I really like Grizzly but would rather ride Roar....  SFA has a more consistent line up of rides that are decent across the board.
37011,KD has the better ride lineup but SFA has superior woodies
37012,"Jokers Jinx, Batwing, Superman.... all great steel coasters.  I'm not saying KD is terrible because it's not.... I'm just saying with everything that KD has lost it's not the hands-down winner anymore.  Even when it comes to flats the new pendulum at SFA is going to really challenge KD."
37013,"I agree that SFA gets more hate than it should, but putting it on the same level as KD is silly. I don’t understand thoosies who claim KD has lost a lot and is trending downhill. Name one other defunct ride from the past decade that is missed besides Volcano."
37014,I even enjoyed Shockwave and I think Delirium is an upgrade.
37015,"Why do you like Roar so much? Serious question, not sarcastic. The layout seems good it just seems like it needs a retrack at a minimum."
37016,I don't find it rough at all.  I love that it's constantly turning and has no straight track on it... it just feels completely out of control and amazing.
37017,It's really not rough in the front I've found
37018,"My headache post ride would like to kindly disagree with you. I'll believe you more if you say it's enjoyable despite the roughness, but not rough at all?"
37019,That's correct. It isn't rough at all in the front
37020,"Man, I love it too. I mean if you don't like wooden coasters there's no way you're going to like it, of course, but if you do love wooden coasters, Roar is excellent. Super fun and out of control feeling. RMC'ing it would be a kick in the stomach. Enough with the conversions to steel."
37021,Well I went ahead and got a gold membership on the assumption I'd go back or go to GAdv in the next year so I'll be sure to give it another go and keep those things in mind. I want to like woodies more but I guess my taste just leans more GP than hardcote enthusiast. I wish I could get on a modern woodie like Mystic Timbers to see what all the hype is about. I feel I've only ridden really old woodies like Roar or Grizzly or Hurler before the redo.
37022,"Superman is about 1000x better in the front than the back in my opinion. This sounds crazy to most, but I rank it as my number 5 coaster for the insane intensity and ejector airtime. (I have 77 credits)"
37023,"That explains why I actually really liked jokers jinx this year. With the mid course break run limited or off, the second half is actually enjoyable.

As for superman, I wouldn't say it was brand new, but it was much more improved on from the last couple years. I think the only rough patch was there at the end before the bunny hills.

Roar gets worse each year, and I've decided I'm not riding it again until they do something to it."
37024,"I agree with you that theming rides is important.  I have never been to SFMM, and the only real ""theme park"" I've been to is Busch Gardens in Williamsburg, but it most definitely makes a difference.  Most mainstream U.S. parks are sorely lacking on the ""theme"" aspect (your Six Flags and your Cedar Fairs).

One of the first things I learned in ride construction - specifically from John Wardley - was all about the importance of the scenery.  I hope to make it to Alton Towers one day, and I also wish more American parks put an emphasis on their theming."
37025,"Cedar Fair is better then Six Flags. Kings island has a bit of theme, and there are some coasters filled with trees (Beast and diamondback). Both of the Busch Gardens are the best theme parks in the US. Of course, Disney and Universal are amazing, too."
